user_input,retrieved_contexts,response,reference,faithfulness,answer_relevancy,context_recall,context_precision,card,category,phase,timestamp
What is the maximum auto rental collision damage coverage on the Capital One Venture X?,"['2\nVisa Infinite Concierge\nCount on your 24/7 Visa Infinite® Concierge* to book your \ntravel, dinner reservations, event tickets and more.\nVisa Infinite Concierge can help you open the door to unique \nexperiences wherever you are around the world. Secure a \ntable at a premium restaurant, enjoy VIP seating at a special \nevent, or make life a little easier with assistance for your \neveryday needs. Visa Concierge is there to help with it all.\nYour Capital One Visa Infinite card comes with complimentary, \n24/7 access to the Visa Infinite® Concierge* service. Simply call \n888-315-6982 anytime for assistance.\n* Capital One Visa Infinite accountholders are responsible for the \npayment of any and all charges associated with any goods, \nservices, reservations or bookings purchased or arranged by \nthe Visa Infinite Concierge on cardholders’ behalf. Any such \npurchases or arrangements are solely between the cardholder \nand the respective merchant, and Visa is not a party to the \ntransaction. All goods and services subject to availability.\nAuto Rental Collision Damage Waiver\nNo cardholder wants to incur the expense of repairing or \nreplacing a rented car. But accidents do happen, and vehicles \ndo get stolen. No matter what happens to Your rental car, You \ncan be covered with Auto Rental Collision Damage Waiver.\nAuto Rental Collision Damage Waiver reimburses You for \ndamages caused by theft or collision – up to the Actual \nCash Value of rental vehicles with an original manufacturer’s \nsuggested retail price of up to seventy-five thousand dollars \n($75,000.00) when new. Auto Rental Collision Damage Waiver \ncovers no other type of loss. For example, in the event of a \ncollision involving Your rented vehicle, damage to any other \ndriver’s car or the injury of anyone or anything is not covered. \nRental periods of fifteen (15) consecutive days within Your \ncountry of residence, and thirty-one (31) consecutive days \noutside it, are both covered. (Longer rental periods, however, \nare not covered).\nYou are eligible for this benefit if Your name is embossed on \nan eligible card issued in the United States and You use it \nto initiate and complete Your entire car rental transaction.', '(Longer rental periods, however, \nare not covered).\nYou are eligible for this benefit if Your name is embossed on \nan eligible card issued in the United States and You use it \nto initiate and complete Your entire car rental transaction. \nOnly You as the primary car renter and any additional drivers \npermitted by the Rental Car Agreement are covered.\nHow Auto Rental Collision Damage Waiver works\nYour Auto Rental Collision Damage Waiver benefit acts as \nprimary coverage and covers theft, damage, valid loss-of-\nuse charges imposed and substantiated by the auto rental \ncompany, administrative fees and reasonable and customary \ntowing charges, due to a covered theft or damage to the \nnearest qualified repair facility. \nHow to use Auto Rental Collision Damage Waiver\n1.  Use Your card to initiate and complete Your entire car rental \ntransaction. \n2.  Review the auto rental agreement and decline the rental \ncompany’s collision damage waiver (CDW/LDW) option, or \na similar provision, as accepting this coverage will cancel \nout Y our benefit. If the rental company insists that You \npurchase their insurance or collision damage waiver, call the \nBenefit Administrator for assistance at 1-800-825-4062. \nOutside the United States, call collect at 1-804-965-8071.\nBefore Y ou leave the lot, be sure to check the car for any \nprior damage.\nThis benefit is in effect during the time the rental car is in Your \n(or an authorized driver’s) control, and it terminates when the \nrental company reassumes control of their vehicle.\nThis benefit is available in the United States and most foreign \ncountries (with the exception of Israel, Jamaica, the \nRepublic of Ireland or Northern Ireland). However, this \nbenefit is not available where precluded by law, or where it’s \nin violation of the territory terms of the auto rental agreement, \nor when prohibited by individual merchants. Because \nregulations vary outside the United States, check with Y our \nauto rental company and the Benefit Administrator before \nY ou travel, to be sure that Auto Rental Collision Damage \nWaiver will apply.', 'Digital Data means information, concepts, knowledge, \nfacts, images, sounds, instructions, or Computer Programs \nstored as or on, created or used on, or transmitted to or from \ncomputer software (including systems and applications \nsoftware), on hard or floppy disks, CD-ROMs, tapes, drives, \ncells, data processing devices or any other repositories \nof computer software which are used with electronically \ncontrolled equipment. Digital Data shall include the capacity \nof an Eligible Wireless Cellular Telephone, Rental Vehicle, or \nCovered Purchase to store information, process information, \nand transmit information over the Internet. \nGeneral Provisions for Auto Rental Collision Damage \nWaiver, Trip Delay Reimbursement, Lost Luggage \nReimbursement, Purchase Security, Return Protection, \nExtended Warranty Protection and Cellular Telephone \nProtection:\n•  Signed or pinned transactions are covered as long as You \nuse Your eligible card to secure the transaction. \n•  You shall do all things reasonable to avoid or diminish any \nloss covered by these benefits. This provision will not be \nunreasonably applied to avoid claims. \n•  If You make any claim knowing it to be false or fraudulent \nin any respect, no coverage shall exist for such claim, and \nYour benefit may be cancelled. Each cardholder agrees \nthat representations regarding claims will be accurate and \ncomplete. Any and all relevant provisions shall be void in any \ncase of fraud, intentional concealment, or misrepresentation \nof material fact. \n•  No legal action for a claim may be brought against the \nProvider until sixty (60) days after the Provider receives Proof \nof Loss. No legal action against the Provider may be brought \nmore than two (2) years after the time for giving Proof of \nLoss. Further, no legal action may be brought against the \nProvider unless all the terms of the Guide to Benefits have \nbeen complied with fully. \n•  These benefits are provided to eligible cardholders at no \nadditional cost. The terms and conditions contained in \nthis Guide to Benefits may be modified by subsequent \n16\nBR414848_M133789_LetterSize.indd   16BR414848_M133789_LetterSize.indd   16 7/15/21   11:58 AM7/15/21   11:58 AM', 'Because \nregulations vary outside the United States, check with Y our \nauto rental company and the Benefit Administrator before \nY ou travel, to be sure that Auto Rental Collision Damage \nWaiver will apply.\nVehicles not covered\nCertain vehicles are not covered by this benefit, they consist of \nexpensive, exotic, and antique cars; cargo vans; certain vans; \nvehicles with an open cargo bed; trucks; motorcycles; mopeds; \nmotorbikes; limousines; and recreational vehicles.\nAn expensive automobile is defined as any vehicle with an \noriginal manufacturer’s suggested retail price of more than \nseventy-five thousand dollars ($75,000.00) when new.\nAn antique car is defined as one that is over twenty (20) years \nold, or one that has not been manufactured for ten (10) years \nor more.\nVans are not covered. But those designed as small-group \ntransportation vehicles (seating up to nine (9) people, \nincluding the driver) are covered.\nIf Y ou have questions about a specific vehicle’s coverage \nor organization where the vehicle is being reserved, call \nthe Benefit Administrator at 1-800-825-4062, or call collect \noutside the United States at 1-804-965-8071 collect.', 'Definitions\nEligible Person means a cardholder who pays for their \nmonthly cellular wireless phone bill with their eligible card. \nYou and Your means an enrolled cardholder who has charged \ntheir monthly cellular wireless phone bill to their covered card.\nPlease see the “Definitions Related to Cyber Incidents” for \nadditional definitions that apply to this benefit. \nPlease see “General Provisions” section at the end of this \ndocument.\nFORM #CELLPHONE – 2017 (04/17)                                                                  CP-O\nFor more information about the benefit described in this \nguide, call the Benefit Administrator at 1-844-288-2140.\nDefinitions Related to Cyber Incidents: The following \nlanguage applies to Auto Rental Collision Damage Waiver, \nExtended Warranty Protection, Cellular Telephone \nProtection and Purchase Security:\nComputer Programs means a set of related electronic \ninstructions which direct the operations and functions of a \ncomputer or device connected to it, which enable the computer \nor device to receive, process, store, retrieve or send data. \nCyber Incident means any of the following acts: \n(a)  unauthorized access to or use of Your Digital Data or an \nEligible Wireless Cellular Telephone, Rental Vehicle, or \nCovered Purchase; \n(b)  alteration, corruption, damage, reduction in functionality, \nmanipulation, misappropriation, theft, deletion, erasure, \nloss of use or destruction of Your Digital Data or an Eligible \nWireless Cellular Telephone, Rental Vehicle, or Covered \nPurchase; \n(c)  transmission or introduction of a computer virus or \nharmful code, including ransomware, into or directed \nagainst Your Digital Data or an Eligible Wireless Cellular \nTelephone, Rental Vehicle, or Covered Purchase; \n(d)  restriction or inhibition of access to or directed against \nYour Digital Data or an Eligible Wireless Cellular \nTelephone, Rental Vehicle, or Covered Purchase; \n(e)  computer errors, including human operating error or \nomission; power failure, surge, or diminution of electronic \nsystems; or mistakes in legitimate electronic code or \ndamage from code installed on an Eligible Wireless \nCellular Telephone, Rental Vehicle, or Covered Purchase \nduring the manufacturing process, upgrade process, or \nnormal maintenance.']","The maximum auto rental collision damage coverage on the Capital One Venture X is up to the Actual Cash Value of rental vehicles with an original manufacturer’s suggested retail price of up to seventy-five thousand dollars ($75,000.00) when new.","The Capital One Venture X Auto Rental Collision Damage Waiver covers up to the actual cash value of rental vehicles with an original MSRP of up to $75,000.",0.5,1.0000000000000002,1.0,0.9166666666361111,Capital One Venture X,simple_fact,Phase 3 - Score Gap 0.45,2026-04-24T22:32:22.288481
What is the auto rental coverage limit on the United Explorer Card?,"['3\nAuto Rental Coverage\nThis benefit provides reimbursement for damages caused by \ntheft or collision of the Rental Vehicle up to $60,000. Coverage is \navailable worldwide.\nYou are covered when You use a Covered Card Account and/or \nredeemable Rewards, to initiate and complete the entire Rental \nVehicle transaction. Only You, as the primary renter of the \nRental Vehicle, and any additional drivers permitted by the \nRental Car Agreement are covered.\nWhat’s Covered?\nThis benefit covers theft, damage, valid loss-of-use charges \nimposed and substantiated by the Rental Agency, administrative \nfees, and reasonable and customary towing charges (due to a \ncovered theft or damage) to the nearest qualified repair facility. \nNo other type of loss is covered. For example, in the event of \na collision involving the Rental Vehicle, damage to any other \ndriver’s car, the injury of anyone, or damage to anything is not \ncovered. Rental periods up to thirty-one (31) consecutive days \nare covered.\nHow Does This Benefit Work?\nInside the United States and outside the United States (where \nthis benefit is available) the coverage provided is primary. \nNew York Residents, inside the United States coverage is \nprimary unless You have personal automobile insurance in \nwhich case it is excess.\nHow Do You Use This Benefit?\n1.   Use  a Covered Card Account and/or redeemable Rewards to \ninitiate and complete the entire Rental Vehicle transaction.\n2.  Re view the Rental Car Agreement and decline the Rental \nAgency’s collision damage waiver/loss damage waiver \n(CDW/LDW) option or a similar provision. Accepting the Rental \nAgency’s CDW/LDW coverage will cancel out this benefit. If the \nRental Agency, outside of the United States, will not allow \nYou to decline their CDW/LDW coverage, then this benefit is \nsecondary to the Rental Agency’s CDW/LDW coverage.\n3.  Some  countries or Rental Agencies require a letter \nof coverage. Please check with the Rental Agency \nbefore You go. If a letter of coverage is required \nvisit\n chasecardbenefits.com or call 1-800-350-2919.\nBefore driving out of the lot, check the Rental Vehicle for \nany prior damage and bring any damage You identify to the \nattention of the Rental Agency.', '2\nYour Guide to Benefits describes the benefit that is in effect as \nof 10/01/24. Information in this guide takes the place of any \nprior benefit and benefit description you may have previously \nreceived. Your effective date of eligibility is determined \nby Chase. \nPlease keep the guide with your account information for future \nreference and call the benefit administrator if you have any \nquestions before taking advantage of the benefit.\nIf you have any questions please call 1-800-350-2919 or if you \nare outside the U.S., call collect at 001-214-503-2953.\nTABLE OF CONTENTS\nAuto Rental Coverage 3\nBaggage Delay Insurance 6\nExtended Warranty Protection 8\nLost Luggage Reimbursement 11\nPurchase Protection 13\nRoadside Assistance 15\nTravel Accident Insurance 17\nTravel and Emergency Assistance 22\nTrip Cancellation and Interruption Insurance 24\nTrip Delay Reimbursement 31\nAdditional Terms 33', '24\nferries and cruise ships, but does not include taxis, car service, \nrental car, rideshare service, commuter rail or commuter \nbus lines\nCovered Card - the credit card or Account that is eligible for \nbenefits as designated by JPMorgan Chase Bank, N.A. and/or \nits affiliates\nCovered Traveler - You and Your Immediate Family Member\nDomestic Partner - a committed relationship between two \nunmarried adults, in which the partners, (1) are each other’s \nsole Domestic Partner, (2) maintain a common residence, \n(3) share at least one (1) of the following financial arrangements: \na joint mortgage or lease, a joint bank account, joint title to or \nownership of a motor vehicle or status as a joint lessee on a \nmotor vehicle lease or a joint credit card account with a financial \ninstitution, (4) are not married or joined in a civil union to \nanyone else or are not the Domestic Partner of anyone else, and \n(5) are not blood related\nImmediate Family Member - spouse or Domestic Partner and \nlegally dependent children under the age of twenty-six (26)\nYou and Your - an individual to whom a Covered Card Account \nhas been issued by JPMorgan Chase Bank, N.A. and/or \nits affiliates\nTravel and Emergency Assistance services are sourced \nby Virginia Surety Company, Inc, an Assurant company, \nand are performed by a third party provider. This is not an \ninsurance benefit.\nTEAS_20240311\nTrip Cancellation and \nInterruption Insurance\nThis benefit provides reimbursement for covered travel \nexpenses if a Trip is cancelled or interrupted due to a covered \nreason. Coverage is limited to the lesser of the following:\n• $1,500 per Covered Traveler\n• $6,000 per Trip for all Covered Travelers\n•  the actual amount charged to the Covered Card and/or \nredeemable Rewards used for a covered travel expense\nNote: Eligible purchases made with redeemable Rewards will be \nreimbursed in dollars.\nThe Covered Traveler is covered when You charge all or a \nportion of the cost of the Trip to Your Covered Card and/or use \nredeemable Rewards. Covered Travelers do not need to be \ntraveling with You for benefits to apply.', 'Before driving out of the lot, check the Rental Vehicle for \nany prior damage and bring any damage You identify to the \nattention of the Rental Agency.\nThis benefit is in effect during the time the Rental Vehicle is in \nYour (or an authorized driver’s) control, and terminates when \nthe Rental Agency reassumes control of the Rental Vehicle.\nWhat Vehicles Are Not Covered?\nCertain vehicles are not covered by this benefit, including: \nexotic vehicles or any vehicle with a dealer or manufacturer’s \nsuggested retail price greater than $125,000, and antique \ncars (cars over twenty (20) years old or that have not been \nmanufactured for ten (10) years or more), cargo vans, trucks \n(other than pick-ups), motorcycles, mopeds, motorbikes, \nlimousines and vehicles that are rented with a driver, \nrecreational vehicles, and passenger vans with seating for more \nthan twelve (12) people including the driver.', '9\n•  The  amount charged to the Covered Card and/or redeemable \nRewards used (excluding shipping and handling)\n•  $10,000 per item and a maximum of $50,000 per \ncalendar year\nNote: Eligible purchases made with redeemable Rewards will be \nreimbursed in dollars.\nWe will decide whether to reimburse for the cost to have the \nitem repaired or replaced, whichever is less. Maximum coverage \nlimits apply.\nIf Your item is to be repaired, You may go to an authorized \nrepair facility and file a claim for reimbursement. Only valid, \ncustomary and reasonable repairs made at the authorized \nrepair facility are covered.\nHow Does This Benefit Work?\nThe coverage begins at the end of the original manufacturer’s \nU.S. repair warranty and provides one (1) year of coverage after \nit has expired. This benefit only covers what would have been \ncovered under the original manufacturer’s U.S. repair warranty.\nIf You received a store provided warranty or purchased a \nservice contract, Our coverage begins at the expiration of the \ncumulative warranties and service contract. If the original \nmanufacturer’s U.S. repair warranty or a combination of the \noriginal manufacturer’s U.S. repair warranty, store provided \nwarranty and a consumer purchased service contract exceeds \nthree (3) years there would not be coverage under this benefit.\nExamples:\n•  On an original manufacture r’s U.S. repair warranty of \nsix (6) months, We would provide You with an additional \ntwelve (12) months of coverage for a combined total of \neighteen (18) months of coverage.\n•  On an original manufacture r’s U.S. repair warranty of \ntwelve (12) months, and a consumer purchased service \ncontract of twenty-four (24) months, We would provide You \nwith an additional twelve (12) months of coverage starting \nat the end of the consumer purchased service contract for a \ncombined total of forty-eight (48) months of coverage.\n•  On an original manufacture r’s U.S. repair warranty of \nsix (6) months, and a consumer purchased service contract \nof thirty-six (36) months, there would be no extension of \ncoverage under this benefit.\nHow Can You Store Your Warranty?']","The auto rental coverage limit on the United Explorer Card is up to $60,000.","The United Explorer Card Auto Rental Coverage provides reimbursement for damages caused by theft or collision up to $60,000.",0.0,0.9999999999999999,1.0,0.9999999999,United Explorer,simple_fact,Phase 3 - Score Gap 0.45,2026-04-24T22:32:22.288481
What is the maximum cell phone protection per claim on the Bilt Palladium card?,"['2\n2. Y\nour coverage resumes on the first day of the calendar month \nfollowing the date of any future payment of your eligible cellular \nwireless telephone bill with your covered card.\nB.\n T\nhe kind of coverage you receive:\n •R\neimbursement for the actual cost to replace or repair a stolen or \ndamaged eligible cellular wireless telephone.\n •C\noverage ends on the earliest of: The date you no longer are a \ncardholder; the date the covered card is determined to be ineligible by \nthe participating organization; the date the participating organization \nceases to pay premium on the \ngroup policy; the date the participating \norganization ceases to participate in the group policy; the date the \ngroup policy is terminated.\nC. Coverage limitations: \nCoverage for a stolen or damaged eligible cellular wireless telephone is \nsubject to the terms, conditions, exclusions, and limits of liability of this \nbenefit. The maximum liability is $800 per claim, and $1,000 per covered \ncard per 12 month period. Each claim is subject to a $50 deductible.  \nCoverage is limited to two (2) claims per covered card per 12 month \nperiod. \nCoverage is excess of any other applicable insurance or indemnity \navailable to you. Coverage is limited only to those amounts not covered \nby any other insurance or indemnity. In no event will this coverage \napply as contributing insurance. This “non-contribution” clause will take \nprecedence over a similar clause found in other insurance or indemnity \nlanguage.\nD.\n What is NOT covered: \nThe following items are excluded from coverage under the group policy:\n •Eligi\nble cellular wireless telephone accessories other than the standard \nbattery and standard antenna provided by the manufacturer; \n •Eligi\nble cellular wireless telephones purchased for resale or for \nprofessional or commercial use;\n •Eligi\nble cellular wireless telephones that are lost or mysteriously \ndisappear;\n •Eligi ble cellular wireless telephones under the care and control of a \ncommon carrier, including, but not limited to, the U.S.', '2\nC. Coverage limitations:\nCoverage is limited to the actual cost, up to $1,500 per incident of \nrepairing or replacing your checked and/or carry-on luggage and any \npersonal property contained within. There is a maximum of 2 claim(s) \nper twelve (12) month period.\nD. Where you are covered:\nCoverage applies worldwide.\nE. What is NOT covered:\n •L\noss or damage of luggage or personal property for regularly scheduled \nshort-distance travel under one hundred (100) miles.\n •L\noss or damage resulting from any dishonest, fraudulent, or criminal act \ncommitted or arranged by you.\n •L\noss resulting from war or hostilities of any kind (including, but \nnot limited to, invasion, terrorism, rebellion, insurrection, riot, or \ncivil commotion); confiscation, expropriation or detention by any \ngovernment, public authority, or customs official; illegal activity or acts.\n •L\noss resulting from contamination by radioactive or hazardous \nsubstances, including mold.\n •Spor\nting equipment or musical instruments, unless checked in as \nluggage with the common carrier and for which a claim check has been \nissued.\n •Elec\ntronic equipment (including, but not limited to, laptops, PDAs, \nvideo/film cameras, or hearing aids).\n •E\nyeglasses, contact lenses, prosthetic devices, dentures, silverware, furs, \nhousehold furniture, or documents (including, but not limited to, visas \nand IDs).\n •Plan\nts, shrubs, animals, consumables, and perishables.\n •T\nraveler’s checks, tickets of any kind (e.g., for airlines, sporting events, \nconcerts, or lottery), negotiable instruments, bullion, rare, or precious \nmetals, stamps, and coins, currency or its equivalent.\n •Je\nwelry, art, used or antique items; collectibles of any kind (such as \nitems designed for people to collect or items that over time become \ncollectibles); recycled, previously owned, refurbished, rebuilt, or \nremanufactured items.\n •D\nefective material or workmanship, ordinary wear and tear or normal \ndeterioration.', '2\nYou must see either a Printed Advertisement or Non-Auction Internet \nAdvertisement for the same product (advertisement must verify same \nmanufacturer and model number) for a lower price within the Coverage \nPeriod from the purchase date, as indicated on Your receipt.\nB. The kind of coverage You receive:\n•  Covered Purchases are covered for the Coverage Period applicable to \nYour Eligible Account for the difference between the documented price \nYou paid and the documented lower price advertised.\n•  This coverage is secondary to any other applicable insurance or \nsimilar coverage available to You or the gift recipient including \nbenefits provided by the retailer (including, but not limited to, refunds, \nexchanges, and store credits). Coverage is limited to only those amounts \nnot covered by any other insurance or similar coverage, or retailer \nbenefits (including, but not limited to, refunds, exchanges, and store \ncredits).\nC. Coverage limitations:\n•   Coverage is limited to the difference between the actual cost of the \nitem (excluding taxes, storage, shipping, and handling costs) and the \nadvertised lower price, up to $250 per claim. There is a minimum claim \namount of $25 and a maximum of four (4) claim(s) per Eligible \nAccount per twelve (12) month period.\n•  This EOC is not an insurance policy, warranty, or service contract.\nD. What is NOT covered:\n•  Any item purchased from an Internet site whose primary purpose is not \nthe sale of the item or related items.\n•  For consumer cards – items purchased for resale, rental, professional, or \ncommercial use.\n•  For commercial cards – items purchased for resale such as professional \ninventory or work-related material.\n•  Jewelry, art, used or antique items; collectibles of any kind (such as \nitems designed for people to collect or items that over time become \ncollectibles); recycled, previously owned, refurbished, rebuilt, or \nremanufactured items.\n•  Customized/personalized, one-of-a-kind, or special-order items.\n•  Layaway items; items returned to any store.\n•  Any items purchased from an Auction.\n•  Items for which the Printed Advertisement or Non-Auction Internet \nAdvertisement containing the lower price was published after the \nCoverage Period.', 'to a maximum of twenty-four (24) months following the day that \nthe Manufacturer’s Warranty or Store Warranty expires.\n• If you purchase a Purchased Warranty of twenty-four (24) months\nor less on a Covered Purchase with an original Manufacturer’s\nWarranty (or Store Warranty), this coverage doubles the time\nperiod of the Covered Purchase’s original Manufacturer’s Warranty \n(or Store Warranty) up to an additional twenty-four (24) months\nfollowing the day that the original Manufacturer’s Warranty (or \nStore Warranty) and the Purchased Warranty’s coverage periods\nend.\nC. Coverage limitations:\n• The maximum benefit for repair or replacement shall not exceed\nthe lesser of the following per claim: (1) The actual purchase\namount charged on your Covered Card, less shipping and\nhandling fees; (2) the actual cost of repair; (3) the actual cost of \nreplacement with an item of like kind and quality; or (4) $10,000.\n• We or our Administrator will decide if a Covered Purchase will be\nrepaired or replaced, or whether you will be reimbursed up to the\nmaximum benefit amount for the item. Only valid and reasonable\nrepairs made at a certified repair facility are covered. Items will be\nreplaced with those of like kind and quality. However, we cannot\nguarantee to match exact color, material, brand, size, or model.\n• Coverage is secondary to and in excess of any other applicable\ninsurance or indemnity available to you or the gift recipient.\nCoverage is limited to only those amounts not covered by any other \ninsurance or indemnity. It is subject to the conditions, limitations,\nand exclusions described in this document. In no event will this\ncoverage apply as contributing insurance. This non-contribution\nclause will take precedence over a similar clause found in other \ninsurance or indemnity language.\nD. What is NOT covered:\n• Used items, antiques, or collectibles of any kind (such as items\ndesigned for people to collect or items that over time become\ncollectibles) that do not come with a Manufacturer’s Warranty \nor Store Warranty (repair or replacement amount will not include\nmarket value at time of claim).\n• Recycled, previously owned, refurbished, rebuilt, or remanufactured\nitems.\n• Product guarantees or “satisfaction guaranteed” items.', 'A. To get coverage:\nYou must pay the entire cost of the \ncommon carrier ticket(s) with your \ncovered card and/or accumulated points from your covered card.\nB. The kind of coverage you receive:\n •Reimbursement for the actual cost of replacing, on an emergency basis, \nany personal articles (e.g., clothing, hygiene and/or grooming products) \nor business eff  ects (e.g., uniforms or general offi   ce supplies) contained \nin your \nchecked baggage, if the checked baggage is delayed in getting to \nyou at your scheduled destination.\n •Coverage begins when the baggage is checked in with the common \ncarrier by you. This includes curbside check-in with facility-designated \npersonnel.\n •Coverage ends when you regain possession of your checked baggage \nfrom the common carrier. This includes curbside checkout with facility-\ndesignated personnel.\n •Coverage is secondary to any other applicable insurance or coverage \navailable to you including benefi  ts provided by the common carrier \n(including, but not limited to, goodwill payments, refunds, credit/\nvouchers). Coverage is limited to only those amounts not covered by any \nother insurance or coverage or common carrier benefi  ts (including, but \nnot limited to, goodwill payments, refunds, credit/vouchers).\nC. Coverage limitations:\nCoverage is limited to the actual cost, up to $250 per claim, of \nreplacing, on an emergency basis, any personal articles or business eff \nects contained in your checked baggage. There is a maximum of 2 \nclaim(s) per twelve (12) month period.\nGuide to Benefi  ts for \nMastercard® Cardholders\nBaggage Delay']",The maximum cell phone protection per claim on the Bilt Palladium card is $800.,"The Bilt Palladium cell phone protection covers up to $800 per claim, with a $50 deductible, and a maximum of 2 claims per 12-month period.",0.0,1.0000000000000002,1.0,0.9999999999,Bilt Palladium,simple_fact,Phase 3 - Score Gap 0.45,2026-04-24T22:32:22.288481
How much is the annual Uber Cash benefit on the Amex Platinum card?,"['Further details will be\navailable at uber.com/signaturesupport starting on May 7, 2026.\nBasic Card Members on a Consumer Platinum or Centurion account and Additional Centurion\nMembers are eligible for $15 Uber Cash each month plus an additional $20 Uber Cash in December,\nand Uber VIP where available (""Amex Benefit""). To receive the Amex Benefit, you must have\ndownloaded the latest version of the Uber, Uber Eats and/or Postmates apps and added your eligible\nPlatinum Card or Centurion Card as a payment method in your Uber account. It may take up to 48\nhours for the Amex Benefit to become available in your Uber account after your eligible Card has\nbeen added to your account. To redeem the Uber Cash received through the Amex Benefit, you must\nselect an American Express Card as the payment method for your transaction and have Uber Cash\ntoggled on. The Amex Benefit may only be used in the United States.\n®\n4/17/26, 7:27 PM Platinum Card® - Terms, Conditions & Disclosures\nhttps://www.americanexpress.com/us/credit-cards/card-application/apply/supplementary/terms/platinum-card/36182-9-0 4/40', ""To receive this benefit, sign into your existing Uber account or sign up to create a new account (latest\nversion of the app required) and make sure your U.S. Consumer American Express Platinum Card is\nset as your payment method for your new or existing Uber One membership. Additionally, ensure\nyour Uber Cash balance is toggled off for Uber One membership fees so your Amex Card is charged\ndirectly to receive the full value of the applicable statement credits, up to $120 each calendar year.\nUber One is a subscription that auto-renews and is subject to the Uber One Membership Terms and\nConditions available at https://www.uber.com/legal/en/document/?name=renewable-passes-\nterms&country=united-states&lang=en. To learn more about Uber's cancellation deadlines and\nrequirements, please visit the Uber Help Center or the Uber One Membership Terms and Conditions.\nThe Uber One Membership Terms and Conditions are subject to change and American Express has\nno control over those changes. Statement credits will not be issued for any applicable free trial or for\nthe portion of an Uber One membership fee that has been discounted or paid for using Uber One\ncredits, Uber Cash, or similar discounts or promotions. American Express Cards added to your Uber\naccount through a third party such as Apple Pay or PayPal will not be eligible.\nCancelling or removing your eligible American Express Card will not automatically cancel your Uber\nOne membership and Uber will continue to collect membership fees in accordance with the Uber One\nMembership Terms and Conditions which are separate from the terms of this benefit.\nIf you transfer to another eligible American Express Card, your eligible Card expires or is replaced, or\nyour Card details change, you will need to remove your previous American Express Card and add\nyour new Card as the payment method for your Uber One membership in your Uber, Uber Eats,\nand/or Postmates account. If your American Express Card details change and you do not update\nyour new Card details as your payment method for your Uber One membership prior to your next\nUber One billing cycle, you will not receive the statement credit(s). For purposes of fulfilling this\nbenefit, American Express will share with Uber certain information about your Card, including the\nCard type, and updated Card information and activation status from time to time."", ""The Amex Benefit will not apply to previous Uber transactions and cannot be used when paying with\na family profile. Uber will apply Uber Cash received through the Amex Benefit at the point of sale and\nit will be displayed on your receipt.\nUber Cash received through the Amex Benefit expires at 11:59 PM Hawaii Standard Time on the last\nday of each calendar month. Unused balance in Uber Cash from your Amex Benefit will not carry\nover to the following month. Uber Cash received through the Amex Benefit will be applied for the\nmonth in which the transaction is completed. If a transaction is eligible for another promotion that you\nhave added to your Uber account, the promotion will be applied before your Amex Benefit. Certain\nother types of balances in Uber Cash may be applied to the cost of your ride or order prior to your\nAmex Benefit in Uber Cash. For purposes of fulfilling this benefit, American Express will share with\nUber certain information about your Card, including the Card type, and updated Card information\nfrom time to time. If you do not wish to receive the Amex Benefit, please call the number on the back\nof your Card. If you do not see the Uber Cash portion of the Amex Benefit in your Uber Cash\nbalance by 5:00 PM Hawaii Standard Time on the first day of each calendar month, call the number\non the back of your Card for assistance.\n$209 CLEAR+ Credit\nBasic Card Members can earn up to $209 in statement credits per calendar year when their Platinum\nCard  or Additional Cards on the Account are used to pay for an annual CLEAR+ Membership.\nEnrollment in CLEAR+ is required and is subject to CLEAR's terms and conditions. American Express\nhas no control over the application and/or approval process for CLEAR and does not have access to\nany information provided to CLEAR by the Card Member or by CLEAR to the Card Member.\nAmerican Express has no liability regarding the CLEAR program. If a Card Member's application is\nnot approved by CLEAR, CLEAR will refund the charges. If the statement credit benefit has been\napplied before CLEAR refunds the charges, that statement credit will be reversed. Statement credit(s)\nmay not be received or may be reversed if the qualifying purchase is returned, refunded, cancelled or\nmodified."", 'POID K0ZB:9967\nBENEFIT TERMS\nThe following benefits and services are subject to change or cancellation.\n$120 Uber One Credit\nBasic Card Members on U.S. Consumer Platinum Accounts are eligible to receive up to $120 in\nstatement credits per calendar year on Uber One membership fees charged to an eligible Card.\nPurchases by both the Basic Card Member and Additional Card Members on the eligible Card\nAccount are eligible for statement credits. However, statement credits will not exceed $120 per\ncalendar year per Card Account. Valid on both monthly and annual Uber One membership purchases.\nBenefit is available for Uber One memberships and Uber accounts located in the U.S., except in\nNorthern Mariana, American Samoa, Guam and U.S. Virgin Islands, for eligible deliveries or rides in\nU.S. cities where Uber, Uber Eats, and/or Postmates are available.\n4/17/26, 7:27 PM Platinum Card® - Terms, Conditions & Disclosures\nhttps://www.americanexpress.com/us/credit-cards/card-application/apply/supplementary/terms/platinum-card/36182-9-0 1/40', 'Statement credit(s) may not be received or\nmay be reversed if an eligible purchase is returned, refunded, cancelled, or modified. American\nExpress also relies on information provided to us by the merchant to identify eligible purchases. If\nAmerican Express does not receive information that identifies your transaction as eligible for this\nbenefit, the Basic Card Member will not receive the statement credit. Basic Card Members may not\nreceive the statement credit if we receive inaccurate information or are otherwise unable to identify\nyour purchase as eligible, if a transaction is made with an electronic wallet or through a third party\n(such as an app store), or if the merchant uses a mobile or wireless card reader to process it.\nIf the Card Account is cancelled or past due, it may not qualify to receive a statement credit. If your\nCard is enrolled in the benefit and you replace your Card, please check the Benefits section of your\namericanexpress.com account, mobile app or call the number on the back of your Card to confirm\nyour continued enrollment in the benefit. If American Express, in its sole discretion, determines that\nyou have engaged in or intend to engage in any manner of abuse, misuse, or gaming in connection\nwith this benefit, American Express will not have an obligation to provide statement credits and may\nreverse any statement credits provided to you. If a charge for an eligible purchase is included in a\nPay Over Time balance on your Card Account, the statement credit associated with that charge may\nnot be applied to that Pay Over Time balance. Instead, the statement credit may be applied to your\nPay In Full balance. For additional information, call the number on the back of your Card.\n$200 Uber Cash\nEffective May 7, 2026, Uber VIP will be removed from the Amex Benefit and replaced with Signature\nSupport for Amex, a premium level of phone customer service including 24/7 access to live customer\nsupport agents. Signature Support for Amex can be accessed in the account section of the Uber,\nUber Eats, or Postmates apps via the Partner Rewards Hub or Help pages. Further details will be\navailable at uber.com/signaturesupport starting on May 7, 2026.']","The annual Uber Cash benefit on the Amex Platinum card is $15 each month plus an additional $20 in December, totaling $200 in Uber Cash per year.","The Amex Platinum provides up to $200 per year in Uber Cash, distributed as $15 per month plus a $20 bonus in December.",0.3333333333333333,0.981625644051156,1.0,0.699999999965,Amex Platinum,simple_fact,Phase 3 - Score Gap 0.45,2026-04-24T22:32:22.288481
What is the Common Carrier Travel Accident Insurance benefit amount on the United Explorer Card?,"['In order to be covered, the Loss must occur within one (1) year \nafter the Accident.\nWhat Are the Benefit Amounts?\nCoverage\nMaximum Benefit Amount \nper Covered Traveler\nTwenty-Four (24) Hour \nTravel Accident $100,000\nCommon Carrier \nTravel Accident $500,000\nThis benefit will pay the Percentages of Maximum Benefit \nAmount for specific Losses as follows: \nLoss \nPercentage of \nMaximum Benefit \nAmount\nLoss of Life; Loss of Speech and \nLoss of Hearing; Loss of Speech \nor Hearing and Loss of one Hand, \nFoot or Sight of One Eye; Loss of \nBoth Hands; Loss of Both Feet; \nLoss of Sight of Both Eyes; Loss of \na combination of any two of a Loss \nof Hand, Loss of Foot or Loss of \nSight of One Eye\n100%\nLoss of One Hand; Loss of One \nFoot; Loss of Sight of One Eye; Loss \nof Speech; Loss of Hearing\n50%\nLoss of Thumb and Index Finger of \nthe same hand 25%', '17\nTravel Accident Insurance\nThis benefit provides payment if a Covered Traveler suffers a \nLoss of Life or loss of limb, sight, speech or hearing due to an \nAccident while traveling on a Trip.\nThe Covered Traveler is covered when You charge all or a \nportion of the cost of the Common Carrier fare to Your Covered \nCard and/or use redeemable Rewards. Covered Travelers do not \nneed to be traveling with You for benefits to apply.\nWhen is the Covered Traveler Covered?\nTwenty-Four (24) Hour Travel Accident\nCoverage begins from Trip Departure Date and ends on Trip \nCompletion Date for Trips up to thirty (30) days. For Trips \nlasting more than thirty (30) days coverage remains in effect \nuntil 12:01 a.m. on the thirty-first (31st) day following the Trip \nDeparture Date. Coverage is reactivated when the Covered \nTraveler commences travel to their return destination on the \nTrip Completion Date.\nCommon Carrier Travel Accident\nCoverage applies when the Covered Traveler:\n1)  is riding as a passenger in, entering, or exiting the Common \nCarrier for which the fare was purchased using the Covered \nCard and/or redeemable Rewards;\n2)  is riding as a passenger in, entering, or exiting any Common \nCarrier licensed to carry the public for hire or any Courtesy \nTransportation provided without a specific charge and while \ntraveling to and from the airport, terminal, or station:\n a)  immediately preceding the departure of the scheduled \nCommon Carrier on which the Covered Traveler is a \npassenger; or\nIf You feel You are in an unsafe location, You will be advised \nto hang up and dial 911. If You are not able to dial 911, the \nroadside assistance provider will call the non-emergency police \nnumber near Your location and remain on the phone with You \nat Your request until the police arrive.\nThis program may be discontinued at any time without \nprior notice.\nProgram void where prohibited.\nDefinitions\nAccount - the credit card Account issued by \nJPMorgan Chase Bank, N.A. and/or its affiliates\nCovered Card - the credit card or Account that is eligible for \nbenefits as designated by JPMorgan Chase Bank, N.A.', '11\nLost Luggage Reimbursement\nThis benefit provides reimbursement for the difference between \nthe actual cash value (replacement cost less depreciation) and \nany reimbursement provided by the Common Carrier for the \ncosts the Covered Traveler incurs to repair or replace their \nChecked Baggage, Carry-On Baggage, and/or personal property \ncontained within that is lost, damaged, or stolen. The maximum \nbenefit is $3,000 per Covered Traveler per Trip (additionally, \nNew York residents are limited to $2,000 per bag and $10,000 \nfor all Covered Travelers per Trip). The maximum benefit per \nCovered Traveler per Trip includes a sub-limit up to $500 for \njewelry and watches and a sub-limit up to $500 for cameras \nand other electronic equipment. The benefit amounts for \njewelry, watches, cameras, and other electronic equipment are \npart of and not in addition to the maximum benefit amount. \nPayment of these benefit amounts reduces and does not \nincrease the maximum benefit.\nItems the Covered Traveler inadvertently leaves behind on \nthe Common Carrier are not considered lost or stolen.\nThe Covered Traveler is covered when You charge all or a \nportion of the cost of the Common Carrier fare to Your Covered \nCard and/or use redeemable Rewards. Covered Travelers do not \nneed to be traveling with You for benefits to apply.\nCoverage for Checked Baggage begins when baggage is checked \nin and is under the care and control of the Common Carrier and \nends when baggage has been retrieved by the Covered Traveler \nfrom the Common Carrier pick up area.\nCoverage for Carry-On Baggage begins when the Covered \nTraveler boards the Common Carrier and ends when the \nCovered Traveler exits the Common Carrier.\nPlease Pay Special Attention to These Conditions:\n•  If the Covered Traveler’s Checked Baggage is lost, stolen, or \ndamaged by the Common Carrier, the loss must be reported \nto the Common Carrier (within their required timeframe for \nnotification) to be eligible for this benefit.\n•  If the Covered Traveler’s Carry-On Baggage is lost, stolen, or \ndamaged while on the Common Carrier, it must be reported \nto the Common Carrier as soon as the Covered Traveler exits \nthe Common Carrier.', '19\nIn the event a Loss is eligible for payment under both the \nCommon Carrier Travel Accident and the Twenty-Four (24) Hour \nTravel Accident coverage, or if a Covered Traveler suffers \nmultiple covered Losses as the result of one (1) Accident, We will \nonly pay the single largest Maximum Benefit Amount applicable \nto all covered Losses.\nIf more than one Covered Traveler under the same Account \nsuffers a Loss arising from the same Accident, We will not pay \nmore than two (2) times the Maximum Benefit Amount (the \naggregate limit of insurance). If an Accident results in benefits \nbecoming payable, which when totaled exceeds two (2) times \nthe Maximum Benefit Amount, the aggregate limit of insurance \nwill be divided proportionally, based on applicable benefit \namounts owed to all Covered Travelers.\nIf the Covered Traveler is eligible for coverage under multiple \nAccounts, then the Covered Traveler will only be covered under \nthe Account which provides the largest Benefit Amount for the \nLoss that has occurred.\nAll benefits, except for Loss of Life, are paid to the Covered \nTraveler. Loss of Life benefits are paid to the Covered \nTraveler’s estate.\nWhat’s Not Covered?', '18\n b)  immediately following the arrival of the scheduled \nCommon Carrier on which the Covered Traveler was a \npassenger; or\n3)  while at the airport, station, or terminal at the beginning or \nend of a Trip.\nIf the purchase of the Common Carrier passenger fare is not \nmade prior to the Covered Traveler’s arrival at the airport, \nterminal, or station, coverage will begin at the time when You \ncharge all or a portion of the cost of the Common Carrier fare to \nYour Covered Card and/or use redeemable Rewards.\nWhat’s Covered?\nTo receive payment under this benefit, the injury to, or death of, \nthe Covered Traveler(s) must be caused by one of the following:\n•  An Accident that occurs while on a Trip as defined under \nWhen is the Covered Traveler Covered?;\n•  If, due to an Accident, the Covered Traveler has not been \nfound within one (1) year of the disappearance, stranding, \nsinking, or wrecking of the Common Carrier in which the \nCovered Traveler was an occupant at the time of the Accident, \nthen it will be assumed that the Covered Traveler has suffered \na Loss of Life.\n•  If, due to an Accident, the Covered Traveler is unavoidably \nexposed to the elements and as a result of this exposure \nsuffers a Loss.\nIn order to be covered, the Loss must occur within one (1) year \nafter the Accident.\nWhat Are the Benefit Amounts?']","The Common Carrier Travel Accident Insurance benefit amount on the United Explorer Card is $500,000 per Covered Traveler.","The United Explorer Card provides Common Carrier Travel Accident Insurance up to $500,000 per covered traveler.",0.5,0.9731025555380021,1.0,0.99999999995,United Explorer,simple_fact,Phase 3 - Score Gap 0.45,2026-04-24T22:32:22.288481
Is the auto rental coverage on the United Explorer Card primary or secondary?,"['3\nAuto Rental Coverage\nThis benefit provides reimbursement for damages caused by \ntheft or collision of the Rental Vehicle up to $60,000. Coverage is \navailable worldwide.\nYou are covered when You use a Covered Card Account and/or \nredeemable Rewards, to initiate and complete the entire Rental \nVehicle transaction. Only You, as the primary renter of the \nRental Vehicle, and any additional drivers permitted by the \nRental Car Agreement are covered.\nWhat’s Covered?\nThis benefit covers theft, damage, valid loss-of-use charges \nimposed and substantiated by the Rental Agency, administrative \nfees, and reasonable and customary towing charges (due to a \ncovered theft or damage) to the nearest qualified repair facility. \nNo other type of loss is covered. For example, in the event of \na collision involving the Rental Vehicle, damage to any other \ndriver’s car, the injury of anyone, or damage to anything is not \ncovered. Rental periods up to thirty-one (31) consecutive days \nare covered.\nHow Does This Benefit Work?\nInside the United States and outside the United States (where \nthis benefit is available) the coverage provided is primary. \nNew York Residents, inside the United States coverage is \nprimary unless You have personal automobile insurance in \nwhich case it is excess.\nHow Do You Use This Benefit?\n1.   Use  a Covered Card Account and/or redeemable Rewards to \ninitiate and complete the entire Rental Vehicle transaction.\n2.  Re view the Rental Car Agreement and decline the Rental \nAgency’s collision damage waiver/loss damage waiver \n(CDW/LDW) option or a similar provision. Accepting the Rental \nAgency’s CDW/LDW coverage will cancel out this benefit. If the \nRental Agency, outside of the United States, will not allow \nYou to decline their CDW/LDW coverage, then this benefit is \nsecondary to the Rental Agency’s CDW/LDW coverage.\n3.  Some  countries or Rental Agencies require a letter \nof coverage. Please check with the Rental Agency \nbefore You go. If a letter of coverage is required \nvisit\n chasecardbenefits.com or call 1-800-350-2919.\nBefore driving out of the lot, check the Rental Vehicle for \nany prior damage and bring any damage You identify to the \nattention of the Rental Agency.', '14\nat Your expense, as part of the claim review process prior to \nbeing reimbursed.\nIf the item is damaged, We will decide whether to reimburse for \nthe cost to have the item repaired or replaced, whichever is less. \nMaximum coverage limits apply.\nCoverage is secondary and in excess of valid and collectible \ninsurance or indemnity (including, but not limited to, \nhomeowner’s, renter’s, automobile, or employer’s insurance \npolicies). This means that if You have another insurance policy, \nthis benefit will cover only the amount Your other policies \ndo not. Deductibles You may have to pay under Your other \ninsurance policies are covered. You would not have to file a \nclaim under Your other insurance If the deductible on the other \ninsurance is equal to or greater than the claim amount.\nWhat’s Not Covered?\nThis benefit does not cover the following:\n• Living animals and plants\n• Antiques or collectible items\n•  Boats, automobiles, aircraft, and any other motorized vehicles \nand their motors, equipment, or accessories, including trailers \nand other items that can be towed by or attached to any \nmotorized vehicle\n• Computer software\n• Items purchased for resale, professional, or commercial use\n•  Items that are lost, or that “mysteriously disappear,” meaning \nthey vanished in an unexplained manner, with no evidence of \nwrongdoing by one person\n•  Items under the control and care of a common carrier, \nincluding the U.S.', 'and/or its affiliates\nCovered Card - the credit card or Account that is eligible for \nbenefits as designated by JPMorgan Chase Bank, N.A. and/or \nits affiliates\nRental Agency - a commercial rental company licensed under \nthe laws of the applicable jurisdiction and whose primary \nbusiness is renting automobiles\nRental Car Agreement - the entire contract an eligible renter \nreceives when renting a Rental Vehicle from a Rental Agency \nwhich describes in full all of the terms and conditions of \nthe rental, as well as the responsibilities of all parties under \nthe contract\nRental Vehicle - a land motor vehicle with four (4) or more \nwheels which the eligible renter has rented for the period of \ntime shown on the Rental Car Agreement and is not identified \nas a non-covered vehicle herein\nRewards - points, miles, cash rewards, or any other type of \nredeemable Rewards associated with your Covered Card, \nprovided that all Rewards have been accumulated by You \nthrough use of a JPMorgan Chase Bank, N.A. and/or its affiliates \nsponsored Rewards program', 'This benefit is secondary and payable on an excess basis over \nand above any amount due from any other valid or collectible \ninsurance or any other form of reimbursement payable by those \nresponsible for the loss.\nWhat’s Not Covered?\nThis benefit does not apply to the following:\n• Hearing aids\n• Artificial teeth, dental bridges, or prosthetic devices\n•  Tickets, documents, money, securities, checks, travelers \nchecks, and valuable papers\n• Business samples\n• Jewelry and watches\n• Cameras, video recorders, and other electronic equipment\n•  Recreational equipment, any equipment that is used to \nengage in a particular sport, hobby, game, excursion, or other \nrecreational activity', '35\nNo Class Actions/No Joinder of Parties: You agree that any \narbitration proceeding will only consider Your Claims. Claims \nby, or on behalf of, other individuals will not be arbitrated in \nany proceeding that is considering Your Claims. You also agree \nthat You will not join with others to bring Claims in the same \narbitration proceeding.\nYOU AND VSC UNDERSTAND AND AGREE THAT BECAUSE OF \nTHIS ARBITRATION PROVISION NEITHER YOU NOR VSC WILL \nHAVE THE RIGHT TO GO TO COURT EXCEPT AS PROVIDED \nABOVE OR TO HAVE A JURY TRIAL OR TO PARTICIPATE AS \nANY MEMBER OF A CLASS OF CLAIMANTS PERTAINING TO \nANY CLAIM.\nDue Diligence: All parties are expected to exercise due \ndiligence to avoid or diminish any theft, loss or damage to the \nproperty covered under these programs. “Due diligence” means \nthe performance of all vigilant activity, attentiveness, and care \nthat would be taken by a reasonable and prudent person in the \nsame or similar circumstances in order to guard and protect \nthe item.\nSubrogation: If payment is made under this benefit, the \nprovider is entitled to recover such amounts from other parties \nor persons. Any party who receives payment under this benefit \nmust transfer to the provider his or her rights to recovery \nagainst any other party or person and must do everything \nnecessary to secure these rights and must do nothing that \nwould jeopardize them.\nSalvage: If an item is not repairable, the administrator may \nrequest You send the item to the administrator for salvage at \nYour expense. Failure to remit the requested item for salvage to \nthe claim administrator may result in denial of the claim.\nSecondary Insurance: Coverage is secondary to any other \napplicable insurance or indemnity available to You unless \nindicated within the Guide. Coverage is limited to only those \namounts not covered by any other insurance or indemnity. It is \nsubject to the conditions, limitations, and exclusions described \nin this Guide. In no event will insurance benefits apply as \ncontributing insurance. The non-contribution insurance clause \nwill take precedence over the non-contribution clause found in \nany other insurance policies.']","The auto rental coverage on the United Explorer Card is primary inside the United States and outside the United States (where this benefit is available). For New York residents, the coverage is primary unless you have personal automobile insurance, in which case it is excess.",The auto rental coverage on the United Explorer Card is primary coverage.,1.0,0.7004120400564369,1.0,0.9999999999,United Explorer,exact_term,Phase 3 - Score Gap 0.45,2026-04-24T22:32:22.288481
How many Priority Pass lounge guests are included free with the Bilt Palladium card?,"['Description\nAirport lounge access provided by Priority Pass is available to all \neligible Bilt Palladium Card cardholders. Cardholders can use \ntheir Priority Pass membership or digital membership card to \naccess an airport lounge in a seamless way, as follows: \n•Eligible cardholders will enjoy complimentary lounge \nmembership for them and up to two guests.For additional guests \nabove two, the Cardholder will be charged $35 per guest per \nlounge visit.\n• Membership to 1200+ Priority Pass lounges in 120+ countries and \nin over 400 airports regardless of airline, frequent ﬂ yer membership \nor class of ticket.\nPriority Pass provides aﬄ  uent cardholders the opportunity to relax, \nrefresh and enhance their airport experience as they wait for their ﬂ \night.\nDetail\nWho Is Eligible:\nU.S. issued Bilt Palladium Card cardholders whose issuing bank \nhas completed the enrollment process.\nHow Priority Pass Works:\n1. Before traveling, eligible cardholders need to activate their \nmembership using their Bilt Palladium Card at the \nwww.PriorityPass.com website. Once activated, cardholders \ncan log on their Priority Pass account at www.PriorityPass.com \nand view a list of participating lounges and experiences.\n2.  Eligible cardholders will enjoy complimentary refreshments, \nnewspapers and\n television. In addition, there is access to business \nfacilities including phone, fax, conference and Internet facilities \n(where available).\n3. To gain access to the lounges, an eligible cardholder only \nneeds to quote “Priority Pass” at the participating lounge \nand, once activated, present their Bilt Palladium Card or \npresent their Digital Membership card (QR Code), found in \nthe Priority Pass app, and their boarding pass.\n4.  A list of participating lounges can be found and viewed using \nthe Priority Pass website or app.\n • FAQs can be viewed online at\nhttps:/ /www.prioritypass.com/en/member-support/faq\n • Contact Priority Pass at\nhttps:/ /www.prioritypass.com/en/member-support/contact-us\nor +1 469 334 4174 for customer support.', '• Terms of Use can be viewed online at\nhttps:/ /www.prioritypass.com/en/terms-of-use\n • Conditions of Use can be viewed online at\nhttps:/ /www.prioritypass.com/en/conditions-of-use\nGuide to Beneﬁ  ts for \nMastercard® Cardholders\nPriority Pass\nAirport Lounge Access', '2\nD. What is NOT covered:\n •Plan\nts, shrubs, animals, consumables, and perishables.\n •Ar\nt objects, antique items, collectibles of any kind (such as items \ndesigned for people to collect or items that over time become \ncollectibles).\n •All \ntypes of stored data or music (including, but not limited to, computer \nsoftware, DVDs, video cassettes, CDs, audio cassettes, and film).\n •K\neys, travelers’ checks, visas, documents of any kind, tickets of any \nkind (e.g. airlines, sporting events, concerts, or lottery), negotiable \ninstruments, bullion, rare, or precious metals, stamps, and coins, \ncurrency or its equivalent.\n •Pr\noperty shipped as freight (including, but not limited to, automobiles \nand their equipment, motorcycles, gasoline or oils, and electrical free-\nstanding motors.\n •C\nomputers, printers, or any computer related equipment.\n •R\nugs, cameras, radios, CD or DVD players, sporting equipment, cellular \nphones, or household furniture.\n •L\nosses resulting from war or hostilities of any kind (including, but \nnot limited to, invasion, terrorism, rebellion, insurrection, riot, or \ncivil commotion); confiscation, expropriation or detention by any \ngovernment, public authority, or customs official; illegal activity or acts.\n •L\nosses resulting from contamination by radioactive or hazardous \nsubstances, including mold.\n •It\nems specifically identified or described in and/or insured under any \nother insurance or indemnity policy.\n •Indi\nrect or direct damages resulting from a loss.\n •An\ny items not contained in your checked baggage.\nE. How to file a claim:\n •Visit \nwww.mycardbenefits.com or call 1-800-Mastercard to open a \nclaim. You must report the claim within sixty (60) days of the loss or the \nclaim may not be honored.\n •R\neport the baggage delay to the common carrier within twenty-four \n(24) hours.', '©2025 Mastercard. 8854 CRED_WRLD_LGD-NC_1225\nFor more information,  \ncall 1-800-Mastercard: 1-800-627-8372,  \nor en Español: 1-800-633-4466. \nVisit our website at www.mastercard.com.', '•  Layaway items; items returned to any store.\n•  Any items purchased from an Auction.\n•  Items for which the Printed Advertisement or Non-Auction Internet \nAdvertisement containing the lower price was published after the \nCoverage Period.\n•  Items advertised or shown as price quotes, bids or final sale amounts \nfrom a non-auction Internet site.\n•  Items advertised in or as a result of “limited quantity,” “going out-of-\nbusiness sales,” “close out” , or as “discontinued” .\n•  Printed Advertisements or Non-Auction Internet Advertisements that \ndisplay pricing lower than Your purchased item due to rebates, special \nofferings, bonuses, free items/giveaways, manufacturer’s coupons, or \nspecial financing.\n•  Professional services, including workmanship, installation, professional \nadvice/counseling, and technical support, or helpline.\n•  Plants, shrubs, animals, pets, consumables, and perishables.\n•  Motorized vehicles, including, but not limited to, automobiles, \nwatercraft/boats, aircraft, and motorcycles, or their motors, \nequipment, or accessories.\n•  Land, any buildings (including, but not limited to, homes and dwellings), \npermanently installed items, fixtures, structures, or home improvement.\n•  Game animals, pets or specimens preserved for display (e.g., fish, birds, \nreptiles, or mammals).\n•  Traveler’s checks, tickets of any kind (e.g., for airlines, sporting events, \nconcerts, or lottery), negotiable instruments, bullion, rare or precious \nmetals, stamps, and coins, currency or its equivalent.\n•  Differences in price due to sales tax, storage, shipping, handling, \npostage, transportation, and delivery.\n•  Differences in price due to foreign exchange rates or fluctuation in \nforeign exchange rates. \nE. How to file a claim:\nFor a Printed Advertisement:\n•  Visit www.mycardbenefits.com or call 1-800-Mastercard to open a \nclaim. You must report the claim within sixty (60) days of the incident \nor the claim may not be honored.']","With the Bilt Palladium card, eligible cardholders can enjoy complimentary lounge membership for themselves and up to two guests.",The Bilt Palladium card includes complimentary Priority Pass lounge access for the cardholder and up to 2 guests. Additional guests above 2 are charged $35 per guest per visit.,1.0,0.7096547086074287,1.0,0.9999999999,Bilt Palladium,exact_term,Phase 3 - Score Gap 0.45,2026-04-24T22:32:22.288481
What is the Purchase Protection coverage window on the United Explorer Card?,"['13\nsole Domestic Partner, (2) maintain a common residence, \n(3) share at least one (1) of the following financial arrangements: \na joint mortgage or lease, a joint bank account, joint title to or \nownership of a motor vehicle or status as a joint lessee on a \nmotor vehicle lease or a joint credit card account with a financial \ninstitution, (4) are not married or joined in a civil union to \nanyone else or are not the Domestic Partner of anyone else, and \n(5) are not blood related\nFamily Member - an individual’s: spouse or Domestic Partner, \nand parents thereof; sons and daughters, including adopted \nchildren and stepchildren; legal guardians or wards; parents, \nincluding stepparents; brothers and sisters; grandparents and \ngrandchildren; aunts or uncles; nieces or nephews; spouses or \nDomestic Partners of any individual of this definition\nRewards - points, miles, cash rewards, or any other type of \nredeemable Rewards associated with Your Covered Card, \nprovided that all Rewards have been accumulated by You \nthrough use of a JPMorgan Chase Bank, N.A. and/or its affiliates \nsponsored Rewards program\nTrip - any pre-paid travel when a portion or the entire cost of a \nround trip or one way Common Carrier fare was paid using the \nCovered Card and/or redeemable Rewards\nWe, Us and Our - Virginia Surety Company, Inc., an Assurant \ncompany, the insurance company that provides these benefits \nfor the Covered Card\nYou and Your - an individual to whom a Covered Card Account \nhas been issued by JPMorgan Chase Bank, N.A. and/or \nits affiliates\nLL_CON_$3K_20240311\nPurchase Protection\nThis benefit protects an item You purchase against theft, \ndamage, or Involuntary and Accidental Parting within \none hundred twenty (120) days (ninety (90) days for \nNew York residents) from the date of purchase. You are \neligible for this benefit when You charge all or a portion of \nthe cost of the eligible item to Your Covered Card and/or use \nredeemable Rewards.\nWhat’s Covered?\nThe benefit applies to purchases made both inside and outside \nthe U.S. Eligible items given as gifts can also be covered.', 'What’s Covered?\nThe benefit applies to purchases made both inside and outside \nthe U.S. Eligible items given as gifts can also be covered.\nCoverage is limited to the lesser of the following:\n• The cost to repair item\n•  The cost to replace the item with an item of like kind \nand quality\n•  The amount charged to the Covered Card and/or redeemable \nRewards used (excluding shipping and handling)\n•  $10,000 per item and a maximum of $50,000 per \ncalendar year\nNote: Eligible purchases made with redeemable Rewards will be \nreimbursed in dollars.\nIf a loss involves a portion of a pair or set, You will only be \nreimbursed for the item that was stolen, damaged, or part of \nan Involuntary and Accidental Parting, not the total value of the \npair or set. This does not apply to items normally sold as pairs \nor sets that are not replaceable by purchasing one piece of \nthe pair or set. You may be asked to send the individual item,', 'repair warranty, store provided warranty and a consumer \npurchased service contract exceeds three (3) years there would \nnot be coverage under this benefit. In no event will coverage \nfrom the original manufacturer’s U.S. repair warranty, store \nprovided warranty or consumer purchased service contract and \nthis coverage exceed four (4) years from the purchase date.\nTo be eligible for this benefit, the item must come with a valid \noriginal manufacturer’s U.S. repair warranty and You must \ncharge all or a portion of the cost of the eligible item to Your \nCovered Card and/or use redeemable Rewards.\nWhat’s Covered?\nThe benefit applies to purchases made both inside and outside \nthe U.S. Eligible items given as gifts can also be covered.\nCoverage is limited to the lesser of the following:\n• The cost to repair the item\n•  The cost to replace the item with an item of like kind \nand quality', '9\n•  The  amount charged to the Covered Card and/or redeemable \nRewards used (excluding shipping and handling)\n•  $10,000 per item and a maximum of $50,000 per \ncalendar year\nNote: Eligible purchases made with redeemable Rewards will be \nreimbursed in dollars.\nWe will decide whether to reimburse for the cost to have the \nitem repaired or replaced, whichever is less. Maximum coverage \nlimits apply.\nIf Your item is to be repaired, You may go to an authorized \nrepair facility and file a claim for reimbursement. Only valid, \ncustomary and reasonable repairs made at the authorized \nrepair facility are covered.\nHow Does This Benefit Work?\nThe coverage begins at the end of the original manufacturer’s \nU.S. repair warranty and provides one (1) year of coverage after \nit has expired. This benefit only covers what would have been \ncovered under the original manufacturer’s U.S. repair warranty.\nIf You received a store provided warranty or purchased a \nservice contract, Our coverage begins at the expiration of the \ncumulative warranties and service contract. If the original \nmanufacturer’s U.S. repair warranty or a combination of the \noriginal manufacturer’s U.S. repair warranty, store provided \nwarranty and a consumer purchased service contract exceeds \nthree (3) years there would not be coverage under this benefit.\nExamples:\n•  On an original manufacture r’s U.S. repair warranty of \nsix (6) months, We would provide You with an additional \ntwelve (12) months of coverage for a combined total of \neighteen (18) months of coverage.\n•  On an original manufacture r’s U.S. repair warranty of \ntwelve (12) months, and a consumer purchased service \ncontract of twenty-four (24) months, We would provide You \nwith an additional twelve (12) months of coverage starting \nat the end of the consumer purchased service contract for a \ncombined total of forty-eight (48) months of coverage.\n•  On an original manufacture r’s U.S. repair warranty of \nsix (6) months, and a consumer purchased service contract \nof thirty-six (36) months, there would be no extension of \ncoverage under this benefit.\nHow Can You Store Your Warranty?', '2\nYour Guide to Benefits describes the benefit that is in effect as \nof 10/01/24. Information in this guide takes the place of any \nprior benefit and benefit description you may have previously \nreceived. Your effective date of eligibility is determined \nby Chase. \nPlease keep the guide with your account information for future \nreference and call the benefit administrator if you have any \nquestions before taking advantage of the benefit.\nIf you have any questions please call 1-800-350-2919 or if you \nare outside the U.S., call collect at 001-214-503-2953.\nTABLE OF CONTENTS\nAuto Rental Coverage 3\nBaggage Delay Insurance 6\nExtended Warranty Protection 8\nLost Luggage Reimbursement 11\nPurchase Protection 13\nRoadside Assistance 15\nTravel Accident Insurance 17\nTravel and Emergency Assistance 22\nTrip Cancellation and Interruption Insurance 24\nTrip Delay Reimbursement 31\nAdditional Terms 33']","The Purchase Protection coverage window on the United Explorer Card protects an item you purchase against theft, damage, or Involuntary and Accidental Parting within one hundred twenty (120) days from the date of purchase (ninety (90) days for New York residents).","The United Explorer Card Purchase Protection covers eligible items within 120 days from the date of purchase, or 90 days for New York residents.",0.75,0.8734585801666165,1.0,0.9999999999,United Explorer,exact_term,Phase 3 - Score Gap 0.45,2026-04-24T22:32:22.288481
What are the Trip Cancellation and Interruption Insurance limits on the United Explorer Card?,"['24\nferries and cruise ships, but does not include taxis, car service, \nrental car, rideshare service, commuter rail or commuter \nbus lines\nCovered Card - the credit card or Account that is eligible for \nbenefits as designated by JPMorgan Chase Bank, N.A. and/or \nits affiliates\nCovered Traveler - You and Your Immediate Family Member\nDomestic Partner - a committed relationship between two \nunmarried adults, in which the partners, (1) are each other’s \nsole Domestic Partner, (2) maintain a common residence, \n(3) share at least one (1) of the following financial arrangements: \na joint mortgage or lease, a joint bank account, joint title to or \nownership of a motor vehicle or status as a joint lessee on a \nmotor vehicle lease or a joint credit card account with a financial \ninstitution, (4) are not married or joined in a civil union to \nanyone else or are not the Domestic Partner of anyone else, and \n(5) are not blood related\nImmediate Family Member - spouse or Domestic Partner and \nlegally dependent children under the age of twenty-six (26)\nYou and Your - an individual to whom a Covered Card Account \nhas been issued by JPMorgan Chase Bank, N.A. and/or \nits affiliates\nTravel and Emergency Assistance services are sourced \nby Virginia Surety Company, Inc, an Assurant company, \nand are performed by a third party provider. This is not an \ninsurance benefit.\nTEAS_20240311\nTrip Cancellation and \nInterruption Insurance\nThis benefit provides reimbursement for covered travel \nexpenses if a Trip is cancelled or interrupted due to a covered \nreason. Coverage is limited to the lesser of the following:\n• $1,500 per Covered Traveler\n• $6,000 per Trip for all Covered Travelers\n•  the actual amount charged to the Covered Card and/or \nredeemable Rewards used for a covered travel expense\nNote: Eligible purchases made with redeemable Rewards will be \nreimbursed in dollars.\nThe Covered Traveler is covered when You charge all or a \nportion of the cost of the Trip to Your Covered Card and/or use \nredeemable Rewards. Covered Travelers do not need to be \ntraveling with You for benefits to apply.', '2\nYour Guide to Benefits describes the benefit that is in effect as \nof 10/01/24. Information in this guide takes the place of any \nprior benefit and benefit description you may have previously \nreceived. Your effective date of eligibility is determined \nby Chase. \nPlease keep the guide with your account information for future \nreference and call the benefit administrator if you have any \nquestions before taking advantage of the benefit.\nIf you have any questions please call 1-800-350-2919 or if you \nare outside the U.S., call collect at 001-214-503-2953.\nTABLE OF CONTENTS\nAuto Rental Coverage 3\nBaggage Delay Insurance 6\nExtended Warranty Protection 8\nLost Luggage Reimbursement 11\nPurchase Protection 13\nRoadside Assistance 15\nTravel Accident Insurance 17\nTravel and Emergency Assistance 22\nTrip Cancellation and Interruption Insurance 24\nTrip Delay Reimbursement 31\nAdditional Terms 33', '25\nover which neither the Common Carrier nor the Covered \nTraveler have control, the term of coverage shall be automatically \nadjusted in accordance with such delay or change.\nWhat Are Covered Travel Expenses?\nCoverage provides reimbursement for the following covered \ntravel expenses resulting from the cancellation or interruption \nof the Covered Traveler’s Trip due to a covered reason:\n•  Non-Refundable prepaid travel expenses charged by the \nCommon Carrier\n•  Change fees imposed by the Common Carrier to change the \ndate and/or time of prescheduled travel arrangements of a \nTrip that has not been cancelled; Change fees do not include a \nchange in Common Carrier fare or new Common Carrier fares\n•  Redeposit fees imposed by the Rewards \nprogram administrator\nFor Trip Interruption only:\nWhen the Trip is interrupted due to the need for necessary \nmedical treatment for a covered reason, this benefit also \nreimburses ground transportation expenses up to $250 to \ndirectly transport the Covered Traveler to the airport, terminal \nor station of departure, and/or between the arrival airport, \nterminal or station and their residence. This does not include \ntransportation in vehicles operated by a medical facility or \nspecifically designed to transport sick or injured individuals.\nWhat Losses Are Covered?\nThis benefit provides coverage for the covered reasons listed \nbelow. It doesn’t provide coverage if the Covered Traveler \nsimply chooses to change plans, is not feeling well but still able \nto travel, or the Covered Traveler can reach their destination \nbut decides not to travel. Any event/incident that occurred prior \nto the Trip being booked is not covered. Please see “What’s Not \nCovered?” for additional restrictions.', '28\n•  Any los s for any Trip booked while on a waiting list for \nspecified medical treatment\n•  Any los s for any Trip that is booked for the purpose of \nobtaining medical treatment\n• Disinclination to  travel due to civil unrest\n•  Failure of the  Covered Traveler or their Traveling Companion \nto obtain necessary visas, passports, or other documents \nrequired for travel, including documents required by a \nCommon Carrier or country such as a vaccine passport\n•  Co vered Traveler’s or their Traveling Companion’s \ncommission or attempted commission of any illegal act, \nincluding any felony\n•  Co vered Traveler’s or their Traveling Companion’s suicide, \nattempted suicide, or intentionally self-inflicted injury\n•  Co vered Traveler or their Traveling Companion being under \nthe influence of any narcotic, legal recreational marijuana, or \nother controlled substance at the time of a loss (except if the \nnarcotic or other controlled substance is taken and used as \nprescribed by a Physician)\n•  A country closing its bo rders, or a Common Carrier cancelling \nor changing travel arrangements or Covered Traveler’s or \ntheir Traveling Companion’s disinclination to travel due to an \nepidemic or pandemic\n•  De fault or financial insolvency of the Common Carrier (Please \ncontact Chase Disputes or the number on the back of Your \nCovered Card if the Trip has been canceled due to default or \nfinancial insolvency)\n•  War, unde clared war, civil war, insurrection, rebellion, \nrevolution, warlike acts by a military force or personnel, any \naction taken in hindering or defending against any of these, \nthe destruction or seizure of property for a military purpose, \nor any consequences of any of these acts; War does not \ninclude terrorism\n•  Any ev ent/incident that occurred prior to the Trip being \nbooked is not covered\n•  The  Trip being cancelled or interrupted for any reason not \ncovered under “What Losses Are Covered?”\nHow Do You File a Claim?\nFollow these steps to file a claim:\n1.  Visit chasecardbenefits.com or call 1-800-350-2919 within \ntwenty (20) days of the Trip Cancellation or Trip Interruption \nor as soon as reasonably possible.', 'Covered Travelers do not need to be \ntraveling with You for benefits to apply.\nWhen is the Covered Traveler Covered?\nFor Trip Cancellation:\nCoverage begins on the initial deposit or booking date of the \nTrip and ends at the point and time of departure on the Trip \nDeparture Date.\nFor Trip Interruption:\nCoverage begins on the Trip Departure Date and ends on the \nTrip Completion Date.\nIn the event the Trip Departure Date and/or the Trip Completion \nDate are delayed, or the point and time of departure and/or \npoint and time of return are changed because of circumstances']","The Trip Cancellation and Interruption Insurance limits on the United Explorer Card are as follows:
- $1,500 per Covered Traveler
- $6,000 per Trip for all Covered Travelers
- The actual amount charged to the Covered Card and/or redeemable Rewards used for a covered travel expense.","The United Explorer Card provides Trip Cancellation and Interruption Insurance up to $1,500 per covered traveler and $6,000 per trip for all covered travelers.",1.0,0.9889770051108847,1.0,0.9999999999,United Explorer,benefit_detail,Phase 3 - Score Gap 0.45,2026-04-24T22:32:22.288481
What is the Trip Delay Reimbursement threshold and maximum on the Capital One Venture X?,"['•  This benefit is provided to eligible cardholders at no \nadditional cost. The terms and conditions contained in \nthis Guide to Benefits may be modified by subsequent \nendorsements. Modifications to the terms and conditions \nmay be provided via additional Guide to Benefits mailings, \nstatement inserts, statement messages or electronic \nnotification. The benefits described in this Guide will not \napply to cardholders whose Accounts have been suspended \nor cancelled. \n•  Termination dates may vary by financial institutions. Your \nfinancial institution can cancel or non-renew the benefits \nfor cardholders, and if they do, they will notify You at least \nthirty (30) days in advance. Federal Insurance Company \n(“Provider”) is the underwriter of these benefits and is solely \nresponsible for its administration and claims. The Plan \nAdministrator provides services on behalf of the Provider. \n•  After the Plan Administrator has paid Your claim, all Your \nrights and remedies against any party in respect of this \nclaim will be transferred to the Plan Administrator to the \nextent of the payment made to You. You must give the Plan \nAdministrator all assistance as may reasonably be required \nto secure all rights and remedies. \n•  This benefit does not apply to the extent that trade or \neconomic sanctions or other laws or regulations prohibit \nthe provision of insurance, including, but not limited to, the \npayment of claims.\nFORM #TRCAN – 2017 (04/17)                                                                               TC-I\nFor more information about the benefit described in this \nguide, please contact the Plan Administrator.\nTrip Delay Reimbursement\nHaving a Covered Trip delayed can mean more than just lost \ntime; it can also create an additional cost that You weren’t \nexpecting to pay.\nTrip Delay Reimbursement covers up to a maximum of five \nhundred dollars ($500.00) for each purchased ticket, for \nreasonable additional expenses incurred when a Covered Trip \nYou purchased with Your eligible Account and/or rewards \nprogram associated with Your covered Account is delayed \nfor more than six (6) hours or requires an overnight stay. The \nbenefit is limited to one claim per Covered Trip. To be eligible \nfor this coverage, You need to purchase either a portion or the \nentire cost of Your Common Carrier fare using Your Account.', 'The \nbenefit is limited to one claim per Covered Trip. To be eligible \nfor this coverage, You need to purchase either a portion or the \nentire cost of Your Common Carrier fare using Your Account. \nYou, Your spouse and Your dependent children under twenty-\ntwo (22) years of age are automatically covered when You \ncharge Your Covered Trip’s Common Carrier fare to Your \neligible Account and/or rewards program associated with Your \ncovered Account. \nThis benefit is supplemental coverage, which means \nthat reasonable expenses during the delay not \notherwise covered by Your Common Carrier, another \nparty or Your primary personal insurance policy, \nmay be reimbursed up to a maximum of five hundred \ndollars ($500.00) per ticket. You will be refunded the \n7\nBR414848_M133789_LetterSize.indd   7BR414848_M133789_LetterSize.indd   7 7/15/21   11:58 AM7/15/21   11:58 AM', 'Digital Data means information, concepts, knowledge, \nfacts, images, sounds, instructions, or Computer Programs \nstored as or on, created or used on, or transmitted to or from \ncomputer software (including systems and applications \nsoftware), on hard or floppy disks, CD-ROMs, tapes, drives, \ncells, data processing devices or any other repositories \nof computer software which are used with electronically \ncontrolled equipment. Digital Data shall include the capacity \nof an Eligible Wireless Cellular Telephone, Rental Vehicle, or \nCovered Purchase to store information, process information, \nand transmit information over the Internet. \nGeneral Provisions for Auto Rental Collision Damage \nWaiver, Trip Delay Reimbursement, Lost Luggage \nReimbursement, Purchase Security, Return Protection, \nExtended Warranty Protection and Cellular Telephone \nProtection:\n•  Signed or pinned transactions are covered as long as You \nuse Your eligible card to secure the transaction. \n•  You shall do all things reasonable to avoid or diminish any \nloss covered by these benefits. This provision will not be \nunreasonably applied to avoid claims. \n•  If You make any claim knowing it to be false or fraudulent \nin any respect, no coverage shall exist for such claim, and \nYour benefit may be cancelled. Each cardholder agrees \nthat representations regarding claims will be accurate and \ncomplete. Any and all relevant provisions shall be void in any \ncase of fraud, intentional concealment, or misrepresentation \nof material fact. \n•  No legal action for a claim may be brought against the \nProvider until sixty (60) days after the Provider receives Proof \nof Loss. No legal action against the Provider may be brought \nmore than two (2) years after the time for giving Proof of \nLoss. Further, no legal action may be brought against the \nProvider unless all the terms of the Guide to Benefits have \nbeen complied with fully. \n•  These benefits are provided to eligible cardholders at no \nadditional cost. The terms and conditions contained in \nthis Guide to Benefits may be modified by subsequent \n16\nBR414848_M133789_LetterSize.indd   16BR414848_M133789_LetterSize.indd   16 7/15/21   11:58 AM7/15/21   11:58 AM', 'excess amount once all other reimbursement has \nbeen exhausted up the limit of liability. \nWhat is covered?\nYour reasonable additional expenses, such as meals and \nlodging, may be reimbursed as long as: \n•  A portion of the fare was purchased with an eligible Account \nand/or rewards program associated with Your covered \nAccount\n•  Your Covered Trip was delayed for more than six (6) hours or \nrequired an overnight stay due to Covered Hazards \n•  Your Covered Trip is for a period of travel that does not \nexceed three hundred and sixty-five (365) days\nWhat is not covered?\n•  Any delay due to a Covered Hazard which was made public \nor made known to You prior to Your departure.\n•  Any pre-paid expenses related to Your Covered Trip, such as \ntour or activity fees associated with Your Covered Trip.\nHow to file a Trip Delay Reimbursement claim\nWithin thirty (30) days of the Covered Trip delay, call \nthe Benefit Administrator at 1-800-825-4062, or call \ncollect outside the U.S. at 1-804-965-8071 . The Benefit \nAdministrator will ask You for some preliminary claim \ninformation and send You a claim form.\nWithin ninety (90) days of the date of Your Covered Trip \ndelay, return Your completed and signed claim form and the \nrequested documentation below to the following address:\nCard Benefit Services\nP .O. Box 72034\nRichmond, VA 23255\nPlease submit the following documents:\n•  A copy of the detailed original and updated travel itinerary \nand/or the Common Carrier tickets\n•  A copy of Your monthly billing statement (showing the \nlast four [4] digits of the Account number) confirming the \nCommon Carrier ticket was charged to the covered Account. \nOnly applicable if the travel itinerary does not reflect the last \nfour (4) digits of the Account number.\n•  If more than one method of payment was used, please \nprovide documentation as to additional currency, voucher, \npoints or any other payment method utilized\n•  Tickets reflecting the total amount charged for the claimed \nCovered Trip\n•  A statement from the Common Carrier explaining the \nreason for the delay\n•  Copies of itemized receipts for Your claimed expenses.', 'For \nfood expenses, receipts are required, however itemized \nreceipts are only required for bills of fifty dollars ($50.00) or \nmore per covered traveler.\n•  Any other documentation deemed necessary by the Benefit \nAdministrator to substantiate the claim\nFailure to contact the Benefit Administrator or return the \ncompleted claim form and documentation within the time \nperiods indicated above may result in the denial of Your \nclaim.\nFor faster filing, or to learn more about  \nTrip Delay Reimbursement, visit   \nwww.eclaimsline.com\nDefinitions\nAccount means your eligible credit card account.\nCommon Carrier means any land, water, or air conveyance \noperating for hire under a valid license for the transportation \nof passengers and for which a ticket must be purchased prior \nto commencing travel. Common Carrier does not include taxis, \nlimousine services, or commuter rail or commuter bus lines or \nrental vehicles.\nCovered Trip means a period of travel that does not exceed \nthree hundred and sixty-five (365) days away from the Eligible \nPerson’s residence to a destination other than the Eligible \nPerson’s city of residence for which the Eligible Person charges \nthe cost of transportation by Common Carrier to the Account \nand/or rewards programs associated with the covered Account.\nCovered Hazards means equipment failure, inclement \nweather, strike and hijacking/skyjacking.\nEligible Person means a cardholder who pays for their \nCovered Trip by using their eligible Account and/or rewards \nprograms associated with their covered Account.\nFamily Member means Your spouse or legally dependent \nchildren under age eighteen (18) [twenty-five (25) if enrolled as \na full-time student at an accredited university].\nYou or Your means an Eligible Person or Your Family Members \nwho charged their Covered Trip to Your eligible Account and/\nor rewards programs associated with Your covered Account. \nPlease see “General Provisions” section at the end of this \ndocument.\nFORM#TRIP 12-300-2017 (04/17)                                                                TD-O\nFor more information about the benefit described in this \nguide, call the Benefit Administrator at 1-800-825-4062, \nor call collect outside the U.S. at 804-965-8071.']","The Trip Delay Reimbursement on the Capital One Venture X covers up to a maximum of five hundred dollars ($500.00) for each purchased ticket, for reasonable additional expenses incurred when a Covered Trip is delayed for more than six (6) hours or requires an overnight stay.",The Capital One Venture X Trip Delay Reimbursement applies when the delay exceeds 6 hours or requires an overnight stay. The maximum benefit is $500 per purchased ticket.,0.6666666666666666,0.9019556404289388,1.0,0.7499999999625,Capital One Venture X,benefit_detail,Phase 3 - Score Gap 0.45,2026-04-24T22:32:22.288481
What does the Baggage Delay Insurance cover on the United Explorer Card and what is the maximum benefit?,"['6\nWe, Us and Our - Virginia Surety Company, Inc., an Assurant \ncompany, the insurance company that provides these benefits \nfor the Covered Card\nYou and Your - an individual to whom a Covered Card Account \nhas been issued by JPMorgan Chase Bank, N.A. and/or \nits affiliates\nARCDW_CON_$60K_PRIMARY_20240311\nBaggage Delay Insurance\nThis benefit provides reimbursement for the emergency \npurchase of essential personal items when the Covered \nTraveler’s Checked Baggage is delayed while on a Trip. This \nbenefit applies if the Covered Traveler’s Checked Baggage is \ndelayed or misdirected by the Common Carrier for more than \nsix (6) hours from the time the Covered Traveler arrives at their \ndestination. The maximum benefit is $100 per day after the \ninitial six (6) hour delay, and for each additional twenty-four (24) \nhour period, up to a maximum of three (3) days.\nThe Covered Traveler is covered when You charge all or a \nportion of the cost of the Common Carrier fare to Your Covered \nCard and/or use redeemable Rewards. Covered Travelers do not \nneed to be traveling with You for benefits to apply.\nWhen is the Covered Traveler Covered?\nBenefits begin on the Trip Departure Date and end on the Trip \nCompletion Date.\nThere is no coverage when the Covered Traveler returns to their \npoint of origin.\nWhat’s Covered?\nThis benefit covers essential personal items that the Covered \nTraveler(s) may need when their baggage is delayed, such \nas toiletries, a change of clothes, and chargers for electronic \ndevices (limit one per device).\nPlease Pay Special Attention to These Conditions:\n•  Baggage delay must be reported to the Common Carrier to be \neligible for this benefit.\nThis benefit is secondary and payable on an excess basis over \nand above any amount due from any other valid or collectible \ninsurance or any other form of reimbursement payable by those \nresponsible for the loss.\nWhat’s Not Covered?', '31\nTrip Delay Reimbursement\nThis benefit provides reimbursement for reasonable expenses \nincurred by the Covered Traveler during a delay due to a \ncovered reason while on a Trip. This benefit applies if the \nCovered Traveler’s Common Carrier is delayed for more \nthan twelve (12) hours or requires an overnight stay. The \nmaximum benefit is $500 per Covered Traveler per Trip.\nThe Covered Traveler is covered when You charge all or a \nportion of the cost of the Common Carrier fare to Your Covered \nCard and/or use redeemable Rewards. Covered Travelers do not \nneed to be traveling with You for benefits to apply.\nWhen is the Covered Traveler Covered?\nBenefits begin on the Trip Departure Date and end on the Trip \nCompletion Date.\nIn the event the Trip Departure Date or Trip Completion Date \nare delayed or changed by the Common Carrier because \nof circumstances over which the Covered Traveler nor the \nCommon Carrier have control, the term of coverage shall be \nautomatically adjusted in accordance with such change.\nWhat’s Covered?\nThis benefit covers reasonable additional expenses incurred \nby the Covered Traveler during the delay, until travel by the \nCovered Traveler becomes possible. Reasonable expenses \ninclude meals, lodging, toiletries, and medication.\nTo take advantage of this benefit, the delay must occur \ndue to equipment failure, inclement weather, strike, \nor hijacking/skyjacking.\nThis benefit is secondary and payable on an excess basis over \nand above any amount due from any other valid or collectible \ninsurance or any other form of reimbursement payable by those \nresponsible for the loss.\nHow Do You File a Claim?\nFollow these steps to file a claim:\n1.  Visit chasecardbenefits.com or call 1-800-350-2919 \nwithin sixty (60) days of the Trip delay or as soon as \nreasonably possible.\n2.  We will ask Yo u a few questions and let You know what \ndocumentation is needed. The requested documents must be \nsubmitted within one hundred (100) days of the of the delay \nor as soon as reasonably possible.', '11\nLost Luggage Reimbursement\nThis benefit provides reimbursement for the difference between \nthe actual cash value (replacement cost less depreciation) and \nany reimbursement provided by the Common Carrier for the \ncosts the Covered Traveler incurs to repair or replace their \nChecked Baggage, Carry-On Baggage, and/or personal property \ncontained within that is lost, damaged, or stolen. The maximum \nbenefit is $3,000 per Covered Traveler per Trip (additionally, \nNew York residents are limited to $2,000 per bag and $10,000 \nfor all Covered Travelers per Trip). The maximum benefit per \nCovered Traveler per Trip includes a sub-limit up to $500 for \njewelry and watches and a sub-limit up to $500 for cameras \nand other electronic equipment. The benefit amounts for \njewelry, watches, cameras, and other electronic equipment are \npart of and not in addition to the maximum benefit amount. \nPayment of these benefit amounts reduces and does not \nincrease the maximum benefit.\nItems the Covered Traveler inadvertently leaves behind on \nthe Common Carrier are not considered lost or stolen.\nThe Covered Traveler is covered when You charge all or a \nportion of the cost of the Common Carrier fare to Your Covered \nCard and/or use redeemable Rewards. Covered Travelers do not \nneed to be traveling with You for benefits to apply.\nCoverage for Checked Baggage begins when baggage is checked \nin and is under the care and control of the Common Carrier and \nends when baggage has been retrieved by the Covered Traveler \nfrom the Common Carrier pick up area.\nCoverage for Carry-On Baggage begins when the Covered \nTraveler boards the Common Carrier and ends when the \nCovered Traveler exits the Common Carrier.\nPlease Pay Special Attention to These Conditions:\n•  If the Covered Traveler’s Checked Baggage is lost, stolen, or \ndamaged by the Common Carrier, the loss must be reported \nto the Common Carrier (within their required timeframe for \nnotification) to be eligible for this benefit.\n•  If the Covered Traveler’s Carry-On Baggage is lost, stolen, or \ndamaged while on the Common Carrier, it must be reported \nto the Common Carrier as soon as the Covered Traveler exits \nthe Common Carrier.', '2\nYour Guide to Benefits describes the benefit that is in effect as \nof 10/01/24. Information in this guide takes the place of any \nprior benefit and benefit description you may have previously \nreceived. Your effective date of eligibility is determined \nby Chase. \nPlease keep the guide with your account information for future \nreference and call the benefit administrator if you have any \nquestions before taking advantage of the benefit.\nIf you have any questions please call 1-800-350-2919 or if you \nare outside the U.S., call collect at 001-214-503-2953.\nTABLE OF CONTENTS\nAuto Rental Coverage 3\nBaggage Delay Insurance 6\nExtended Warranty Protection 8\nLost Luggage Reimbursement 11\nPurchase Protection 13\nRoadside Assistance 15\nTravel Accident Insurance 17\nTravel and Emergency Assistance 22\nTrip Cancellation and Interruption Insurance 24\nTrip Delay Reimbursement 31\nAdditional Terms 33', '7\nThe benefit does not apply to any loss caused by, or resulting \nfrom, directly or indirectly: War, undeclared war, civil war, \ninsurrection, rebellion, revolution, warlike acts by a military \nforce or personnel, any action taken in hindering or defending \nagainst any of these, the destruction or seizure of property for a \nmilitary purpose, or any consequences of any of these acts. War \ndoes not include terrorism.\nHow Do You File a Claim?\nThe Covered Traveler should notify the airline (or other \nCommon Carrier) before leaving the airport or station, and \nkeep a copy of any report provided.\nFollow these steps to file a claim:\n1.  Visit chasecardbenefits.com or call 1-800-350-2919 within \ntwenty (20) days of the date the Covered Traveler’s Checked \nBaggage was delayed or as soon as reasonably possible.\n2.  We will ask Yo u a few questions and let You know what \ndocumentation is needed. The requested documents must \nbe submitted within ninety (90) days of the Checked Baggage \nbeing delayed or as soon as reasonably possible.\nDocuments You May Need to Provide\nWhen You file a claim, We will provide the details, but generally \nYou should be prepared to send:\n• Trave l itinerary\n•  Co vered Card Account statement (showing the last \nfour (4) digits of the Account number) demonstrating that \nthe payment for the Common Carrier fare was made on Your \nCovered Card and/or with redeemable Rewards\n•  Writte n confirmation of the baggage delay from the \nCommon Carrier\n• Co py of the settlement or denial from the Common Carrier\n•  Co pies of itemized receipts for the purchase of essential items\n•  Any other docume ntation deemed necessary by Us to \nsubstantiate the claim\nDefinitions\nAccount - the credit card Account issued by \nJPMorgan Chase Bank, N.A. and/or its affiliates\nChecked Baggage - suitcases or personal belongings, for which \na claim check has been issued to the Covered Traveler by a \nCommon Carrier\nCommon Carrier - a mode of transportation that’s licensed \nto transport any public passenger who pays a fare or buys a \nticket, and is available on a regular schedule.']","The Baggage Delay Insurance on the United Explorer Card provides reimbursement for the emergency purchase of essential personal items when the Covered Traveler’s Checked Baggage is delayed for more than six (6) hours from the time they arrive at their destination. The maximum benefit is $100 per day after the initial six (6) hour delay, and for each additional twenty-four (24) hour period, up to a maximum of three (3) days.","The United Explorer Card Baggage Delay Insurance provides $100 per day after the initial 6-hour delay, for each additional 24-hour period, up to a maximum of 3 days. It covers essential personal items like toiletries, a change of clothes, and chargers for electronic devices.",0.8,0.9243719855496764,1.0,0.9999999999,United Explorer,benefit_detail,Phase 3 - Score Gap 0.45,2026-04-24T22:32:22.288481
What is the Lost Luggage Reimbursement maximum on the Capital One Venture X?,"['As a handy reference guide, please read this and keep it \nin a safe place with your other insurance documents. This \ninformation is a brief description of the important features of \nthis insurance plan. It is not an insurance contract. Insurance \nbenefits are underwritten by Federal Insurance Company. \nCoverage may not be available in all states or certain terms may \nbe different where required by state law. Chubb NA is the U.S.-\nbased operating division of the Chubb Group of Companies, \nheaded by Chubb Ltd. (NYSE:CB) Insurance products and \nservices are provided by Chubb Insurance underwriting \ncompanies and not by the parent company itself.\nLost Luggage Reimbursement\nHave You ever been waiting for Your Checked Luggage to come \naround the belt only to find that it has been lost by Your airline? \nFortunately, Lost Luggage Reimbursement is here to help. \nWith Lost Luggage Reimbursement, You can be reimbursed \nfor the difference between the “value of the amount claimed” \nand the Common Carrier’s payment up to three thousand \ndollars ($3,000.00) per Covered Trip (for New York \nresidents, coverage is limited to two thousand dollars \n($2,000.00) per bag), provided the Checked Luggage and/\nor Carry-on Baggage and/or its contents was lost due to \ntheft or misdirection by the Common Carrier. “Value of the \namount claimed” is the lesser of the following three amounts: \nthe original purchase price of the item(s), the actual cash \nvalue of the item(s) at the time of theft or misdirection (with \nappropriate deduction for depreciation), and the cost to \nreplace the item(s). \nYou and Your Immediate Family Members are all eligible for \nthis benefit when You take a Covered Trip and pay for the cost \nof Your Common Carrier tickets with Your eligible card issued \nin the United States and/or rewards program associated with \nYour covered Account. To be eligible for coverage, You must \npurchase a portion or the entire cost of the Covered Trip with \nYour covered Account and/or rewards program associated \nwith Your covered Account. Only Your Checked Luggage and/\nor Carry-On Baggage and/or its contents is covered.', 'Digital Data means information, concepts, knowledge, \nfacts, images, sounds, instructions, or Computer Programs \nstored as or on, created or used on, or transmitted to or from \ncomputer software (including systems and applications \nsoftware), on hard or floppy disks, CD-ROMs, tapes, drives, \ncells, data processing devices or any other repositories \nof computer software which are used with electronically \ncontrolled equipment. Digital Data shall include the capacity \nof an Eligible Wireless Cellular Telephone, Rental Vehicle, or \nCovered Purchase to store information, process information, \nand transmit information over the Internet. \nGeneral Provisions for Auto Rental Collision Damage \nWaiver, Trip Delay Reimbursement, Lost Luggage \nReimbursement, Purchase Security, Return Protection, \nExtended Warranty Protection and Cellular Telephone \nProtection:\n•  Signed or pinned transactions are covered as long as You \nuse Your eligible card to secure the transaction. \n•  You shall do all things reasonable to avoid or diminish any \nloss covered by these benefits. This provision will not be \nunreasonably applied to avoid claims. \n•  If You make any claim knowing it to be false or fraudulent \nin any respect, no coverage shall exist for such claim, and \nYour benefit may be cancelled. Each cardholder agrees \nthat representations regarding claims will be accurate and \ncomplete. Any and all relevant provisions shall be void in any \ncase of fraud, intentional concealment, or misrepresentation \nof material fact. \n•  No legal action for a claim may be brought against the \nProvider until sixty (60) days after the Provider receives Proof \nof Loss. No legal action against the Provider may be brought \nmore than two (2) years after the time for giving Proof of \nLoss. Further, no legal action may be brought against the \nProvider unless all the terms of the Guide to Benefits have \nbeen complied with fully. \n•  These benefits are provided to eligible cardholders at no \nadditional cost. The terms and conditions contained in \nthis Guide to Benefits may be modified by subsequent \n16\nBR414848_M133789_LetterSize.indd   16BR414848_M133789_LetterSize.indd   16 7/15/21   11:58 AM7/15/21   11:58 AM', 'Only Your Checked Luggage and/\nor Carry-On Baggage and/or its contents is covered.\nThis benefit is supplemental to and excess of any collectible \ninsurance and/or collectible reimbursement from any other \nsource. The Benefit Administrator will refund the excess \namount once all other reimbursement has been exhausted \nup to the limit of liability.\nPlease Note: You must take all reasonable means to protect, \nsave and/or recover Your Checked Luggage and/or Carry-on \nBaggage and/or its contents at all times.\nWhat is not covered?\nLuggage Reimbursement does not apply to loss or theft of the  \nfollowing items: \n•  Automobiles, automobile accessories and/or equipment, \nmotorcycles, motors, bicycles (except when checked \nwith the Common Carrier), boats, or other vehicles or \nconveyances\n•  Contact lenses, eyeglasses, sunglasses, hearing aids, artificial \nteeth, dental bridges, and prosthetic limbs\n•  Money, securities, credit or debit cards, checks, and \ntravelers’ checks\n•  Tickets, documents (travel or otherwise), keys, coins, deeds, \nbullion, stamps, perishables, consumables, perfume, \ncosmetics, rugs and carpets, animals, cameras, sporting \nequipment, and household furniture\n•  Property shipped as freight or shipped prior to the Covered \nTrip departure date\n•  Items specifically identified or described in and insured \nunder any other insurance policy\n•  Losses arising from confiscation or expropriation by any \ngovernment or public authority or detention by customs or \nother officials\n•  Losses resulting from abuse, fraud, hostilities of any kind \n(including, but not limited to, war, invasion, rebellion, or \ninsurrection)\n•  Business items (items that are used in the purchase, sale, \nproduction, promotion, or distribution of goods or services \nincluding but not limited to, manuals, computers and their \naccessories, software, data, facsimile, samples, collateral \nmaterials, etc.), cellular telephones, or art objects\nHow to file a Lost Luggage Reimbursement claim\nImmediately notify the Common Carrier to begin their claims \nprocess if Your luggage and/or its contents are lost or stolen.', 'If You do not notify the \nBenefit Administrator within twenty (20) days of the date \nthe luggage was lost or stolen, Your claim may be denied.\nWithin ninety (90) days of the date Your luggage was lost or \nstolen, return Your claim form and the requested documentation \nbelow to the address provided by the Benefit Administrator: \n•  A copy of Your monthly billing statement or the travel \nitinerary (showing the last four [4] digits of the Account \nnumber) confirming a portion of the Common Carrier ticket \nwas charged to the covered Account \n•  If more than one method of payment was used, please \nprovide documentation as to additional currency, voucher, \npoints or any other payment method utilized \n•  A copy of ticketing by the Common Carrier, including but \nnot limited to itinerary, boarding pass, or used ticket stub\n•  A copy of any check, settlement, denial or explanation of \ncoverage issued by the Common Carrier together with a \ncopy of the Common Carrier’s completed claim form, a list \nof the items lost and their value, and a copy of the luggage \nclaim check (if applicable)\n•  A copy of Your insurance policy’s Declarations Page (if \napplicable) to confirm Your deductible (Declarations Page \nmeans the document(s) in Your insurance policy that lists \nnames, coverages, limits, effective dates and deductibles) \n•  A copy of any settlement of the loss or theft from Your \nprimary insurance\n•  Any other documentation deemed necessary by the Benefit \nAdministrator to substantiate the loss or theft \nFor faster filing, or to learn more about  \nLost Luggage Reimbursement visit   \nwww.eclaimsline.com\nIf You have personal insurance (i.e., homeowner’s, renter’s, \nor other insurance applicable to the lost or stolen luggage or \ncontents), You are required to file a claim with Your insurance \ncompany and submit a copy of any claim settlement along \nwith Your completed claim form.\nIf the claim amount is within Your personal insurance \ndeductible, the Benefit Administrator may, at its discretion, \n10\nBR414848_M133789_LetterSize.indd   10BR414848_M133789_LetterSize.indd   10 7/15/21   11:58 AM7/15/21   11:58 AM', 'The Company will consider it \na Loss of hand or foot even if the fingers, thumb, or foot is later \nreattached. \nIn order to be eligible for this additional coverage, the entire \ncost of the Common Carrier passenger fare(s), less redeemable \ncertificates, vouchers, or coupons, must be charged to Your \ncovered Account and/or rewards programs associated with \n5\nCovered Loss Benefit Maximum\nAccidental Loss of Life, two or more \nMembers, sight of both eyes, speech \nand hearing or any combination thereof\n$1,000.00\nAccidental Loss of one Member, sight of \none eye, speech or hearing\n$500.00\nAccidental Loss of the thumb and index \nfinger of the same hand\n$250.00\nBR414848_M133789_LetterSize.indd   5BR414848_M133789_LetterSize.indd   5 7/15/21   11:58 AM7/15/21   11:58 AM']","The Lost Luggage Reimbursement maximum on the Capital One Venture X is up to three thousand dollars ($3,000.00) per Covered Trip. For New York residents, coverage is limited to two thousand dollars ($2,000.00) per bag.","The Capital One Venture X provides Lost Luggage Reimbursement up to $3,000 per covered traveler per trip, with sub-limits of $500 for jewelry and watches, and $500 for cameras and other electronic equipment.",0.5,0.9840439682000875,0.5,0.9999999999,Capital One Venture X,benefit_detail,Phase 3 - Score Gap 0.45,2026-04-24T22:32:22.288481
What dining credits does the Amex Gold card offer?,"['Statement credit(s) may not be received or may be reversed if an eligible\npurchase is returned, refunded, cancelled, or modified.\nAmerican Express also relies on information provided to us by the merchant to identify eligible\npurchases. If American Express does not receive information that identifies the transaction as an\neligible purchase, the Account will not receive the statement credit. For example, the transaction may\nnot be eligible if: it is not made directly with the merchant, it is made at a merchant located within\nanother establishment (e.g. a restaurant inside a hotel or department store), it is for a non-dining\npurchase (e.g. Resy-branded American Express® gift cards or merchandise that features Resy\nbranding or is sold at Resy restaurants), the merchant uses a third-party to process or submit the\ntransaction to American Express (e.g. using mobile or wireless card readers), or you make a\npurchase using a third-party (e.g. a third-party payment platform or food delivery service).\nIf the Card Account is cancelled or past due, it may not qualify to receive a statement credit. If\nAmerican Express, in its sole discretion, determines that you have engaged in or intend to engage in\nany manner of abuse, misuse, or gaming in connection with this benefit, American Express will not\nhave an obligation to provide statement credits and may reverse any statement credits provided to\nyou. If your Card is enrolled in the benefit and you replace your Card, please check the Benefits\nsection of your americanexpress.com account, mobile app or call the number on the back of your\nCard to confirm your continued enrollment in the benefit. If a charge for an eligible purchase is\nincluded in a Pay Over Time balance on your Card Account, the statement credit associated with that\ncharge may not be applied to that Pay Over Time balance. Instead, the statement credit may be\napplied to your Pay In Full balance. For additional information, call the number on the back of your\nCard.\n$120 Dining Credit\nEnrollment is required to receive this benefit. Only the Basic Card Member or Authorized Account\nManager(s) on a U.S. Consumer Gold Card Account can enroll in the benefit. U.S. Consumer\nTraditional Gold, Senior Gold, and Classic Gold are not eligible.', 'American Express Venue Collection™ Concessions Statement Credit\nEarn 10% back as a statement credit after using your enrolled eligible Card to make qualifying food\nand beverage concessions purchases at stadiums and arenas in the American Express Venue\nCollection™. Limit one enrolled Card per Card Member, up to $250 back in statement credits each\ncalendar year. See terms.\nEligibility and Enrollment\nEligible Card Members must first add offer to Card and then use same Card for qualifying purchases.\nOnly American Express Cards issued by American Express in the US are eligible to enroll in this\noffer. American Express Prepaid Cards, Corporate Cards, Debit Cards, and American Express-\nbranded Cards issued by other financial institutions are not eligible for this offer.\nLimit one enrollment per Card Member regardless of whether a Card Member has more than one\neligible Card. Card Members must select one eligible Card to enroll. Limit $250 USD in statement\ncredits on that enrolled Card each calendar year. If the enrolled Card is canceled or past due, it may\nnot qualify to receive the statement credit(s). Offers are non-transferable between Cards. Offer ends\nDecember 31, 2026.\nQualifying Purchases\nOffer only valid on qualifying purchases at American Express Venue Collection™ venues. Qualifying\npurchases include food and beverage concessions purchases made in-person at point of sale and at\nself-service kiosks at venues in the American Express Venue Collection™, not including the\nexclusions specifically defined below. At Hollywood Bowl, qualifying purchases also include purchases\nmade in the Hollywood Bowl app or via web browser (hollywoodbowl.com/onlineorder/amex).\nThe following are not qualifying purchases: Purchases in Amazon-operated Just Walk Out Stores,\npurchases at Hard Rock Stadium in the Cantaloupe & Pepsi Food Zone, suite and catering orders, in\napp purchases at venues not specifically identified above, ticket sales, restaurants, transportation,\nparking, gift cards, merchandise, and all other non-concession purchases made at venues in the\nAmerican Express Venue Collection. An up-to-date list of venues in the American Express Venue\nCollection can be found at go.amex/amex-venue-collection.\nOffer not valid on purchases made using third parties, such as resellers, delivery services, or other\nintermediaries.', ""Offer not valid on purchases made using third parties, such as resellers, delivery services, or other\nintermediaries.\nStatement Credit\nPlease allow up to 120 days after the qualifying purchase for the statement credit(s) to be posted to\nthe Card account, provided that American Express receives information from the merchant about your\nqualifying purchase. The 10% back in the form of statement credit(s), up to $250 in total statement\ncredits per calendar year, is calculated based off the total amount of a qualifying purchase made in\nUS dollars or following conversion to US dollars from a foreign currency, if applicable.\nParticipation in Amex Offers is subject to Amex Offers Program Terms.\nAmerican Express Venue Collection Entrances and Fast Lanes\nAmerican Express Venue Collection  Entrances and Fast Lanes\nAmerican Express Card Member entrances and/or fast lanes are available at venues in the American\nExpress Venue Collection. Card Member entrances and fast lanes may not be available for all\nevents; hours of availability may vary and are subject to change. Entrances and fast lanes may be\nmodified or discontinued at any time and without notice. Card Members must have a valid ticket to\nthe event and can access the Card Member entrance or fast lane by presenting a valid American\nExpress Card in the Card Member's name. The number of guests that may accompany a Card\nMember through a Card Member entrance of fast lane may vary by venue. Additional terms may\napply by venue and by event (including, without limitation, security protocols). American Express does\nnot operate the Card Member entrances or fast lanes; the applicable venue operates the entrance.\nVenue personnel reserve the right to not allow Card Members and their guests admittance through\n™\n™\n4/17/26, 7:28 PM American Express® Gold Card - Terms, Conditions & Disclosures\nhttps://www.americanexpress.com/us/credit-cards/card-application/apply/supplementary/terms/gold-card/39161-9-0 7/17"", 'Only the Basic Card Member or Authorized Account\nManager(s) on a U.S. Consumer Gold Card Account can enroll in the benefit. U.S. Consumer\nTraditional Gold, Senior Gold, and Classic Gold are not eligible. Eligible purchases must be charged\nto a Card Member on the enrolled Card Account for the benefit to apply. Purchases by both the Basic\nCard Member and Additional Card Members on the enrolled Card Account are eligible for statement\ncredits. However, each Card Account is eligible for up to a $10 statement credit per month, for a total\nof $120 per calendar year in statement credits across all Cards on the Account. Participating partners\nare Grubhub (including Seamless), The Cheesecake Factory, Goldbelly, Wine.com and Five Guys. In-\nperson transactions and online orders only valid if made from participating partner locations in the\nU.S. If American Express does not receive information that identifies your transaction as eligible for\n4/17/26, 7:28 PM American Express® Gold Card - Terms, Conditions & Disclosures\nhttps://www.americanexpress.com/us/credit-cards/card-application/apply/supplementary/terms/gold-card/39161-9-0 3/17', 'the Card Member entrance or fast lane for any reason, including, without limitation, not adhering to\nsecurity protocols. To learn more about a specific venue, please visit americanexpress.com/venues.\nAmerican Express App\nThe American Express® App and app features are available only for eligible accounts in the United\nStates. American Express® prepaid Cards and Cards issued by non-American Express issuers are\nnot eligible.\nTo log in, customers must have an American Express user ID and password or create one in the app.\nAmex Oﬀers\nTo redeem an Amex Offer®, eligible Card Members must first enroll in the offer through their online\naccount or in the American Express® App, and then using their enrolled Card to make a qualifying\npurchase. Only U.S.-issued American Express Consumer and Business Cards may be eligible to\nparticipate. Card Members can check their eligibility by visiting the Amex Offers section of their online\naccount. American Express, in its sole discretion, reserves the right to determine eligibility for the\nAmex Offers program and may revoke access or enrollment if we determine that you have engaged,\nor are likely to engage, in abuse, misuse, or gaming of the program. Please review the terms of each\noffer for details on how to redeem. By enrolling in an offer, you agree that American Express may use\nyour transaction and personal information to administer the offer, communicate with you about it, and\nfacilitate your experience in accordance with the American Express Privacy Statement. You also\nconsent to receiving electronic communications from American Express, including email, app\nnotifications, and other digital messages, related to your enrolled offers and the Amex Offers\nprogram.\nBy enrolling in an offer, you agree to the individual offer terms and Program Terms. See individual\noffer terms below, and full Program Terms here.\nAmex Preferred Tickets\nAmex Preferred Tickets  (formerly referred to as American Express Preferred Access)\nEligible American Express  Card Members may purchase Amex Preferred Tickets  for select events\nand select seats, during a specified period while supplies last. Tickets are sold by and fulfilled by\nthird party ticket sellers (not American Express), and such tickets are subject to the rules, terms and\nconditions, prices and fees set by the ticket seller, event promoter and/or the venue.']","The Amex Gold card offers a $120 Dining Credit. Enrollment is required to receive this benefit. Only the Basic Card Member or Authorized Account Manager(s) on a U.S. Consumer Gold Card Account can enroll in the benefit. Eligible purchases must be charged to a Card Member on the enrolled Card Account for the benefit to apply. Each Card Account is eligible for up to a $10 statement credit per month, for a total of $120 per calendar year in statement credits across all Cards on the Account. Participating partners include Grubhub (including Seamless), The Cheesecake Factory, Goldbelly, Wine.com, and Five Guys. In-person transactions and online orders are only valid if made from participating partner locations in the U.S.","The Amex Gold card offers up to $120 per year in dining credits ($10 per month) at participating partners including Grubhub, The Cheesecake Factory, Goldbelly, Wine.com, Five Guys, and participating Shake Shack locations.",1.0,0.9245143579414166,1.0,0.7499999999625,Amex Gold,benefit_detail,Phase 3 - Score Gap 0.45,2026-04-24T22:32:22.288481
What is the Airline Fee Credit on the Amex Platinum card?,"['$200 Airline Fee Credit\nEnrollment through American Express is required to receive the benefit. Basic Card Members on U.S.\nConsumer and Corporate Platinum Card Accounts can enroll in the benefit by making their airline\nselection in the Benefits section of their americanexpress.com online account or by calling us. Enrolled\nBasic Card Members on U.S. Consumer Platinum and U.S. Corporate Platinum Card Accounts are\neligible to receive up to $200 in statement credits per calendar year for incidental airline fees charged\nby their one selected qualifying airline to the enrolled Card Account. Purchases by both the Basic\nCard Member and Additional Card Members on the enrolled Card Account are eligible for statement\ncredits. However, the total amount of statement credits will not exceed $200 per calendar year, per\nCard Account. To receive statement credits, the Basic Card Member must select one qualifying airline\nthrough their American Express Online Account or the link for their Card below:\n• American Express Platinum Card®:\nhttps://global.americanexpress.com/card-benefits/enroll/airline-fee-credit/platinum\n• Goldman Sachs Platinum Card®:\nhttps://global.americanexpress.com/card-benefits/enroll/airline-fee-credit/goldman-platinum-card\n• Morgan Stanley Platinum Card®:\nhttps://global.americanexpress.com/card-benefits/enroll/airline-fee-credit/morgan-stanley-platinum-card\n• Charles Schwab Platinum Card®:\nhttps://global.americanexpress.com/card-benefits/enroll/airline-fee-credit/schwab-platinum-card\n• American Express Corporate Platinum Card®:\nhttps://global.americanexpress.com/card-benefits/enroll/airline-fee-credit/corporate-platinum\nQualifying airlines include Alaska Airlines, American Airlines, Delta Airlines, Hawaiian Airlines, JetBlue\nAirways, Spirit Airlines, Southwest Airlines, and United Airlines, and are subject to change. Only the\nBasic Card Member or Authorized Account Manager(s) on the Card Account can select the qualifying\nairline. Card Members who have not chosen one qualifying airline will be able to do so at any time.', ""issued American\nExpress card. For access at select locations, Card Members must arrive within 3 hours of their\ndeparting flight. Refer to the specific location's access policy for more information. During a layover\nCard Members may use the Escape Lounge in the connecting airport at any time. For more\ninformation on access policies and lounge terms and conditions, see https://escapelounges.com. All\naccess to an Escape Lounge is subject to space availability. Card Member must be at least 18 years\nof age to enter without a parent or legal guardian. All Escape Lounge visitors must be of legal\ndrinking age in the jurisdiction where the Lounge is located to consume alcoholic beverages. Please\ndrink responsibly. Card Members may bring up to two complimentary guests per visit. Card Member\nmust adhere to all house rules of participating lounges. Card Members and their guests will receive\nall the complimentary benefits and amenities afforded to the Escape Lounge customers, as well as\naccess to purchase non-complimentary items. Some product features may be subject to additional\ncharges. Escape Lounge locations are subject to change without notice. Additional restrictions may\napply.\nFee Credit for Global Entry or TSA PreCheck\nThe benefit is available to (i) Consumer Platinum Card  Members, and Business Platinum Card\nMembers, and (ii) Centurion  Card Members. The benefit is also available to all Additional Card\nMembers on Consumer and Business Platinum Accounts, and all Additional Card Members on\nConsumer and Business Centurion Accounts. Basic Card Members are eligible to receive a statement\ncredit every 4 years for either up to $85 for the TSA PreCheck  application fee (when applying\nthrough a TSA official enrollment provider) or $120 for the Global Entry application fee, in each case\nwhen charged to the Basic Card or any eligible Additional Cards on the eligible Card Account. Basic\nCard Members will receive a statement credit for the first program (either Global Entry or TSA\nPreCheck) to which they or their eligible Additional Cards apply and pay for with their eligible Card\nregardless of whether they are approved for Global Entry or TSA PreCheck."", 'However, eligible Card\nMembers can earn no more than one credit for up to $85 for TSA PreCheck or $120 credit for Global\nEntry (but not both programs), depending upon the program the Card Member first applies for, for an\napplication fee charged to an eligible Card. American Express has no control over the application\n®\n®\n®\n®\n®\n® ®\n®\n®\n4/17/26, 7:27 PM Platinum Card® - Terms, Conditions & Disclosures\nhttps://www.americanexpress.com/us/credit-cards/card-application/apply/supplementary/terms/platinum-card/36182-9-0 20/40', ""Only the\nBasic Card Member or Authorized Account Manager(s) on the Card Account can select the qualifying\nairline. Card Members who have not chosen one qualifying airline will be able to do so at any time.\nCard Members who have already selected one qualifying airline will be able to change their choice\none time each year in January through their American Express Online Account or by calling the\nnumber on the back of the Card. Card Members who do not change their airline selection will remain\nwith their current airline. Incidental airline fees must be separate charges from airline ticket charges.\nFees not charged by the Card Member's selected airline (e.g. wireless internet and fees incurred with\nairline alliance partners) do not qualify for statement credits. Incidental airline fees charged prior to\nselection of a qualifying airline are not eligible for statement credits. Airline tickets, upgrades, mileage\npoints purchases, mileage points transfer fees, gift cards, duty free purchases, and award tickets are\nnot deemed to be incidental fees. The airline must submit the charge under the appropriate merchant\ncode, industry code, or required service or product identifier for the charge to be recognized as an\nincidental air travel fee.\nPlease allow 6-8 weeks after the qualifying incidental air travel fee is charged to your Card Account\nfor statement credit(s) to be posted to the Account. American Express relies on airlines to submit the\ncorrect information on airline transactions, so please call the number on the back of the Card if\nstatement credits have not posted after 8 weeks from the date of purchase. American Express also\nrelies on the airlines' processing of transactions to determine the transaction date. If there is a delay\nin the airline submitting the transaction to us or if the airline uses another date as the transaction\ndate then your purchase may not earn the statement credit benefit for the benefit period in which you\nmade the purchase. If you have transferred to a different Card at the time the airline submits the\ntransaction, you may not receive the statement credit. Card Members remain responsible for timely\npayment of all charges. Statement credits may not be received or may be reversed if the purchase is\ncancelled, modified, or returned. To be eligible for this benefit, Card Account(s) must be not cancelled\nand not past due at the time of statement credit fulfillment."", ""and/or approval process for Global Entry or TSA PreCheck, and does not have access to any\ninformation provided to the government by the Card Member or by the government to the Card\nMember. American Express has no liability regarding the Global Entry or TSA PreCheck Programs.\nU.S. Customs and Border Protection (CBP) (for Global Entry) and U.S. Transportation Security\nAdministration (TSA) (for TSA PreCheck) charge an application fee to process each respective\napplication regardless of whether the Card Member's application is approved. The Department of\nHomeland Security may suspend acceptance of applications on any basis at its discretion. American\nExpress will provide a statement credit for the application fee regardless of the decision made by\nCBP (for Global Entry) or TSA (for TSA PreCheck) but will not provide a statement credit for\nsubsequent application fees charged to the same eligible Card within 4 years, even if the original\napplication is rejected.\nMembership for Global Entry or TSA PreCheck is per person, and a separate application must be\ncompleted for each individual. TSA PreCheck application must be processed through a TSA official\nenrollment provider. Global Entry membership also includes access to the TSA PreCheck program\nwith no additional application or fee required. For additional information on the Global Entry or TSA\nPreCheck programs, including information regarding the application and/or approval process and for a\nlist of participating airlines and airports, as well as the full terms and conditions of the programs,\nplease go to www.cbp.gov/travel/trusted-traveler-programs/global-entry for Global Entry and www.tsa.gov\nfor TSA PreCheck. The Global Entry or TSA PreCheck programs are subject to change, and\nAmerican Express has no control over those changes.\nThe statement credit benefit applies to the Global Entry or TSA PreCheck programs only. Other\nprogram applications including, but not limited to, NEXUS, SENTRI, FAST, and Privium are not\neligible for the statement credit benefit.\nPlease allow up to 8 weeks after the qualifying Global Entry or TSA PreCheck transaction is charged\nto the eligible Card account for the statement credit to be posted to the Card account. Statement\ncredits may not be received or may be reversed if an eligible purchase is returned, refunded,\ncancelled, or modified.""]","The Airline Fee Credit on the Amex Platinum card provides enrolled Basic Card Members on U.S. Consumer and Corporate Platinum Card Accounts with up to $200 in statement credits per calendar year for incidental airline fees charged by their one selected qualifying airline. To receive this benefit, enrollment through American Express is required, and the Basic Card Member must select a qualifying airline. Eligible incidental fees include charges such as baggage fees, but do not include airline tickets or upgrades. The total amount of statement credits will not exceed $200 per calendar year, per Card Account.",The Amex Platinum card offers up to $200 per calendar year in statement credits for incidental airline fees charged by one selected qualifying airline. Enrollment is required and a qualifying airline must be selected.,0.8571428571428571,0.9245212794347033,1.0,0.9166666666361111,Amex Platinum,benefit_detail,Phase 3 - Score Gap 0.45,2026-04-24T22:32:22.288481
What are the Trip Cancellation and Interruption limits on the Bilt Palladium card?,"['1\nGuide to Benefits for  \nMastercard® Cardholders\nCommon Carrier  \nTrip Cancellation and \nTrip Interruption\nKey Terms\nThroughout this document, you and your refer to the Cardholder. \nWe, us, and our refer to New Hampshire Insurance Company, an AIG \nCompany, New York, NY.\nAccident(al) means a sudden, unforeseen, and unexpected event \nwhich: (1) Happens by chance; (2) arises from a source external to \nthe Eligible Traveler; (3) is independent of illness, disease or their \nbodily malfunction or medical or surgical treatment thereof; (4) \noccurs while you are insured under the Group Policy; and (5) is the \ndirect cause of loss.\nAccidental Bodily Injury means an Accidental injury to the body of an \nexternal origin, unintentional and unforeseen by the Eligible Traveler. \nAn Accidental Bodily Injury must be verified by a Physician.\nAccount Holder means a person to whom an Eligible Account is \nissued and who holds the Eligible Account under his or her name.\nAdministrator means Sedgwick Claims Management Services, Inc. \nYou may contact the Administrator if you have questions regarding \nthis coverage or would like to make a claim. The Administrator can be \nreached by phone at 1-800-Mastercard.\nAuthorized User means an individual who is recorded as an \nauthorized user of an Eligible Account by the Account Holder and who \nis authorized by the Account Holder to make purchases on the Eligible \nAccount.\nCardholder means the Account Holder or Authorized User of an \nEligible Account in good standing who is a U.S. citizen or a legal \nresident of the U.S. or a U.S. territory, including the District of \nColumbia, American Samoa, Puerto Rico, Guam, the U.S. Virgin \nIslands, and the Northern Mariana Islands.\nCommon Carrier means any air, land, or water conveyance operating \nunder a valid license for the transportation of passengers for hire and \nfor which a ticket must be purchased prior to commencing travel. \nCommon Carrier does not include taxis, limousine services, commuter \nrails or commuter bus lines, personal automobiles, or rental cars.\nCovered Card means the Mastercard card linked to your Eligible \nAccount.', '2\nFamily Member means a spouse, Domestic Partner, or unmarried \ndependent children up to nineteen (19) years of age (or under age \ntwenty-six (26) if a full-time student at an accredited college or \nuniversity).\nGroup Policy means the Trip Cancellation/Interruption Insurance \nPolicy entered between New Hampshire Insurance Company, an \nAIG Company, and Mastercard Insurance Master Trust, which is the \nsubject of this Guide to Benefits.\nPhysician means a licensed medical, surgical, or dental practitioner \nacting within the scope of his or her license. The treating Physician \nmay not be an Eligible Traveler, an Eligible Traveler’s Family Member, \na Traveling Companion or related to an Eligible Traveler by blood.\nPre-Existing Condition means any condition resulting from any injury \nor Sickness affecting an Eligible Traveler, a Traveling Companion, or \na Family Member traveling with an Eligible Traveler within the sixty \n(60) day period prior to the purchase date of a Covered Trip. The\ncondition must have (a) first manifested itself or exhibited symptoms\nwhich would have caused one to seek diagnosis, care, or treatment;\n(b) required taking prescribed drugs or medicine; or (c) required\nmedical treatment or treatment was recommended by a Physician.\nTaking maintenance medications for a condition that is considered\nstable shall not be included as a Pre-Existing Condition.\nSickness means ill health, disorder, or unsound condition that is \ndiagnosed or treated by a Physician.\nTraveling Companion means an individual(s) who has made \nadvanced arrangements with you or your Family Members to travel \ntogether for all or part of a Covered Trip. \nTrip Cancellation means the cancellation of travel arrangements \nwhen the Eligible Traveler is prevented from traveling on a Common \nCarrier for a Covered Trip on or before the departure of the Covered \nTrip.\nTrip Interruption means the interruption of the Covered Trip either \non the way to the point of departure or after departure of the \nCovered Trip.\nEvidence of Coverage\nRefer to Key Terms for the definitions of you, your, we, us and our, \nand words that appear capitalized. This EOC is subject to the Legal \nDisclosures set forth below.', 'Evidence of Coverage\nRefer to Key Terms for the definitions of you, your, we, us and our, \nand words that appear capitalized. This EOC is subject to the Legal \nDisclosures set forth below.\nA. To get coverage:\nYou must charge the full amount of a Covered Trip to your Covered \nCard or in combination with your Covered Card and accumulated \npoints on your Eligible Account or redeemable certificates, vouchers, \ncoupons, or discounts awarded from frequent flyer program or \nsimilar program.\nB. Covered Losses:\nCovered Losses include Trip Cancellations or Trip Interruptions that \nresult from Accidental Bodily Injury or loss of life or Sickness of either \nthe Eligible Traveler, Traveling Companion or a Family Member of the \nEligible Traveler or Traveling Companion.\nC. The kind of coverage you receive:\nTrip Cancellation\nWe will reimburse you for the nonrefundable amount paid to a \nCommon Carrier with your Covered Card if a Covered Loss causes \nan Eligible Traveler’s Trip Cancellation, subject to the cancellation \nprovisions in effect at the time the Common Carrier is notified of \ncancellation.\nIf a Physician advises the Eligible Traveler that a Covered Trip is \nmedically inadvisable, the Eligible Traveler must immediately notify \nthe appropriate Common Carrier of his or her Trip Cancellation after \nreceiving such medical advice. If the Eligible Traveler does not provide \nsuch notification, our payment will not exceed the cancellation \npenalties imposed by the Common Carrier and in effect during the \nforty-eight (48) hour period immediately following the Physician’s \nnotice that travel was not advisable, subject to any other limits set \nforth herein.\nTrip Interruption\nIf a Covered Loss causes an Eligible Traveler’s Trip Interruption, we \nwill reimburse you for the nonrefundable amount paid to a Common \nCarrier with your Covered Card for the following:\n1.  The forfeited, non-refundable, pre-paid land, air and sea\ntransportation arrangements that were missed; and\n2.', '2\nC. Coverage limitations:\nCoverage is limited to the lesser of the following:\n• $300 per trip.\n• Coverage is limited to 1 claims per twelve (12) month period.\nCoverage is secondary to any other applicable insurance or benefit \navailable to you including benefits provided by the common carrier \n(including, but not limited to, exchanged tickets, drop in ticket prices, \ngoodwill payments, refunds, credits, or vouchers).\nD. How to file a claim:\n• Call 1-800-Mastercard or go to www.mycardbenefits.com to initiate \na clai\nm. You must report the claim within sixty (60) days of the failure \nor the claim may not be honored.\n• Submit the \nfollowing documentation within one hundred and eighty \n(180) days from the date of failure or the claim may not be honored: \n o Co\nvered card billing statement showing the charge for the covered \ntrip. \n o Proo\nf of the delay from the common carrier.\n o Rec\neipts for travel expenses.\n o Any\n other documentation that may be reasonably requested by us or \nour administrator to validate a claim. \nLegal Disclosure\nThis Guide to Benefits is not, by itself, a policy or contract of insurance or \nother contract.\nBenefits are provided to you, the accountholder, at no additional charge. \nNon-insurance services may have associated costs, which will be your \nresponsibility (for example, legal referrals are free, but the lawyer’s fee is \nyour responsibility). \nThe insurance benefits are provided under a group policy issued by New \nHampshire Insurance Company, an AIG company. This Guide to Benefits is \na summary of benefits provided to you. The attached Key Terms and EOC \nare governed by the Group Policy.\nEffective date of benefits: Effective July 1, 2019, this Guide to Benefits \nreplaces all prior disclosures, program descriptions, advertising, and \nbrochures by any party. The Policyholder and the insurer reserve the right \nto change the benefits and features of these programs at any time. \nNotice will be provided for any changes.\nCancellation: The Policyholder can cancel these benefits at any time or \nchoose not to renew the insurance coverage for all cardholders.', 'The forfeited, non-refundable, pre-paid land, air and sea\ntransportation arrangements that were missed; and\n2.  Additional transportation expenses that the Eligible Traveler incurs \nless any available refunds, not to exceed the cost of an economy-\nclass air ticket by the most direct route for the Eligible Traveler to\nrejoin his or her Common Carrier Covered Trip or to return to his or \nher place of origin.\nIf a Covered Loss causes an Eligible Traveler to temporarily postpone \ntransportation by a Common Carrier for a Covered Trip and a new \ndeparture date is set, we will reimburse you for the following: \n1.  The additional expenses incurred to purchase tickets for the new \ndeparture (not to exceed the difference between the original fare\nand the economy fare for the rescheduled Covered Trip by the most \ndirect route); and\n2.  The unused, non-refundable land, air, and sea arrangements paid\nto a Common Carrier with your Covered Card.\nTerm of Coverage\nCoverage begins on the date the Covered Trip was purchased and \nends immediately at the time the Covered Trip is completed.\nAn Eligible Traveler’s coverage terminates on any of the following \ndates: The date the Eligible Traveler is no longer eligible to \nparticipate; the date the Eligible Account is determined to be \nineligible by the participating organization; the date the participating \norganization ceases to pay premium on the Group Policy; the date \nthe participating organization ceases to participate in the Group \nPolicy; or the date the Group Policy is terminated.\nCoverage Limitations\nThe maximum benefit amount is $2,000 per Covered Trip and \n$5,000 per Eligible Account per 12 consecutive month period.\nCoverage is secondary to and in excess of any other applicable \ninsurance or benefit available to the Eligible Traveler including \nbenefits provided by the Common Carrier, such as exchanged tickets, \ndrop in ticket prices, goodwill payments, refunds, credits, or \nvouchers. In no event will this coverage apply as contributing \ninsurance. \nThis “non-contribution” clause will take precedence over the “non-\ncontribution” clauses found in other insurance or indemnity \nlanguage. Coverage is not available in states where prohibited.']","The Trip Cancellation and Interruption limits on the Bilt Palladium card are as follows:

- The maximum benefit amount is $2,000 per Covered Trip.
- The maximum benefit amount is $5,000 per Eligible Account per 12 consecutive month period.
- Coverage is limited to $300 per trip.
- Coverage is limited to 1 claim per twelve (12) month period.","The Bilt Palladium Trip Cancellation and Interruption benefit provides up to $2,000 per covered trip, with a maximum of $5,000 per eligible account per 12-month period.",0.75,1.0,1.0,0.19999999998,Bilt Palladium,benefit_detail,Phase 3 - Score Gap 0.45,2026-04-24T22:32:22.288481
What is the Extended Warranty Protection on the United Explorer Card?,"['8\nmotor vehicle lease or a joint credit card account with a financial \ninstitution, (4) are not married or joined in a civil union to \nanyone else or are not the Domestic Partner of anyone else, and \n(5) are not blood related\nFamily Member - an individual’s: spouse or Domestic Partner, \nand parents thereof; sons and daughters, including adopted \nchildren and stepchildren; legal guardians or wards; parents, \nincluding stepparents; brothers and sisters; grandparents and \ngrandchildren; aunts or uncles; nieces or nephews; spouses or \nDomestic Partners of any individual of this definition\nRewards - points, miles, cash rewards, or any other type of \nredeemable Rewards associated with Your Covered Card, \nprovided that all Rewards have been accumulated by You \nthrough use of a JPMorgan Chase Bank, N.A. and/or its affiliates \nsponsored Rewards program\nTrip - any pre-paid travel when a portion or the entire cost of a \nround trip or one way Common Carrier fare was paid using the \nCovered Card and/or redeemable Rewards\nTrip Completion Date - the date on which the Covered Traveler \nis scheduled to return to the point of origin or to a different \nfinal destination\nTrip Departure Date - the date on which the Covered Traveler \nis scheduled to leave on the Trip\nWe, Us and Our - Virginia Surety Company, Inc., an Assurant \ncompany, the insurance company that provides these benefits \nfor the Covered Card\nYou and Your - an individual to whom a Covered Card Account \nhas been issued by JPMorgan Chase Bank, N.A. and/or \nits affiliates\nBD_CON_$100 DAY_3 DAYS_20240311\nExtended Warranty Protection\nThis benefit extends the original manufacturer’s U.S. repair \nwarranty coverage by one (1) additional year. If You received \na store provided warranty or purchased a service contract, \nthis coverage begins at the end of the cumulative warranties \nand service contract. If the original manufacturer’s U.S. repair \nwarranty or a combination of the original manufacturer’s U.S. \nrepair warranty, store provided warranty and a consumer \npurchased service contract exceeds three (3) years there would \nnot be coverage under this benefit. In no event will coverage \nfrom the original manufacturer’s U.S.', '2\nYour Guide to Benefits describes the benefit that is in effect as \nof 10/01/24. Information in this guide takes the place of any \nprior benefit and benefit description you may have previously \nreceived. Your effective date of eligibility is determined \nby Chase. \nPlease keep the guide with your account information for future \nreference and call the benefit administrator if you have any \nquestions before taking advantage of the benefit.\nIf you have any questions please call 1-800-350-2919 or if you \nare outside the U.S., call collect at 001-214-503-2953.\nTABLE OF CONTENTS\nAuto Rental Coverage 3\nBaggage Delay Insurance 6\nExtended Warranty Protection 8\nLost Luggage Reimbursement 11\nPurchase Protection 13\nRoadside Assistance 15\nTravel Accident Insurance 17\nTravel and Emergency Assistance 22\nTrip Cancellation and Interruption Insurance 24\nTrip Delay Reimbursement 31\nAdditional Terms 33', 'repair warranty, store provided warranty and a consumer \npurchased service contract exceeds three (3) years there would \nnot be coverage under this benefit. In no event will coverage \nfrom the original manufacturer’s U.S. repair warranty, store \nprovided warranty or consumer purchased service contract and \nthis coverage exceed four (4) years from the purchase date.\nTo be eligible for this benefit, the item must come with a valid \noriginal manufacturer’s U.S. repair warranty and You must \ncharge all or a portion of the cost of the eligible item to Your \nCovered Card and/or use redeemable Rewards.\nWhat’s Covered?\nThe benefit applies to purchases made both inside and outside \nthe U.S. Eligible items given as gifts can also be covered.\nCoverage is limited to the lesser of the following:\n• The cost to repair the item\n•  The cost to replace the item with an item of like kind \nand quality', '9\n•  The  amount charged to the Covered Card and/or redeemable \nRewards used (excluding shipping and handling)\n•  $10,000 per item and a maximum of $50,000 per \ncalendar year\nNote: Eligible purchases made with redeemable Rewards will be \nreimbursed in dollars.\nWe will decide whether to reimburse for the cost to have the \nitem repaired or replaced, whichever is less. Maximum coverage \nlimits apply.\nIf Your item is to be repaired, You may go to an authorized \nrepair facility and file a claim for reimbursement. Only valid, \ncustomary and reasonable repairs made at the authorized \nrepair facility are covered.\nHow Does This Benefit Work?\nThe coverage begins at the end of the original manufacturer’s \nU.S. repair warranty and provides one (1) year of coverage after \nit has expired. This benefit only covers what would have been \ncovered under the original manufacturer’s U.S. repair warranty.\nIf You received a store provided warranty or purchased a \nservice contract, Our coverage begins at the expiration of the \ncumulative warranties and service contract. If the original \nmanufacturer’s U.S. repair warranty or a combination of the \noriginal manufacturer’s U.S. repair warranty, store provided \nwarranty and a consumer purchased service contract exceeds \nthree (3) years there would not be coverage under this benefit.\nExamples:\n•  On an original manufacture r’s U.S. repair warranty of \nsix (6) months, We would provide You with an additional \ntwelve (12) months of coverage for a combined total of \neighteen (18) months of coverage.\n•  On an original manufacture r’s U.S. repair warranty of \ntwelve (12) months, and a consumer purchased service \ncontract of twenty-four (24) months, We would provide You \nwith an additional twelve (12) months of coverage starting \nat the end of the consumer purchased service contract for a \ncombined total of forty-eight (48) months of coverage.\n•  On an original manufacture r’s U.S. repair warranty of \nsix (6) months, and a consumer purchased service contract \nof thirty-six (36) months, there would be no extension of \ncoverage under this benefit.\nHow Can You Store Your Warranty?', 'repair warranty of \nsix (6) months, and a consumer purchased service contract \nof thirty-six (36) months, there would be no extension of \ncoverage under this benefit.\nHow Can You Store Your Warranty?\nWhen You purchase an eligible item that carries a warranty, You \ncan store Your itemized sales receipt and warranty information \nonline at chasecardbenefits.com. \nYou can call 1-800-350-2919 \nfor assistance uploading Your documentation.\nIf You choose not to utilize the warranty storage, be sure to \nkeep Your monthly billing statement (showing the last four \n(4) digits of the Account number) reflecting the purchase, the \nitemized sales receipt, and the warranty information in a safe \nplace. These documents will be required to verify Your claim.\nWhat’s Not Covered?\nThis benefit does not cover the following:\n•  Boats , automobiles, aircraft, and any other motorized vehicles \nand their motors, equipment, or accessories, including trailers \nand other items that can be towed by or attached to any \nmotorized vehicle']","The Extended Warranty Protection on the United Explorer Card extends the original manufacturer’s U.S. repair warranty coverage by one (1) additional year. This coverage begins at the end of the cumulative warranties and service contracts if you received a store-provided warranty or purchased a service contract. If the original manufacturer’s U.S. repair warranty or a combination of warranties exceeds three (3) years, there would not be coverage under this benefit. The total coverage from the original manufacturer’s warranty and this benefit cannot exceed four (4) years from the purchase date.

To be eligible for this benefit, the item must come with a valid original manufacturer’s U.S. repair warranty, and you must charge all or a portion of the cost of the eligible item to your Covered Card and/or use redeemable Rewards. Coverage applies to purchases made both inside and outside the U.S., and eligible items given as gifts can also be covered.

Coverage is limited to the lesser of the cost to repair the item, the cost to replace the item with one of like kind and quality, the amount charged to the Covered Card and/or redeemable Rewards used (excluding shipping and handling), $10,000 per item, and a maximum of $50,000 per calendar year.","The United Explorer Card Extended Warranty Protection extends the original manufacturer's U.S. repair warranty by one additional year on warranties of 3 years or less. Coverage is limited to $10,000 per item and $50,000 per Account.",1.0,0.9579096807112197,1.0,0.8055555555287036,United Explorer,benefit_detail,Phase 3 - Score Gap 0.45,2026-04-24T22:32:22.288481
What rewards rate does the Amex Gold card earn at U.S. supermarkets?,"[""Any limit will not be\napplied to Charges for foreign currency or for travelers cheques or gift cheques obtained other than\nby telephone from us.\nThe Spending Limit for the Additional Card Member(s) is optional. If no Spending Limit is set on the\nAdditional Card, spending capacity on this Card will be subject to the Basic Card Member's account\nterms and conditions.\nThe Gold Card Membership Rewards\nBasic Card Members will earn one point for each dollar charged for an eligible purchase in each\nbilling period on The American Express Gold Card or an Additional Card on their Account. Basic Card\nMembers will earn: 3 additional points (for a total of 4 points) on the first $50,000 of eligible\npurchases per calendar year at restaurants worldwide; 3 additional points (for a total of 4 points) on\nthe first $25,000 of eligible purchases per calendar year at supermarkets located in the U.S.\n(superstores, convenience stores, warehouse clubs, and meal-kit delivery services are not considered\nsupermarkets); 2 additional points (for a total of 3 points) for each dollar of eligible purchases\ncharged on airfare on a scheduled flight charged directly with passenger airlines (charter flights and\nprivate jet flights are excluded) and airfare charged directly through amextravel.com or the Amex\nTravel App ; and 1 additional point (for a total of 2 points) for each dollar of eligible purchases\ncharged through amextravel.com or the Amex Travel App  for prepaid hotels, prepaid car rentals, or\ncruise reservations (non-prepaid car rentals, non-prepaid hotels, ticketing services or other fees are\nexcluded). Bonuses you may receive with your Card on other purchase categories or in connection\nwith promotions or offers from American Express may not be combined with this benefit. Basic Card\nMembers may not earn additional points for purchases at a restaurant located within another\nestablishment (e.g., a restaurant inside a hotel, casino, or event venue), events held within a\nrestaurant, purchases at events or of event tickets, purchases made through third-party food delivery\nservices outside of the U.S., or purchases at bars, nightclubs, cafeterias, caterers, theatre clubs,\nbreweries, bakeries, and meeting venues."", ""You must have or create an account with Venmo or\nPayPal and link your Online Account to your PayPal or Venmo account to use Send & Split. You\nmust add money to your Send Account from your eligible Card(s) to use Send & Split to send a\nVenmo or PayPal recipient. The charge on your Card for an Add Money transaction does not earn\nrewards and is subject to the Card's purchase APR. There is no fee to send funds to US recipients.\nPayPal charges a fee to send funds to non-US recipients.\nFor complete details visit americanexpress.com/sendandsplitterms to view Terms & Conditions. Send\nAccount issued by American Express National Bank, Member FDIC.\nShop Small Map\nOnly qualifying American Express Card accepting small merchants will be featured on the map.\nPlease note that business location and other information provided on the map may contain\ninaccuracies or errors, including as a result of information provided by third parties. The data on this\nmap is constantly being updated, please continually check back for updates.\nSpending Limits\nWhen you request that we apply a limit as described below on Charges incurred by an Additional\nCard Member on your Account, you agree to these terms. These terms supplement, and are\nincorporated by reference into, the terms of your Card Member Agreement.\nAt your request, we may agree to apply a limit to the total dollar amount of Purchases, during each\nbilling period, that are charged to Card numbers associated with one or more specified Additional\nCard Members on your Account. At your request, we may agree to apply a limit to the total dollar\namount of cash access transactions at ATMs, during each billing period, that are made using Card\nnumbers associated with one or more specified Additional Card Members on your Account. If we\nagree to apply a limit, it is not a guarantee that the Additional Card Member will be able to make\nPurchases or cash access transactions up to the applicable limit. In applying any limit we will not\n®\n®\n®\n4/17/26, 7:28 PM American Express® Gold Card - Terms, Conditions & Disclosures\nhttps://www.americanexpress.com/us/credit-cards/card-application/apply/supplementary/terms/gold-card/39161-9-0 14/17"", ""to satisfy the $2,000 purchase requirement. Your purchases as the Basic Card Member will not count\ntoward the $2,000 purchase requirement.\nEligible purchases are purchases for goods and services minus returns and other credits. Eligible\npurchases do NOT include fees or interest charges, cash advances, purchases of travelers checks,\npurchases or reloading of prepaid cards, purchase of gift cards, person-to-person payments, or purchases\nof other cash equivalents. Additional terms and restrictions apply.\nThe Additional Card Member's period to spend $2,000 may be shorter than 6 months depending on when\nthey receive their Card. Also, purchases may fall outside of the 6 month period in some cases, such as a\ndelay in merchants submitting transactions to us or if the purchase date differs from the date they made\nthe transaction. (For example, if they buy goods online, the purchase date may be the date the goods are\nshipped). The 10,000 Membership Rewards points will be applied 8-12 weeks after the Threshold\nAmount is met.\nIf we determine that you or your Additional Card Members have engaged in abuse, misuse, or gaming in\nconnection with this offer in any way or that you intend to do so, including if you or your Additional Card\nMembers return purchases made to meet the Threshold Amount, we may not credit, we may freeze, or\nwe may take away the Membership Rewards points from your card account. We may also cancel any\ncard accounts you and your Additional Card Members have with us.\nOffers may vary and you may see different offers in different advertisements. To take advantage of this\nspecific offer, apply through this advertisement. This offer is not transferable. American Express reserves\nthe right to modify or revoke this offer at any time.\nTerms and Conditions for the Membership Rewards program apply. Visit membershiprewards.com/terms\nfor more information. Participating partners and available rewards are subject to change without notice.\nThe value of Membership Rewards points varies according to how you choose to use them. To learn\nmore, go to www.membershiprewards.com/pointsinfo.\nThe annual fee for the American Express Gold Card is $325. There is no annual fee for up to 5\nAdditional Cards. The annual fee for 6 or more Additional Cards is $35 for each Card."", 'The annual fee for the American Express Gold Card is $325. There is no annual fee for up to 5\nAdditional Cards. The annual fee for 6 or more Additional Cards is $35 for each Card.\nBENEFIT TERMS\nThe following benefits and services are subject to change or cancellation.\n$100 Resy Credit\nEnrollment through American Express is required to receive this benefit. Only the Basic Card Member\nor Authorized Account Manager(s) on a U.S. Consumer American Express® Gold Card Account can\nenroll in the benefit in the Benefits section of their americanexpress.com online account or by calling\nthe number on the back of their Card. This benefit is not available to Classic Gold, Traditional Gold,\nor Senior Gold Card Members. Enrolled Basic Card Members can earn up to $50 in statement credits\nsemi-annually when the Basic Card or Additional Cards on the enrolled Account are used to pay for\neligible Resy purchases. However, each enrolled Card Account is only eligible for up to $50 in\n®\n®\n4/17/26, 7:28 PM American Express® Gold Card - Terms, Conditions & Disclosures\nhttps://www.americanexpress.com/us/credit-cards/card-application/apply/supplementary/terms/gold-card/39161-9-0 2/17', ""Therefore, we will ask for your\nAdditional Card Member's name, address, date of birth, and other personal information.\nThe American Express® Gold Card is issued by American Express National Bank. ©2026 American\nExpress National Bank.\nPOID K41C:8979\nOFFER TERMS\n10,000 Membership Rewards Points\nAdd one or more new Additional Card Members to your account and you can earn 10,000 Membership\nRewards points for the first Additional Card Member that spends $2,000 or more in eligible purchases on\ntheir Card within their first 6 months of Card Membership starting from the date on which the Additional\nCard Member is added. The maximum you can earn as part of this offer is 10,000 Membership Rewards\npoints. Purchases made by other Additional Card Members on your Account will not count toward the\n$2,000 purchase requirement. Purchases made by eligible Additional Card Members will not be combined\n®\n®\n4/17/26, 7:28 PM American Express® Gold Card - Terms, Conditions & Disclosures\nhttps://www.americanexpress.com/us/credit-cards/card-application/apply/supplementary/terms/gold-card/39161-9-0 1/17""]","The Amex Gold card earns 4 points for each dollar of eligible purchases at supermarkets located in the U.S. on the first $25,000 of eligible purchases per calendar year.","The Amex Gold card earns 4X Membership Rewards points at U.S. supermarkets on up to $25,000 per year in purchases. Superstores, warehouse clubs, and convenience stores are not included.",1.0,0.8717133988650331,1.0,0.9999999999,Amex Gold,benefit_detail,Phase 3 - Score Gap 0.45,2026-04-24T22:32:22.288481
What is the Delta Stays credit on the Delta SkyMiles Gold card?,"['For additional\ninformation on Delta Stays, visit delta.com/stays. The Delta Stays program is subject to change, and\nAmerican Express has no control over those changes. Bookings through Delta Vacations and\nproducts other than prepaid hotels and vacation rentals booked through Delta Stays will not qualify\nfor statement credits. Statement credit(s) may not be received or may be reversed if the Eligible Delta\nStays Booking is refunded, cancelled, or modified. If the Card Account is cancelled or past due at the\ntime of statement credit fulfillment, it may not qualify to receive a statement credit. Prepaid hotels and\nvacation rentals available through the Delta Stays platform are subject to change. If American\nExpress, in its sole discretion, determines that you have engaged in or intend to engage in any\nmanner of abuse, misuse, or gaming in connection with this benefit, American Express will not have\nan obligation to provide and may reverse any statement credits provided to you.\n$200 Delta Flight Credit\nIf, in any calendar year, eligible purchases on the Delta SkyMiles Gold or Gold Business American\nExpress Card Account total $10,000 or more (the ""Purchase Requirement""), the Basic Card Member\nwill receive a $200 Delta eCredit (the ""Credit"") in their SkyMiles account that can be used toward a\nDelta flight purchase. Delta flight purchases are limited to purchases of Delta-marketed flights made\non delta.com or with Delta Reservations. The Credit may also be applied toward the Delta airfare\nportion of a Delta Vacations package. The Credit will be issued as a Delta eCredit, which will be\navailable in ""My Profile"" on delta.com under ""Certificates, eCredits, and Vouchers."" To use the Credit,\nrefer to the certificate number, redemption code, and redemption instructions that will be sent to the\nemail address listed on your Delta SkyMiles account. The Credit is only valid for payment of tickets,\nincluding fare, surcharge and government-imposed taxes and fees imposed on ticket purchases. It is\nnot valid for other types of fees (including bag fees, change fees, upgrades or other ancillary\npurchases or fees with Delta), and it does not have any cash value.', 'The\ntrademarks are registered, or registrations are applied for, in countries of the world served by Delta.\n©2026. All SkyMiles program rules apply to SkyMiles program membership, miles, offers, mile accrual,\nmile redemption and travel benefits. To review the rules, please visit delta.com/memberguide. Offers void\nwhere prohibited by law. Offers are subject to change without notice. Other restrictions apply.\nThe Delta SkyMiles® Gold American Express Card is issued by American Express National Bank.\n©2026 American Express National Bank.\nPOID K2FX:9962\nBENEFIT TERMS\nThe following benefits and services are subject to change or cancellation.\n$100 Delta Stays Credit\nBasic Delta SkyMiles  Gold American Express Card Members can earn up to $100 in statement\ncredits per calendar year when a Basic Card or an Additional Card on the Account is used to pay for\n®\n4/17/26, 7:29 PM Delta SkyMiles® Gold American Express Card - Terms, Conditions & Disclosures\nhttps://www.americanexpress.com/us/credit-cards/card-application/apply/supplementary/terms/delta-skymiles-gold-american-express-card/36182-9-0 1/13', 'nightclubs, cafeterias, and convenience stores.\n2x Miles on Delta Purchases: Basic Card Members will earn 1 additional mile (for a total of 2 miles)\non each dollar of eligible purchases on their Card or any Additional Cards on the Card Account\ncharged directly with Delta where Delta is the merchant of record, such as purchases via delta.com,\nthe Fly Delta app, phone reservations, or ticket counters, for upgrades, miles, seat selection, Delta\nSky Club  membership, and in-flight purchases of food and beverages on Delta-operated flights\n(""Delta Purchases""). Delta Purchases do not include in-flight purchases where Delta is not the\nmerchant of record, such as in-flight wireless internet access and charitable contributions. Delta\nPurchases do not include Delta Gift Cards and purchases made at deltashop.com and/or the Delta\nFlight Museum. Delta Purchases include Delta Vacations  packages but not other all-inclusive\npackages. Delta purchases include new Delta Stays prepaid hotel or vacation rental bookings on the\nDelta Stays platform (delta.com/stays). Delta Purchases include purchases of qualifying Delta, Delta\nConnection  carrier and Delta Shuttle  flights taken with the purchase of a fare that is eligible for\nSkyMiles mileage credit. For purposes of this Card benefit, ""Delta Purchases"" also includes Delta\nMain Basic (Basic Economy) fares, notwithstanding that these fares do not earn SkyMiles mileage\ncredit for travel. Full SkyMiles program terms: delta.com/memberguide. Additional miles earned for\nDelta flight purchases made with the Card will be based on the total ticket price, including base fare,\ncarrier-imposed surcharges and government-imposed taxes and fees.\nEligible purchases are purchases for goods and services minus returns and other credits. Eligible\npurchases do NOT include fees or interest charges, cash advances, purchases of travelers checks,\npurchases of gift cards, person-to-person transactions, purchases or reloading of prepaid cards, or\npurchases of other cash equivalents. Miles will be posted to the Basic Card Member\'s Delta SkyMiles\naccount 8 to 12 weeks after the end of each month. To be eligible to receive miles, the Card Account\nmust not be canceled or past due at the time of fulfillment.', 'a new Delta Stays prepaid hotel or vacation rental booking on the Delta Stays platform\n(delta.com/stays) (each, an ""Eligible Delta Stays Booking"").\nPurchases by both the Basic Card Member and any Additional Card Members on the Card Account\nare eligible for statement credits. However, the total amount of statement credits for Eligible Delta\nStays Bookings will not exceed $100 on the Card Account per calendar year. Eligible Delta Stays\nBooking does not include interest charges, cancellation fees, property fees, resort fees, or other\nsimilar fees, or any charges by a property to you (whether for your booking, your stay or otherwise).\nPlease allow 6-8 weeks after an Eligible Delta Stays Booking is charged to your Card for statement\ncredit(s) to be posted to the Account. Call the number on the back of the Card if statement credits\nhave not posted by that time, or for additional information. American Express relies on the merchant\'s\nprocessing of transactions to determine the transaction date. If there is a delay in the merchant\nsubmitting the transaction to us or if the merchant uses another date as the transaction date then\nyour purchase may not earn the statement credit benefit for the benefit period in which you made the\npurchase. For example, if an Eligible Delta Stays Booking is purchased on December 31st but the\nmerchant processes the transaction such that it is identified to us as occurring on January 1st, the\nJanuary statement credit would be applied if available. American Express also relies on information\nprovided to us by the merchant to identify an Eligible Delta Stays Booking. If American Express does\nnot receive the information that identifies your transaction as eligible for this benefit, the Basic Card\nMember will not receive the statement credit. Basic Card Members may not receive the statement\ncredit if we receive inaccurate information or are otherwise unable to identify your purchase as\neligible, if a transaction is made with an electronic wallet or through a third party (such as an app\nstore), or if the merchant uses a mobile or wireless card reader to process it. For additional\ninformation on Delta Stays, visit delta.com/stays. The Delta Stays program is subject to change, and\nAmerican Express has no control over those changes.', 'Examples may include, but are not limited to: Charges made outside of the\nU.S., in duty-free stores, or on board airplanes or cruise vessels; international airline ticket\nPurchases; vehicle rentals; lodging stays extended beyond original reservation period; certain mail\norder Purchases; Purchases billed on a recurring basis; Purchases at gas stations;\ntelecommunications charges, including charges incurred with calling cards; taxicab charges; security\n®\n4/17/26, 7:29 PM Delta SkyMiles® Gold American Express Card - Terms, Conditions & Disclosures\nhttps://www.americanexpress.com/us/credit-cards/card-application/apply/supplementary/terms/delta-skymiles-gold-american-express-card/36182-9-0 11/13']","Basic Delta SkyMiles Gold American Express Card Members can earn up to $100 in statement credits per calendar year when a Basic Card or an Additional Card on the Account is used to pay for a new Delta Stays prepaid hotel or vacation rental booking on the Delta Stays platform (delta.com/stays). The total amount of statement credits for Eligible Delta Stays Bookings will not exceed $100 on the Card Account per calendar year. Eligible Delta Stays Booking does not include interest charges, cancellation fees, property fees, resort fees, or other similar fees. Statement credits may take 6-8 weeks to post to the Account after the Eligible Delta Stays Booking is charged.",The Delta SkyMiles Gold card offers up to $100 per calendar year in statement credits on eligible Delta Stays prepaid hotel or vacation rental bookings on the Delta Stays platform.,1.0,0.7876179512035884,1.0,0.6388888888675925,Amex Delta Gold,benefit_detail,Phase 3 - Score Gap 0.45,2026-04-24T22:32:22.288481
Does the Delta SkyMiles Gold card offer free checked bags?,"[""Benefits are non-transferable, subject to availability,\nand cannot be redeemed for cash, cash-equivalents, or credit.\nDispute Resolution\nNot all disputes are resolved in the Card Member's favor.\nFirst Checked Bag Free\nBenefit is limited to Basic Card Members (not Additional Card Members) with the Delta SkyMiles\nGold or Gold Business, Delta SkyMiles  Platinum or Platinum Business, or Delta SkyMiles  Reserve\nor Reserve Business American Express Card. Reservation must include the Basic Card Member's\nSkyMiles number. Fee waiver also available for passengers traveling on the same reservation as the\nBasic Card Member. Maximum nine waivers per reservation. Waiver is only for standard bag fee, if\nany, for the first checked bag that is not overweight and not oversize under Delta's applicable rules\nas set forth in Delta's contract of carriage. Additional checked bags will be subject to the applicable\nbaggage fees as outlined by Delta's rules and the purchased fare as set forth in Delta's contract of\ncarriage. The first checked bag fee waiver will only be applied on flight segments which originate on\na Delta or Delta Connection  carrier when you check-in with Delta for both a Delta marketed and\nDelta operated flight. Codeshare flights are not eligible. New Card Members and Card Members\nupgrading from another Delta SkyMiles Card product will be eligible for the checked baggage fee\nwaiver benefit after receiving their Card from American Express. Waiver is not available to\npassengers who are already receiving one or more checked bags free (for example, due to itinerary\n®\n®\n® ®\n®\n4/17/26, 7:29 PM Delta SkyMiles® Gold American Express Card - Terms, Conditions & Disclosures\nhttps://www.americanexpress.com/us/credit-cards/card-application/apply/supplementary/terms/delta-skymiles-gold-american-express-card/36182-9-0 6/13"", 'For additional\ninformation on Delta Stays, visit delta.com/stays. The Delta Stays program is subject to change, and\nAmerican Express has no control over those changes. Bookings through Delta Vacations and\nproducts other than prepaid hotels and vacation rentals booked through Delta Stays will not qualify\nfor statement credits. Statement credit(s) may not be received or may be reversed if the Eligible Delta\nStays Booking is refunded, cancelled, or modified. If the Card Account is cancelled or past due at the\ntime of statement credit fulfillment, it may not qualify to receive a statement credit. Prepaid hotels and\nvacation rentals available through the Delta Stays platform are subject to change. If American\nExpress, in its sole discretion, determines that you have engaged in or intend to engage in any\nmanner of abuse, misuse, or gaming in connection with this benefit, American Express will not have\nan obligation to provide and may reverse any statement credits provided to you.\n$200 Delta Flight Credit\nIf, in any calendar year, eligible purchases on the Delta SkyMiles Gold or Gold Business American\nExpress Card Account total $10,000 or more (the ""Purchase Requirement""), the Basic Card Member\nwill receive a $200 Delta eCredit (the ""Credit"") in their SkyMiles account that can be used toward a\nDelta flight purchase. Delta flight purchases are limited to purchases of Delta-marketed flights made\non delta.com or with Delta Reservations. The Credit may also be applied toward the Delta airfare\nportion of a Delta Vacations package. The Credit will be issued as a Delta eCredit, which will be\navailable in ""My Profile"" on delta.com under ""Certificates, eCredits, and Vouchers."" To use the Credit,\nrefer to the certificate number, redemption code, and redemption instructions that will be sent to the\nemail address listed on your Delta SkyMiles account. The Credit is only valid for payment of tickets,\nincluding fare, surcharge and government-imposed taxes and fees imposed on ticket purchases. It is\nnot valid for other types of fees (including bag fees, change fees, upgrades or other ancillary\npurchases or fees with Delta), and it does not have any cash value.', 'The\ntrademarks are registered, or registrations are applied for, in countries of the world served by Delta.\n©2026. All SkyMiles program rules apply to SkyMiles program membership, miles, offers, mile accrual,\nmile redemption and travel benefits. To review the rules, please visit delta.com/memberguide. Offers void\nwhere prohibited by law. Offers are subject to change without notice. Other restrictions apply.\nThe Delta SkyMiles® Gold American Express Card is issued by American Express National Bank.\n©2026 American Express National Bank.\nPOID K2FX:9962\nBENEFIT TERMS\nThe following benefits and services are subject to change or cancellation.\n$100 Delta Stays Credit\nBasic Delta SkyMiles  Gold American Express Card Members can earn up to $100 in statement\ncredits per calendar year when a Basic Card or an Additional Card on the Account is used to pay for\n®\n4/17/26, 7:29 PM Delta SkyMiles® Gold American Express Card - Terms, Conditions & Disclosures\nhttps://www.americanexpress.com/us/credit-cards/card-application/apply/supplementary/terms/delta-skymiles-gold-american-express-card/36182-9-0 1/13', ""It is\nnot valid for other types of fees (including bag fees, change fees, upgrades or other ancillary\npurchases or fees with Delta), and it does not have any cash value. The Credit expires within one\nyear from the date of issuance and must be redeemed on or before the expiration date. If the value\nof the Credit is greater than the flight purchased, the Card Member will be able to use the residual\nvalue in another transaction before the expiration date. Visit delta.com/redeem for more information\nabout redemption options. Limit one Credit per calendar year per Card Account. Please allow 6-8\nweeks after reaching the Purchase Requirement for the Credit to be issued. On rare occasions (for\nexample, when the name on your SkyMiles account doesn't match the name on your Amex account),\nthe timing of the deposit could be delayed. If the Card Account is cancelled or past due at the time of\nCredit issuance, it may not qualify to receive the Credit. If you have transferred to a different Card\nafter reaching the Purchase Requirement and before the time of Credit issuance, you may not\nreceive the Credit. The Credit is non-transferable from one Delta SkyMiles Member's account to\nanother but can be applied towards someone else's ticket without limitation. The Credit may be\ncombined with up to 2 other Delta eCredits. If the Basic Card Member transfers from a different Delta\nSkyMiles Card product to the Delta SkyMiles Gold Card, any eligible purchases made on the prior\n4/17/26, 7:29 PM Delta SkyMiles® Gold American Express Card - Terms, Conditions & Disclosures\nhttps://www.americanexpress.com/us/credit-cards/card-application/apply/supplementary/terms/delta-skymiles-gold-american-express-card/36182-9-0 2/13"", 'Examples may include, but are not limited to: Charges made outside of the\nU.S., in duty-free stores, or on board airplanes or cruise vessels; international airline ticket\nPurchases; vehicle rentals; lodging stays extended beyond original reservation period; certain mail\norder Purchases; Purchases billed on a recurring basis; Purchases at gas stations;\ntelecommunications charges, including charges incurred with calling cards; taxicab charges; security\n®\n4/17/26, 7:29 PM Delta SkyMiles® Gold American Express Card - Terms, Conditions & Disclosures\nhttps://www.americanexpress.com/us/credit-cards/card-application/apply/supplementary/terms/delta-skymiles-gold-american-express-card/36182-9-0 11/13']","Yes, the Amex Delta Gold card offers a benefit of a first checked bag free for Basic Card Members. This benefit is limited to the Basic Card Member and passengers traveling on the same reservation, with certain conditions regarding Delta flights.","Yes, the Delta SkyMiles Gold card provides the first checked bag free for the Basic Card Member and up to 8 companions on the same reservation on Delta-operated flights.",1.0,0.7616902937755585,1.0,0.9999999999,Amex Delta Gold,benefit_detail,Phase 3 - Score Gap 0.45,2026-04-24T22:32:22.288481
Does the Amex Gold card include airport lounge access?,"['take into account any credits (such as for returned merchandise or for payments), even if a credit\nrelates to a Purchase made by the Additional Card Member. Any request that we change a limit may\nnot be effective until a subsequent billing period. Any Charges (as defined below) incurred by the\nAdditional Card Member prior to the date during a billing period that we apply the limit will not be\nsubject to the limit for that billing period.\nBecause of systems or administrative considerations, arrangements with merchants, or for other\nbusiness reasons, we may, but are not required to, treat some Purchases and/or cash access\ntransactions (collectively, Charges) as not being subject to any such limits. You agree to pay all\nCharges without regard to whether any Charges exceed a limit, and you agree that we are not liable\nto you or any other person when a limit is not applied to any Charges and/or when Charges are\nincurred and billed that exceed a limit. While we typically require merchants to obtain an authorization\nfor purchases and submit final transaction documentation for payment in a timely manner, a limit may\nnot apply or may be exceeded when a merchant does not obtain an authorization for any reason;\nwhen a merchant obtains an authorization for a partial amount of the final charge submitted to us for\npayment; or when such submissions are not submitted or processed at the same time that the\nauthorization is obtained. Examples may include, but are not limited to: Charges made outside of the\nU.S., in duty-free stores, or on board airplanes or cruise vessels; international airline ticket\nPurchases; vehicle rentals; lodging stays extended beyond original reservation period; certain mail\norder Purchases; Purchases billed on a recurring basis; Purchases at gas stations;\ntelecommunications charges, including charges incurred with calling cards; taxicab charges; security\ndeposits; late, damage or other fees in connection with rentals; Purchases billed in installments;\nrestaurant tips and other gratuities; and Charges that occur before the end of billing period, if the\nCharge is posted to your Account after the Closing Date of that billing period. Any limit will not be\napplied to Charges for foreign currency or for travelers cheques or gift cheques obtained other than\nby telephone from us.\nThe Spending Limit for the Additional Card Member(s) is optional.', ""However, each enrolled Card Account is only eligible for up to $7 in statement\ncredits per month, for a total of up to $84 per calendar year in statement credits across all Cards on\nthe account.\nValid at Dunkin' locations in the U.S. that accept American Express® Cards. If American Express\ndoes not receive information that identifies the transaction as eligible for the benefit, the Basic Card\nMember will not receive the statement credit. For example, the transaction may not be eligible if it is\nnot made directly with Dunkin' (e.g., through a caterer or delivery service app) or if it is made at a\nDunkin' located within another establishment (e.g., at a pop up or inside an airport or gas station).\nEligible purchases do not include gift cards purchased online or any Dunkin' branded products\npurchased at other retailers (including gift cards).\nPlease allow up to 8 weeks after an eligible purchase is charged to the enrolled Card Account for\nstatement credit(s) to be posted to the Account. Please call the number on the back of the Card if\nstatement credits have not posted after 8 weeks from the date of purchase. American Express relies\non the merchant's processing of transactions to determine the transaction date. If there is a delay in\nthe merchant submitting the transaction to us or if the merchant uses another date as the transaction\ndate, then you may not earn the statement credit benefit for the benefit period in which you made the\npurchase. For example, if an eligible purchase is made on December 31st but the merchant\nprocesses the transaction such that it is identified to us as occurring on January 1st, the January\nstatement credit would be applied if available. If you have transferred to a different Card at the time\nthe merchant submits the transaction, you may not receive the statement credit. Statement credit(s)\nmay not be received or may be reversed if an eligible purchase is returned, refunded, cancelled, or\nmodified.\nAmerican Express also relies on information provided to us by the merchant to identify eligible\npurchases. In addition, the Basic Card Member may not receive the statement credit if the transaction\nis made with an electronic wallet or through a third party (such as an app store) or if the merchant\nuses a mobile or wireless card reader to process it."", 'the Card Member entrance or fast lane for any reason, including, without limitation, not adhering to\nsecurity protocols. To learn more about a specific venue, please visit americanexpress.com/venues.\nAmerican Express App\nThe American Express® App and app features are available only for eligible accounts in the United\nStates. American Express® prepaid Cards and Cards issued by non-American Express issuers are\nnot eligible.\nTo log in, customers must have an American Express user ID and password or create one in the app.\nAmex Oﬀers\nTo redeem an Amex Offer®, eligible Card Members must first enroll in the offer through their online\naccount or in the American Express® App, and then using their enrolled Card to make a qualifying\npurchase. Only U.S.-issued American Express Consumer and Business Cards may be eligible to\nparticipate. Card Members can check their eligibility by visiting the Amex Offers section of their online\naccount. American Express, in its sole discretion, reserves the right to determine eligibility for the\nAmex Offers program and may revoke access or enrollment if we determine that you have engaged,\nor are likely to engage, in abuse, misuse, or gaming of the program. Please review the terms of each\noffer for details on how to redeem. By enrolling in an offer, you agree that American Express may use\nyour transaction and personal information to administer the offer, communicate with you about it, and\nfacilitate your experience in accordance with the American Express Privacy Statement. You also\nconsent to receiving electronic communications from American Express, including email, app\nnotifications, and other digital messages, related to your enrolled offers and the Amex Offers\nprogram.\nBy enrolling in an offer, you agree to the individual offer terms and Program Terms. See individual\noffer terms below, and full Program Terms here.\nAmex Preferred Tickets\nAmex Preferred Tickets  (formerly referred to as American Express Preferred Access)\nEligible American Express  Card Members may purchase Amex Preferred Tickets  for select events\nand select seats, during a specified period while supplies last. Tickets are sold by and fulfilled by\nthird party ticket sellers (not American Express), and such tickets are subject to the rules, terms and\nconditions, prices and fees set by the ticket seller, event promoter and/or the venue.', ""You must have or create an account with Venmo or\nPayPal and link your Online Account to your PayPal or Venmo account to use Send & Split. You\nmust add money to your Send Account from your eligible Card(s) to use Send & Split to send a\nVenmo or PayPal recipient. The charge on your Card for an Add Money transaction does not earn\nrewards and is subject to the Card's purchase APR. There is no fee to send funds to US recipients.\nPayPal charges a fee to send funds to non-US recipients.\nFor complete details visit americanexpress.com/sendandsplitterms to view Terms & Conditions. Send\nAccount issued by American Express National Bank, Member FDIC.\nShop Small Map\nOnly qualifying American Express Card accepting small merchants will be featured on the map.\nPlease note that business location and other information provided on the map may contain\ninaccuracies or errors, including as a result of information provided by third parties. The data on this\nmap is constantly being updated, please continually check back for updates.\nSpending Limits\nWhen you request that we apply a limit as described below on Charges incurred by an Additional\nCard Member on your Account, you agree to these terms. These terms supplement, and are\nincorporated by reference into, the terms of your Card Member Agreement.\nAt your request, we may agree to apply a limit to the total dollar amount of Purchases, during each\nbilling period, that are charged to Card numbers associated with one or more specified Additional\nCard Members on your Account. At your request, we may agree to apply a limit to the total dollar\namount of cash access transactions at ATMs, during each billing period, that are made using Card\nnumbers associated with one or more specified Additional Card Members on your Account. If we\nagree to apply a limit, it is not a guarantee that the Additional Card Member will be able to make\nPurchases or cash access transactions up to the applicable limit. In applying any limit we will not\n®\n®\n®\n4/17/26, 7:28 PM American Express® Gold Card - Terms, Conditions & Disclosures\nhttps://www.americanexpress.com/us/credit-cards/card-application/apply/supplementary/terms/gold-card/39161-9-0 14/17"", ""Any limit will not be\napplied to Charges for foreign currency or for travelers cheques or gift cheques obtained other than\nby telephone from us.\nThe Spending Limit for the Additional Card Member(s) is optional. If no Spending Limit is set on the\nAdditional Card, spending capacity on this Card will be subject to the Basic Card Member's account\nterms and conditions.\nThe Gold Card Membership Rewards\nBasic Card Members will earn one point for each dollar charged for an eligible purchase in each\nbilling period on The American Express Gold Card or an Additional Card on their Account. Basic Card\nMembers will earn: 3 additional points (for a total of 4 points) on the first $50,000 of eligible\npurchases per calendar year at restaurants worldwide; 3 additional points (for a total of 4 points) on\nthe first $25,000 of eligible purchases per calendar year at supermarkets located in the U.S.\n(superstores, convenience stores, warehouse clubs, and meal-kit delivery services are not considered\nsupermarkets); 2 additional points (for a total of 3 points) for each dollar of eligible purchases\ncharged on airfare on a scheduled flight charged directly with passenger airlines (charter flights and\nprivate jet flights are excluded) and airfare charged directly through amextravel.com or the Amex\nTravel App ; and 1 additional point (for a total of 2 points) for each dollar of eligible purchases\ncharged through amextravel.com or the Amex Travel App  for prepaid hotels, prepaid car rentals, or\ncruise reservations (non-prepaid car rentals, non-prepaid hotels, ticketing services or other fees are\nexcluded). Bonuses you may receive with your Card on other purchase categories or in connection\nwith promotions or offers from American Express may not be combined with this benefit. Basic Card\nMembers may not earn additional points for purchases at a restaurant located within another\nestablishment (e.g., a restaurant inside a hotel, casino, or event venue), events held within a\nrestaurant, purchases at events or of event tickets, purchases made through third-party food delivery\nservices outside of the U.S., or purchases at bars, nightclubs, cafeterias, caterers, theatre clubs,\nbreweries, bakeries, and meeting venues.""]",This benefit is not mentioned in the Amex Gold benefits guide.,"No, the Amex Gold card does not include airport lounge access.",0.0,0.0,0.0,0.0,Amex Gold,negative,Phase 3 - Score Gap 0.45,2026-04-24T22:32:22.288481
Does the United Explorer Card include cell phone protection?,"['13\nsole Domestic Partner, (2) maintain a common residence, \n(3) share at least one (1) of the following financial arrangements: \na joint mortgage or lease, a joint bank account, joint title to or \nownership of a motor vehicle or status as a joint lessee on a \nmotor vehicle lease or a joint credit card account with a financial \ninstitution, (4) are not married or joined in a civil union to \nanyone else or are not the Domestic Partner of anyone else, and \n(5) are not blood related\nFamily Member - an individual’s: spouse or Domestic Partner, \nand parents thereof; sons and daughters, including adopted \nchildren and stepchildren; legal guardians or wards; parents, \nincluding stepparents; brothers and sisters; grandparents and \ngrandchildren; aunts or uncles; nieces or nephews; spouses or \nDomestic Partners of any individual of this definition\nRewards - points, miles, cash rewards, or any other type of \nredeemable Rewards associated with Your Covered Card, \nprovided that all Rewards have been accumulated by You \nthrough use of a JPMorgan Chase Bank, N.A. and/or its affiliates \nsponsored Rewards program\nTrip - any pre-paid travel when a portion or the entire cost of a \nround trip or one way Common Carrier fare was paid using the \nCovered Card and/or redeemable Rewards\nWe, Us and Our - Virginia Surety Company, Inc., an Assurant \ncompany, the insurance company that provides these benefits \nfor the Covered Card\nYou and Your - an individual to whom a Covered Card Account \nhas been issued by JPMorgan Chase Bank, N.A. and/or \nits affiliates\nLL_CON_$3K_20240311\nPurchase Protection\nThis benefit protects an item You purchase against theft, \ndamage, or Involuntary and Accidental Parting within \none hundred twenty (120) days (ninety (90) days for \nNew York residents) from the date of purchase. You are \neligible for this benefit when You charge all or a portion of \nthe cost of the eligible item to Your Covered Card and/or use \nredeemable Rewards.\nWhat’s Covered?\nThe benefit applies to purchases made both inside and outside \nthe U.S. Eligible items given as gifts can also be covered.', '8\nmotor vehicle lease or a joint credit card account with a financial \ninstitution, (4) are not married or joined in a civil union to \nanyone else or are not the Domestic Partner of anyone else, and \n(5) are not blood related\nFamily Member - an individual’s: spouse or Domestic Partner, \nand parents thereof; sons and daughters, including adopted \nchildren and stepchildren; legal guardians or wards; parents, \nincluding stepparents; brothers and sisters; grandparents and \ngrandchildren; aunts or uncles; nieces or nephews; spouses or \nDomestic Partners of any individual of this definition\nRewards - points, miles, cash rewards, or any other type of \nredeemable Rewards associated with Your Covered Card, \nprovided that all Rewards have been accumulated by You \nthrough use of a JPMorgan Chase Bank, N.A. and/or its affiliates \nsponsored Rewards program\nTrip - any pre-paid travel when a portion or the entire cost of a \nround trip or one way Common Carrier fare was paid using the \nCovered Card and/or redeemable Rewards\nTrip Completion Date - the date on which the Covered Traveler \nis scheduled to return to the point of origin or to a different \nfinal destination\nTrip Departure Date - the date on which the Covered Traveler \nis scheduled to leave on the Trip\nWe, Us and Our - Virginia Surety Company, Inc., an Assurant \ncompany, the insurance company that provides these benefits \nfor the Covered Card\nYou and Your - an individual to whom a Covered Card Account \nhas been issued by JPMorgan Chase Bank, N.A. and/or \nits affiliates\nBD_CON_$100 DAY_3 DAYS_20240311\nExtended Warranty Protection\nThis benefit extends the original manufacturer’s U.S. repair \nwarranty coverage by one (1) additional year. If You received \na store provided warranty or purchased a service contract, \nthis coverage begins at the end of the cumulative warranties \nand service contract. If the original manufacturer’s U.S. repair \nwarranty or a combination of the original manufacturer’s U.S. \nrepair warranty, store provided warranty and a consumer \npurchased service contract exceeds three (3) years there would \nnot be coverage under this benefit. In no event will coverage \nfrom the original manufacturer’s U.S.', '30\nProvider of Lodging - a hotel, inn, motel, bed and breakfast, \nhostel, residential rental properties (such as Airbnb and Vrbo) \nand timeshares\nRewards - points, miles, cash rewards, or any other type of \nredeemable Rewards associated with Your Covered Card, \nprovided that all Rewards have been accumulated by You \nthrough use of JPMorgan Chase Bank, N.A. and/or its affiliates \nsponsored Rewards program\nSevere Weather - any dangerous meteorological phenomena \nwith the potential to cause major damage, serious social \ndisruption, or loss of human life; Severe Weather also includes \nwildfire related smog and volcanic ash\nTerrorist Activity - multiple Terrorist Incidents or Travel \nWarnings related to terrorism that have occurred within the \ntwelve (12) months prior to the initial deposit date or booking \ndate of a Trip located within twenty-five (25) miles of an airport, \nProvider of Lodging listed on the Covered Traveler’s itinerary \nand/or Host at Destination location\nTerrorist Incident - the use or intended use of any bomb, \nnuclear, biological, or chemical agent dangerous to human \nlife; or any violent act of a single individual resulting in mass \ncasualties; or any violent act of a terrorist organization or cell \nresulting in mass casualties.', 'For questions,  \ncall 1-800-350-2919 \nEffective 10/01/24\nBGC11386\nGuide to Benefits\nImportant information about your  \ntravel and purchase protection benefits\nUnited SM Explorer Card and\nUnited Quest SM Card\nVisa Signature® and Visa Platinum', '22\nTrip Completion Date - the date on which the Covered Traveler \nis scheduled to return to the point of origin or to a different \nfinal destination\nWe, Us and Our - Virginia Surety Company, Inc., an Assurant \ncompany, the insurance company that provides these benefits \nfor the Covered Card\nYou and Your - an individual to whom a Covered Card Account \nhas been issued by JPMorgan Chase Bank, N.A. and/or \nits affiliates\nTAI_CON_$500K_20240311\nTravel and Emergency Assistance\nIf an emergency occurs while the Covered Traveler is traveling \naway from home, they would have access to Travel and \nEmergency Assistance services. To access these services, \ncall 1-800-350-2919 in the United States, or call collect \ninternationally at 001-214-503-2953 to connect with the \nappropriate local emergency and assistance resources twenty-\nfour (24) hours a day, three hundred sixty-five (365) days a year.\nTravel and Emergency Assistance services provide \nassistance and referrals.\nThe Covered Traveler is responsible for the cost of any \nactual medical, legal, transportation, cash advance, \nor other services or goods provided.\nWhat Are the Specific Travel and Emergency \nAssistance Services?\nWhen traveling away from home, emergencies can escalate \nquickly. Something that is relatively straightforward when at \nhome, like replacing prescription medication, can become \ncomplicated when navigating local laws or language barriers. \nTravel and Emergency Assistance services are designed to help \nin numerous situations. Services include:\n•  Emergency Message Service records and relays emergency \nmessages for Covered Travelers, their Immediate Family \nMembers, or business associates. Reasonable efforts will be \nused to relay emergency messages in accordance with benefit \nguidelines and limitations but cannot take responsibility for \nthe failure to transmit any message successfully. All costs are \nthe Covered Traveler’s responsibility.\n•  Medical Referral Assistance provides medical referral, \nmonitoring, and follow-up. The Covered Traveler can be \ngiven names of local English-speaking doctors, dentists, and \nhospitals; assign a doctor to consult by phone with local \nmedical personnel, if necessary, to monitor their condition; \nand keep in contact with their family, serving as a continuing \nliaison.']",This benefit is not mentioned in the United Explorer benefits guide.,"No, the United Explorer Card does not include cell phone protection.",0.0,0.0,0.0,0.0,United Explorer,negative,Phase 3 - Score Gap 0.45,2026-04-24T22:32:22.288481
Does the Delta SkyMiles Gold card include a companion certificate?,"[""All Award Ticket rules apply, as set forth on\ndelta.com and in the specific terms incorporated into your Award Ticket. Award Travel is defined as\ntravel using an Award Ticket. Award Travel seats are limited and may not be available on all flights or\nin all markets.\nSkyMiles account balance must have sufficient miles for the entire Award Ticket(s) being purchased.\nTakeOff 15 benefit is not combinable with certificates, Delta eCredits, Delta Gift Cards, vouchers, or\nwith any other discounts or promotional offers.\nAward Ticket Taxes/Fees:\nAward Ticket taxes and fees include only U.S. excise and departure/arrival taxes, airport charges,\nsegment fees, the September 11th Security Fee, and international taxes and fees normally included\nin the Award Ticket.\nAward Ticket Cancellations and Changes:\nIn the event of a voluntary cancellation of the Award Ticket to which the TakeOff 15 benefit was\napplied, redeemed miles will be redeposited into the Card Member's SkyMiles account, except for\nDelta Main Basic (Basic Economy) tickets. Current Award Ticket redeposit fees apply. Delta Main\nBasic (Basic Economy) cancellations will result in cancellation charge assessed in miles, as outlined\nin fare rules. Remaining miles after deduction of the cancellation charge will be redeposited to Card\nMember's SkyMiles account. There is no discount applicable to the cancellation charge.\nIf changing an Award Ticket after ticketing, discount is applied to the new Award Ticket (if eligible),\nand the difference in miles will be deducted from the Card Member's SkyMiles account (if the new\nAward Ticket mileage amount is higher) or redeposited into the Card Member's SkyMiles account (if\nthe new Award Ticket mileage amount is lower). Delta Main Basic (Basic Economy) tickets are not\neligible for voluntary changes. SkyMiles Member must be an active Basic Delta SkyMiles Gold,\nPlatinum or Reserve American Express Card Member or Basic Delta SkyMiles Gold, Platinum or\nReserve Business American Express Card Member at time that the Award Ticket is changed to be\neligible for the TakeOff 15 benefit on the changed Award Ticket.\nMiscellaneous:\nAll SkyMiles Program rules apply to SkyMiles Program membership, miles, offers, mile accrual, mile\nredemption, and travel benefits."", 'For additional\ninformation on Delta Stays, visit delta.com/stays. The Delta Stays program is subject to change, and\nAmerican Express has no control over those changes. Bookings through Delta Vacations and\nproducts other than prepaid hotels and vacation rentals booked through Delta Stays will not qualify\nfor statement credits. Statement credit(s) may not be received or may be reversed if the Eligible Delta\nStays Booking is refunded, cancelled, or modified. If the Card Account is cancelled or past due at the\ntime of statement credit fulfillment, it may not qualify to receive a statement credit. Prepaid hotels and\nvacation rentals available through the Delta Stays platform are subject to change. If American\nExpress, in its sole discretion, determines that you have engaged in or intend to engage in any\nmanner of abuse, misuse, or gaming in connection with this benefit, American Express will not have\nan obligation to provide and may reverse any statement credits provided to you.\n$200 Delta Flight Credit\nIf, in any calendar year, eligible purchases on the Delta SkyMiles Gold or Gold Business American\nExpress Card Account total $10,000 or more (the ""Purchase Requirement""), the Basic Card Member\nwill receive a $200 Delta eCredit (the ""Credit"") in their SkyMiles account that can be used toward a\nDelta flight purchase. Delta flight purchases are limited to purchases of Delta-marketed flights made\non delta.com or with Delta Reservations. The Credit may also be applied toward the Delta airfare\nportion of a Delta Vacations package. The Credit will be issued as a Delta eCredit, which will be\navailable in ""My Profile"" on delta.com under ""Certificates, eCredits, and Vouchers."" To use the Credit,\nrefer to the certificate number, redemption code, and redemption instructions that will be sent to the\nemail address listed on your Delta SkyMiles account. The Credit is only valid for payment of tickets,\nincluding fare, surcharge and government-imposed taxes and fees imposed on ticket purchases. It is\nnot valid for other types of fees (including bag fees, change fees, upgrades or other ancillary\npurchases or fees with Delta), and it does not have any cash value.', 'Except for\ntickets refunded under Delta\'s Risk Free Cancellation policy, miles redeemed with Pay with Miles\ncannot be re-deposited in the member\'s SkyMiles Account — even for fully refundable fares. Residual\nvalue for a changed or cancelled ticket will be issued as an e-certificate applicable to future Delta\npurchases. For additional terms, conditions, and restrictions, visit delta.com/paywithmiles.\nPriority Boarding\nBasic Delta SkyMiles  Gold or Gold Business, Delta SkyMiles  Platinum or Platinum Business, and\nDelta SkyMiles  Reserve or Reserve Business American Express Card Members (""Eligible Card\nMembers"") are entitled to receive Zone 5 Priority Boarding on Delta and Delta Connection carrier\noperated flights when the Eligible Card Member\'s SkyMiles number is included on the reservation.\nBenefit is limited to Basic Eligible Card Members (not Additional Card Members). Benefit is also\navailable for passengers traveling in the same reservation as the Basic Card Member, up to a\nmaximum of nine passengers per reservation. Zone 5 Priority Boarding will only be available on Delta\nand Delta Connection carrier operated flights. Delta does not offer Zone 5 Priority Boarding on Delta\nShuttle  flights. New Eligible Card Members and Eligible Card Members who have upgraded from\nanother Delta SkyMiles American Express Card will be eligible for the Priority Boarding benefit after\nreceiving their Card from American Express. Boarding offerings are subject to change without notice.\nAdditional terms, conditions and restrictions may apply. See delta.com/amex for details.\nSeller of Travel\nAmerican Express Travel Related Services Company, Inc. is acting solely as a sales agent for travel\nsuppliers and is not responsible for the actions or inactions of such suppliers. Certain suppliers pay\nus commission and other incentives for reaching sales targets or other goals and may provide\nincentives to our Travel Consultants. For more information visit www.americanexpress.com/travelterms.\nCalifornia CST#1022318; Washington UBI#600-469-694\nSend & Split\nSend & Split® is only available in the American Express® App (""Amex App"") to Card Members with\nan eligible Card.', 'nightclubs, cafeterias, and convenience stores.\n2x Miles on Delta Purchases: Basic Card Members will earn 1 additional mile (for a total of 2 miles)\non each dollar of eligible purchases on their Card or any Additional Cards on the Card Account\ncharged directly with Delta where Delta is the merchant of record, such as purchases via delta.com,\nthe Fly Delta app, phone reservations, or ticket counters, for upgrades, miles, seat selection, Delta\nSky Club  membership, and in-flight purchases of food and beverages on Delta-operated flights\n(""Delta Purchases""). Delta Purchases do not include in-flight purchases where Delta is not the\nmerchant of record, such as in-flight wireless internet access and charitable contributions. Delta\nPurchases do not include Delta Gift Cards and purchases made at deltashop.com and/or the Delta\nFlight Museum. Delta Purchases include Delta Vacations  packages but not other all-inclusive\npackages. Delta purchases include new Delta Stays prepaid hotel or vacation rental bookings on the\nDelta Stays platform (delta.com/stays). Delta Purchases include purchases of qualifying Delta, Delta\nConnection  carrier and Delta Shuttle  flights taken with the purchase of a fare that is eligible for\nSkyMiles mileage credit. For purposes of this Card benefit, ""Delta Purchases"" also includes Delta\nMain Basic (Basic Economy) fares, notwithstanding that these fares do not earn SkyMiles mileage\ncredit for travel. Full SkyMiles program terms: delta.com/memberguide. Additional miles earned for\nDelta flight purchases made with the Card will be based on the total ticket price, including base fare,\ncarrier-imposed surcharges and government-imposed taxes and fees.\nEligible purchases are purchases for goods and services minus returns and other credits. Eligible\npurchases do NOT include fees or interest charges, cash advances, purchases of travelers checks,\npurchases of gift cards, person-to-person transactions, purchases or reloading of prepaid cards, or\npurchases of other cash equivalents. Miles will be posted to the Basic Card Member\'s Delta SkyMiles\naccount 8 to 12 weeks after the end of each month. To be eligible to receive miles, the Card Account\nmust not be canceled or past due at the time of fulfillment.', 'The\ntrademarks are registered, or registrations are applied for, in countries of the world served by Delta.\n©2026. All SkyMiles program rules apply to SkyMiles program membership, miles, offers, mile accrual,\nmile redemption and travel benefits. To review the rules, please visit delta.com/memberguide. Offers void\nwhere prohibited by law. Offers are subject to change without notice. Other restrictions apply.\nThe Delta SkyMiles® Gold American Express Card is issued by American Express National Bank.\n©2026 American Express National Bank.\nPOID K2FX:9962\nBENEFIT TERMS\nThe following benefits and services are subject to change or cancellation.\n$100 Delta Stays Credit\nBasic Delta SkyMiles  Gold American Express Card Members can earn up to $100 in statement\ncredits per calendar year when a Basic Card or an Additional Card on the Account is used to pay for\n®\n4/17/26, 7:29 PM Delta SkyMiles® Gold American Express Card - Terms, Conditions & Disclosures\nhttps://www.americanexpress.com/us/credit-cards/card-application/apply/supplementary/terms/delta-skymiles-gold-american-express-card/36182-9-0 1/13']",This benefit is not mentioned in the Amex Delta Gold benefits guide.,"No, the Delta SkyMiles Gold card does not include a companion certificate.",0.0,0.0,0.0,0.0,Amex Delta Gold,negative,Phase 3 - Score Gap 0.45,2026-04-24T22:32:22.288481
Does the Capital One Venture X auto rental coverage include motorcycles?,"['Because \nregulations vary outside the United States, check with Y our \nauto rental company and the Benefit Administrator before \nY ou travel, to be sure that Auto Rental Collision Damage \nWaiver will apply.\nVehicles not covered\nCertain vehicles are not covered by this benefit, they consist of \nexpensive, exotic, and antique cars; cargo vans; certain vans; \nvehicles with an open cargo bed; trucks; motorcycles; mopeds; \nmotorbikes; limousines; and recreational vehicles.\nAn expensive automobile is defined as any vehicle with an \noriginal manufacturer’s suggested retail price of more than \nseventy-five thousand dollars ($75,000.00) when new.\nAn antique car is defined as one that is over twenty (20) years \nold, or one that has not been manufactured for ten (10) years \nor more.\nVans are not covered. But those designed as small-group \ntransportation vehicles (seating up to nine (9) people, \nincluding the driver) are covered.\nIf Y ou have questions about a specific vehicle’s coverage \nor organization where the vehicle is being reserved, call \nthe Benefit Administrator at 1-800-825-4062, or call collect \noutside the United States at 1-804-965-8071 collect.', 'Related instances & losses not covered\n•  Any obligation You assume under any agreement (other \nthan the deductible on Your personal auto policy)\n•  Any violation of the auto rental agreement or this benefit\n•  Injury of anyone, or damage to anything, inside or outside \nthe Rental Vehicle\n•  Loss or theft of personal belongings\n•  Personal liability\n•  Expenses assumed, waived, or paid by the auto rental \ncompany, or its insurer\n•  The cost of any insurance, or collision damage waiver, \noffered by or purchased through the auto rental company\n•  Depreciation of the Rental Vehicle caused by the incident \nincluding, but not limited to, “diminished value”\n•  Expenses reimbursable by Your insurer, employer, or \nemployer’s insurance\n•  Theft or damage due to intentional acts, or due to the \ndriver(s) being under the influence of alcohol, intoxicants, or \ndrugs, or due to contraband, or illegal activities\n•  Wear and tear, gradual deterioration, or mechanical \nbreakdown\n•  Items not installed by the original manufacturer\n•  Damage due to off-road operation of the Rental Vehicle\n•  Theft or damage due to hostility of any kind (including, \nbut not limited to, war, invasion, rebellion, insurrection, or \nterrorist activities)\n•  Confiscation by authorities\n•  Vehicles that do not meet the definition of covered vehicles\nBR414848_M133789_LetterSize.indd   2BR414848_M133789_LetterSize.indd   2 7/15/21   11:58 AM7/15/21   11:58 AM', 'Digital Data means information, concepts, knowledge, \nfacts, images, sounds, instructions, or Computer Programs \nstored as or on, created or used on, or transmitted to or from \ncomputer software (including systems and applications \nsoftware), on hard or floppy disks, CD-ROMs, tapes, drives, \ncells, data processing devices or any other repositories \nof computer software which are used with electronically \ncontrolled equipment. Digital Data shall include the capacity \nof an Eligible Wireless Cellular Telephone, Rental Vehicle, or \nCovered Purchase to store information, process information, \nand transmit information over the Internet. \nGeneral Provisions for Auto Rental Collision Damage \nWaiver, Trip Delay Reimbursement, Lost Luggage \nReimbursement, Purchase Security, Return Protection, \nExtended Warranty Protection and Cellular Telephone \nProtection:\n•  Signed or pinned transactions are covered as long as You \nuse Your eligible card to secure the transaction. \n•  You shall do all things reasonable to avoid or diminish any \nloss covered by these benefits. This provision will not be \nunreasonably applied to avoid claims. \n•  If You make any claim knowing it to be false or fraudulent \nin any respect, no coverage shall exist for such claim, and \nYour benefit may be cancelled. Each cardholder agrees \nthat representations regarding claims will be accurate and \ncomplete. Any and all relevant provisions shall be void in any \ncase of fraud, intentional concealment, or misrepresentation \nof material fact. \n•  No legal action for a claim may be brought against the \nProvider until sixty (60) days after the Provider receives Proof \nof Loss. No legal action against the Provider may be brought \nmore than two (2) years after the time for giving Proof of \nLoss. Further, no legal action may be brought against the \nProvider unless all the terms of the Guide to Benefits have \nbeen complied with fully. \n•  These benefits are provided to eligible cardholders at no \nadditional cost. The terms and conditions contained in \nthis Guide to Benefits may be modified by subsequent \n16\nBR414848_M133789_LetterSize.indd   16BR414848_M133789_LetterSize.indd   16 7/15/21   11:58 AM7/15/21   11:58 AM', 'The eligible item must have a valid original \nmanufacturer’s U.S. repair warranty of three (3) years or less, \nstore-purchased dealer warranty, or an assembler warranty.\nWhat Extended Protection does not cover\n•  Boats, automobiles, aircraft, and any other motorized \nvehicles and their motors, equipment, or accessories, \nincluding trailers and other items that can be towed by or \nattached to any motorized vehicle\n•  Any costs other than those specifically covered under the \nterms of the original manufacturer’s written U.S. repair \nwarranty, as supplied by the original manufacturer, or other \neligible warranty\n•  Items purchased for resale, professional, or commercial use\n•  Real estate and items which are intended to become part of \nreal estate including, but not limited to, items that are hard-\nwired or hard-plumbed, garage doors, garage door openers, \nand ceiling fans\n•  Rented or leased items \n•  Computer software\n•  Medical equipment\n•  Used or pre-owned items (Refurbished items will be covered \nas long as it has a warranty with it and would not be \nconsidered used or pre-owned.) \n•  Losses caused by or resulting from a Cyber Incident\nFiling an Extended Protection claim\nTo file a claim, call the Benefit Administrator at 1-844-288-2140 \nimmediately after the failure of Your covered item. Please note \nif You do not notify the Benefit Administrator within sixty \n(60) days of product failure, Your claim may be denied. \nThe Benefit Administrator will request preliminary claim \ninformation, direct You to the appropriate repair facility, and \nsend You the claim form. \nGift recipients of eligible items are also covered, but they must \nprovide all the documents needed to substantiate their claim.\nIf You received or purchased a service contract or an \nextended warranty when You purchased Your item, this \nbenefit will be supplemental to, and in excess of, that \ncoverage.', 'You are eligible for this benefit if You are a cardholder of an \neligible card issued in the United States. \nGifts purchased for friends and family members may also be \ncovered if they are purchased with Your covered Account and/\nor rewards program associated with Your covered Account.\nPurchase Security covers \nEligible items of personal property purchased with Your \nAccount and/or rewards program associated with Your \ncovered Account are covered for damage or theft. Purchases \nmade outside the United States are also covered as long as You \npurchased the item with Your covered Account and/or rewards \nprogram associated with Your covered Account.\nPurchase Security does not cover \n•  Animals and living plants\n•  Antiques or collectible items\n•  Boats, aircraft, automobiles, and any other motorized \nvehicles and their motors, equipment, or accessories, \nincluding trailers and other items towable or attachable to \nany motorized vehicle\n•  Broken items, unless the result of a covered occurrence\n•  Computer software\n•  Items purchased for resale, either professional or \ncommercial use\n•  Items that are lost, or that “mysteriously disappear,” \nmeaning they vanished in an unexplained manner, with no \nevidence of wrongdoing by one person or several\n•  Items under the control and care of a common carrier \n(including the U.S.']",This benefit is not mentioned in the Capital One Venture X benefits guide.,"No, motorcycles are explicitly excluded from the Capital One Venture X Auto Rental Collision Damage Waiver.",0.5,0.0,1.0,0.6999999999766667,Capital One Venture X,negative,Phase 3 - Score Gap 0.45,2026-04-24T22:32:22.288481
Does the Bilt Palladium cell phone protection cover lost phones?,"['2\n2. Y\nour coverage resumes on the first day of the calendar month \nfollowing the date of any future payment of your eligible cellular \nwireless telephone bill with your covered card.\nB.\n T\nhe kind of coverage you receive:\n •R\neimbursement for the actual cost to replace or repair a stolen or \ndamaged eligible cellular wireless telephone.\n •C\noverage ends on the earliest of: The date you no longer are a \ncardholder; the date the covered card is determined to be ineligible by \nthe participating organization; the date the participating organization \nceases to pay premium on the \ngroup policy; the date the participating \norganization ceases to participate in the group policy; the date the \ngroup policy is terminated.\nC. Coverage limitations: \nCoverage for a stolen or damaged eligible cellular wireless telephone is \nsubject to the terms, conditions, exclusions, and limits of liability of this \nbenefit. The maximum liability is $800 per claim, and $1,000 per covered \ncard per 12 month period. Each claim is subject to a $50 deductible.  \nCoverage is limited to two (2) claims per covered card per 12 month \nperiod. \nCoverage is excess of any other applicable insurance or indemnity \navailable to you. Coverage is limited only to those amounts not covered \nby any other insurance or indemnity. In no event will this coverage \napply as contributing insurance. This “non-contribution” clause will take \nprecedence over a similar clause found in other insurance or indemnity \nlanguage.\nD.\n What is NOT covered: \nThe following items are excluded from coverage under the group policy:\n •Eligi\nble cellular wireless telephone accessories other than the standard \nbattery and standard antenna provided by the manufacturer; \n •Eligi\nble cellular wireless telephones purchased for resale or for \nprofessional or commercial use;\n •Eligi\nble cellular wireless telephones that are lost or mysteriously \ndisappear;\n •Eligi ble cellular wireless telephones under the care and control of a \ncommon carrier, including, but not limited to, the U.S.', 'In the event \nthe EOC, Key Terms, or Legal Disclosures of this Guide to Benefi  ts confl  ict \nwith the provisions of the group policy, the terms of the group policy \ngovern your coverage.\nGroup Policy means the Cellular Protection Insurance Policy entered \nbetween New Hampshire Insurance Company, an AIG Company, and \nMastercard Insurance Master Trust, which is the subject of this Guide to \nBenefi  ts.\nMysteriously Disappear means the vanishing of an item in an unexplained \nmanner where there is absence of evidence of a wrongful act by a person \nor persons. \nStolen means taken by force and/or under duress or a loss which involves \nthe disappearance of an eligible cellular wireless telephone from a known \nplace under circumstances that would indicate the probability of theft \nand for which a police report was fi  led within forty-eight hours of the \ntheft.\nEvidence of Coverage\nRefer to Key Terms for the defi  nitions of you, your, we, us, our, and words \nthat appear in bold. This \nEOC is subject to the Legal Disclosures set forth \nbelow.\nA. To get coverage:\nYou must charge your monthly \neligible cellular wireless telephone bill \nto your covered card. You are eligible for coverage the fi  rst day of the \ncalendar month following the payment of your eligible cellular wireless \ntelephone bill to your covered card. If you pay an eligible cellular wireless \ntelephone bill with your covered card and fail to pay a subsequent bill to \nyour covered card in a particular month, your coverage period changes as \nfollows:\n1. Your coverage is suspended beginning the fi  rst day of the calendar \nmonth following the month of nonpayment to your covered card; and\nGuide to Benefi  ts for \nMastercard® Cardholders\nCellular Wireless Telephone \nProtection – Consumer', 'In addition, we shall not be deemed to provide cover and we shall not \nbe liable to pay any claim or provide any benefit under the group policy \nto the extent that the provision of such cover, payment of such claim \nor provision of such benefit would expose us, our parent company or \nits ultimate controlling entity to any sanction, prohibition or restriction \nunder United Nations resolutions or the trade or economic sanctions, \nlaws or regulations of the European Union or the United States \nof America.\nE.\t How\n\tt\no\n\tfi\nle\n\t\na\n\t\nclaim:\n •C\nall 1-800-Mastercard or go to www.mycardbenefits.com to open a \nclaim. You must report the claim within 90 days of the loss, or as soon \nas reasonably possible, or the claim may not be honored. Upon receipt \nof a notice of claim, we will provide you with the necessary instructions \nfor filing proof of loss. Written proof of loss must be submitted to \nour \nadministrator within 120 days of the loss or the claim may not be \nhonored. Required documentation may include but is not limited to the \nfollowing:\n o Y\nour card statement reflecting the monthly eligible cellular wireless \ntelephone payments for the month preceding the date the eligible \ncellular wireless telephone was stolen or suffered damage;\n o A\n copy of your current wireless service provider’s billing statement;\n o If\n a claim is due to damage, a copy of the repair estimate and photos \nof the damage; \n o If\n the claim is due to theft, a copy of the police report filed within 48 \nhours of the theft; and\n o An\ny other documentation or information reasonably requested by us \nto support the claim.\nLegal Disclosure\nThis Guide to Benefits is not, by itself, a policy or contract of insurance or \nother contract.\nBenefits are provided to you, the \ncardholder, at no additional charge.  \nThe insurance benefits are provided under the group policy issued by  \nNew Hampshire Insurance Company, an AIG company. This Guide to \nBenefits is a summary of benefits provided to you. The attached Key \nTerms and \nEOC are governed by the group policy.', 'Postal Service, \nairplanes or delivery service; \n •Eligi\nble cellular wireless telephones stolen from baggage unless \nhand-carried and under the eligible person’s supervision or under the \nsupervision of the eligible person’s traveling companion who is previously \nknown to the eligible person; \n •Eligi\nble cellular wireless telephones stolen from a construction site;\n •Eligi\nble cellular wireless telephones which have been rented or leased \nfrom a person or company other than a cellular provider;\n •Eligi\nble cellular wireless telephones which have been borrowed;\n •Eligi\nble cellular wireless telephones that are received as part of a \npre-paid plan;\n •C\nosmetic damage to the eligible cellular wireless telephone or damage \nthat does not impact the eligible cellular wireless telephone’s ability to \nmake or receive phone calls (including minor screen cracks and fractures \nless than 2 inches in length that do not prevent the ability to make \nor receive phone calls or to use other features related to making or \nreceiving phone calls);\n •D\namage or theft resulting from abuse, intentional acts, fraud, hostilities \nof any kind (including, but not limited to, war, invasion, rebellion or \ninsurrection), confiscation by the authorities, risks of contraband, \nillegal activities, normal wear and tear, flood, earthquake, radioactive \ncontamination, or damage from inherent product defects or vermin;\n •D\namage or theft resulting from mis-delivery or voluntary parting from \nthe eligible cellular wireless telephone; \n •R\neplacement eligible cellular wireless telephone(s) purchased from \nanyone other than a cellular service provider’s retail or internet store \nthat has the ability to initiate activation with the cellular service \nprovider;\n •T axes, delivery or transportation charges or any fees associated with \nthe service provided; and\n •L\nosses covered under a warranty issued by a manufacturer, distributor \nor seller.', '1\nKey Terms\nThroughout this document, You and Your refer to the cardholder or \nauthorized user of the covered card. We, Us, and Our refer to New \nHampshire Insurance Company, an AIG Company.\nAdministrator means Sedgwick Claims Management Services, Inc. \nYou may contact the administrator if you have questions regarding this \ncoverage or would like to make a claim. The administrator can be reached \nby phone at \n1-800-Mastercard.\nAuthorized User means an individual who is authorized to make \npurchases on the covered card by the cardholder and is recorded by the \nParticipating Organization on its records as being an authorized user.\nCardholder means the person who has been issued an account by the \nParticipating Organization for the covered card.\nCarry-on Luggage means suitcases or other containers specifi  cally \ndesignated for carrying personal property, which are carried on board a \ncommon carrier by you.\nChecked Luggage means suitcases or other containers specifi  cally \ndesignated for carrying personal property, for which a claim check has \nbeen issued to you by a common carrier.\nCommon Carrier means an air, land, or water motorized transportation \ncarrier operating under a regularly published schedule and current license \nas required by law for the conveyance of passengers. Common carrier \ndoes not include helicopters, taxis rental cars, hired cars, and private and \ncontract carriers.\nCovered Card means the Mastercard card.\nDamage means items that can no longer perform the function they \nwere intended to do in normal service due to broken parts, material or \nstructural failures.\nEvidence of Coverage (EOC) means the document describing the terms, \nconditions, and exclusions. The EOC, Key Terms, and Legal Disclosures are \nthe entire agreement between You and Us. Representations or promises \nmade by anyone that are not contained in the EOC, Key Terms, or Legal \nDisclosures are not a part of your coverage.\nLost means luggage (including personal property contained within) that \nis missing for 10 consecutive days and whose whereabouts are unknown \nto you or the common carrier.\nUnited States Dollars (USD) means the currency of the United States \nof America.']",This benefit is not mentioned in the Bilt Palladium benefits guide.,"No, the Bilt Palladium cell phone protection does not cover phones that are lost or mysteriously disappear. It only covers stolen or damaged phones.",1.0,0.5208390029607767,1.0,0.9999999999,Bilt Palladium,negative,Phase 3 - Score Gap 0.45,2026-04-24T22:32:22.288481
How does the auto rental coverage limit differ between the Capital One Venture X and the United Explorer Card?,"['Related instances & losses not covered\n•  Any obligation You assume under any agreement (other \nthan the deductible on Your personal auto policy)\n•  Any violation of the auto rental agreement or this benefit\n•  Injury of anyone, or damage to anything, inside or outside \nthe Rental Vehicle\n•  Loss or theft of personal belongings\n•  Personal liability\n•  Expenses assumed, waived, or paid by the auto rental \ncompany, or its insurer\n•  The cost of any insurance, or collision damage waiver, \noffered by or purchased through the auto rental company\n•  Depreciation of the Rental Vehicle caused by the incident \nincluding, but not limited to, “diminished value”\n•  Expenses reimbursable by Your insurer, employer, or \nemployer’s insurance\n•  Theft or damage due to intentional acts, or due to the \ndriver(s) being under the influence of alcohol, intoxicants, or \ndrugs, or due to contraband, or illegal activities\n•  Wear and tear, gradual deterioration, or mechanical \nbreakdown\n•  Items not installed by the original manufacturer\n•  Damage due to off-road operation of the Rental Vehicle\n•  Theft or damage due to hostility of any kind (including, \nbut not limited to, war, invasion, rebellion, insurrection, or \nterrorist activities)\n•  Confiscation by authorities\n•  Vehicles that do not meet the definition of covered vehicles\nBR414848_M133789_LetterSize.indd   2BR414848_M133789_LetterSize.indd   2 7/15/21   11:58 AM7/15/21   11:58 AM', '3\nAuto Rental Coverage\nThis benefit provides reimbursement for damages caused by \ntheft or collision of the Rental Vehicle up to $60,000. Coverage is \navailable worldwide.\nYou are covered when You use a Covered Card Account and/or \nredeemable Rewards, to initiate and complete the entire Rental \nVehicle transaction. Only You, as the primary renter of the \nRental Vehicle, and any additional drivers permitted by the \nRental Car Agreement are covered.\nWhat’s Covered?\nThis benefit covers theft, damage, valid loss-of-use charges \nimposed and substantiated by the Rental Agency, administrative \nfees, and reasonable and customary towing charges (due to a \ncovered theft or damage) to the nearest qualified repair facility. \nNo other type of loss is covered. For example, in the event of \na collision involving the Rental Vehicle, damage to any other \ndriver’s car, the injury of anyone, or damage to anything is not \ncovered. Rental periods up to thirty-one (31) consecutive days \nare covered.\nHow Does This Benefit Work?\nInside the United States and outside the United States (where \nthis benefit is available) the coverage provided is primary. \nNew York Residents, inside the United States coverage is \nprimary unless You have personal automobile insurance in \nwhich case it is excess.\nHow Do You Use This Benefit?\n1.   Use  a Covered Card Account and/or redeemable Rewards to \ninitiate and complete the entire Rental Vehicle transaction.\n2.  Re view the Rental Car Agreement and decline the Rental \nAgency’s collision damage waiver/loss damage waiver \n(CDW/LDW) option or a similar provision. Accepting the Rental \nAgency’s CDW/LDW coverage will cancel out this benefit. If the \nRental Agency, outside of the United States, will not allow \nYou to decline their CDW/LDW coverage, then this benefit is \nsecondary to the Rental Agency’s CDW/LDW coverage.\n3.  Some  countries or Rental Agencies require a letter \nof coverage. Please check with the Rental Agency \nbefore You go. If a letter of coverage is required \nvisit\n chasecardbenefits.com or call 1-800-350-2919.\nBefore driving out of the lot, check the Rental Vehicle for \nany prior damage and bring any damage You identify to the \nattention of the Rental Agency.', '2\nVisa Infinite Concierge\nCount on your 24/7 Visa Infinite® Concierge* to book your \ntravel, dinner reservations, event tickets and more.\nVisa Infinite Concierge can help you open the door to unique \nexperiences wherever you are around the world. Secure a \ntable at a premium restaurant, enjoy VIP seating at a special \nevent, or make life a little easier with assistance for your \neveryday needs. Visa Concierge is there to help with it all.\nYour Capital One Visa Infinite card comes with complimentary, \n24/7 access to the Visa Infinite® Concierge* service. Simply call \n888-315-6982 anytime for assistance.\n* Capital One Visa Infinite accountholders are responsible for the \npayment of any and all charges associated with any goods, \nservices, reservations or bookings purchased or arranged by \nthe Visa Infinite Concierge on cardholders’ behalf. Any such \npurchases or arrangements are solely between the cardholder \nand the respective merchant, and Visa is not a party to the \ntransaction. All goods and services subject to availability.\nAuto Rental Collision Damage Waiver\nNo cardholder wants to incur the expense of repairing or \nreplacing a rented car. But accidents do happen, and vehicles \ndo get stolen. No matter what happens to Your rental car, You \ncan be covered with Auto Rental Collision Damage Waiver.\nAuto Rental Collision Damage Waiver reimburses You for \ndamages caused by theft or collision – up to the Actual \nCash Value of rental vehicles with an original manufacturer’s \nsuggested retail price of up to seventy-five thousand dollars \n($75,000.00) when new. Auto Rental Collision Damage Waiver \ncovers no other type of loss. For example, in the event of a \ncollision involving Your rented vehicle, damage to any other \ndriver’s car or the injury of anyone or anything is not covered. \nRental periods of fifteen (15) consecutive days within Your \ncountry of residence, and thirty-one (31) consecutive days \noutside it, are both covered. (Longer rental periods, however, \nare not covered).\nYou are eligible for this benefit if Your name is embossed on \nan eligible card issued in the United States and You use it \nto initiate and complete Your entire car rental transaction.', '2\nYour Guide to Benefits describes the benefit that is in effect as \nof 10/01/24. Information in this guide takes the place of any \nprior benefit and benefit description you may have previously \nreceived. Your effective date of eligibility is determined \nby Chase. \nPlease keep the guide with your account information for future \nreference and call the benefit administrator if you have any \nquestions before taking advantage of the benefit.\nIf you have any questions please call 1-800-350-2919 or if you \nare outside the U.S., call collect at 001-214-503-2953.\nTABLE OF CONTENTS\nAuto Rental Coverage 3\nBaggage Delay Insurance 6\nExtended Warranty Protection 8\nLost Luggage Reimbursement 11\nPurchase Protection 13\nRoadside Assistance 15\nTravel Accident Insurance 17\nTravel and Emergency Assistance 22\nTrip Cancellation and Interruption Insurance 24\nTrip Delay Reimbursement 31\nAdditional Terms 33', 'Because \nregulations vary outside the United States, check with Y our \nauto rental company and the Benefit Administrator before \nY ou travel, to be sure that Auto Rental Collision Damage \nWaiver will apply.\nVehicles not covered\nCertain vehicles are not covered by this benefit, they consist of \nexpensive, exotic, and antique cars; cargo vans; certain vans; \nvehicles with an open cargo bed; trucks; motorcycles; mopeds; \nmotorbikes; limousines; and recreational vehicles.\nAn expensive automobile is defined as any vehicle with an \noriginal manufacturer’s suggested retail price of more than \nseventy-five thousand dollars ($75,000.00) when new.\nAn antique car is defined as one that is over twenty (20) years \nold, or one that has not been manufactured for ten (10) years \nor more.\nVans are not covered. But those designed as small-group \ntransportation vehicles (seating up to nine (9) people, \nincluding the driver) are covered.\nIf Y ou have questions about a specific vehicle’s coverage \nor organization where the vehicle is being reserved, call \nthe Benefit Administrator at 1-800-825-4062, or call collect \noutside the United States at 1-804-965-8071 collect.', 'Wondering if a vehicle is covered?\nCall 1-800-350-2919\nWhat’s Not Covered?\nThis benefit does not apply to the following:\n•  Any obligation assumed under any agreement (other than the \ndeductible on a personal auto policy)\n•  Any violation of the Rental Car Agreement or the terms \nof this benefit\n•  Injury of anyone, including You, or damage to anything, inside \nor outside the Rental Vehicle\n•  Loss or theft of personal belongings\n• Personal liability\n•  Expenses assumed, waived or paid by the Rental Agency \nor its insurer\n•  The cost of any insurance or collision damage waiver offered \nby or purchased through the Rental Agency\n•  Depreciation of the Rental Vehicle caused by the incident \nincluding, but not limited to, “diminished value”\n•  Expenses reimbursable by an insurer, employer, or \nemployer’s insurance\n•  Theft or damage due to intentional acts or due to the driver(s) \nbeing under the influence of alcohol, intoxicants, or drugs, or \ndue to contraband, or illegal activities\n•  Wear and tear, gradual deterioration, or \nmechanical breakdown\n• Items not installed by the original manufacturer\n• Damage due to off-road operation of the Rental Vehicle\n•  Theft or damage due to hostility of any kind (including, \nbut not limited to, war, invasion, rebellion, insurrection, or \nterrorist activities)\n• Confiscation by authorities\n• Vehicles that do not meet the definition of Rental Vehicle\n•  Rental periods that either exceed or are intended to exceed \nthirty-one (31) days\n• Leases and mini leases\n•  Theft or damage resulting from Your and/or an authorized \ndriver’s lack of reasonable care in protecting the Rental \nVehicle before and/or after damage or theft occurs (for \nexample, leaving the car running and unattended)\n• Vehicles that are not rented from a Rental Agency\n•  Damage to the interior bed of a pick-up truck unless such \ndamage is caused by or the result of a covered loss, such as \ntheft or collision\n•  The Rental Vehicle is rented through a car sharing company \nthat allows individuals to rent out their own vehicle\nHow Do You File a Claim?\nIt is Your responsibility to make every effort to protect the \nRental Vehicle from damage or theft.', '(Longer rental periods, however, \nare not covered).\nYou are eligible for this benefit if Your name is embossed on \nan eligible card issued in the United States and You use it \nto initiate and complete Your entire car rental transaction. \nOnly You as the primary car renter and any additional drivers \npermitted by the Rental Car Agreement are covered.\nHow Auto Rental Collision Damage Waiver works\nYour Auto Rental Collision Damage Waiver benefit acts as \nprimary coverage and covers theft, damage, valid loss-of-\nuse charges imposed and substantiated by the auto rental \ncompany, administrative fees and reasonable and customary \ntowing charges, due to a covered theft or damage to the \nnearest qualified repair facility. \nHow to use Auto Rental Collision Damage Waiver\n1.  Use Your card to initiate and complete Your entire car rental \ntransaction. \n2.  Review the auto rental agreement and decline the rental \ncompany’s collision damage waiver (CDW/LDW) option, or \na similar provision, as accepting this coverage will cancel \nout Y our benefit. If the rental company insists that You \npurchase their insurance or collision damage waiver, call the \nBenefit Administrator for assistance at 1-800-825-4062. \nOutside the United States, call collect at 1-804-965-8071.\nBefore Y ou leave the lot, be sure to check the car for any \nprior damage.\nThis benefit is in effect during the time the rental car is in Your \n(or an authorized driver’s) control, and it terminates when the \nrental company reassumes control of their vehicle.\nThis benefit is available in the United States and most foreign \ncountries (with the exception of Israel, Jamaica, the \nRepublic of Ireland or Northern Ireland). However, this \nbenefit is not available where precluded by law, or where it’s \nin violation of the territory terms of the auto rental agreement, \nor when prohibited by individual merchants. Because \nregulations vary outside the United States, check with Y our \nauto rental company and the Benefit Administrator before \nY ou travel, to be sure that Auto Rental Collision Damage \nWaiver will apply.', 'Before driving out of the lot, check the Rental Vehicle for \nany prior damage and bring any damage You identify to the \nattention of the Rental Agency.\nThis benefit is in effect during the time the Rental Vehicle is in \nYour (or an authorized driver’s) control, and terminates when \nthe Rental Agency reassumes control of the Rental Vehicle.\nWhat Vehicles Are Not Covered?\nCertain vehicles are not covered by this benefit, including: \nexotic vehicles or any vehicle with a dealer or manufacturer’s \nsuggested retail price greater than $125,000, and antique \ncars (cars over twenty (20) years old or that have not been \nmanufactured for ten (10) years or more), cargo vans, trucks \n(other than pick-ups), motorcycles, mopeds, motorbikes, \nlimousines and vehicles that are rented with a driver, \nrecreational vehicles, and passenger vans with seating for more \nthan twelve (12) people including the driver.', 'at 804-965-8071.\n$1,000,000.00 Worldwide Automatic Common \nCarrier Travel Accident Insurance\nTHE PLAN: As a Capital One Visa Infinite Cardholder, you \nwill be automatically insured up to $1,000,000.00 against \naccidental loss of life, limb, sight, speech or hearing while riding \nas a passenger in, entering or exiting any licensed common \ncarrier, provided the entire cost of the passenger fare(s), less \nredeemable certificates, vouchers or coupons, has been \ncharged to your Capital One Visa Infinite account. If the entire \ncost of the passenger fare has been charged to your Capital One \nVisa Infinite account prior to departure for the airport, terminal \nor station, coverage is also provided for common carrier travel \n(including taxi, bus, train or airport limousine, including courtesy \ntransportation); immediately, a) preceding your departure, \ndirectly to the airport, terminal or station b) while at the airport, \nterminal or station, and c) immediately following your arrival at \nthe airport, terminal or station of your destination. If the entire \ncost of the passenger fare has not been charged prior to your \narrival at the airport, terminal or station, coverage begins at the \ntime the entire cost of the travel passenger fare is charged to \nyour Capital One Visa Infinite account. Common Carrier means \nany land, water or air conveyance operated by those whose \noccupation or business is the transportation of persons without \ndiscrimination and for hire.\nELIGIBILITY: This travel insurance plan is provided to Capital \nOne Visa Infinite cardholders, automatically when the entire \ncost of the passenger fare(s) are charged to your Capital One \nVisa Infinite account while the insurance is effective. It is not \nnecessary for you to notify Capital One, the administrator or \nthe Company when tickets are purchased.\n8\nBR414848_M133789_LetterSize.indd   8BR414848_M133789_LetterSize.indd   8 7/15/21   11:58 AM7/15/21   11:58 AM', '9\n•  The  amount charged to the Covered Card and/or redeemable \nRewards used (excluding shipping and handling)\n•  $10,000 per item and a maximum of $50,000 per \ncalendar year\nNote: Eligible purchases made with redeemable Rewards will be \nreimbursed in dollars.\nWe will decide whether to reimburse for the cost to have the \nitem repaired or replaced, whichever is less. Maximum coverage \nlimits apply.\nIf Your item is to be repaired, You may go to an authorized \nrepair facility and file a claim for reimbursement. Only valid, \ncustomary and reasonable repairs made at the authorized \nrepair facility are covered.\nHow Does This Benefit Work?\nThe coverage begins at the end of the original manufacturer’s \nU.S. repair warranty and provides one (1) year of coverage after \nit has expired. This benefit only covers what would have been \ncovered under the original manufacturer’s U.S. repair warranty.\nIf You received a store provided warranty or purchased a \nservice contract, Our coverage begins at the expiration of the \ncumulative warranties and service contract. If the original \nmanufacturer’s U.S. repair warranty or a combination of the \noriginal manufacturer’s U.S. repair warranty, store provided \nwarranty and a consumer purchased service contract exceeds \nthree (3) years there would not be coverage under this benefit.\nExamples:\n•  On an original manufacture r’s U.S. repair warranty of \nsix (6) months, We would provide You with an additional \ntwelve (12) months of coverage for a combined total of \neighteen (18) months of coverage.\n•  On an original manufacture r’s U.S. repair warranty of \ntwelve (12) months, and a consumer purchased service \ncontract of twenty-four (24) months, We would provide You \nwith an additional twelve (12) months of coverage starting \nat the end of the consumer purchased service contract for a \ncombined total of forty-eight (48) months of coverage.\n•  On an original manufacture r’s U.S. repair warranty of \nsix (6) months, and a consumer purchased service contract \nof thirty-six (36) months, there would be no extension of \ncoverage under this benefit.\nHow Can You Store Your Warranty?']","The Capital One Venture X provides Auto Rental Collision Damage Waiver coverage for damages caused by theft or collision up to the Actual Cash Value of rental vehicles with an original manufacturer's suggested retail price of up to seventy-five thousand dollars ($75,000.00) when new. 

In contrast, the United Explorer Card offers coverage for damages caused by theft or collision of the Rental Vehicle up to $60,000. 

Therefore, the coverage limit for the Capital One Venture X is higher than that of the United Explorer Card.","The Capital One Venture X covers rental vehicles with an MSRP up to $75,000, while the United Explorer Card covers up to $60,000. Both provide primary coverage.",0.16666666666666666,0.9090002347177011,0.6666666666666666,0.0,Multiple,cross_card,Phase 3 - Score Gap 0.45,2026-04-24T22:32:22.288481
How does the Trip Delay Reimbursement threshold differ between the Capital One Venture X and the United Explorer Card?,"['•  This benefit is provided to eligible cardholders at no \nadditional cost. The terms and conditions contained in \nthis Guide to Benefits may be modified by subsequent \nendorsements. Modifications to the terms and conditions \nmay be provided via additional Guide to Benefits mailings, \nstatement inserts, statement messages or electronic \nnotification. The benefits described in this Guide will not \napply to cardholders whose Accounts have been suspended \nor cancelled. \n•  Termination dates may vary by financial institutions. Your \nfinancial institution can cancel or non-renew the benefits \nfor cardholders, and if they do, they will notify You at least \nthirty (30) days in advance. Federal Insurance Company \n(“Provider”) is the underwriter of these benefits and is solely \nresponsible for its administration and claims. The Plan \nAdministrator provides services on behalf of the Provider. \n•  After the Plan Administrator has paid Your claim, all Your \nrights and remedies against any party in respect of this \nclaim will be transferred to the Plan Administrator to the \nextent of the payment made to You. You must give the Plan \nAdministrator all assistance as may reasonably be required \nto secure all rights and remedies. \n•  This benefit does not apply to the extent that trade or \neconomic sanctions or other laws or regulations prohibit \nthe provision of insurance, including, but not limited to, the \npayment of claims.\nFORM #TRCAN – 2017 (04/17)                                                                               TC-I\nFor more information about the benefit described in this \nguide, please contact the Plan Administrator.\nTrip Delay Reimbursement\nHaving a Covered Trip delayed can mean more than just lost \ntime; it can also create an additional cost that You weren’t \nexpecting to pay.\nTrip Delay Reimbursement covers up to a maximum of five \nhundred dollars ($500.00) for each purchased ticket, for \nreasonable additional expenses incurred when a Covered Trip \nYou purchased with Your eligible Account and/or rewards \nprogram associated with Your covered Account is delayed \nfor more than six (6) hours or requires an overnight stay. The \nbenefit is limited to one claim per Covered Trip. To be eligible \nfor this coverage, You need to purchase either a portion or the \nentire cost of Your Common Carrier fare using Your Account.', '31\nTrip Delay Reimbursement\nThis benefit provides reimbursement for reasonable expenses \nincurred by the Covered Traveler during a delay due to a \ncovered reason while on a Trip. This benefit applies if the \nCovered Traveler’s Common Carrier is delayed for more \nthan twelve (12) hours or requires an overnight stay. The \nmaximum benefit is $500 per Covered Traveler per Trip.\nThe Covered Traveler is covered when You charge all or a \nportion of the cost of the Common Carrier fare to Your Covered \nCard and/or use redeemable Rewards. Covered Travelers do not \nneed to be traveling with You for benefits to apply.\nWhen is the Covered Traveler Covered?\nBenefits begin on the Trip Departure Date and end on the Trip \nCompletion Date.\nIn the event the Trip Departure Date or Trip Completion Date \nare delayed or changed by the Common Carrier because \nof circumstances over which the Covered Traveler nor the \nCommon Carrier have control, the term of coverage shall be \nautomatically adjusted in accordance with such change.\nWhat’s Covered?\nThis benefit covers reasonable additional expenses incurred \nby the Covered Traveler during the delay, until travel by the \nCovered Traveler becomes possible. Reasonable expenses \ninclude meals, lodging, toiletries, and medication.\nTo take advantage of this benefit, the delay must occur \ndue to equipment failure, inclement weather, strike, \nor hijacking/skyjacking.\nThis benefit is secondary and payable on an excess basis over \nand above any amount due from any other valid or collectible \ninsurance or any other form of reimbursement payable by those \nresponsible for the loss.\nHow Do You File a Claim?\nFollow these steps to file a claim:\n1.  Visit chasecardbenefits.com or call 1-800-350-2919 \nwithin sixty (60) days of the Trip delay or as soon as \nreasonably possible.\n2.  We will ask Yo u a few questions and let You know what \ndocumentation is needed. The requested documents must be \nsubmitted within one hundred (100) days of the of the delay \nor as soon as reasonably possible.', 'excess amount once all other reimbursement has \nbeen exhausted up the limit of liability. \nWhat is covered?\nYour reasonable additional expenses, such as meals and \nlodging, may be reimbursed as long as: \n•  A portion of the fare was purchased with an eligible Account \nand/or rewards program associated with Your covered \nAccount\n•  Your Covered Trip was delayed for more than six (6) hours or \nrequired an overnight stay due to Covered Hazards \n•  Your Covered Trip is for a period of travel that does not \nexceed three hundred and sixty-five (365) days\nWhat is not covered?\n•  Any delay due to a Covered Hazard which was made public \nor made known to You prior to Your departure.\n•  Any pre-paid expenses related to Your Covered Trip, such as \ntour or activity fees associated with Your Covered Trip.\nHow to file a Trip Delay Reimbursement claim\nWithin thirty (30) days of the Covered Trip delay, call \nthe Benefit Administrator at 1-800-825-4062, or call \ncollect outside the U.S. at 1-804-965-8071 . The Benefit \nAdministrator will ask You for some preliminary claim \ninformation and send You a claim form.\nWithin ninety (90) days of the date of Your Covered Trip \ndelay, return Your completed and signed claim form and the \nrequested documentation below to the following address:\nCard Benefit Services\nP .O. Box 72034\nRichmond, VA 23255\nPlease submit the following documents:\n•  A copy of the detailed original and updated travel itinerary \nand/or the Common Carrier tickets\n•  A copy of Your monthly billing statement (showing the \nlast four [4] digits of the Account number) confirming the \nCommon Carrier ticket was charged to the covered Account. \nOnly applicable if the travel itinerary does not reflect the last \nfour (4) digits of the Account number.\n•  If more than one method of payment was used, please \nprovide documentation as to additional currency, voucher, \npoints or any other payment method utilized\n•  Tickets reflecting the total amount charged for the claimed \nCovered Trip\n•  A statement from the Common Carrier explaining the \nreason for the delay\n•  Copies of itemized receipts for Your claimed expenses.', '2\nYour Guide to Benefits describes the benefit that is in effect as \nof 10/01/24. Information in this guide takes the place of any \nprior benefit and benefit description you may have previously \nreceived. Your effective date of eligibility is determined \nby Chase. \nPlease keep the guide with your account information for future \nreference and call the benefit administrator if you have any \nquestions before taking advantage of the benefit.\nIf you have any questions please call 1-800-350-2919 or if you \nare outside the U.S., call collect at 001-214-503-2953.\nTABLE OF CONTENTS\nAuto Rental Coverage 3\nBaggage Delay Insurance 6\nExtended Warranty Protection 8\nLost Luggage Reimbursement 11\nPurchase Protection 13\nRoadside Assistance 15\nTravel Accident Insurance 17\nTravel and Emergency Assistance 22\nTrip Cancellation and Interruption Insurance 24\nTrip Delay Reimbursement 31\nAdditional Terms 33', 'The \nbenefit is limited to one claim per Covered Trip. To be eligible \nfor this coverage, You need to purchase either a portion or the \nentire cost of Your Common Carrier fare using Your Account. \nYou, Your spouse and Your dependent children under twenty-\ntwo (22) years of age are automatically covered when You \ncharge Your Covered Trip’s Common Carrier fare to Your \neligible Account and/or rewards program associated with Your \ncovered Account. \nThis benefit is supplemental coverage, which means \nthat reasonable expenses during the delay not \notherwise covered by Your Common Carrier, another \nparty or Your primary personal insurance policy, \nmay be reimbursed up to a maximum of five hundred \ndollars ($500.00) per ticket. You will be refunded the \n7\nBR414848_M133789_LetterSize.indd   7BR414848_M133789_LetterSize.indd   7 7/15/21   11:58 AM7/15/21   11:58 AM', '25\nover which neither the Common Carrier nor the Covered \nTraveler have control, the term of coverage shall be automatically \nadjusted in accordance with such delay or change.\nWhat Are Covered Travel Expenses?\nCoverage provides reimbursement for the following covered \ntravel expenses resulting from the cancellation or interruption \nof the Covered Traveler’s Trip due to a covered reason:\n•  Non-Refundable prepaid travel expenses charged by the \nCommon Carrier\n•  Change fees imposed by the Common Carrier to change the \ndate and/or time of prescheduled travel arrangements of a \nTrip that has not been cancelled; Change fees do not include a \nchange in Common Carrier fare or new Common Carrier fares\n•  Redeposit fees imposed by the Rewards \nprogram administrator\nFor Trip Interruption only:\nWhen the Trip is interrupted due to the need for necessary \nmedical treatment for a covered reason, this benefit also \nreimburses ground transportation expenses up to $250 to \ndirectly transport the Covered Traveler to the airport, terminal \nor station of departure, and/or between the arrival airport, \nterminal or station and their residence. This does not include \ntransportation in vehicles operated by a medical facility or \nspecifically designed to transport sick or injured individuals.\nWhat Losses Are Covered?\nThis benefit provides coverage for the covered reasons listed \nbelow. It doesn’t provide coverage if the Covered Traveler \nsimply chooses to change plans, is not feeling well but still able \nto travel, or the Covered Traveler can reach their destination \nbut decides not to travel. Any event/incident that occurred prior \nto the Trip being booked is not covered. Please see “What’s Not \nCovered?” for additional restrictions.', 'For \nfood expenses, receipts are required, however itemized \nreceipts are only required for bills of fifty dollars ($50.00) or \nmore per covered traveler.\n•  Any other documentation deemed necessary by the Benefit \nAdministrator to substantiate the claim\nFailure to contact the Benefit Administrator or return the \ncompleted claim form and documentation within the time \nperiods indicated above may result in the denial of Your \nclaim.\nFor faster filing, or to learn more about  \nTrip Delay Reimbursement, visit   \nwww.eclaimsline.com\nDefinitions\nAccount means your eligible credit card account.\nCommon Carrier means any land, water, or air conveyance \noperating for hire under a valid license for the transportation \nof passengers and for which a ticket must be purchased prior \nto commencing travel. Common Carrier does not include taxis, \nlimousine services, or commuter rail or commuter bus lines or \nrental vehicles.\nCovered Trip means a period of travel that does not exceed \nthree hundred and sixty-five (365) days away from the Eligible \nPerson’s residence to a destination other than the Eligible \nPerson’s city of residence for which the Eligible Person charges \nthe cost of transportation by Common Carrier to the Account \nand/or rewards programs associated with the covered Account.\nCovered Hazards means equipment failure, inclement \nweather, strike and hijacking/skyjacking.\nEligible Person means a cardholder who pays for their \nCovered Trip by using their eligible Account and/or rewards \nprograms associated with their covered Account.\nFamily Member means Your spouse or legally dependent \nchildren under age eighteen (18) [twenty-five (25) if enrolled as \na full-time student at an accredited university].\nYou or Your means an Eligible Person or Your Family Members \nwho charged their Covered Trip to Your eligible Account and/\nor rewards programs associated with Your covered Account. \nPlease see “General Provisions” section at the end of this \ndocument.\nFORM#TRIP 12-300-2017 (04/17)                                                                TD-O\nFor more information about the benefit described in this \nguide, call the Benefit Administrator at 1-800-825-4062, \nor call collect outside the U.S. at 804-965-8071.', '6\nWe, Us and Our - Virginia Surety Company, Inc., an Assurant \ncompany, the insurance company that provides these benefits \nfor the Covered Card\nYou and Your - an individual to whom a Covered Card Account \nhas been issued by JPMorgan Chase Bank, N.A. and/or \nits affiliates\nARCDW_CON_$60K_PRIMARY_20240311\nBaggage Delay Insurance\nThis benefit provides reimbursement for the emergency \npurchase of essential personal items when the Covered \nTraveler’s Checked Baggage is delayed while on a Trip. This \nbenefit applies if the Covered Traveler’s Checked Baggage is \ndelayed or misdirected by the Common Carrier for more than \nsix (6) hours from the time the Covered Traveler arrives at their \ndestination. The maximum benefit is $100 per day after the \ninitial six (6) hour delay, and for each additional twenty-four (24) \nhour period, up to a maximum of three (3) days.\nThe Covered Traveler is covered when You charge all or a \nportion of the cost of the Common Carrier fare to Your Covered \nCard and/or use redeemable Rewards. Covered Travelers do not \nneed to be traveling with You for benefits to apply.\nWhen is the Covered Traveler Covered?\nBenefits begin on the Trip Departure Date and end on the Trip \nCompletion Date.\nThere is no coverage when the Covered Traveler returns to their \npoint of origin.\nWhat’s Covered?\nThis benefit covers essential personal items that the Covered \nTraveler(s) may need when their baggage is delayed, such \nas toiletries, a change of clothes, and chargers for electronic \ndevices (limit one per device).\nPlease Pay Special Attention to These Conditions:\n•  Baggage delay must be reported to the Common Carrier to be \neligible for this benefit.\nThis benefit is secondary and payable on an excess basis over \nand above any amount due from any other valid or collectible \ninsurance or any other form of reimbursement payable by those \nresponsible for the loss.\nWhat’s Not Covered?', 'As a handy reference guide, please read this and keep it \nin a safe place with your other insurance documents. This \ninformation is a brief description of the important features of \nthis insurance plan. It is not an insurance contract. Insurance \nbenefits are underwritten by Federal Insurance Company. \nCoverage may not be available in all states or certain terms may \nbe different where required by state law. Chubb NA is the U.S.-\nbased operating division of the Chubb Group of Companies, \nheaded by Chubb Ltd. (NYSE:CB) Insurance products and \nservices are provided by Chubb Insurance underwriting \ncompanies and not by the parent company itself.\nLost Luggage Reimbursement\nHave You ever been waiting for Your Checked Luggage to come \naround the belt only to find that it has been lost by Your airline? \nFortunately, Lost Luggage Reimbursement is here to help. \nWith Lost Luggage Reimbursement, You can be reimbursed \nfor the difference between the “value of the amount claimed” \nand the Common Carrier’s payment up to three thousand \ndollars ($3,000.00) per Covered Trip (for New York \nresidents, coverage is limited to two thousand dollars \n($2,000.00) per bag), provided the Checked Luggage and/\nor Carry-on Baggage and/or its contents was lost due to \ntheft or misdirection by the Common Carrier. “Value of the \namount claimed” is the lesser of the following three amounts: \nthe original purchase price of the item(s), the actual cash \nvalue of the item(s) at the time of theft or misdirection (with \nappropriate deduction for depreciation), and the cost to \nreplace the item(s). \nYou and Your Immediate Family Members are all eligible for \nthis benefit when You take a Covered Trip and pay for the cost \nof Your Common Carrier tickets with Your eligible card issued \nin the United States and/or rewards program associated with \nYour covered Account. To be eligible for coverage, You must \npurchase a portion or the entire cost of the Covered Trip with \nYour covered Account and/or rewards program associated \nwith Your covered Account. Only Your Checked Luggage and/\nor Carry-On Baggage and/or its contents is covered.', '29\n•  Copies of the cancellation or refund policies of providers \ninvolved in the Trip\n•  Proof of covered travel expenses incurred due to a \nTrip Interruption\n• Any unused vouchers, tickets, or coupons\n•  Any other documentation deemed necessary by Us to \nsubstantiate the claim\nDefinitions\nAccidental Bodily Injury - bodily injury, which is sudden, \nunforeseen, and unexpected; happens by chance; is \nindependent of illness and disease and is the direct cause of \na loss\nAccount - the credit card Account issued by \nJPMorgan Chase Bank, N.A. and/or its affiliates\nCommon Carrier - a mode of transportation that’s licensed \nto transport any public passenger who pays a fare or buys a \nticket, and is available on a regular schedule. Examples include \nplanes, trains, ferries and cruise ships, but does not include \ntaxis, car service, rental car, rideshare service, commuter rail or \ncommuter bus lines\nCovered Card - the credit card or Account that is eligible for \nbenefits as designated by JPMorgan Chase Bank, N.A.']","The Trip Delay Reimbursement for the Capital One Venture X covers reasonable additional expenses incurred when a Covered Trip is delayed for more than six (6) hours or requires an overnight stay. The maximum benefit is $500 per purchased ticket.

In contrast, the United Explorer Card provides reimbursement for reasonable expenses incurred during a delay due to a covered reason if the Common Carrier is delayed for more than twelve (12) hours or requires an overnight stay. The maximum benefit is also $500 per Covered Traveler per Trip.

Therefore, the key difference is the delay threshold: the Capital One Venture X has a threshold of more than six (6) hours, while the United Explorer Card has a threshold of more than twelve (12) hours.","The Capital One Venture X Trip Delay Reimbursement kicks in after a 6-hour delay, while the United Explorer Card requires a delay of more than 12 hours or an overnight stay. Both offer a maximum benefit of $500.",0.0,0.9407136633985861,1.0,0.0,Multiple,cross_card,Phase 3 - Score Gap 0.45,2026-04-24T22:32:22.288481
"Which card has a higher Trip Cancellation limit, the United Explorer Card or the Bilt Palladium?","['The terrorist act must be intended \nto intimidate or coerce a civilian population, to influence the \npolicy of a government by intimidation or coercion, or to affect \nthe conduct of a government by mass destruction\nTour Operator - an entity which organizes travel components \ninto packaged arrangements for sale directly to the \ntravelling public\nTravel Warning - a warning, issued by the United States \nDepartment of State or other United States governmental \nauthority with jurisdiction to issue travel advice, that travel \nis not advisable due to an imminent, credible, and specific \nterrorist threat; Travel Warning does not include general travel \nadvisories in the absence of an imminent, credible, and specific \nterrorist threat\nTraveling Companion - any individual traveling with You or \nYour Family Member on a Trip\nTrip - pre-paid travel when a portion or the entire cost of a \nround trip or one way Common Carrier fare was paid using the \nCovered Card and/or redeemable Rewards, and which does not \nexceed sixty (60) consecutive days in duration\nTrip Cancellation - the cancellation of travel arrangements due \nto a loss when the Covered Traveler is prevented from traveling \non a Trip on or before the Trip Departure Date\nTrip Completion Date - the date on which the Covered Traveler \nis scheduled to return to the point of origin or to a different \nfinal destination\nTrip Departure Date - the date on which the Covered Traveler \nis scheduled to leave on the Trip\nTrip Interruption - the interruption of the Covered Traveler’s \nTrip either on the way to their point of departure or after \ndeparture of the Trip\nWar - hostilities following a formal declaration of war by a \ngovernmental authority; in the absence of a formal declaration \nof war by a governmental authority, armed, open and \ncontinuous hostilities between two (2) countries or armed, open \nand continuous hostilities between two (2) factions, each in \ncontrol of territory or claiming jurisdiction over the geographic \narea of hostility', '2\nFamily Member means a spouse, Domestic Partner, or unmarried \ndependent children up to nineteen (19) years of age (or under age \ntwenty-six (26) if a full-time student at an accredited college or \nuniversity).\nGroup Policy means the Trip Cancellation/Interruption Insurance \nPolicy entered between New Hampshire Insurance Company, an \nAIG Company, and Mastercard Insurance Master Trust, which is the \nsubject of this Guide to Benefits.\nPhysician means a licensed medical, surgical, or dental practitioner \nacting within the scope of his or her license. The treating Physician \nmay not be an Eligible Traveler, an Eligible Traveler’s Family Member, \na Traveling Companion or related to an Eligible Traveler by blood.\nPre-Existing Condition means any condition resulting from any injury \nor Sickness affecting an Eligible Traveler, a Traveling Companion, or \na Family Member traveling with an Eligible Traveler within the sixty \n(60) day period prior to the purchase date of a Covered Trip. The\ncondition must have (a) first manifested itself or exhibited symptoms\nwhich would have caused one to seek diagnosis, care, or treatment;\n(b) required taking prescribed drugs or medicine; or (c) required\nmedical treatment or treatment was recommended by a Physician.\nTaking maintenance medications for a condition that is considered\nstable shall not be included as a Pre-Existing Condition.\nSickness means ill health, disorder, or unsound condition that is \ndiagnosed or treated by a Physician.\nTraveling Companion means an individual(s) who has made \nadvanced arrangements with you or your Family Members to travel \ntogether for all or part of a Covered Trip. \nTrip Cancellation means the cancellation of travel arrangements \nwhen the Eligible Traveler is prevented from traveling on a Common \nCarrier for a Covered Trip on or before the departure of the Covered \nTrip.\nTrip Interruption means the interruption of the Covered Trip either \non the way to the point of departure or after departure of the \nCovered Trip.\nEvidence of Coverage\nRefer to Key Terms for the definitions of you, your, we, us and our, \nand words that appear capitalized. This EOC is subject to the Legal \nDisclosures set forth below.', 'Visit chasecardbenefits.com or call 1-800-350-2919 within \ntwenty (20) days of the Trip Cancellation or Trip Interruption \nor as soon as reasonably possible.\n2.  We will ask Yo u a few questions and let You know what \ndocumentation is needed. The requested documents \nmust be submitted within ninety (90) days or as soon as \nreasonably possible.\nDocuments You May Need to Provide\nWhen You file a claim, We will provide the details, but generally \nYou should be prepared to send:\n• Trave l itinerary\n•  Docume ntation confirming the reason for Trip Cancellation \nor Trip Interruption (e.g., medical documents, death \ncertificate, etc.)\n•  Co vered Card Account statement (showing the last four (4) \ndigits of the Account number) demonstrating that the \npayment for the Trip was made on Your Covered Card and/or \nwith redeemable Rewards', 'This benefit may be subject to change without prior notice. \nPlease visit www.mastercard.com/us/worldlegend or call \n1-800-Mastercard for the latest benefit information.\nMastercard Travel & Lifestyle Services\nAs a World Legend Mastercard® cardholder, you have access \nto Mastercard® Travel & Lifestyle Services, a suite of benefits, \namenities and upgrades, preferential treatment and premium \ntravel offers from best-in-class travel companies across \nhotels, air travel, tours, cruises, car rentals and more*. This is \na digital, self-service travel booking platform exclusively for \nMastercard cardholders. It provides access to special travel \nconditions, premium benefits, and a curated selection of \nhotels and resorts, including the Mastercard Luxury Hotels & \nResorts Collection. Get the most from all your travels whether \nyou are planning a last-minute getaway or your dream \nfamily vacation. Plus, take advantage of the Mastercard \nLowest Hotel Rate Guarantee** and Mastercard Hotel Stay \nGuarantee*** which deliver value and peace of mind.\n * Travel & Lifestyle Services are provided by a third party. \nNo travel bookings are being made by Mastercard, nor is \nMastercard acting as a travel agency or providing any travel \nconsultation or advice, in connection with Mastercard Travel \n& Lifestyle Services.\n ** Mastercard Lowest Hotel Rate Guarantee: If you book \na qualifying ‘prepaid’ rate or ‘postpaid’ rate hotel stay \nthrough the Mastercard Travel & Lifestyle Services program \neither online or through an authorized program agent using \nyour Mastercard and then find the same hotel room type, \nin the same hotel, for the same dates, the same number \nof children and adults, at a lower price online, before taxes \nand fees, we’ll refund you the difference. To receive a \nrefund you must submit a claim as described in the Terms & \nConditions prior to your stay and at least seventy-two (72) \nhours before the date of your reservation check-in.', '29\n•  Copies of the cancellation or refund policies of providers \ninvolved in the Trip\n•  Proof of covered travel expenses incurred due to a \nTrip Interruption\n• Any unused vouchers, tickets, or coupons\n•  Any other documentation deemed necessary by Us to \nsubstantiate the claim\nDefinitions\nAccidental Bodily Injury - bodily injury, which is sudden, \nunforeseen, and unexpected; happens by chance; is \nindependent of illness and disease and is the direct cause of \na loss\nAccount - the credit card Account issued by \nJPMorgan Chase Bank, N.A. and/or its affiliates\nCommon Carrier - a mode of transportation that’s licensed \nto transport any public passenger who pays a fare or buys a \nticket, and is available on a regular schedule. Examples include \nplanes, trains, ferries and cruise ships, but does not include \ntaxis, car service, rental car, rideshare service, commuter rail or \ncommuter bus lines\nCovered Card - the credit card or Account that is eligible for \nbenefits as designated by JPMorgan Chase Bank, N.A.', 'This benefit may be subject to change without prior notice. \nPlease visit www.mastercard.com/us/worldlegend or call \n1-800-Mastercard for the latest benefit information.\nAccount and Billing Information\nImportant: Contact your card-issuing financial institution \ndirectly for questions concerning your account, such as \naccount balance, credit line, billing inquiries (including \ntransaction exchange rates), merchant disputes, or \ninformation about additional services not described in this \nGuide. Your financial institution’s phone number should be \navailable on your monthly billing statement or on the back of \nyour card.\nAll benefits described in this Guide are subject to terms, \nconditions, and availability, and may be changed or \nterminated without notice. Mastercard is not responsible \nfor the performance or non-performance of any third-party \nservice provider, nor for any loss or damage arising from \nreliance on this Guide. This document does not create any \ncontractual rights beyond those in your cardholder agreement. \nFor current benefit details, visit the official program website \nor contact your issuer.', '24\nferries and cruise ships, but does not include taxis, car service, \nrental car, rideshare service, commuter rail or commuter \nbus lines\nCovered Card - the credit card or Account that is eligible for \nbenefits as designated by JPMorgan Chase Bank, N.A. and/or \nits affiliates\nCovered Traveler - You and Your Immediate Family Member\nDomestic Partner - a committed relationship between two \nunmarried adults, in which the partners, (1) are each other’s \nsole Domestic Partner, (2) maintain a common residence, \n(3) share at least one (1) of the following financial arrangements: \na joint mortgage or lease, a joint bank account, joint title to or \nownership of a motor vehicle or status as a joint lessee on a \nmotor vehicle lease or a joint credit card account with a financial \ninstitution, (4) are not married or joined in a civil union to \nanyone else or are not the Domestic Partner of anyone else, and \n(5) are not blood related\nImmediate Family Member - spouse or Domestic Partner and \nlegally dependent children under the age of twenty-six (26)\nYou and Your - an individual to whom a Covered Card Account \nhas been issued by JPMorgan Chase Bank, N.A. and/or \nits affiliates\nTravel and Emergency Assistance services are sourced \nby Virginia Surety Company, Inc, an Assurant company, \nand are performed by a third party provider. This is not an \ninsurance benefit.\nTEAS_20240311\nTrip Cancellation and \nInterruption Insurance\nThis benefit provides reimbursement for covered travel \nexpenses if a Trip is cancelled or interrupted due to a covered \nreason. Coverage is limited to the lesser of the following:\n• $1,500 per Covered Traveler\n• $6,000 per Trip for all Covered Travelers\n•  the actual amount charged to the Covered Card and/or \nredeemable Rewards used for a covered travel expense\nNote: Eligible purchases made with redeemable Rewards will be \nreimbursed in dollars.\nThe Covered Traveler is covered when You charge all or a \nportion of the cost of the Trip to Your Covered Card and/or use \nredeemable Rewards. Covered Travelers do not need to be \ntraveling with You for benefits to apply.', 'Common Carrier does not include taxis, limousine services, commuter \nrails or commuter bus lines, personal automobiles, or rental cars.\nCovered Card means the Mastercard card linked to your Eligible \nAccount.\nCovered Trip means a period of round-trip travel to one or more \ndestinations other than an Eligible Traveler’s place of residence at \nthe time of departure where: (1) The Eligible Traveler departs by \nCommon Carrier to begin the period of round-trip travel; (2) the \nperiod of round-trip travel ends when the Eligible Traveler returns \nby Common Carrier to the place of departure; (3) the period of \nround-trip travel does not exceed three hundred sixty-five (365) days \naway from the Eligible Traveler’s place of residence at the time of \ndeparture; and (4) the Eligible Traveler charges the full amount of the \ncost of transportation by Common Carrier(s) to your Covered Card. \nThe period of round-trip travel may consist of round-trip, one-way, \nor combinations of round-trip and one-way tickets with Common \nCarrier(s).\nDomestic Partner means a person who can provide documentation \nof registration of a Domestic Partner relationship with another \nperson pursuant to a state, county, or municipal provision or who \nmeets all of the following qualifications: (1) Has resided with his or \nher partner continuously for at least 12 months in a sole-partner \nrelationship that is intended to be permanent; (2) is not married to \nany other person; (3) is at least eighteen (18) years old; (4) is not \nrelated to his or her partner by blood closer than would bar marriage \nper state law; and (5) is financially interdependent with his or her \npartner as can be documented by copies of joint home ownership \nor lease, common bank accounts, credit cards, investments, or \ninsurance.\nEligible Account means the account associated with a U.S. issued \ncredit card, debit card, checking account, line of credit, loan, \ncertificate of deposit or other account that is eligible for coverage \nunder the Group Policy.\nEligible Traveler means you and your Family Members and Traveling \nCompanions who purchase a Covered Trip to your Covered Card.', 'For questions,  \ncall 1-800-350-2919 \nEffective 10/01/24\nBGC11386\nGuide to Benefits\nImportant information about your  \ntravel and purchase protection benefits\nUnited SM Explorer Card and\nUnited Quest SM Card\nVisa Signature® and Visa Platinum', 'Inclement Weather means any severe weather condition which delays \nthe scheduled arrival or departure of a common carrier.\nReturn Destination means the place to which You expect to return from \nYour trip as indicated on Your common carrier ticket.\nTraveling Companion means any individual(s) with whom you have \narranged to travel on the same trip with the same itinerary and for which \nthe cost of trip was charged with your covered card.\nTrip means a scheduled period of travel with a destination and return \ndestination away from your primary residence using a common carrier.\nUnited States Dollars (USD) means the currency of the United States \nof America.\nEvidence of Coverage\nRefer to Key Terms for the defi  nitions of you, your, we, us, our, and words \nthat appear in bold and Legal Disclosures.\nA. To get coverage:\nYou must purchase the trip entirely with your covered card for you, or \nyour family member, and your traveling companions. If redeemable \ncertifi  cates, vouchers, coupons, or discounts awarded from frequent fl  ier \nprograms are used to purchase the trip, any remaining charge for the trip \nmust be purchased entirely with your covered card.\nB. The kind of coverage you receive:\nIf you are delayed more than six (6) hours while traveling to your \ndestination or return destination, we will reimburse you for travel \nexpenses as a result of the delay. There is no coverage, if the common \ncarrier cancels within six (6) hours of your scheduled departure time on \nthe common carrier for which you have purchased a ticket for your trip.\nDelay is:\na) Inclement weather;\nb)  Equipment failure of a common carrier (documented by the common \ncarrier); or\nc) Lost or stolen passport or travel documents.\nd)  Delays due to: war, invasion, acts of foreign enemies, hostilities \nbetween nations (whether declared or not), and civil war are not \ncovered.\nGuide to Benefi  ts for \nMastercard® Cardholders\nTrip Delay']","The United Explorer Card has a Trip Cancellation limit of $6,000 per Trip for all Covered Travelers, while the Bilt Palladium does not mention a specific Trip Cancellation limit. Therefore, the United Explorer Card has a higher Trip Cancellation limit.","The Bilt Palladium has a higher per-trip limit at $2,000 per trip, while the United Explorer Card provides $1,500 per covered traveler. However, the United Explorer allows up to $6,000 per trip for all covered travelers combined.",0.3333333333333333,0.9244139307464952,0.0,0.0,Multiple,cross_card,Phase 3 - Score Gap 0.45,2026-04-24T22:32:22.288481
"Which cards offer Priority Pass lounge access, the Amex Platinum or the Bilt Palladium?","['Please drink responsibly. American Express reserves the right to limit the number of\nevents Card Members (and their guests) may attend and to cancel tickets/packages without refund\nfor any violations of the terms and conditions of this event. American Express also reserves the right\nto remove any person from any event for inappropriate behavior including, but not limited to, conduct\nthat is disruptive, abusive, or violent. American Express is not responsible for the actions or inactions\nof any third party. For more information, please visit americanexpress.com/entertainment.\nPremium Global Assist® Hotline\nWhile Premium Global Assist  Hotline coordination and assistance services are offered at no\nadditional charge from American Express, Card Members may be responsible for the costs charged\nby third-party service providers. Premium Global Assist Hotline may provide emergency medical\ntransportation assistance at no cost if approved and coordinated by Premium Global Assist Hotline.\nFor full Terms and Conditions call 1-800-345-AMEX or see americanexpress.com/GAterms.\nPriority Pass  Select\nThis benefit is available to U.S. Platinum Card  Members. Platinum Card  Members and Additional\nPlatinum Card  Members must enroll in the Priority Pass  Select program through the benefits\nsection of their americanexpress.com account or by calling the number on the back of their Card to\nreceive the benefit. Companion Platinum Cards on Consumer Platinum Accounts and Additional Gold\nand Additional Business Expense Cards on Business Platinum Accounts are not eligible for the\nPriority Pass Select benefit. Priority Pass is an independent airport lounge access program. You\nacknowledge and agree that American Express will verify your Card Account number and provide\nupdated Card Account information to Priority Pass. Priority Pass will use this information to fulfill on\nthe Priority Pass Select program and may use this information for marketing related to the program.\nOnce enrolled, Platinum Card  Card Members with a valid Card Account may access participating\nPriority Pass Select lounges by presenting their Priority Pass Select card and airline boarding pass. If\nthe Card Account is canceled, you will not be eligible for Priority Pass Select and your enrollment will\nbe canceled. When visiting a Priority Pass Select lounge that admits guests, Platinum Card\nMembers receive complimentary access for up to two accompanying guests.', 'Description\nAirport lounge access provided by Priority Pass is available to all \neligible Bilt Palladium Card cardholders. Cardholders can use \ntheir Priority Pass membership or digital membership card to \naccess an airport lounge in a seamless way, as follows: \n•Eligible cardholders will enjoy complimentary lounge \nmembership for them and up to two guests.For additional guests \nabove two, the Cardholder will be charged $35 per guest per \nlounge visit.\n• Membership to 1200+ Priority Pass lounges in 120+ countries and \nin over 400 airports regardless of airline, frequent ﬂ yer membership \nor class of ticket.\nPriority Pass provides aﬄ  uent cardholders the opportunity to relax, \nrefresh and enhance their airport experience as they wait for their ﬂ \night.\nDetail\nWho Is Eligible:\nU.S. issued Bilt Palladium Card cardholders whose issuing bank \nhas completed the enrollment process.\nHow Priority Pass Works:\n1. Before traveling, eligible cardholders need to activate their \nmembership using their Bilt Palladium Card at the \nwww.PriorityPass.com website. Once activated, cardholders \ncan log on their Priority Pass account at www.PriorityPass.com \nand view a list of participating lounges and experiences.\n2.  Eligible cardholders will enjoy complimentary refreshments, \nnewspapers and\n television. In addition, there is access to business \nfacilities including phone, fax, conference and Internet facilities \n(where available).\n3. To gain access to the lounges, an eligible cardholder only \nneeds to quote “Priority Pass” at the participating lounge \nand, once activated, present their Bilt Palladium Card or \npresent their Digital Membership card (QR Code), found in \nthe Priority Pass app, and their boarding pass.\n4.  A list of participating lounges can be found and viewed using \nthe Priority Pass website or app.\n • FAQs can be viewed online at\nhttps:/ /www.prioritypass.com/en/member-support/faq\n • Contact Priority Pass at\nhttps:/ /www.prioritypass.com/en/member-support/contact-us\nor +1 469 334 4174 for customer support.', 'the number of guests or do not admit guests. In some lounges, Priority Pass Select members must\nbe 21 years of age to enter without a parent or guardian. Priority Pass Select members must adhere\nto all house rules of participating lounges and access to participating lounges is subject to all rules,\nterms and conditions of the applicable lounge. Amenities may vary among airport lounge locations.\nConference rooms, where available, may be reserved for a nominal fee. Priority Pass Select lounge\npartners and locations are subject to change. All Priority Pass Select members must adhere to the\nPriority Pass Conditions of Use, which will be sent to you with your membership package, and can\nbe viewed at www.prioritypass.com. Upon receipt of your enrollment information, Priority Pass will\nsend your Priority Pass Select card and membership package which you should receive within 10–14\nbusiness days. If you have not received the Priority Pass card after 14 days, please contact American\nExpress using the number on the back of your American Express  Card. To receive immediate\naccess to lounges after your enrollment in Priority Pass Select has been processed, you can activate\nyour membership online by using your Priority Pass Select membership details to receive a Digital\nMembership Card. For a step-by-step guide on the activation process, visit prioritypass.com/activation.\nEffective May 19, 2026, guest visit fees may be automatically charged to your Card or paid during\nthe check-in process at the Priority Pass Select lounge, as instructed by check-in staff at the Priority\nPass Select lounge.\nEffective June 22, 2026, you acknowledge and agree that American Express will verify your email\naddress and provide that information to Priority Pass. Priority Pass will use this information to fulfill\nthe Priority Pass Select program and may use this information for marketing related to the program.\nUpon receipt of your enrollment information, Priority Pass will send you email instructions to receive\nyour Priority Pass Digital Membership Card. Once enrolled in Priority Pass Select, Platinum Card\nCard Members whose Card account is not cancelled may access participating Priority Pass Select\nlounges by presenting their valid physical Priority Pass Card (if previously received), their Priority\nPass Digital Membership Card, or their physical American Express Card and airline boarding\npass.\nReturn Protection\nReturn Protection is subject to additional important terms, conditions and exclusions.', '• Terms of Use can be viewed online at\nhttps:/ /www.prioritypass.com/en/terms-of-use\n • Conditions of Use can be viewed online at\nhttps:/ /www.prioritypass.com/en/conditions-of-use\nGuide to Beneﬁ  ts for \nMastercard® Cardholders\nPriority Pass\nAirport Lounge Access', 'When visiting a Priority Pass Select lounge that admits guests, Platinum Card\nMembers receive complimentary access for up to two accompanying guests. After two guests, the\nCard Account on file with Priority Pass Select will be automatically charged the guest visit fee of the\nPriority Pass Standard program for each additional guest after you have signed up for the additional\nguest visit and it has been reported to Priority Pass by the participating lounge. Some lounges limit\n®\n®\n™\n® ®\n® ™\n®\n®\n4/17/26, 7:27 PM Platinum Card® - Terms, Conditions & Disclosures\nhttps://www.americanexpress.com/us/credit-cards/card-application/apply/supplementary/terms/platinum-card/36182-9-0 32/40', '©2025 Mastercard. 8854 CRED_WRLD_LGD-NC_1225\nFor more information,  \ncall 1-800-Mastercard: 1-800-627-8372,  \nor en Español: 1-800-633-4466. \nVisit our website at www.mastercard.com.', 'Companion\nPlatinum Cards on Consumer Platinum Accounts and Additional Gold and Additional Business\nExpense Cards on Business Platinum Accounts are not eligible for access to participating locations.\nCard Members must present their valid U.S. Platinum Card , a government-issued I.D., and a\nboarding pass showing a confirmed reservation for same-day travel on any carrier. Guest access and\nassociated fees are subject to the terms and conditions of the participating lounge provider.\nParticipation, locations, rates, and policies of lounges are subject to change without notice, and Card\nMembers and their guests will not be compensated for such changes. Amenities, services, and hours\nmay vary by participating lounge and are subject to change without notice. American Express and the\nparticipating lounge will not be liable for any articles lost or stolen, or damages suffered by the Card\nMember or guests inside the participating lounge. For participating lounges with a self-service bar, the\nCard Member may be required to be of legal drinking age in the participating lounge jurisdiction to\nenter without a parent or legal guardian. All Card Members and their guests must be of legal drinking\nage to consume alcoholic beverages. Please drink responsibly. Each participating lounge may have\ntheir own policy allowing for children under a certain age to enter for free with the Card Member who\nis a parent or legal guardian. Card Member must adhere to all house rules of participating lounges.\nParticipating lounges reserve the right to remove any person from the premises for inappropriate\nbehavior or failure to adhere to rules, including, but not limited to, conduct that is disruptive, abusive,\nor violent. If American Express, in its sole discretion, determines that the Card Member or their\nguests have engaged in abuse, misuse, or gaming in connection with access to participating lounges\nin any way, or that the Card Member or their guests intend to do so, we may remove access to the\nAdditional Lounges from the Account. American Express and the participating lounge reserve the right\nto revise the rules at any time without notice. For the most current list of participating lounges and\naccess requirements, please use the Lounge Finder feature in the American Express App or visit\nwww.americanexpress.com/findalounge.', 'Provision of services is subject to \navailability and applicable legal restrictions.\n©2019 Mastercard.', 'For the most current list of participating lounges and\naccess requirements, please use the Lounge Finder feature in the American Express App or visit\nwww.americanexpress.com/findalounge.\nAmerican Express Venue Collection\n®\n®\n™\n4/17/26, 7:27 PM Platinum Card® - Terms, Conditions & Disclosures\nhttps://www.americanexpress.com/us/credit-cards/card-application/apply/supplementary/terms/platinum-card/36182-9-0 13/40', 'Bilt Palladium World Legend \nMastercard \nImportant information. Please read and save.\nThis Guide to Benefits contains detailed information about \nthe benefits you can access as a preferred cardholder. This \nGuide supersedes any guide or program description you may \nhave received earlier.\nFor more information on any of these services, call the \nMastercard Assistance Center at 1-800-Mastercard:  \n1-800-627-8372, or en Español: 1-800-633-4466.\n“Card” refers to World Legend Mastercard® card and \n“Cardholder”refers to a World Legend Mastercard® \ncardholder.\nMastercard® Guide \nto Benefits\nfor World Legend  \nMastercard  Credit \nCardholders']",Both the Amex Platinum and the Bilt Palladium offer Priority Pass lounge access.,Both the Amex Platinum and the Bilt Palladium offer Priority Pass lounge access. The Bilt Palladium includes the cardholder and up to 2 guests free. The Amex Platinum includes Priority Pass Select with unlimited access.,1.0,0.8495060768918731,0.6666666666666666,0.0,Multiple,cross_card,Phase 3 - Score Gap 0.45,2026-04-24T22:32:22.288481
