user_input,retrieved_contexts,response,reference,faithfulness,answer_relevancy,context_recall,context_precision,card,category,phase,timestamp
What is the maximum auto rental collision damage coverage on the Capital One Venture X?,"['Because \nregulations vary outside the United States, check with Y our \nauto rental company and the Benefit Administrator before \nY ou travel, to be sure that Auto Rental Collision Damage \nWaiver will apply.\nVehicles not covered\nCertain vehicles are not covered by this benefit, they consist of \nexpensive, exotic, and antique cars; cargo vans; certain vans; \nvehicles with an open cargo bed; trucks; motorcycles; mopeds; \nmotorbikes; limousines; and recreational vehicles.\nAn expensive automobile is defined as any vehicle with an \noriginal manufacturer’s suggested retail price of more than \nseventy-five thousand dollars ($75,000.00) when new.\nAn antique car is defined as one that is over twenty (20) years \nold, or one that has not been manufactured for ten (10) years \nor more.\nVans are not covered. But those designed as small-group \ntransportation vehicles (seating up to nine (9) people, \nincluding the driver) are covered.\nIf Y ou have questions about a specific vehicle’s coverage \nor organization where the vehicle is being reserved, call \nthe Benefit Administrator at 1-800-825-4062, or call collect \noutside the United States at 1-804-965-8071 collect.', '(Longer rental periods, however, \nare not covered).\nYou are eligible for this benefit if Your name is embossed on \nan eligible card issued in the United States and You use it \nto initiate and complete Your entire car rental transaction. \nOnly You as the primary car renter and any additional drivers \npermitted by the Rental Car Agreement are covered.\nHow Auto Rental Collision Damage Waiver works\nYour Auto Rental Collision Damage Waiver benefit acts as \nprimary coverage and covers theft, damage, valid loss-of-\nuse charges imposed and substantiated by the auto rental \ncompany, administrative fees and reasonable and customary \ntowing charges, due to a covered theft or damage to the \nnearest qualified repair facility. \nHow to use Auto Rental Collision Damage Waiver\n1.  Use Your card to initiate and complete Your entire car rental \ntransaction. \n2.  Review the auto rental agreement and decline the rental \ncompany’s collision damage waiver (CDW/LDW) option, or \na similar provision, as accepting this coverage will cancel \nout Y our benefit. If the rental company insists that You \npurchase their insurance or collision damage waiver, call the \nBenefit Administrator for assistance at 1-800-825-4062. \nOutside the United States, call collect at 1-804-965-8071.\nBefore Y ou leave the lot, be sure to check the car for any \nprior damage.\nThis benefit is in effect during the time the rental car is in Your \n(or an authorized driver’s) control, and it terminates when the \nrental company reassumes control of their vehicle.\nThis benefit is available in the United States and most foreign \ncountries (with the exception of Israel, Jamaica, the \nRepublic of Ireland or Northern Ireland). However, this \nbenefit is not available where precluded by law, or where it’s \nin violation of the territory terms of the auto rental agreement, \nor when prohibited by individual merchants. Because \nregulations vary outside the United States, check with Y our \nauto rental company and the Benefit Administrator before \nY ou travel, to be sure that Auto Rental Collision Damage \nWaiver will apply.', 'The \nbenefit is limited to one claim per Covered Trip. To be eligible \nfor this coverage, You need to purchase either a portion or the \nentire cost of Your Common Carrier fare using Your Account. \nYou, Your spouse and Your dependent children under twenty-\ntwo (22) years of age are automatically covered when You \ncharge Your Covered Trip’s Common Carrier fare to Your \neligible Account and/or rewards program associated with Your \ncovered Account. \nThis benefit is supplemental coverage, which means \nthat reasonable expenses during the delay not \notherwise covered by Your Common Carrier, another \nparty or Your primary personal insurance policy, \nmay be reimbursed up to a maximum of five hundred \ndollars ($500.00) per ticket. You will be refunded the \n7\nBR414848_M133789_LetterSize.indd   7BR414848_M133789_LetterSize.indd   7 7/15/21   11:58 AM7/15/21   11:58 AM', '2\nVisa Infinite Concierge\nCount on your 24/7 Visa Infinite® Concierge* to book your \ntravel, dinner reservations, event tickets and more.\nVisa Infinite Concierge can help you open the door to unique \nexperiences wherever you are around the world. Secure a \ntable at a premium restaurant, enjoy VIP seating at a special \nevent, or make life a little easier with assistance for your \neveryday needs. Visa Concierge is there to help with it all.\nYour Capital One Visa Infinite card comes with complimentary, \n24/7 access to the Visa Infinite® Concierge* service. Simply call \n888-315-6982 anytime for assistance.\n* Capital One Visa Infinite accountholders are responsible for the \npayment of any and all charges associated with any goods, \nservices, reservations or bookings purchased or arranged by \nthe Visa Infinite Concierge on cardholders’ behalf. Any such \npurchases or arrangements are solely between the cardholder \nand the respective merchant, and Visa is not a party to the \ntransaction. All goods and services subject to availability.\nAuto Rental Collision Damage Waiver\nNo cardholder wants to incur the expense of repairing or \nreplacing a rented car. But accidents do happen, and vehicles \ndo get stolen. No matter what happens to Your rental car, You \ncan be covered with Auto Rental Collision Damage Waiver.\nAuto Rental Collision Damage Waiver reimburses You for \ndamages caused by theft or collision – up to the Actual \nCash Value of rental vehicles with an original manufacturer’s \nsuggested retail price of up to seventy-five thousand dollars \n($75,000.00) when new. Auto Rental Collision Damage Waiver \ncovers no other type of loss. For example, in the event of a \ncollision involving Your rented vehicle, damage to any other \ndriver’s car or the injury of anyone or anything is not covered. \nRental periods of fifteen (15) consecutive days within Your \ncountry of residence, and thirty-one (31) consecutive days \noutside it, are both covered. (Longer rental periods, however, \nare not covered).\nYou are eligible for this benefit if Your name is embossed on \nan eligible card issued in the United States and You use it \nto initiate and complete Your entire car rental transaction.', 'at 804-965-8071.\n$1,000,000.00 Worldwide Automatic Common \nCarrier Travel Accident Insurance\nTHE PLAN: As a Capital One Visa Infinite Cardholder, you \nwill be automatically insured up to $1,000,000.00 against \naccidental loss of life, limb, sight, speech or hearing while riding \nas a passenger in, entering or exiting any licensed common \ncarrier, provided the entire cost of the passenger fare(s), less \nredeemable certificates, vouchers or coupons, has been \ncharged to your Capital One Visa Infinite account. If the entire \ncost of the passenger fare has been charged to your Capital One \nVisa Infinite account prior to departure for the airport, terminal \nor station, coverage is also provided for common carrier travel \n(including taxi, bus, train or airport limousine, including courtesy \ntransportation); immediately, a) preceding your departure, \ndirectly to the airport, terminal or station b) while at the airport, \nterminal or station, and c) immediately following your arrival at \nthe airport, terminal or station of your destination. If the entire \ncost of the passenger fare has not been charged prior to your \narrival at the airport, terminal or station, coverage begins at the \ntime the entire cost of the travel passenger fare is charged to \nyour Capital One Visa Infinite account. Common Carrier means \nany land, water or air conveyance operated by those whose \noccupation or business is the transportation of persons without \ndiscrimination and for hire.\nELIGIBILITY: This travel insurance plan is provided to Capital \nOne Visa Infinite cardholders, automatically when the entire \ncost of the passenger fare(s) are charged to your Capital One \nVisa Infinite account while the insurance is effective. It is not \nnecessary for you to notify Capital One, the administrator or \nthe Company when tickets are purchased.\n8\nBR414848_M133789_LetterSize.indd   8BR414848_M133789_LetterSize.indd   8 7/15/21   11:58 AM7/15/21   11:58 AM']","The maximum auto rental collision damage coverage on the Capital One Venture X is up to the Actual Cash Value of rental vehicles with an original manufacturer’s suggested retail price of up to seventy-five thousand dollars ($75,000.00) when new.","The Capital One Venture X Auto Rental Collision Damage Waiver covers up to the actual cash value of rental vehicles with an original MSRP of up to $75,000.",0.5,1.0000000000000002,1.0,0.9166666666361111,Capital One Venture X,simple_fact,,2026-04-19T13:01:11.156750
What is the auto rental coverage limit on the United Explorer Card?,"['What’s Covered?\nThe benefit applies to purchases made both inside and outside \nthe U.S. Eligible items given as gifts can also be covered.\nCoverage is limited to the lesser of the following:\n• The cost to repair item\n•  The cost to replace the item with an item of like kind \nand quality\n•  The amount charged to the Covered Card and/or redeemable \nRewards used (excluding shipping and handling)\n•  $10,000 per item and a maximum of $50,000 per \ncalendar year\nNote: Eligible purchases made with redeemable Rewards will be \nreimbursed in dollars.\nIf a loss involves a portion of a pair or set, You will only be \nreimbursed for the item that was stolen, damaged, or part of \nan Involuntary and Accidental Parting, not the total value of the \npair or set. This does not apply to items normally sold as pairs \nor sets that are not replaceable by purchasing one piece of \nthe pair or set. You may be asked to send the individual item,', 'Before driving out of the lot, check the Rental Vehicle for \nany prior damage and bring any damage You identify to the \nattention of the Rental Agency.\nThis benefit is in effect during the time the Rental Vehicle is in \nYour (or an authorized driver’s) control, and terminates when \nthe Rental Agency reassumes control of the Rental Vehicle.\nWhat Vehicles Are Not Covered?\nCertain vehicles are not covered by this benefit, including: \nexotic vehicles or any vehicle with a dealer or manufacturer’s \nsuggested retail price greater than $125,000, and antique \ncars (cars over twenty (20) years old or that have not been \nmanufactured for ten (10) years or more), cargo vans, trucks \n(other than pick-ups), motorcycles, mopeds, motorbikes, \nlimousines and vehicles that are rented with a driver, \nrecreational vehicles, and passenger vans with seating for more \nthan twelve (12) people including the driver.', '3\nAuto Rental Coverage\nThis benefit provides reimbursement for damages caused by \ntheft or collision of the Rental Vehicle up to $60,000. Coverage is \navailable worldwide.\nYou are covered when You use a Covered Card Account and/or \nredeemable Rewards, to initiate and complete the entire Rental \nVehicle transaction. Only You, as the primary renter of the \nRental Vehicle, and any additional drivers permitted by the \nRental Car Agreement are covered.\nWhat’s Covered?\nThis benefit covers theft, damage, valid loss-of-use charges \nimposed and substantiated by the Rental Agency, administrative \nfees, and reasonable and customary towing charges (due to a \ncovered theft or damage) to the nearest qualified repair facility. \nNo other type of loss is covered. For example, in the event of \na collision involving the Rental Vehicle, damage to any other \ndriver’s car, the injury of anyone, or damage to anything is not \ncovered. Rental periods up to thirty-one (31) consecutive days \nare covered.\nHow Does This Benefit Work?\nInside the United States and outside the United States (where \nthis benefit is available) the coverage provided is primary. \nNew York Residents, inside the United States coverage is \nprimary unless You have personal automobile insurance in \nwhich case it is excess.\nHow Do You Use This Benefit?\n1.   Use  a Covered Card Account and/or redeemable Rewards to \ninitiate and complete the entire Rental Vehicle transaction.\n2.  Re view the Rental Car Agreement and decline the Rental \nAgency’s collision damage waiver/loss damage waiver \n(CDW/LDW) option or a similar provision. Accepting the Rental \nAgency’s CDW/LDW coverage will cancel out this benefit. If the \nRental Agency, outside of the United States, will not allow \nYou to decline their CDW/LDW coverage, then this benefit is \nsecondary to the Rental Agency’s CDW/LDW coverage.\n3.  Some  countries or Rental Agencies require a letter \nof coverage. Please check with the Rental Agency \nbefore You go. If a letter of coverage is required \nvisit\n chasecardbenefits.com or call 1-800-350-2919.\nBefore driving out of the lot, check the Rental Vehicle for \nany prior damage and bring any damage You identify to the \nattention of the Rental Agency.', 'Wondering if a vehicle is covered?\nCall 1-800-350-2919\nWhat’s Not Covered?\nThis benefit does not apply to the following:\n•  Any obligation assumed under any agreement (other than the \ndeductible on a personal auto policy)\n•  Any violation of the Rental Car Agreement or the terms \nof this benefit\n•  Injury of anyone, including You, or damage to anything, inside \nor outside the Rental Vehicle\n•  Loss or theft of personal belongings\n• Personal liability\n•  Expenses assumed, waived or paid by the Rental Agency \nor its insurer\n•  The cost of any insurance or collision damage waiver offered \nby or purchased through the Rental Agency\n•  Depreciation of the Rental Vehicle caused by the incident \nincluding, but not limited to, “diminished value”\n•  Expenses reimbursable by an insurer, employer, or \nemployer’s insurance\n•  Theft or damage due to intentional acts or due to the driver(s) \nbeing under the influence of alcohol, intoxicants, or drugs, or \ndue to contraband, or illegal activities\n•  Wear and tear, gradual deterioration, or \nmechanical breakdown\n• Items not installed by the original manufacturer\n• Damage due to off-road operation of the Rental Vehicle\n•  Theft or damage due to hostility of any kind (including, \nbut not limited to, war, invasion, rebellion, insurrection, or \nterrorist activities)\n• Confiscation by authorities\n• Vehicles that do not meet the definition of Rental Vehicle\n•  Rental periods that either exceed or are intended to exceed \nthirty-one (31) days\n• Leases and mini leases\n•  Theft or damage resulting from Your and/or an authorized \ndriver’s lack of reasonable care in protecting the Rental \nVehicle before and/or after damage or theft occurs (for \nexample, leaving the car running and unattended)\n• Vehicles that are not rented from a Rental Agency\n•  Damage to the interior bed of a pick-up truck unless such \ndamage is caused by or the result of a covered loss, such as \ntheft or collision\n•  The Rental Vehicle is rented through a car sharing company \nthat allows individuals to rent out their own vehicle\nHow Do You File a Claim?\nIt is Your responsibility to make every effort to protect the \nRental Vehicle from damage or theft.', 'repair warranty, store provided warranty and a consumer \npurchased service contract exceeds three (3) years there would \nnot be coverage under this benefit. In no event will coverage \nfrom the original manufacturer’s U.S. repair warranty, store \nprovided warranty or consumer purchased service contract and \nthis coverage exceed four (4) years from the purchase date.\nTo be eligible for this benefit, the item must come with a valid \noriginal manufacturer’s U.S. repair warranty and You must \ncharge all or a portion of the cost of the eligible item to Your \nCovered Card and/or use redeemable Rewards.\nWhat’s Covered?\nThe benefit applies to purchases made both inside and outside \nthe U.S. Eligible items given as gifts can also be covered.\nCoverage is limited to the lesser of the following:\n• The cost to repair the item\n•  The cost to replace the item with an item of like kind \nand quality']","The auto rental coverage limit on the United Explorer Card is up to $60,000.","The United Explorer Card Auto Rental Coverage provides reimbursement for damages caused by theft or collision up to $60,000.",0.0,0.9999999999999999,1.0,0.3333333333,United Explorer,simple_fact,,2026-04-19T13:01:11.156750
What is the maximum cell phone protection per claim on the Bilt Palladium card?,"['2\n2. Y\nour coverage resumes on the first day of the calendar month \nfollowing the date of any future payment of your eligible cellular \nwireless telephone bill with your covered card.\nB.\n T\nhe kind of coverage you receive:\n •R\neimbursement for the actual cost to replace or repair a stolen or \ndamaged eligible cellular wireless telephone.\n •C\noverage ends on the earliest of: The date you no longer are a \ncardholder; the date the covered card is determined to be ineligible by \nthe participating organization; the date the participating organization \nceases to pay premium on the \ngroup policy; the date the participating \norganization ceases to participate in the group policy; the date the \ngroup policy is terminated.\nC. Coverage limitations: \nCoverage for a stolen or damaged eligible cellular wireless telephone is \nsubject to the terms, conditions, exclusions, and limits of liability of this \nbenefit. The maximum liability is $800 per claim, and $1,000 per covered \ncard per 12 month period. Each claim is subject to a $50 deductible.  \nCoverage is limited to two (2) claims per covered card per 12 month \nperiod. \nCoverage is excess of any other applicable insurance or indemnity \navailable to you. Coverage is limited only to those amounts not covered \nby any other insurance or indemnity. In no event will this coverage \napply as contributing insurance. This “non-contribution” clause will take \nprecedence over a similar clause found in other insurance or indemnity \nlanguage.\nD.\n What is NOT covered: \nThe following items are excluded from coverage under the group policy:\n •Eligi\nble cellular wireless telephone accessories other than the standard \nbattery and standard antenna provided by the manufacturer; \n •Eligi\nble cellular wireless telephones purchased for resale or for \nprofessional or commercial use;\n •Eligi\nble cellular wireless telephones that are lost or mysteriously \ndisappear;\n •Eligi ble cellular wireless telephones under the care and control of a \ncommon carrier, including, but not limited to, the U.S.', 'A. To get coverage:\n •You must purchase the new item entirely with your covered card and/\nor accumulated points from your covered card for yourself or to give as \na gift.\nB. The kind of coverage you receive:\n• Most items you purchase entirely with your covered card are covered if \ndamaged or stolen within 90 \ndays from the date of purchase as \nindicated on your covered card’s receipt.\n• Items you purchase with your covered card and give as gifts also are \ncovered.\n• This coverage is secondary to any other applicable insurance or \ncoverage available to you or the gift recipient. Coverage is limited to \nonly those amounts not covered by any other insurance or coverage \nbenefi t.\nC. Coverage limitations:\n• Coverage is limited to the lesser of the following:\n• \nThe actual cost of the item (excluding delivery and transportation \ncosts).\n• A maximum of $1,000 per loss and a total of $50,000 per cardholder\naccount per twelve (12) month period.\n• Purchases that are made up of a pair or set will be limited to the cost \nof repair or replacement of the specifi c item stolen or damaged. If the \nspecifi c item cannot be replaced individually or repaired, the value of the \npair or set will be covered not to exceed the limits above.\nGuide to Benefi  ts for \nMastercard® Cardholders\nPurchase Assurance', 'In addition, we shall not be deemed to provide cover and we shall not \nbe liable to pay any claim or provide any benefit under the group policy \nto the extent that the provision of such cover, payment of such claim \nor provision of such benefit would expose us, our parent company or \nits ultimate controlling entity to any sanction, prohibition or restriction \nunder United Nations resolutions or the trade or economic sanctions, \nlaws or regulations of the European Union or the United States \nof America.\nE.\t How\n\tt\no\n\tfi\nle\n\t\na\n\t\nclaim:\n •C\nall 1-800-Mastercard or go to www.mycardbenefits.com to open a \nclaim. You must report the claim within 90 days of the loss, or as soon \nas reasonably possible, or the claim may not be honored. Upon receipt \nof a notice of claim, we will provide you with the necessary instructions \nfor filing proof of loss. Written proof of loss must be submitted to \nour \nadministrator within 120 days of the loss or the claim may not be \nhonored. Required documentation may include but is not limited to the \nfollowing:\n o Y\nour card statement reflecting the monthly eligible cellular wireless \ntelephone payments for the month preceding the date the eligible \ncellular wireless telephone was stolen or suffered damage;\n o A\n copy of your current wireless service provider’s billing statement;\n o If\n a claim is due to damage, a copy of the repair estimate and photos \nof the damage; \n o If\n the claim is due to theft, a copy of the police report filed within 48 \nhours of the theft; and\n o An\ny other documentation or information reasonably requested by us \nto support the claim.\nLegal Disclosure\nThis Guide to Benefits is not, by itself, a policy or contract of insurance or \nother contract.\nBenefits are provided to you, the \ncardholder, at no additional charge.  \nThe insurance benefits are provided under the group policy issued by  \nNew Hampshire Insurance Company, an AIG company. This Guide to \nBenefits is a summary of benefits provided to you. The attached Key \nTerms and \nEOC are governed by the group policy.', 'to a maximum of twenty-four (24) months following the day that \nthe Manufacturer’s Warranty or Store Warranty expires.\n• If you purchase a Purchased Warranty of twenty-four (24) months\nor less on a Covered Purchase with an original Manufacturer’s\nWarranty (or Store Warranty), this coverage doubles the time\nperiod of the Covered Purchase’s original Manufacturer’s Warranty \n(or Store Warranty) up to an additional twenty-four (24) months\nfollowing the day that the original Manufacturer’s Warranty (or \nStore Warranty) and the Purchased Warranty’s coverage periods\nend.\nC. Coverage limitations:\n• The maximum benefit for repair or replacement shall not exceed\nthe lesser of the following per claim: (1) The actual purchase\namount charged on your Covered Card, less shipping and\nhandling fees; (2) the actual cost of repair; (3) the actual cost of \nreplacement with an item of like kind and quality; or (4) $10,000.\n• We or our Administrator will decide if a Covered Purchase will be\nrepaired or replaced, or whether you will be reimbursed up to the\nmaximum benefit amount for the item. Only valid and reasonable\nrepairs made at a certified repair facility are covered. Items will be\nreplaced with those of like kind and quality. However, we cannot\nguarantee to match exact color, material, brand, size, or model.\n• Coverage is secondary to and in excess of any other applicable\ninsurance or indemnity available to you or the gift recipient.\nCoverage is limited to only those amounts not covered by any other \ninsurance or indemnity. It is subject to the conditions, limitations,\nand exclusions described in this document. In no event will this\ncoverage apply as contributing insurance. This non-contribution\nclause will take precedence over a similar clause found in other \ninsurance or indemnity language.\nD. What is NOT covered:\n• Used items, antiques, or collectibles of any kind (such as items\ndesigned for people to collect or items that over time become\ncollectibles) that do not come with a Manufacturer’s Warranty \nor Store Warranty (repair or replacement amount will not include\nmarket value at time of claim).\n• Recycled, previously owned, refurbished, rebuilt, or remanufactured\nitems.\n• Product guarantees or “satisfaction guaranteed” items.', 'A. To get coverage:\nYou must pay the entire cost of the \ncommon carrier ticket(s) with your \ncovered card and/or accumulated points from your covered card.\nB. The kind of coverage you receive:\n •Reimbursement for the actual cost of replacing, on an emergency basis, \nany personal articles (e.g., clothing, hygiene and/or grooming products) \nor business eff  ects (e.g., uniforms or general offi   ce supplies) contained \nin your \nchecked baggage, if the checked baggage is delayed in getting to \nyou at your scheduled destination.\n •Coverage begins when the baggage is checked in with the common \ncarrier by you. This includes curbside check-in with facility-designated \npersonnel.\n •Coverage ends when you regain possession of your checked baggage \nfrom the common carrier. This includes curbside checkout with facility-\ndesignated personnel.\n •Coverage is secondary to any other applicable insurance or coverage \navailable to you including benefi  ts provided by the common carrier \n(including, but not limited to, goodwill payments, refunds, credit/\nvouchers). Coverage is limited to only those amounts not covered by any \nother insurance or coverage or common carrier benefi  ts (including, but \nnot limited to, goodwill payments, refunds, credit/vouchers).\nC. Coverage limitations:\nCoverage is limited to the actual cost, up to $250 per claim, of \nreplacing, on an emergency basis, any personal articles or business eff \nects contained in your checked baggage. There is a maximum of 2 \nclaim(s) per twelve (12) month period.\nGuide to Benefi  ts for \nMastercard® Cardholders\nBaggage Delay']",The maximum cell phone protection per claim on the Bilt Palladium card is $800.,"The Bilt Palladium cell phone protection covers up to $800 per claim, with a $50 deductible, and a maximum of 2 claims per 12-month period.",0.0,1.0000000000000002,1.0,0.9999999999,Bilt Palladium,simple_fact,,2026-04-19T13:01:11.156750
How much is the annual Uber Cash benefit on the Amex Platinum card?,"['Further details will be\navailable at uber.com/signaturesupport starting on May 7, 2026.\nBasic Card Members on a Consumer Platinum or Centurion account and Additional Centurion\nMembers are eligible for $15 Uber Cash each month plus an additional $20 Uber Cash in December,\nand Uber VIP where available (""Amex Benefit""). To receive the Amex Benefit, you must have\ndownloaded the latest version of the Uber, Uber Eats and/or Postmates apps and added your eligible\nPlatinum Card or Centurion Card as a payment method in your Uber account. It may take up to 48\nhours for the Amex Benefit to become available in your Uber account after your eligible Card has\nbeen added to your account. To redeem the Uber Cash received through the Amex Benefit, you must\nselect an American Express Card as the payment method for your transaction and have Uber Cash\ntoggled on. The Amex Benefit may only be used in the United States.\n®\n4/17/26, 7:27 PM Platinum Card® - Terms, Conditions & Disclosures\nhttps://www.americanexpress.com/us/credit-cards/card-application/apply/supplementary/terms/platinum-card/36182-9-0 4/40', ""To be eligible for the Amex Benefit, your Card Account must not be canceled or past due. American\nExpress reserves the right to suspend your eligibility for the Amex Benefit if we suspect any violation\nor abuse. Cards added to your Uber account through a third party or electronic wallet such as Apple\nPay or PayPal will not be eligible to receive the Amex Benefit. An eligible Platinum Card or Centurion\nCard can only receive the Amex Benefit on one Uber account. If the same Card is added to multiple\nUber accounts, only the first Uber account to which the Card is added will receive the Amex Benefit.\nThe Uber Cash received through the Amex Benefit is found within your Uber Cash balance. If you do\nnot see this Uber Cash in your Uber Cash balance within 48 hours from the time you enroll, call the\nnumber on the back of your Card for assistance.\nTo continue to receive the Amex Benefit, the details for your eligible Card must be kept up-to-date in\nyour Uber account and your Uber, Uber Eats and/or Postmates app versions must be kept up-to-\ndate. If your American Express Card details change, you will need to update your Card details in your\nUber payment profile before the end of the current month to ensure you remain enrolled in the Amex\nBenefit, otherwise you may need to re-enroll to continue to receive your Amex benefit. The Uber App,\nand all other Uber products and services, including but not limited to Uber VIP (which is available in\nselect cities) and Uber Cash, are governed by Uber's terms and conditions.\nIn order to use the Uber Cash received through the Amex Benefit, Uber Cash must be toggled on\nand an American Express Card must be selected as the payment method for your transaction.\nThe Amex Benefit may be applied to any services to which Uber permits Uber Cash to be applied. If\nyour Uber Cash balance does not satisfy the cost of your ride or order, the Amex Card selected for\nthe transaction will be charged for the difference.\nThe Amex Benefit will not apply to previous Uber transactions and cannot be used when paying with\na family profile. Uber will apply Uber Cash received through the Amex Benefit at the point of sale and\nit will be displayed on your receipt."", ""The Amex Benefit will not apply to previous Uber transactions and cannot be used when paying with\na family profile. Uber will apply Uber Cash received through the Amex Benefit at the point of sale and\nit will be displayed on your receipt.\nUber Cash received through the Amex Benefit expires at 11:59 PM Hawaii Standard Time on the last\nday of each calendar month. Unused balance in Uber Cash from your Amex Benefit will not carry\nover to the following month. Uber Cash received through the Amex Benefit will be applied for the\nmonth in which the transaction is completed. If a transaction is eligible for another promotion that you\nhave added to your Uber account, the promotion will be applied before your Amex Benefit. Certain\nother types of balances in Uber Cash may be applied to the cost of your ride or order prior to your\nAmex Benefit in Uber Cash. For purposes of fulfilling this benefit, American Express will share with\nUber certain information about your Card, including the Card type, and updated Card information\nfrom time to time. If you do not wish to receive the Amex Benefit, please call the number on the back\nof your Card. If you do not see the Uber Cash portion of the Amex Benefit in your Uber Cash\nbalance by 5:00 PM Hawaii Standard Time on the first day of each calendar month, call the number\non the back of your Card for assistance.\n$209 CLEAR+ Credit\nBasic Card Members can earn up to $209 in statement credits per calendar year when their Platinum\nCard  or Additional Cards on the Account are used to pay for an annual CLEAR+ Membership.\nEnrollment in CLEAR+ is required and is subject to CLEAR's terms and conditions. American Express\nhas no control over the application and/or approval process for CLEAR and does not have access to\nany information provided to CLEAR by the Card Member or by CLEAR to the Card Member.\nAmerican Express has no liability regarding the CLEAR program. If a Card Member's application is\nnot approved by CLEAR, CLEAR will refund the charges. If the statement credit benefit has been\napplied before CLEAR refunds the charges, that statement credit will be reversed. Statement credit(s)\nmay not be received or may be reversed if the qualifying purchase is returned, refunded, cancelled or\nmodified."", ""If you do not see this Uber Cash in your Uber Cash balance\nwithin 48 hours from the time you enroll, call the number on the back of your Card for assistance.\nTo continue to receive the Amex Benefit, the details for your eligible Card must be kept up-to-date in\nyour Uber account and your Uber, Uber Eats and/or Postmates app versions must be kept up-to-\ndate. If your American Express Card details change, you will need to update your Card details in your\nUber payment profile before the end of the current month to ensure you remain enrolled in the Amex\nBenefit, otherwise you may need to re-enroll to continue to receive your Amex benefit. The Uber App,\nand all other Uber products and services, including but not limited to Uber Cash, are governed by\nUber's terms and conditions.\nIn order to use the Uber Cash received through the Amex Benefit, Uber Cash must be toggled on\nand an American Express Card must be selected as the payment method for your transaction.\nThe Amex Benefit may be applied to any services to which Uber permits Uber Cash to be applied. If\nyour Uber Cash balance does not satisfy the cost of your ride or order, the Amex Card selected for\n4/17/26, 7:28 PM American Express® Gold Card - Terms, Conditions & Disclosures\nhttps://www.americanexpress.com/us/credit-cards/card-application/apply/supplementary/terms/gold-card/39161-9-0 4/17"", 'POID K0ZB:9967\nBENEFIT TERMS\nThe following benefits and services are subject to change or cancellation.\n$120 Uber One Credit\nBasic Card Members on U.S. Consumer Platinum Accounts are eligible to receive up to $120 in\nstatement credits per calendar year on Uber One membership fees charged to an eligible Card.\nPurchases by both the Basic Card Member and Additional Card Members on the eligible Card\nAccount are eligible for statement credits. However, statement credits will not exceed $120 per\ncalendar year per Card Account. Valid on both monthly and annual Uber One membership purchases.\nBenefit is available for Uber One memberships and Uber accounts located in the U.S., except in\nNorthern Mariana, American Samoa, Guam and U.S. Virgin Islands, for eligible deliveries or rides in\nU.S. cities where Uber, Uber Eats, and/or Postmates are available.\n4/17/26, 7:27 PM Platinum Card® - Terms, Conditions & Disclosures\nhttps://www.americanexpress.com/us/credit-cards/card-application/apply/supplementary/terms/platinum-card/36182-9-0 1/40']","The annual Uber Cash benefit on the Amex Platinum card is $180, which includes $15 Uber Cash each month plus an additional $20 Uber Cash in December.","The Amex Platinum provides up to $200 per year in Uber Cash, distributed as $15 per month plus a $20 bonus in December.",0.6666666666666666,0.9816494593566081,1.0,0.99999999995,Amex Platinum,simple_fact,,2026-04-19T13:01:11.156750
What is the Common Carrier Travel Accident Insurance benefit amount on the United Explorer Card?,"['18\n b)  immediately following the arrival of the scheduled \nCommon Carrier on which the Covered Traveler was a \npassenger; or\n3)  while at the airport, station, or terminal at the beginning or \nend of a Trip.\nIf the purchase of the Common Carrier passenger fare is not \nmade prior to the Covered Traveler’s arrival at the airport, \nterminal, or station, coverage will begin at the time when You \ncharge all or a portion of the cost of the Common Carrier fare to \nYour Covered Card and/or use redeemable Rewards.\nWhat’s Covered?\nTo receive payment under this benefit, the injury to, or death of, \nthe Covered Traveler(s) must be caused by one of the following:\n•  An Accident that occurs while on a Trip as defined under \nWhen is the Covered Traveler Covered?;\n•  If, due to an Accident, the Covered Traveler has not been \nfound within one (1) year of the disappearance, stranding, \nsinking, or wrecking of the Common Carrier in which the \nCovered Traveler was an occupant at the time of the Accident, \nthen it will be assumed that the Covered Traveler has suffered \na Loss of Life.\n•  If, due to an Accident, the Covered Traveler is unavoidably \nexposed to the elements and as a result of this exposure \nsuffers a Loss.\nIn order to be covered, the Loss must occur within one (1) year \nafter the Accident.\nWhat Are the Benefit Amounts?', '19\nIn the event a Loss is eligible for payment under both the \nCommon Carrier Travel Accident and the Twenty-Four (24) Hour \nTravel Accident coverage, or if a Covered Traveler suffers \nmultiple covered Losses as the result of one (1) Accident, We will \nonly pay the single largest Maximum Benefit Amount applicable \nto all covered Losses.\nIf more than one Covered Traveler under the same Account \nsuffers a Loss arising from the same Accident, We will not pay \nmore than two (2) times the Maximum Benefit Amount (the \naggregate limit of insurance). If an Accident results in benefits \nbecoming payable, which when totaled exceeds two (2) times \nthe Maximum Benefit Amount, the aggregate limit of insurance \nwill be divided proportionally, based on applicable benefit \namounts owed to all Covered Travelers.\nIf the Covered Traveler is eligible for coverage under multiple \nAccounts, then the Covered Traveler will only be covered under \nthe Account which provides the largest Benefit Amount for the \nLoss that has occurred.\nAll benefits, except for Loss of Life, are paid to the Covered \nTraveler. Loss of Life benefits are paid to the Covered \nTraveler’s estate.\nWhat’s Not Covered?', 'In order to be covered, the Loss must occur within one (1) year \nafter the Accident.\nWhat Are the Benefit Amounts?\nCoverage\nMaximum Benefit Amount \nper Covered Traveler\nTwenty-Four (24) Hour \nTravel Accident $100,000\nCommon Carrier \nTravel Accident $500,000\nThis benefit will pay the Percentages of Maximum Benefit \nAmount for specific Losses as follows: \nLoss \nPercentage of \nMaximum Benefit \nAmount\nLoss of Life; Loss of Speech and \nLoss of Hearing; Loss of Speech \nor Hearing and Loss of one Hand, \nFoot or Sight of One Eye; Loss of \nBoth Hands; Loss of Both Feet; \nLoss of Sight of Both Eyes; Loss of \na combination of any two of a Loss \nof Hand, Loss of Foot or Loss of \nSight of One Eye\n100%\nLoss of One Hand; Loss of One \nFoot; Loss of Sight of One Eye; Loss \nof Speech; Loss of Hearing\n50%\nLoss of Thumb and Index Finger of \nthe same hand 25%', '17\nTravel Accident Insurance\nThis benefit provides payment if a Covered Traveler suffers a \nLoss of Life or loss of limb, sight, speech or hearing due to an \nAccident while traveling on a Trip.\nThe Covered Traveler is covered when You charge all or a \nportion of the cost of the Common Carrier fare to Your Covered \nCard and/or use redeemable Rewards. Covered Travelers do not \nneed to be traveling with You for benefits to apply.\nWhen is the Covered Traveler Covered?\nTwenty-Four (24) Hour Travel Accident\nCoverage begins from Trip Departure Date and ends on Trip \nCompletion Date for Trips up to thirty (30) days. For Trips \nlasting more than thirty (30) days coverage remains in effect \nuntil 12:01 a.m. on the thirty-first (31st) day following the Trip \nDeparture Date. Coverage is reactivated when the Covered \nTraveler commences travel to their return destination on the \nTrip Completion Date.\nCommon Carrier Travel Accident\nCoverage applies when the Covered Traveler:\n1)  is riding as a passenger in, entering, or exiting the Common \nCarrier for which the fare was purchased using the Covered \nCard and/or redeemable Rewards;\n2)  is riding as a passenger in, entering, or exiting any Common \nCarrier licensed to carry the public for hire or any Courtesy \nTransportation provided without a specific charge and while \ntraveling to and from the airport, terminal, or station:\n a)  immediately preceding the departure of the scheduled \nCommon Carrier on which the Covered Traveler is a \npassenger; or\nIf You feel You are in an unsafe location, You will be advised \nto hang up and dial 911. If You are not able to dial 911, the \nroadside assistance provider will call the non-emergency police \nnumber near Your location and remain on the phone with You \nat Your request until the police arrive.\nThis program may be discontinued at any time without \nprior notice.\nProgram void where prohibited.\nDefinitions\nAccount - the credit card Account issued by \nJPMorgan Chase Bank, N.A. and/or its affiliates\nCovered Card - the credit card or Account that is eligible for \nbenefits as designated by JPMorgan Chase Bank, N.A.', '•  If the Covered Traveler’s Carry-On Baggage is lost, stolen, or \ndamaged while on the Common Carrier, it must be reported \nto the Common Carrier as soon as the Covered Traveler exits \nthe Common Carrier.\nThis benefit is secondary and payable on an excess basis over \nand above any amount due from any other valid or collectible \ninsurance or any other form of reimbursement payable by those \nresponsible for the loss.\nWhat’s Not Covered?\nThis benefit does not apply to loss or theft of the following:\n•  Items that have been removed from Carry-On Baggage by \nthe Covered Traveler and inadvertently left behind on the \nCommon Carrier\n• Documents or valuable papers\n• Money\n• Securities\n• Tickets\n• Checks\n• Travelers’ checks\n• Furs\nThis benefit does not apply to any loss caused by, or resulting \nfrom, directly or indirectly: War, undeclared war, civil war,']","The Common Carrier Travel Accident Insurance benefit amount on the United Explorer Card is $500,000.","The United Explorer Card provides Common Carrier Travel Accident Insurance up to $500,000 per covered traveler.",0.0,0.9731025555380021,1.0,0.4166666666458333,United Explorer,simple_fact,,2026-04-19T13:01:11.156750
Is the auto rental coverage on the United Explorer Card primary or secondary?,"['3\nAuto Rental Coverage\nThis benefit provides reimbursement for damages caused by \ntheft or collision of the Rental Vehicle up to $60,000. Coverage is \navailable worldwide.\nYou are covered when You use a Covered Card Account and/or \nredeemable Rewards, to initiate and complete the entire Rental \nVehicle transaction. Only You, as the primary renter of the \nRental Vehicle, and any additional drivers permitted by the \nRental Car Agreement are covered.\nWhat’s Covered?\nThis benefit covers theft, damage, valid loss-of-use charges \nimposed and substantiated by the Rental Agency, administrative \nfees, and reasonable and customary towing charges (due to a \ncovered theft or damage) to the nearest qualified repair facility. \nNo other type of loss is covered. For example, in the event of \na collision involving the Rental Vehicle, damage to any other \ndriver’s car, the injury of anyone, or damage to anything is not \ncovered. Rental periods up to thirty-one (31) consecutive days \nare covered.\nHow Does This Benefit Work?\nInside the United States and outside the United States (where \nthis benefit is available) the coverage provided is primary. \nNew York Residents, inside the United States coverage is \nprimary unless You have personal automobile insurance in \nwhich case it is excess.\nHow Do You Use This Benefit?\n1.   Use  a Covered Card Account and/or redeemable Rewards to \ninitiate and complete the entire Rental Vehicle transaction.\n2.  Re view the Rental Car Agreement and decline the Rental \nAgency’s collision damage waiver/loss damage waiver \n(CDW/LDW) option or a similar provision. Accepting the Rental \nAgency’s CDW/LDW coverage will cancel out this benefit. If the \nRental Agency, outside of the United States, will not allow \nYou to decline their CDW/LDW coverage, then this benefit is \nsecondary to the Rental Agency’s CDW/LDW coverage.\n3.  Some  countries or Rental Agencies require a letter \nof coverage. Please check with the Rental Agency \nbefore You go. If a letter of coverage is required \nvisit\n chasecardbenefits.com or call 1-800-350-2919.\nBefore driving out of the lot, check the Rental Vehicle for \nany prior damage and bring any damage You identify to the \nattention of the Rental Agency.', 'This benefit is secondary and payable on an excess basis over \nand above any amount due from any other valid or collectible \ninsurance or any other form of reimbursement payable by those \nresponsible for the loss.\nWhat’s Not Covered?\nThis benefit does not apply to the following:\n• Hearing aids\n• Artificial teeth, dental bridges, or prosthetic devices\n•  Tickets, documents, money, securities, checks, travelers \nchecks, and valuable papers\n• Business samples\n• Jewelry and watches\n• Cameras, video recorders, and other electronic equipment\n•  Recreational equipment, any equipment that is used to \nengage in a particular sport, hobby, game, excursion, or other \nrecreational activity', '14\nat Your expense, as part of the claim review process prior to \nbeing reimbursed.\nIf the item is damaged, We will decide whether to reimburse for \nthe cost to have the item repaired or replaced, whichever is less. \nMaximum coverage limits apply.\nCoverage is secondary and in excess of valid and collectible \ninsurance or indemnity (including, but not limited to, \nhomeowner’s, renter’s, automobile, or employer’s insurance \npolicies). This means that if You have another insurance policy, \nthis benefit will cover only the amount Your other policies \ndo not. Deductibles You may have to pay under Your other \ninsurance policies are covered. You would not have to file a \nclaim under Your other insurance If the deductible on the other \ninsurance is equal to or greater than the claim amount.\nWhat’s Not Covered?\nThis benefit does not cover the following:\n• Living animals and plants\n• Antiques or collectible items\n•  Boats, automobiles, aircraft, and any other motorized vehicles \nand their motors, equipment, or accessories, including trailers \nand other items that can be towed by or attached to any \nmotorized vehicle\n• Computer software\n• Items purchased for resale, professional, or commercial use\n•  Items that are lost, or that “mysteriously disappear,” meaning \nthey vanished in an unexplained manner, with no evidence of \nwrongdoing by one person\n•  Items under the control and care of a common carrier, \nincluding the U.S.', 'Before driving out of the lot, check the Rental Vehicle for \nany prior damage and bring any damage You identify to the \nattention of the Rental Agency.\nThis benefit is in effect during the time the Rental Vehicle is in \nYour (or an authorized driver’s) control, and terminates when \nthe Rental Agency reassumes control of the Rental Vehicle.\nWhat Vehicles Are Not Covered?\nCertain vehicles are not covered by this benefit, including: \nexotic vehicles or any vehicle with a dealer or manufacturer’s \nsuggested retail price greater than $125,000, and antique \ncars (cars over twenty (20) years old or that have not been \nmanufactured for ten (10) years or more), cargo vans, trucks \n(other than pick-ups), motorcycles, mopeds, motorbikes, \nlimousines and vehicles that are rented with a driver, \nrecreational vehicles, and passenger vans with seating for more \nthan twelve (12) people including the driver.', 'and/or its affiliates\nCovered Card - the credit card or Account that is eligible for \nbenefits as designated by JPMorgan Chase Bank, N.A. and/or \nits affiliates\nRental Agency - a commercial rental company licensed under \nthe laws of the applicable jurisdiction and whose primary \nbusiness is renting automobiles\nRental Car Agreement - the entire contract an eligible renter \nreceives when renting a Rental Vehicle from a Rental Agency \nwhich describes in full all of the terms and conditions of \nthe rental, as well as the responsibilities of all parties under \nthe contract\nRental Vehicle - a land motor vehicle with four (4) or more \nwheels which the eligible renter has rented for the period of \ntime shown on the Rental Car Agreement and is not identified \nas a non-covered vehicle herein\nRewards - points, miles, cash rewards, or any other type of \nredeemable Rewards associated with your Covered Card, \nprovided that all Rewards have been accumulated by You \nthrough use of a JPMorgan Chase Bank, N.A. and/or its affiliates \nsponsored Rewards program']","The auto rental coverage on the United Explorer Card is primary inside the United States and outside the United States (where this benefit is available). However, for New York residents, the coverage is primary unless you have personal automobile insurance, in which case it is excess.",The auto rental coverage on the United Explorer Card is primary coverage.,1.0,0.7770224630576965,1.0,0.9999999999,United Explorer,exact_term,,2026-04-19T13:01:11.156750
How many Priority Pass lounge guests are included free with the Bilt Palladium card?,"['Description\nAirport lounge access provided by Priority Pass is available to all \neligible Bilt Palladium Card cardholders. Cardholders can use \ntheir Priority Pass membership or digital membership card to \naccess an airport lounge in a seamless way, as follows: \n•Eligible cardholders will enjoy complimentary lounge \nmembership for them and up to two guests.For additional guests \nabove two, the Cardholder will be charged $35 per guest per \nlounge visit.\n• Membership to 1200+ Priority Pass lounges in 120+ countries and \nin over 400 airports regardless of airline, frequent ﬂ yer membership \nor class of ticket.\nPriority Pass provides aﬄ  uent cardholders the opportunity to relax, \nrefresh and enhance their airport experience as they wait for their ﬂ \night.\nDetail\nWho Is Eligible:\nU.S. issued Bilt Palladium Card cardholders whose issuing bank \nhas completed the enrollment process.\nHow Priority Pass Works:\n1. Before traveling, eligible cardholders need to activate their \nmembership using their Bilt Palladium Card at the \nwww.PriorityPass.com website. Once activated, cardholders \ncan log on their Priority Pass account at www.PriorityPass.com \nand view a list of participating lounges and experiences.\n2.  Eligible cardholders will enjoy complimentary refreshments, \nnewspapers and\n television. In addition, there is access to business \nfacilities including phone, fax, conference and Internet facilities \n(where available).\n3. To gain access to the lounges, an eligible cardholder only \nneeds to quote “Priority Pass” at the participating lounge \nand, once activated, present their Bilt Palladium Card or \npresent their Digital Membership card (QR Code), found in \nthe Priority Pass app, and their boarding pass.\n4.  A list of participating lounges can be found and viewed using \nthe Priority Pass website or app.\n • FAQs can be viewed online at\nhttps:/ /www.prioritypass.com/en/member-support/faq\n • Contact Priority Pass at\nhttps:/ /www.prioritypass.com/en/member-support/contact-us\nor +1 469 334 4174 for customer support.', '• Terms of Use can be viewed online at\nhttps:/ /www.prioritypass.com/en/terms-of-use\n • Conditions of Use can be viewed online at\nhttps:/ /www.prioritypass.com/en/conditions-of-use\nGuide to Beneﬁ  ts for \nMastercard® Cardholders\nPriority Pass\nAirport Lounge Access', 'When visiting a Priority Pass Select lounge that admits guests, Platinum Card\nMembers receive complimentary access for up to two accompanying guests. After two guests, the\nCard Account on file with Priority Pass Select will be automatically charged the guest visit fee of the\nPriority Pass Standard program for each additional guest after you have signed up for the additional\nguest visit and it has been reported to Priority Pass by the participating lounge. Some lounges limit\n®\n®\n™\n® ®\n® ™\n®\n®\n4/17/26, 7:27 PM Platinum Card® - Terms, Conditions & Disclosures\nhttps://www.americanexpress.com/us/credit-cards/card-application/apply/supplementary/terms/platinum-card/36182-9-0 32/40', 'the number of guests or do not admit guests. In some lounges, Priority Pass Select members must\nbe 21 years of age to enter without a parent or guardian. Priority Pass Select members must adhere\nto all house rules of participating lounges and access to participating lounges is subject to all rules,\nterms and conditions of the applicable lounge. Amenities may vary among airport lounge locations.\nConference rooms, where available, may be reserved for a nominal fee. Priority Pass Select lounge\npartners and locations are subject to change. All Priority Pass Select members must adhere to the\nPriority Pass Conditions of Use, which will be sent to you with your membership package, and can\nbe viewed at www.prioritypass.com. Upon receipt of your enrollment information, Priority Pass will\nsend your Priority Pass Select card and membership package which you should receive within 10–14\nbusiness days. If you have not received the Priority Pass card after 14 days, please contact American\nExpress using the number on the back of your American Express  Card. To receive immediate\naccess to lounges after your enrollment in Priority Pass Select has been processed, you can activate\nyour membership online by using your Priority Pass Select membership details to receive a Digital\nMembership Card. For a step-by-step guide on the activation process, visit prioritypass.com/activation.\nEffective May 19, 2026, guest visit fees may be automatically charged to your Card or paid during\nthe check-in process at the Priority Pass Select lounge, as instructed by check-in staff at the Priority\nPass Select lounge.\nEffective June 22, 2026, you acknowledge and agree that American Express will verify your email\naddress and provide that information to Priority Pass. Priority Pass will use this information to fulfill\nthe Priority Pass Select program and may use this information for marketing related to the program.\nUpon receipt of your enrollment information, Priority Pass will send you email instructions to receive\nyour Priority Pass Digital Membership Card. Once enrolled in Priority Pass Select, Platinum Card\nCard Members whose Card account is not cancelled may access participating Priority Pass Select\nlounges by presenting their valid physical Priority Pass Card (if previously received), their Priority\nPass Digital Membership Card, or their physical American Express Card and airline boarding\npass.\nReturn Protection\nReturn Protection is subject to additional important terms, conditions and exclusions.', 'Please drink responsibly. American Express reserves the right to limit the number of\nevents Card Members (and their guests) may attend and to cancel tickets/packages without refund\nfor any violations of the terms and conditions of this event. American Express also reserves the right\nto remove any person from any event for inappropriate behavior including, but not limited to, conduct\nthat is disruptive, abusive, or violent. American Express is not responsible for the actions or inactions\nof any third party. For more information, please visit americanexpress.com/entertainment.\nPremium Global Assist® Hotline\nWhile Premium Global Assist  Hotline coordination and assistance services are offered at no\nadditional charge from American Express, Card Members may be responsible for the costs charged\nby third-party service providers. Premium Global Assist Hotline may provide emergency medical\ntransportation assistance at no cost if approved and coordinated by Premium Global Assist Hotline.\nFor full Terms and Conditions call 1-800-345-AMEX or see americanexpress.com/GAterms.\nPriority Pass  Select\nThis benefit is available to U.S. Platinum Card  Members. Platinum Card  Members and Additional\nPlatinum Card  Members must enroll in the Priority Pass  Select program through the benefits\nsection of their americanexpress.com account or by calling the number on the back of their Card to\nreceive the benefit. Companion Platinum Cards on Consumer Platinum Accounts and Additional Gold\nand Additional Business Expense Cards on Business Platinum Accounts are not eligible for the\nPriority Pass Select benefit. Priority Pass is an independent airport lounge access program. You\nacknowledge and agree that American Express will verify your Card Account number and provide\nupdated Card Account information to Priority Pass. Priority Pass will use this information to fulfill on\nthe Priority Pass Select program and may use this information for marketing related to the program.\nOnce enrolled, Platinum Card  Card Members with a valid Card Account may access participating\nPriority Pass Select lounges by presenting their Priority Pass Select card and airline boarding pass. If\nthe Card Account is canceled, you will not be eligible for Priority Pass Select and your enrollment will\nbe canceled. When visiting a Priority Pass Select lounge that admits guests, Platinum Card\nMembers receive complimentary access for up to two accompanying guests.']",Eligible Bilt Palladium Card cardholders enjoy complimentary lounge membership for themselves and up to two guests.,The Bilt Palladium card includes complimentary Priority Pass lounge access for the cardholder and up to 2 guests. Additional guests above 2 are charged $35 per guest per visit.,1.0,0.6959536253710602,1.0,0.9999999999,Bilt Palladium,exact_term,,2026-04-19T13:01:11.156750
What is the Purchase Protection coverage window on the United Explorer Card?,"['repair warranty, store provided warranty and a consumer \npurchased service contract exceeds three (3) years there would \nnot be coverage under this benefit. In no event will coverage \nfrom the original manufacturer’s U.S. repair warranty, store \nprovided warranty or consumer purchased service contract and \nthis coverage exceed four (4) years from the purchase date.\nTo be eligible for this benefit, the item must come with a valid \noriginal manufacturer’s U.S. repair warranty and You must \ncharge all or a portion of the cost of the eligible item to Your \nCovered Card and/or use redeemable Rewards.\nWhat’s Covered?\nThe benefit applies to purchases made both inside and outside \nthe U.S. Eligible items given as gifts can also be covered.\nCoverage is limited to the lesser of the following:\n• The cost to repair the item\n•  The cost to replace the item with an item of like kind \nand quality', '9\n•  The  amount charged to the Covered Card and/or redeemable \nRewards used (excluding shipping and handling)\n•  $10,000 per item and a maximum of $50,000 per \ncalendar year\nNote: Eligible purchases made with redeemable Rewards will be \nreimbursed in dollars.\nWe will decide whether to reimburse for the cost to have the \nitem repaired or replaced, whichever is less. Maximum coverage \nlimits apply.\nIf Your item is to be repaired, You may go to an authorized \nrepair facility and file a claim for reimbursement. Only valid, \ncustomary and reasonable repairs made at the authorized \nrepair facility are covered.\nHow Does This Benefit Work?\nThe coverage begins at the end of the original manufacturer’s \nU.S. repair warranty and provides one (1) year of coverage after \nit has expired. This benefit only covers what would have been \ncovered under the original manufacturer’s U.S. repair warranty.\nIf You received a store provided warranty or purchased a \nservice contract, Our coverage begins at the expiration of the \ncumulative warranties and service contract. If the original \nmanufacturer’s U.S. repair warranty or a combination of the \noriginal manufacturer’s U.S. repair warranty, store provided \nwarranty and a consumer purchased service contract exceeds \nthree (3) years there would not be coverage under this benefit.\nExamples:\n•  On an original manufacture r’s U.S. repair warranty of \nsix (6) months, We would provide You with an additional \ntwelve (12) months of coverage for a combined total of \neighteen (18) months of coverage.\n•  On an original manufacture r’s U.S. repair warranty of \ntwelve (12) months, and a consumer purchased service \ncontract of twenty-four (24) months, We would provide You \nwith an additional twelve (12) months of coverage starting \nat the end of the consumer purchased service contract for a \ncombined total of forty-eight (48) months of coverage.\n•  On an original manufacture r’s U.S. repair warranty of \nsix (6) months, and a consumer purchased service contract \nof thirty-six (36) months, there would be no extension of \ncoverage under this benefit.\nHow Can You Store Your Warranty?', 'What’s Covered?\nThe benefit applies to purchases made both inside and outside \nthe U.S. Eligible items given as gifts can also be covered.\nCoverage is limited to the lesser of the following:\n• The cost to repair item\n•  The cost to replace the item with an item of like kind \nand quality\n•  The amount charged to the Covered Card and/or redeemable \nRewards used (excluding shipping and handling)\n•  $10,000 per item and a maximum of $50,000 per \ncalendar year\nNote: Eligible purchases made with redeemable Rewards will be \nreimbursed in dollars.\nIf a loss involves a portion of a pair or set, You will only be \nreimbursed for the item that was stolen, damaged, or part of \nan Involuntary and Accidental Parting, not the total value of the \npair or set. This does not apply to items normally sold as pairs \nor sets that are not replaceable by purchasing one piece of \nthe pair or set. You may be asked to send the individual item,', 'For questions,  \ncall 1-800-350-2919 \nEffective 10/01/24\nBGC11386\nGuide to Benefits\nImportant information about your  \ntravel and purchase protection benefits\nUnited SM Explorer Card and\nUnited Quest SM Card\nVisa Signature® and Visa Platinum', '13\nsole Domestic Partner, (2) maintain a common residence, \n(3) share at least one (1) of the following financial arrangements: \na joint mortgage or lease, a joint bank account, joint title to or \nownership of a motor vehicle or status as a joint lessee on a \nmotor vehicle lease or a joint credit card account with a financial \ninstitution, (4) are not married or joined in a civil union to \nanyone else or are not the Domestic Partner of anyone else, and \n(5) are not blood related\nFamily Member - an individual’s: spouse or Domestic Partner, \nand parents thereof; sons and daughters, including adopted \nchildren and stepchildren; legal guardians or wards; parents, \nincluding stepparents; brothers and sisters; grandparents and \ngrandchildren; aunts or uncles; nieces or nephews; spouses or \nDomestic Partners of any individual of this definition\nRewards - points, miles, cash rewards, or any other type of \nredeemable Rewards associated with Your Covered Card, \nprovided that all Rewards have been accumulated by You \nthrough use of a JPMorgan Chase Bank, N.A. and/or its affiliates \nsponsored Rewards program\nTrip - any pre-paid travel when a portion or the entire cost of a \nround trip or one way Common Carrier fare was paid using the \nCovered Card and/or redeemable Rewards\nWe, Us and Our - Virginia Surety Company, Inc., an Assurant \ncompany, the insurance company that provides these benefits \nfor the Covered Card\nYou and Your - an individual to whom a Covered Card Account \nhas been issued by JPMorgan Chase Bank, N.A. and/or \nits affiliates\nLL_CON_$3K_20240311\nPurchase Protection\nThis benefit protects an item You purchase against theft, \ndamage, or Involuntary and Accidental Parting within \none hundred twenty (120) days (ninety (90) days for \nNew York residents) from the date of purchase. You are \neligible for this benefit when You charge all or a portion of \nthe cost of the eligible item to Your Covered Card and/or use \nredeemable Rewards.\nWhat’s Covered?\nThe benefit applies to purchases made both inside and outside \nthe U.S. Eligible items given as gifts can also be covered.']","The Purchase Protection coverage window on the United Explorer Card protects an item you purchase against theft, damage, or Involuntary and Accidental Parting within one hundred twenty (120) days (ninety (90) days for New York residents) from the date of purchase.","The United Explorer Card Purchase Protection covers eligible items within 120 days from the date of purchase, or 90 days for New York residents.",1.0,0.8192629303887924,1.0,0.19999999998,United Explorer,exact_term,,2026-04-19T13:01:11.156750
What are the Trip Cancellation and Interruption Insurance limits on the United Explorer Card?,"['25\nover which neither the Common Carrier nor the Covered \nTraveler have control, the term of coverage shall be automatically \nadjusted in accordance with such delay or change.\nWhat Are Covered Travel Expenses?\nCoverage provides reimbursement for the following covered \ntravel expenses resulting from the cancellation or interruption \nof the Covered Traveler’s Trip due to a covered reason:\n•  Non-Refundable prepaid travel expenses charged by the \nCommon Carrier\n•  Change fees imposed by the Common Carrier to change the \ndate and/or time of prescheduled travel arrangements of a \nTrip that has not been cancelled; Change fees do not include a \nchange in Common Carrier fare or new Common Carrier fares\n•  Redeposit fees imposed by the Rewards \nprogram administrator\nFor Trip Interruption only:\nWhen the Trip is interrupted due to the need for necessary \nmedical treatment for a covered reason, this benefit also \nreimburses ground transportation expenses up to $250 to \ndirectly transport the Covered Traveler to the airport, terminal \nor station of departure, and/or between the arrival airport, \nterminal or station and their residence. This does not include \ntransportation in vehicles operated by a medical facility or \nspecifically designed to transport sick or injured individuals.\nWhat Losses Are Covered?\nThis benefit provides coverage for the covered reasons listed \nbelow. It doesn’t provide coverage if the Covered Traveler \nsimply chooses to change plans, is not feeling well but still able \nto travel, or the Covered Traveler can reach their destination \nbut decides not to travel. Any event/incident that occurred prior \nto the Trip being booked is not covered. Please see “What’s Not \nCovered?” for additional restrictions.', '24\nferries and cruise ships, but does not include taxis, car service, \nrental car, rideshare service, commuter rail or commuter \nbus lines\nCovered Card - the credit card or Account that is eligible for \nbenefits as designated by JPMorgan Chase Bank, N.A. and/or \nits affiliates\nCovered Traveler - You and Your Immediate Family Member\nDomestic Partner - a committed relationship between two \nunmarried adults, in which the partners, (1) are each other’s \nsole Domestic Partner, (2) maintain a common residence, \n(3) share at least one (1) of the following financial arrangements: \na joint mortgage or lease, a joint bank account, joint title to or \nownership of a motor vehicle or status as a joint lessee on a \nmotor vehicle lease or a joint credit card account with a financial \ninstitution, (4) are not married or joined in a civil union to \nanyone else or are not the Domestic Partner of anyone else, and \n(5) are not blood related\nImmediate Family Member - spouse or Domestic Partner and \nlegally dependent children under the age of twenty-six (26)\nYou and Your - an individual to whom a Covered Card Account \nhas been issued by JPMorgan Chase Bank, N.A. and/or \nits affiliates\nTravel and Emergency Assistance services are sourced \nby Virginia Surety Company, Inc, an Assurant company, \nand are performed by a third party provider. This is not an \ninsurance benefit.\nTEAS_20240311\nTrip Cancellation and \nInterruption Insurance\nThis benefit provides reimbursement for covered travel \nexpenses if a Trip is cancelled or interrupted due to a covered \nreason. Coverage is limited to the lesser of the following:\n• $1,500 per Covered Traveler\n• $6,000 per Trip for all Covered Travelers\n•  the actual amount charged to the Covered Card and/or \nredeemable Rewards used for a covered travel expense\nNote: Eligible purchases made with redeemable Rewards will be \nreimbursed in dollars.\nThe Covered Traveler is covered when You charge all or a \nportion of the cost of the Trip to Your Covered Card and/or use \nredeemable Rewards. Covered Travelers do not need to be \ntraveling with You for benefits to apply.', '27\nPlease Pay Special Attention to These Conditions:\n•  Be aware of the Common Carrier’s cancellation provisions. \nIf the Covered Traveler suffers a loss causing Trip Cancellation \nor Trip Interruption, they must immediately notify the \nappropriate Common Carrier. If such notification by the \nCovered Traveler does not occur and failure to notify the \nCommon Carrier results in the surrender of Non-Refundable \ncovered travel expenses, that would have otherwise been \nrefundable had they notified the Common Carrier, no benefit \nshall be payable. If a loss prevents the Covered Traveler from \nproviding the notification, the benefit may still apply.\n•  No coverage will be provided for a Trip that is scheduled to \nlast longer than sixty (60) days.\n•  In the event the Covered Traveler’s Trip Cancellation or Trip \nInterruption results in the issuance of a credit voucher by \nthe Common Carrier for the value of the unused portion of \nthe Trip, no benefits shall be payable for that portion of the \ncovered travel expenses for which the credit voucher was \nissued until it expires.\n•  We will not reimburse additional transportation expenses \nincurred by the Covered Traveler other than those described \nabove. This includes the difference in cost between the \noriginal fare or any new fare to return home or rejoin the Trip.\nThis benefit is secondary and payable on an excess basis over \nand above any amount due from any other valid or collectible \ninsurance or any other form of reimbursement payable by those \nresponsible for the loss.\nWhat’s Not Covered?', 'Covered Travelers do not need to be \ntraveling with You for benefits to apply.\nWhen is the Covered Traveler Covered?\nFor Trip Cancellation:\nCoverage begins on the initial deposit or booking date of the \nTrip and ends at the point and time of departure on the Trip \nDeparture Date.\nFor Trip Interruption:\nCoverage begins on the Trip Departure Date and ends on the \nTrip Completion Date.\nIn the event the Trip Departure Date and/or the Trip Completion \nDate are delayed, or the point and time of departure and/or \npoint and time of return are changed because of circumstances', 'What’s Covered?\nThe benefit applies to purchases made both inside and outside \nthe U.S. Eligible items given as gifts can also be covered.\nCoverage is limited to the lesser of the following:\n• The cost to repair item\n•  The cost to replace the item with an item of like kind \nand quality\n•  The amount charged to the Covered Card and/or redeemable \nRewards used (excluding shipping and handling)\n•  $10,000 per item and a maximum of $50,000 per \ncalendar year\nNote: Eligible purchases made with redeemable Rewards will be \nreimbursed in dollars.\nIf a loss involves a portion of a pair or set, You will only be \nreimbursed for the item that was stolen, damaged, or part of \nan Involuntary and Accidental Parting, not the total value of the \npair or set. This does not apply to items normally sold as pairs \nor sets that are not replaceable by purchasing one piece of \nthe pair or set. You may be asked to send the individual item,']","The Trip Cancellation and Interruption Insurance limits on the United Explorer Card are as follows:
- $1,500 per Covered Traveler
- $6,000 per Trip for all Covered Travelers
- The actual amount charged to the Covered Card and/or redeemable Rewards used for a covered travel expense.","The United Explorer Card provides Trip Cancellation and Interruption Insurance up to $1,500 per covered traveler and $6,000 per trip for all covered travelers.",1.0,0.9669398718025426,1.0,0.49999999995,United Explorer,benefit_detail,,2026-04-19T13:01:11.156750
What is the Trip Delay Reimbursement threshold and maximum on the Capital One Venture X?,"['•  This benefit is provided to eligible cardholders at no \nadditional cost. The terms and conditions contained in \nthis Guide to Benefits may be modified by subsequent \nendorsements. Modifications to the terms and conditions \nmay be provided via additional Guide to Benefits mailings, \nstatement inserts, statement messages or electronic \nnotification. The benefits described in this Guide will not \napply to cardholders whose Accounts have been suspended \nor cancelled. \n•  Termination dates may vary by financial institutions. Your \nfinancial institution can cancel or non-renew the benefits \nfor cardholders, and if they do, they will notify You at least \nthirty (30) days in advance. Federal Insurance Company \n(“Provider”) is the underwriter of these benefits and is solely \nresponsible for its administration and claims. The Plan \nAdministrator provides services on behalf of the Provider. \n•  After the Plan Administrator has paid Your claim, all Your \nrights and remedies against any party in respect of this \nclaim will be transferred to the Plan Administrator to the \nextent of the payment made to You. You must give the Plan \nAdministrator all assistance as may reasonably be required \nto secure all rights and remedies. \n•  This benefit does not apply to the extent that trade or \neconomic sanctions or other laws or regulations prohibit \nthe provision of insurance, including, but not limited to, the \npayment of claims.\nFORM #TRCAN – 2017 (04/17)                                                                               TC-I\nFor more information about the benefit described in this \nguide, please contact the Plan Administrator.\nTrip Delay Reimbursement\nHaving a Covered Trip delayed can mean more than just lost \ntime; it can also create an additional cost that You weren’t \nexpecting to pay.\nTrip Delay Reimbursement covers up to a maximum of five \nhundred dollars ($500.00) for each purchased ticket, for \nreasonable additional expenses incurred when a Covered Trip \nYou purchased with Your eligible Account and/or rewards \nprogram associated with Your covered Account is delayed \nfor more than six (6) hours or requires an overnight stay. The \nbenefit is limited to one claim per Covered Trip. To be eligible \nfor this coverage, You need to purchase either a portion or the \nentire cost of Your Common Carrier fare using Your Account.', 'excess amount once all other reimbursement has \nbeen exhausted up the limit of liability. \nWhat is covered?\nYour reasonable additional expenses, such as meals and \nlodging, may be reimbursed as long as: \n•  A portion of the fare was purchased with an eligible Account \nand/or rewards program associated with Your covered \nAccount\n•  Your Covered Trip was delayed for more than six (6) hours or \nrequired an overnight stay due to Covered Hazards \n•  Your Covered Trip is for a period of travel that does not \nexceed three hundred and sixty-five (365) days\nWhat is not covered?\n•  Any delay due to a Covered Hazard which was made public \nor made known to You prior to Your departure.\n•  Any pre-paid expenses related to Your Covered Trip, such as \ntour or activity fees associated with Your Covered Trip.\nHow to file a Trip Delay Reimbursement claim\nWithin thirty (30) days of the Covered Trip delay, call \nthe Benefit Administrator at 1-800-825-4062, or call \ncollect outside the U.S. at 1-804-965-8071 . The Benefit \nAdministrator will ask You for some preliminary claim \ninformation and send You a claim form.\nWithin ninety (90) days of the date of Your Covered Trip \ndelay, return Your completed and signed claim form and the \nrequested documentation below to the following address:\nCard Benefit Services\nP .O. Box 72034\nRichmond, VA 23255\nPlease submit the following documents:\n•  A copy of the detailed original and updated travel itinerary \nand/or the Common Carrier tickets\n•  A copy of Your monthly billing statement (showing the \nlast four [4] digits of the Account number) confirming the \nCommon Carrier ticket was charged to the covered Account. \nOnly applicable if the travel itinerary does not reflect the last \nfour (4) digits of the Account number.\n•  If more than one method of payment was used, please \nprovide documentation as to additional currency, voucher, \npoints or any other payment method utilized\n•  Tickets reflecting the total amount charged for the claimed \nCovered Trip\n•  A statement from the Common Carrier explaining the \nreason for the delay\n•  Copies of itemized receipts for Your claimed expenses.', 'The \nbenefit is limited to one claim per Covered Trip. To be eligible \nfor this coverage, You need to purchase either a portion or the \nentire cost of Your Common Carrier fare using Your Account. \nYou, Your spouse and Your dependent children under twenty-\ntwo (22) years of age are automatically covered when You \ncharge Your Covered Trip’s Common Carrier fare to Your \neligible Account and/or rewards program associated with Your \ncovered Account. \nThis benefit is supplemental coverage, which means \nthat reasonable expenses during the delay not \notherwise covered by Your Common Carrier, another \nparty or Your primary personal insurance policy, \nmay be reimbursed up to a maximum of five hundred \ndollars ($500.00) per ticket. You will be refunded the \n7\nBR414848_M133789_LetterSize.indd   7BR414848_M133789_LetterSize.indd   7 7/15/21   11:58 AM7/15/21   11:58 AM', 'For \nfood expenses, receipts are required, however itemized \nreceipts are only required for bills of fifty dollars ($50.00) or \nmore per covered traveler.\n•  Any other documentation deemed necessary by the Benefit \nAdministrator to substantiate the claim\nFailure to contact the Benefit Administrator or return the \ncompleted claim form and documentation within the time \nperiods indicated above may result in the denial of Your \nclaim.\nFor faster filing, or to learn more about  \nTrip Delay Reimbursement, visit   \nwww.eclaimsline.com\nDefinitions\nAccount means your eligible credit card account.\nCommon Carrier means any land, water, or air conveyance \noperating for hire under a valid license for the transportation \nof passengers and for which a ticket must be purchased prior \nto commencing travel. Common Carrier does not include taxis, \nlimousine services, or commuter rail or commuter bus lines or \nrental vehicles.\nCovered Trip means a period of travel that does not exceed \nthree hundred and sixty-five (365) days away from the Eligible \nPerson’s residence to a destination other than the Eligible \nPerson’s city of residence for which the Eligible Person charges \nthe cost of transportation by Common Carrier to the Account \nand/or rewards programs associated with the covered Account.\nCovered Hazards means equipment failure, inclement \nweather, strike and hijacking/skyjacking.\nEligible Person means a cardholder who pays for their \nCovered Trip by using their eligible Account and/or rewards \nprograms associated with their covered Account.\nFamily Member means Your spouse or legally dependent \nchildren under age eighteen (18) [twenty-five (25) if enrolled as \na full-time student at an accredited university].\nYou or Your means an Eligible Person or Your Family Members \nwho charged their Covered Trip to Your eligible Account and/\nor rewards programs associated with Your covered Account. \nPlease see “General Provisions” section at the end of this \ndocument.\nFORM#TRIP 12-300-2017 (04/17)                                                                TD-O\nFor more information about the benefit described in this \nguide, call the Benefit Administrator at 1-800-825-4062, \nor call collect outside the U.S. at 804-965-8071.', 'Trip Interruption means the Insured Person’s Covered Trip \nis interrupted either on the way to the Covered Trip point of \ndeparture or after the Covered Trip departure.\nYou or Yours means an Insured Person who purchase their \ntrip to the Insured person’s covered Account and/or rewards \nprograms associated with the Insured Person’s covered Account.\nAdditional provisions for Trip Cancellation and Interruption\n•  As a handy reference guide, please read this and keep it in a \nsafe place with Your other insurance documents. \n•  This description of coverage is not a contract of insurance \nbut is simply an informative statement of the principal \nprovisions of the insurance while in effect. Complete \nprovisions pertaining to this plan of insurance are contained \nin the master policy, on file with the Policyholder: BNY \nMidwest Trust Company as trustee of the Chubb Financial \nInstitution Group Insurance Trust for the Account of \nparticipating financial institutions. Policy #: 6478-07-74\n•  Signed or pinned transactions are covered as long as You \nuse Your eligible card to secure the transaction. \n•  You shall do all things reasonable to avoid or diminish any \nLoss covered by this benefit. This provision will not be \nunreasonably applied to avoid claims. \n•  If You make any claim knowing it to be false or fraudulent \nin any respect, no coverage shall exist for such claim, and \nYour benefit may be cancelled. Each cardholder agrees \nthat representations regarding claims will be accurate and \ncomplete. Any and all relevant provisions shall be void in any \ncase of fraud, intentional concealment, or misrepresentation \nof material fact. \n•  No legal action for a claim may be brought against the \nProvider until sixty (60) days after the Provider receives Proof \nof Loss. No legal action against the Provider may be brought \nmore than two (2) years after the time for giving Proof of \nLoss. Further, no legal action may be brought against the \nProvider unless all the terms of the Guide to Benefits have \nbeen complied with fully. \n•  This benefit is provided to eligible cardholders at no \nadditional cost. The terms and conditions contained in \nthis Guide to Benefits may be modified by subsequent \nendorsements.']","The Trip Delay Reimbursement on the Capital One Venture X covers up to a maximum of five hundred dollars ($500.00) for each purchased ticket, for reasonable additional expenses incurred when a Covered Trip is delayed for more than six (6) hours or requires an overnight stay.",The Capital One Venture X Trip Delay Reimbursement applies when the delay exceeds 6 hours or requires an overnight stay. The maximum benefit is $500 per purchased ticket.,0.6666666666666666,0.9019599360160844,1.0,0.99999999995,Capital One Venture X,benefit_detail,,2026-04-19T13:01:11.156750
What does the Baggage Delay Insurance cover on the United Explorer Card and what is the maximum benefit?,"['31\nTrip Delay Reimbursement\nThis benefit provides reimbursement for reasonable expenses \nincurred by the Covered Traveler during a delay due to a \ncovered reason while on a Trip. This benefit applies if the \nCovered Traveler’s Common Carrier is delayed for more \nthan twelve (12) hours or requires an overnight stay. The \nmaximum benefit is $500 per Covered Traveler per Trip.\nThe Covered Traveler is covered when You charge all or a \nportion of the cost of the Common Carrier fare to Your Covered \nCard and/or use redeemable Rewards. Covered Travelers do not \nneed to be traveling with You for benefits to apply.\nWhen is the Covered Traveler Covered?\nBenefits begin on the Trip Departure Date and end on the Trip \nCompletion Date.\nIn the event the Trip Departure Date or Trip Completion Date \nare delayed or changed by the Common Carrier because \nof circumstances over which the Covered Traveler nor the \nCommon Carrier have control, the term of coverage shall be \nautomatically adjusted in accordance with such change.\nWhat’s Covered?\nThis benefit covers reasonable additional expenses incurred \nby the Covered Traveler during the delay, until travel by the \nCovered Traveler becomes possible. Reasonable expenses \ninclude meals, lodging, toiletries, and medication.\nTo take advantage of this benefit, the delay must occur \ndue to equipment failure, inclement weather, strike, \nor hijacking/skyjacking.\nThis benefit is secondary and payable on an excess basis over \nand above any amount due from any other valid or collectible \ninsurance or any other form of reimbursement payable by those \nresponsible for the loss.\nHow Do You File a Claim?\nFollow these steps to file a claim:\n1.  Visit chasecardbenefits.com or call 1-800-350-2919 \nwithin sixty (60) days of the Trip delay or as soon as \nreasonably possible.\n2.  We will ask Yo u a few questions and let You know what \ndocumentation is needed. The requested documents must be \nsubmitted within one hundred (100) days of the of the delay \nor as soon as reasonably possible.', '6\nWe, Us and Our - Virginia Surety Company, Inc., an Assurant \ncompany, the insurance company that provides these benefits \nfor the Covered Card\nYou and Your - an individual to whom a Covered Card Account \nhas been issued by JPMorgan Chase Bank, N.A. and/or \nits affiliates\nARCDW_CON_$60K_PRIMARY_20240311\nBaggage Delay Insurance\nThis benefit provides reimbursement for the emergency \npurchase of essential personal items when the Covered \nTraveler’s Checked Baggage is delayed while on a Trip. This \nbenefit applies if the Covered Traveler’s Checked Baggage is \ndelayed or misdirected by the Common Carrier for more than \nsix (6) hours from the time the Covered Traveler arrives at their \ndestination. The maximum benefit is $100 per day after the \ninitial six (6) hour delay, and for each additional twenty-four (24) \nhour period, up to a maximum of three (3) days.\nThe Covered Traveler is covered when You charge all or a \nportion of the cost of the Common Carrier fare to Your Covered \nCard and/or use redeemable Rewards. Covered Travelers do not \nneed to be traveling with You for benefits to apply.\nWhen is the Covered Traveler Covered?\nBenefits begin on the Trip Departure Date and end on the Trip \nCompletion Date.\nThere is no coverage when the Covered Traveler returns to their \npoint of origin.\nWhat’s Covered?\nThis benefit covers essential personal items that the Covered \nTraveler(s) may need when their baggage is delayed, such \nas toiletries, a change of clothes, and chargers for electronic \ndevices (limit one per device).\nPlease Pay Special Attention to These Conditions:\n•  Baggage delay must be reported to the Common Carrier to be \neligible for this benefit.\nThis benefit is secondary and payable on an excess basis over \nand above any amount due from any other valid or collectible \ninsurance or any other form of reimbursement payable by those \nresponsible for the loss.\nWhat’s Not Covered?', '11\nLost Luggage Reimbursement\nThis benefit provides reimbursement for the difference between \nthe actual cash value (replacement cost less depreciation) and \nany reimbursement provided by the Common Carrier for the \ncosts the Covered Traveler incurs to repair or replace their \nChecked Baggage, Carry-On Baggage, and/or personal property \ncontained within that is lost, damaged, or stolen. The maximum \nbenefit is $3,000 per Covered Traveler per Trip (additionally, \nNew York residents are limited to $2,000 per bag and $10,000 \nfor all Covered Travelers per Trip). The maximum benefit per \nCovered Traveler per Trip includes a sub-limit up to $500 for \njewelry and watches and a sub-limit up to $500 for cameras \nand other electronic equipment. The benefit amounts for \njewelry, watches, cameras, and other electronic equipment are \npart of and not in addition to the maximum benefit amount. \nPayment of these benefit amounts reduces and does not \nincrease the maximum benefit.\nItems the Covered Traveler inadvertently leaves behind on \nthe Common Carrier are not considered lost or stolen.\nThe Covered Traveler is covered when You charge all or a \nportion of the cost of the Common Carrier fare to Your Covered \nCard and/or use redeemable Rewards. Covered Travelers do not \nneed to be traveling with You for benefits to apply.\nCoverage for Checked Baggage begins when baggage is checked \nin and is under the care and control of the Common Carrier and \nends when baggage has been retrieved by the Covered Traveler \nfrom the Common Carrier pick up area.\nCoverage for Carry-On Baggage begins when the Covered \nTraveler boards the Common Carrier and ends when the \nCovered Traveler exits the Common Carrier.\nPlease Pay Special Attention to These Conditions:\n•  If the Covered Traveler’s Checked Baggage is lost, stolen, or \ndamaged by the Common Carrier, the loss must be reported \nto the Common Carrier (within their required timeframe for \nnotification) to be eligible for this benefit.\n•  If the Covered Traveler’s Carry-On Baggage is lost, stolen, or \ndamaged while on the Common Carrier, it must be reported \nto the Common Carrier as soon as the Covered Traveler exits \nthe Common Carrier.', '2\nYour Guide to Benefits describes the benefit that is in effect as \nof 10/01/24. Information in this guide takes the place of any \nprior benefit and benefit description you may have previously \nreceived. Your effective date of eligibility is determined \nby Chase. \nPlease keep the guide with your account information for future \nreference and call the benefit administrator if you have any \nquestions before taking advantage of the benefit.\nIf you have any questions please call 1-800-350-2919 or if you \nare outside the U.S., call collect at 001-214-503-2953.\nTABLE OF CONTENTS\nAuto Rental Coverage 3\nBaggage Delay Insurance 6\nExtended Warranty Protection 8\nLost Luggage Reimbursement 11\nPurchase Protection 13\nRoadside Assistance 15\nTravel Accident Insurance 17\nTravel and Emergency Assistance 22\nTrip Cancellation and Interruption Insurance 24\nTrip Delay Reimbursement 31\nAdditional Terms 33', '•  If the Covered Traveler’s Carry-On Baggage is lost, stolen, or \ndamaged while on the Common Carrier, it must be reported \nto the Common Carrier as soon as the Covered Traveler exits \nthe Common Carrier.\nThis benefit is secondary and payable on an excess basis over \nand above any amount due from any other valid or collectible \ninsurance or any other form of reimbursement payable by those \nresponsible for the loss.\nWhat’s Not Covered?\nThis benefit does not apply to loss or theft of the following:\n•  Items that have been removed from Carry-On Baggage by \nthe Covered Traveler and inadvertently left behind on the \nCommon Carrier\n• Documents or valuable papers\n• Money\n• Securities\n• Tickets\n• Checks\n• Travelers’ checks\n• Furs\nThis benefit does not apply to any loss caused by, or resulting \nfrom, directly or indirectly: War, undeclared war, civil war,']","The Baggage Delay Insurance on the United Explorer Card provides reimbursement for the emergency purchase of essential personal items when the Covered Traveler’s Checked Baggage is delayed or misdirected by the Common Carrier for more than six (6) hours from the time the Covered Traveler arrives at their destination. The maximum benefit is $100 per day after the initial six (6) hour delay, and for each additional twenty-four (24) hour period, up to a maximum of three (3) days.","The United Explorer Card Baggage Delay Insurance provides $100 per day after the initial 6-hour delay, for each additional 24-hour period, up to a maximum of 3 days. It covers essential personal items like toiletries, a change of clothes, and chargers for electronic devices.",1.0,0.9243909276260089,1.0,0.49999999995,United Explorer,benefit_detail,,2026-04-19T13:01:11.156750
What is the Lost Luggage Reimbursement maximum on the Capital One Venture X?,"['Only Your Checked Luggage and/\nor Carry-On Baggage and/or its contents is covered.\nThis benefit is supplemental to and excess of any collectible \ninsurance and/or collectible reimbursement from any other \nsource. The Benefit Administrator will refund the excess \namount once all other reimbursement has been exhausted \nup to the limit of liability.\nPlease Note: You must take all reasonable means to protect, \nsave and/or recover Your Checked Luggage and/or Carry-on \nBaggage and/or its contents at all times.\nWhat is not covered?\nLuggage Reimbursement does not apply to loss or theft of the  \nfollowing items: \n•  Automobiles, automobile accessories and/or equipment, \nmotorcycles, motors, bicycles (except when checked \nwith the Common Carrier), boats, or other vehicles or \nconveyances\n•  Contact lenses, eyeglasses, sunglasses, hearing aids, artificial \nteeth, dental bridges, and prosthetic limbs\n•  Money, securities, credit or debit cards, checks, and \ntravelers’ checks\n•  Tickets, documents (travel or otherwise), keys, coins, deeds, \nbullion, stamps, perishables, consumables, perfume, \ncosmetics, rugs and carpets, animals, cameras, sporting \nequipment, and household furniture\n•  Property shipped as freight or shipped prior to the Covered \nTrip departure date\n•  Items specifically identified or described in and insured \nunder any other insurance policy\n•  Losses arising from confiscation or expropriation by any \ngovernment or public authority or detention by customs or \nother officials\n•  Losses resulting from abuse, fraud, hostilities of any kind \n(including, but not limited to, war, invasion, rebellion, or \ninsurrection)\n•  Business items (items that are used in the purchase, sale, \nproduction, promotion, or distribution of goods or services \nincluding but not limited to, manuals, computers and their \naccessories, software, data, facsimile, samples, collateral \nmaterials, etc.), cellular telephones, or art objects\nHow to file a Lost Luggage Reimbursement claim\nImmediately notify the Common Carrier to begin their claims \nprocess if Your luggage and/or its contents are lost or stolen.', 'As a handy reference guide, please read this and keep it \nin a safe place with your other insurance documents. This \ninformation is a brief description of the important features of \nthis insurance plan. It is not an insurance contract. Insurance \nbenefits are underwritten by Federal Insurance Company. \nCoverage may not be available in all states or certain terms may \nbe different where required by state law. Chubb NA is the U.S.-\nbased operating division of the Chubb Group of Companies, \nheaded by Chubb Ltd. (NYSE:CB) Insurance products and \nservices are provided by Chubb Insurance underwriting \ncompanies and not by the parent company itself.\nLost Luggage Reimbursement\nHave You ever been waiting for Your Checked Luggage to come \naround the belt only to find that it has been lost by Your airline? \nFortunately, Lost Luggage Reimbursement is here to help. \nWith Lost Luggage Reimbursement, You can be reimbursed \nfor the difference between the “value of the amount claimed” \nand the Common Carrier’s payment up to three thousand \ndollars ($3,000.00) per Covered Trip (for New York \nresidents, coverage is limited to two thousand dollars \n($2,000.00) per bag), provided the Checked Luggage and/\nor Carry-on Baggage and/or its contents was lost due to \ntheft or misdirection by the Common Carrier. “Value of the \namount claimed” is the lesser of the following three amounts: \nthe original purchase price of the item(s), the actual cash \nvalue of the item(s) at the time of theft or misdirection (with \nappropriate deduction for depreciation), and the cost to \nreplace the item(s). \nYou and Your Immediate Family Members are all eligible for \nthis benefit when You take a Covered Trip and pay for the cost \nof Your Common Carrier tickets with Your eligible card issued \nin the United States and/or rewards program associated with \nYour covered Account. To be eligible for coverage, You must \npurchase a portion or the entire cost of the Covered Trip with \nYour covered Account and/or rewards program associated \nwith Your covered Account. Only Your Checked Luggage and/\nor Carry-On Baggage and/or its contents is covered.', 'The \nbenefit is limited to one claim per Covered Trip. To be eligible \nfor this coverage, You need to purchase either a portion or the \nentire cost of Your Common Carrier fare using Your Account. \nYou, Your spouse and Your dependent children under twenty-\ntwo (22) years of age are automatically covered when You \ncharge Your Covered Trip’s Common Carrier fare to Your \neligible Account and/or rewards program associated with Your \ncovered Account. \nThis benefit is supplemental coverage, which means \nthat reasonable expenses during the delay not \notherwise covered by Your Common Carrier, another \nparty or Your primary personal insurance policy, \nmay be reimbursed up to a maximum of five hundred \ndollars ($500.00) per ticket. You will be refunded the \n7\nBR414848_M133789_LetterSize.indd   7BR414848_M133789_LetterSize.indd   7 7/15/21   11:58 AM7/15/21   11:58 AM', '), cellular telephones, or art objects\nHow to file a Lost Luggage Reimbursement claim\nImmediately notify the Common Carrier to begin their claims \nprocess if Your luggage and/or its contents are lost or stolen. \nWithin twenty (20) days of the date Your luggage is lost or stolen, \nand You have notified the Common Carrier and begun their \nclaims process, call the Benefit Administrator at 1-800-825-4062 \n, or call collect outside the U.S. at 1-804-965-8071. The Benefit \nAdministrator will ask You for some preliminary claim information \nand send You a special claim form. If You do not notify the \nBenefit Administrator within twenty (20) days of the date \nthe luggage was lost or stolen, Your claim may be denied.', 'THE COST: This travel insurance plan is provided at no \nadditional cost to eligible Capital One Visa Infinite cardholders. \nCapital One pays the premium for the insurance.\nBENEFICIARY: The Loss of Life benefit will be paid to the \nbeneficiary designated by the insured. If no such designation \nhas been made, that benefit will be paid to the first surviving \nbeneficiary in the following order: a) the Insured’s spouse, \nb) the Insured’s children, c) the Insured’s parents, d) the \nInsured’s brothers and sisters, e) the Insured’s estate. All other \nindemnities will be paid to the Insured.\nTHE BENEFITS: The full Benefit Amount of $1,000,000.00 is \npayable for accidental loss of life, two or more members, sight \nof both eyes, speech and hearing or any combination thereof. \nOne half of the Benefit Amount is payable for accidental loss \nof: one member, sight of one eye, speech or hearing. One \nquarter of the Benefit Amount is payable for the accidental \nloss of the thumb and index finger of the same hand.\nMember means hand or foot. Loss means, with respect to \na hand, complete severance through or above the knuckle \njoints of at least 4 fingers on the same hand; with respect to \na foot, complete severance through or above the ankle joint. \nThe Company will consider it a loss of hand or foot even if they \nare later reattached. Benefit Amount means the Loss amount \napplicable at the time the entire cost of the passenger fare is \ncharged to your Capital One Visa Infinite account. Accident \nor Accidental means a sudden, unforeseen and unexpected \nevent happening by chance. Accidental Bodily Injury(ies) \nmeans bodily injury which is Accidental, is the direct source \nof a Loss, is independent of disease, illness or other cause and \noccurs while this policy is in force. Covered Trip means travel \non a Common Carrier when the entire cost of the passenger \nfare for such transportation, less redeemable certificates, \nvouchers or coupons, has been charged to an Insured Person’s \nAccount issued by the Policyholder.']","The Lost Luggage Reimbursement maximum on the Capital One Venture X is up to three thousand dollars ($3,000.00) per Covered Trip. For New York residents, coverage is limited to two thousand dollars ($2,000.00) per bag.","The Capital One Venture X provides Lost Luggage Reimbursement up to $3,000 per covered traveler per trip, with sub-limits of $500 for jewelry and watches, and $500 for cameras and other electronic equipment.",0.5,0.9840439682000875,0.5,0.99999999995,Capital One Venture X,benefit_detail,,2026-04-19T13:01:11.156750
What dining credits does the Amex Gold card offer?,"['Statement credit(s) may not be received or may be reversed if an eligible\npurchase is returned, refunded, cancelled, or modified.\nAmerican Express also relies on information provided to us by the merchant to identify eligible\npurchases. If American Express does not receive information that identifies the transaction as an\neligible purchase, the Account will not receive the statement credit. For example, the transaction may\nnot be eligible if: it is not made directly with the merchant, it is made at a merchant located within\nanother establishment (e.g. a restaurant inside a hotel or department store), it is for a non-dining\npurchase (e.g. Resy-branded American Express® gift cards or merchandise that features Resy\nbranding or is sold at Resy restaurants), the merchant uses a third-party to process or submit the\ntransaction to American Express (e.g. using mobile or wireless card readers), or you make a\npurchase using a third-party (e.g. a third-party payment platform or food delivery service).\nIf the Card Account is cancelled or past due, it may not qualify to receive a statement credit. If\nAmerican Express, in its sole discretion, determines that you have engaged in or intend to engage in\nany manner of abuse, misuse, or gaming in connection with this benefit, American Express will not\nhave an obligation to provide statement credits and may reverse any statement credits provided to\nyou. If your Card is enrolled in the benefit and you replace your Card, please check the Benefits\nsection of your americanexpress.com account, mobile app or call the number on the back of your\nCard to confirm your continued enrollment in the benefit. If a charge for an eligible purchase is\nincluded in a Pay Over Time balance on your Card Account, the statement credit associated with that\ncharge may not be applied to that Pay Over Time balance. Instead, the statement credit may be\napplied to your Pay In Full balance. For additional information, call the number on the back of your\nCard.\n$120 Dining Credit\nEnrollment is required to receive this benefit. Only the Basic Card Member or Authorized Account\nManager(s) on a U.S. Consumer Gold Card Account can enroll in the benefit. U.S. Consumer\nTraditional Gold, Senior Gold, and Classic Gold are not eligible.', 'Only the Basic Card Member or Authorized Account\nManager(s) on a U.S. Consumer Gold Card Account can enroll in the benefit. U.S. Consumer\nTraditional Gold, Senior Gold, and Classic Gold are not eligible. Eligible purchases must be charged\nto a Card Member on the enrolled Card Account for the benefit to apply. Purchases by both the Basic\nCard Member and Additional Card Members on the enrolled Card Account are eligible for statement\ncredits. However, each Card Account is eligible for up to a $10 statement credit per month, for a total\nof $120 per calendar year in statement credits across all Cards on the Account. Participating partners\nare Grubhub (including Seamless), The Cheesecake Factory, Goldbelly, Wine.com and Five Guys. In-\nperson transactions and online orders only valid if made from participating partner locations in the\nU.S. If American Express does not receive information that identifies your transaction as eligible for\n4/17/26, 7:28 PM American Express® Gold Card - Terms, Conditions & Disclosures\nhttps://www.americanexpress.com/us/credit-cards/card-application/apply/supplementary/terms/gold-card/39161-9-0 3/17', 'The annual fee for the American Express Gold Card is $325. There is no annual fee for up to 5\nAdditional Cards. The annual fee for 6 or more Additional Cards is $35 for each Card.\nBENEFIT TERMS\nThe following benefits and services are subject to change or cancellation.\n$100 Resy Credit\nEnrollment through American Express is required to receive this benefit. Only the Basic Card Member\nor Authorized Account Manager(s) on a U.S. Consumer American Express® Gold Card Account can\nenroll in the benefit in the Benefits section of their americanexpress.com online account or by calling\nthe number on the back of their Card. This benefit is not available to Classic Gold, Traditional Gold,\nor Senior Gold Card Members. Enrolled Basic Card Members can earn up to $50 in statement credits\nsemi-annually when the Basic Card or Additional Cards on the enrolled Account are used to pay for\neligible Resy purchases. However, each enrolled Card Account is only eligible for up to $50 in\n®\n®\n4/17/26, 7:28 PM American Express® Gold Card - Terms, Conditions & Disclosures\nhttps://www.americanexpress.com/us/credit-cards/card-application/apply/supplementary/terms/gold-card/39161-9-0 2/17', ""Any limit will not be\napplied to Charges for foreign currency or for travelers cheques or gift cheques obtained other than\nby telephone from us.\nThe Spending Limit for the Additional Card Member(s) is optional. If no Spending Limit is set on the\nAdditional Card, spending capacity on this Card will be subject to the Basic Card Member's account\nterms and conditions.\nThe Gold Card Membership Rewards\nBasic Card Members will earn one point for each dollar charged for an eligible purchase in each\nbilling period on The American Express Gold Card or an Additional Card on their Account. Basic Card\nMembers will earn: 3 additional points (for a total of 4 points) on the first $50,000 of eligible\npurchases per calendar year at restaurants worldwide; 3 additional points (for a total of 4 points) on\nthe first $25,000 of eligible purchases per calendar year at supermarkets located in the U.S.\n(superstores, convenience stores, warehouse clubs, and meal-kit delivery services are not considered\nsupermarkets); 2 additional points (for a total of 3 points) for each dollar of eligible purchases\ncharged on airfare on a scheduled flight charged directly with passenger airlines (charter flights and\nprivate jet flights are excluded) and airfare charged directly through amextravel.com or the Amex\nTravel App ; and 1 additional point (for a total of 2 points) for each dollar of eligible purchases\ncharged through amextravel.com or the Amex Travel App  for prepaid hotels, prepaid car rentals, or\ncruise reservations (non-prepaid car rentals, non-prepaid hotels, ticketing services or other fees are\nexcluded). Bonuses you may receive with your Card on other purchase categories or in connection\nwith promotions or offers from American Express may not be combined with this benefit. Basic Card\nMembers may not earn additional points for purchases at a restaurant located within another\nestablishment (e.g., a restaurant inside a hotel, casino, or event venue), events held within a\nrestaurant, purchases at events or of event tickets, purchases made through third-party food delivery\nservices outside of the U.S., or purchases at bars, nightclubs, cafeterias, caterers, theatre clubs,\nbreweries, bakeries, and meeting venues."", 'additional points category. For example, Basic Card Members may not receive additional points\nwhen: a merchant uses a third-party to sell their products or services; or a merchant uses a third-\nparty to process or submit your transaction to us (e.g., using mobile or wireless card readers); or you\nchoose to make a purchase using a third-party payment account or make a purchase using a mobile\nor digital wallet. Please visit americanexpress.com/rewards-info for more information about rewards.\nThe Hotel Collection Program\nThe Hotel Collection (THC) benefits are available for new bookings of two consecutive nights or more\nmade through American Express Travel with participating properties and are valid only for eligible\nU.S. Consumer and Business Gold Card, Platinum Card® Members, and Centurion® Members.\nAdditional Card Members on Consumer and Business Platinum Card Accounts, and Additional Card\nMembers on Consumer and Business Centurion Accounts are also eligible for THC program benefits.\nDelta SkyMiles® Gold and Platinum Card Members are not eligible. Bookings must be made using an\neligible Card and must be paid using that Card, or another American Express® Card, in the eligible\nCard Member\'s name, and that Card Member must be traveling on the itinerary booked. Noon check-\nin, late check-out and the room upgrade are subject to availability; certain room categories are not\neligible for upgrade. The type of $100 credit and additional amenity (if applicable) varies by property;\nthe $100 credit will be applied to eligible charges up to $100. To receive the $100 credit, the eligible\nspend must be charged to your hotel room. The $100 credit will be applied at check-out. Advance\nreservations are recommended for certain credits. Benefit restrictions vary by property. Benefits are\napplied per room, per stay (with a three-room limit per stay). Back-to-back stays booked by a single\nCard Member, Card Members staying in the same room or Card Members traveling in the same party\nwithin a 24-hour period at the same property are considered one stay and are ineligible for additional\nTHC benefits (""Prohibited Action"").']","The Amex Gold card offers a $120 Dining Credit. Enrollment is required to receive this benefit, and only the Basic Card Member or Authorized Account Manager(s) on a U.S. Consumer Gold Card Account can enroll. Eligible purchases must be charged to a Card Member on the enrolled Card Account for the benefit to apply. Each Card Account is eligible for up to a $10 statement credit per month, for a total of $120 per calendar year in statement credits across all Cards on the Account. Participating partners include Grubhub (including Seamless), The Cheesecake Factory, Goldbelly, Wine.com, and Five Guys.","The Amex Gold card offers up to $120 per year in dining credits ($10 per month) at participating partners including Grubhub, The Cheesecake Factory, Goldbelly, Wine.com, Five Guys, and participating Shake Shack locations.",1.0,0.9245143579414166,1.0,0.99999999995,Amex Gold,benefit_detail,,2026-04-19T13:01:11.156750
What is the Airline Fee Credit on the Amex Platinum card?,"['$200 Airline Fee Credit\nEnrollment through American Express is required to receive the benefit. Basic Card Members on U.S.\nConsumer and Corporate Platinum Card Accounts can enroll in the benefit by making their airline\nselection in the Benefits section of their americanexpress.com online account or by calling us. Enrolled\nBasic Card Members on U.S. Consumer Platinum and U.S. Corporate Platinum Card Accounts are\neligible to receive up to $200 in statement credits per calendar year for incidental airline fees charged\nby their one selected qualifying airline to the enrolled Card Account. Purchases by both the Basic\nCard Member and Additional Card Members on the enrolled Card Account are eligible for statement\ncredits. However, the total amount of statement credits will not exceed $200 per calendar year, per\nCard Account. To receive statement credits, the Basic Card Member must select one qualifying airline\nthrough their American Express Online Account or the link for their Card below:\n• American Express Platinum Card®:\nhttps://global.americanexpress.com/card-benefits/enroll/airline-fee-credit/platinum\n• Goldman Sachs Platinum Card®:\nhttps://global.americanexpress.com/card-benefits/enroll/airline-fee-credit/goldman-platinum-card\n• Morgan Stanley Platinum Card®:\nhttps://global.americanexpress.com/card-benefits/enroll/airline-fee-credit/morgan-stanley-platinum-card\n• Charles Schwab Platinum Card®:\nhttps://global.americanexpress.com/card-benefits/enroll/airline-fee-credit/schwab-platinum-card\n• American Express Corporate Platinum Card®:\nhttps://global.americanexpress.com/card-benefits/enroll/airline-fee-credit/corporate-platinum\nQualifying airlines include Alaska Airlines, American Airlines, Delta Airlines, Hawaiian Airlines, JetBlue\nAirways, Spirit Airlines, Southwest Airlines, and United Airlines, and are subject to change. Only the\nBasic Card Member or Authorized Account Manager(s) on the Card Account can select the qualifying\nairline. Card Members who have not chosen one qualifying airline will be able to do so at any time.', ""Only the\nBasic Card Member or Authorized Account Manager(s) on the Card Account can select the qualifying\nairline. Card Members who have not chosen one qualifying airline will be able to do so at any time.\nCard Members who have already selected one qualifying airline will be able to change their choice\none time each year in January through their American Express Online Account or by calling the\nnumber on the back of the Card. Card Members who do not change their airline selection will remain\nwith their current airline. Incidental airline fees must be separate charges from airline ticket charges.\nFees not charged by the Card Member's selected airline (e.g. wireless internet and fees incurred with\nairline alliance partners) do not qualify for statement credits. Incidental airline fees charged prior to\nselection of a qualifying airline are not eligible for statement credits. Airline tickets, upgrades, mileage\npoints purchases, mileage points transfer fees, gift cards, duty free purchases, and award tickets are\nnot deemed to be incidental fees. The airline must submit the charge under the appropriate merchant\ncode, industry code, or required service or product identifier for the charge to be recognized as an\nincidental air travel fee.\nPlease allow 6-8 weeks after the qualifying incidental air travel fee is charged to your Card Account\nfor statement credit(s) to be posted to the Account. American Express relies on airlines to submit the\ncorrect information on airline transactions, so please call the number on the back of the Card if\nstatement credits have not posted after 8 weeks from the date of purchase. American Express also\nrelies on the airlines' processing of transactions to determine the transaction date. If there is a delay\nin the airline submitting the transaction to us or if the airline uses another date as the transaction\ndate then your purchase may not earn the statement credit benefit for the benefit period in which you\nmade the purchase. If you have transferred to a different Card at the time the airline submits the\ntransaction, you may not receive the statement credit. Card Members remain responsible for timely\npayment of all charges. Statement credits may not be received or may be reversed if the purchase is\ncancelled, modified, or returned. To be eligible for this benefit, Card Account(s) must be not cancelled\nand not past due at the time of statement credit fulfillment."", 'If your Card is enrolled in the benefit and you replace your Card, please check the Benefits\nsection of your americanexpress.com account, mobile app or call the number on the back of your\nCard to confirm your continued enrollment in the benefit. If a charge for an eligible purchase is\nincluded in a Pay Over Time balance on your Card Account, the statement credit associated with that\ncharge may not be applied to that Pay Over Time balance. Instead, the statement credit may be\napplied to your Pay In Full balance. For additional information, call the number on the back of your\nCard.\n$600 Hotel Credit\nBasic Card Members on U.S. Consumer Platinum Card Account are eligible to receive up to $300 in\nstatement credits semi-annually (January to June, and July to December) for up to a total of $600 per\ncalendar year, when they or Additional Platinum Card Members use their Cards to pay for eligible\nprepaid Fine Hotels + Resorts® and The Hotel Collection bookings made through American Express\n4/17/26, 7:27 PM Platinum Card® - Terms, Conditions & Disclosures\nhttps://www.americanexpress.com/us/credit-cards/card-application/apply/supplementary/terms/platinum-card/36182-9-0 10/40', 'However, eligible Card\nMembers can earn no more than one credit for up to $85 for TSA PreCheck or $120 credit for Global\nEntry (but not both programs), depending upon the program the Card Member first applies for, for an\napplication fee charged to an eligible Card. American Express has no control over the application\n®\n®\n®\n®\n®\n® ®\n®\n®\n4/17/26, 7:27 PM Platinum Card® - Terms, Conditions & Disclosures\nhttps://www.americanexpress.com/us/credit-cards/card-application/apply/supplementary/terms/platinum-card/36182-9-0 20/40', 'To be eligible for this benefit, Card Account(s) must be not cancelled\nand not past due at the time of statement credit fulfillment. If American Express, in its sole discretion,\ndetermines that you have engaged in or intend to engage in any manner of abuse, misuse, or\ngaming in connection with this benefit, American Express will not have an obligation to provide\nstatement credits and may reverse any statement credits provided to you. If a charge for an eligible\npurchase is included in a Pay Over Time feature balance on your Card Account, the statement credit\nassociated with that charge may not be applied to that Pay Over Time feature balance. Instead, the\nstatement credit may be applied to your Pay In Full balance. For additional information, call the\nnumber on the back of your Card.\n$200 Oura Ring Credit\n4/17/26, 7:27 PM Platinum Card® - Terms, Conditions & Disclosures\nhttps://www.americanexpress.com/us/credit-cards/card-application/apply/supplementary/terms/platinum-card/36182-9-0 3/40']","The Airline Fee Credit on the Amex Platinum card provides enrolled Basic Card Members with up to $200 in statement credits per calendar year for incidental airline fees charged by their selected qualifying airline. To receive this benefit, enrollment through American Express is required, and the Basic Card Member must select one qualifying airline. Eligible incidental fees must be separate from airline ticket charges and must be charged by the selected airline. The total amount of statement credits will not exceed $200 per calendar year, per Card Account.",The Amex Platinum card offers up to $200 per calendar year in statement credits for incidental airline fees charged by one selected qualifying airline. Enrollment is required and a qualifying airline must be selected.,1.0,0.9245396386717232,1.0,0.99999999995,Amex Platinum,benefit_detail,,2026-04-19T13:01:11.156750
What are the Trip Cancellation and Interruption limits on the Bilt Palladium card?,"['Evidence of Coverage\nRefer to Key Terms for the definitions of you, your, we, us and our, \nand words that appear capitalized. This EOC is subject to the Legal \nDisclosures set forth below.\nA. To get coverage:\nYou must charge the full amount of a Covered Trip to your Covered \nCard or in combination with your Covered Card and accumulated \npoints on your Eligible Account or redeemable certificates, vouchers, \ncoupons, or discounts awarded from frequent flyer program or \nsimilar program.\nB. Covered Losses:\nCovered Losses include Trip Cancellations or Trip Interruptions that \nresult from Accidental Bodily Injury or loss of life or Sickness of either \nthe Eligible Traveler, Traveling Companion or a Family Member of the \nEligible Traveler or Traveling Companion.\nC. The kind of coverage you receive:\nTrip Cancellation\nWe will reimburse you for the nonrefundable amount paid to a \nCommon Carrier with your Covered Card if a Covered Loss causes \nan Eligible Traveler’s Trip Cancellation, subject to the cancellation \nprovisions in effect at the time the Common Carrier is notified of \ncancellation.\nIf a Physician advises the Eligible Traveler that a Covered Trip is \nmedically inadvisable, the Eligible Traveler must immediately notify \nthe appropriate Common Carrier of his or her Trip Cancellation after \nreceiving such medical advice. If the Eligible Traveler does not provide \nsuch notification, our payment will not exceed the cancellation \npenalties imposed by the Common Carrier and in effect during the \nforty-eight (48) hour period immediately following the Physician’s \nnotice that travel was not advisable, subject to any other limits set \nforth herein.\nTrip Interruption\nIf a Covered Loss causes an Eligible Traveler’s Trip Interruption, we \nwill reimburse you for the nonrefundable amount paid to a Common \nCarrier with your Covered Card for the following:\n1.  The forfeited, non-refundable, pre-paid land, air and sea\ntransportation arrangements that were missed; and\n2.', 'The forfeited, non-refundable, pre-paid land, air and sea\ntransportation arrangements that were missed; and\n2.  Additional transportation expenses that the Eligible Traveler incurs \nless any available refunds, not to exceed the cost of an economy-\nclass air ticket by the most direct route for the Eligible Traveler to\nrejoin his or her Common Carrier Covered Trip or to return to his or \nher place of origin.\nIf a Covered Loss causes an Eligible Traveler to temporarily postpone \ntransportation by a Common Carrier for a Covered Trip and a new \ndeparture date is set, we will reimburse you for the following: \n1.  The additional expenses incurred to purchase tickets for the new \ndeparture (not to exceed the difference between the original fare\nand the economy fare for the rescheduled Covered Trip by the most \ndirect route); and\n2.  The unused, non-refundable land, air, and sea arrangements paid\nto a Common Carrier with your Covered Card.\nTerm of Coverage\nCoverage begins on the date the Covered Trip was purchased and \nends immediately at the time the Covered Trip is completed.\nAn Eligible Traveler’s coverage terminates on any of the following \ndates: The date the Eligible Traveler is no longer eligible to \nparticipate; the date the Eligible Account is determined to be \nineligible by the participating organization; the date the participating \norganization ceases to pay premium on the Group Policy; the date \nthe participating organization ceases to participate in the Group \nPolicy; or the date the Group Policy is terminated.\nCoverage Limitations\nThe maximum benefit amount is $2,000 per Covered Trip and \n$5,000 per Eligible Account per 12 consecutive month period.\nCoverage is secondary to and in excess of any other applicable \ninsurance or benefit available to the Eligible Traveler including \nbenefits provided by the Common Carrier, such as exchanged tickets, \ndrop in ticket prices, goodwill payments, refunds, credits, or \nvouchers. In no event will this coverage apply as contributing \ninsurance. \nThis “non-contribution” clause will take precedence over the “non-\ncontribution” clauses found in other insurance or indemnity \nlanguage. Coverage is not available in states where prohibited.', 'A. To get coverage:\nYou must pay the entire cost of the \ncommon carrier ticket(s) with your \ncovered card and/or accumulated points from your covered card.\nB. The kind of coverage you receive:\n •Reimbursement for the actual cost of replacing, on an emergency basis, \nany personal articles (e.g., clothing, hygiene and/or grooming products) \nor business eff  ects (e.g., uniforms or general offi   ce supplies) contained \nin your \nchecked baggage, if the checked baggage is delayed in getting to \nyou at your scheduled destination.\n •Coverage begins when the baggage is checked in with the common \ncarrier by you. This includes curbside check-in with facility-designated \npersonnel.\n •Coverage ends when you regain possession of your checked baggage \nfrom the common carrier. This includes curbside checkout with facility-\ndesignated personnel.\n •Coverage is secondary to any other applicable insurance or coverage \navailable to you including benefi  ts provided by the common carrier \n(including, but not limited to, goodwill payments, refunds, credit/\nvouchers). Coverage is limited to only those amounts not covered by any \nother insurance or coverage or common carrier benefi  ts (including, but \nnot limited to, goodwill payments, refunds, credit/vouchers).\nC. Coverage limitations:\nCoverage is limited to the actual cost, up to $250 per claim, of \nreplacing, on an emergency basis, any personal articles or business eff \nects contained in your checked baggage. There is a maximum of 2 \nclaim(s) per twelve (12) month period.\nGuide to Benefi  ts for \nMastercard® Cardholders\nBaggage Delay', 'Inclement Weather means any severe weather condition which delays \nthe scheduled arrival or departure of a common carrier.\nReturn Destination means the place to which You expect to return from \nYour trip as indicated on Your common carrier ticket.\nTraveling Companion means any individual(s) with whom you have \narranged to travel on the same trip with the same itinerary and for which \nthe cost of trip was charged with your covered card.\nTrip means a scheduled period of travel with a destination and return \ndestination away from your primary residence using a common carrier.\nUnited States Dollars (USD) means the currency of the United States \nof America.\nEvidence of Coverage\nRefer to Key Terms for the defi  nitions of you, your, we, us, our, and words \nthat appear in bold and Legal Disclosures.\nA. To get coverage:\nYou must purchase the trip entirely with your covered card for you, or \nyour family member, and your traveling companions. If redeemable \ncertifi  cates, vouchers, coupons, or discounts awarded from frequent fl  ier \nprograms are used to purchase the trip, any remaining charge for the trip \nmust be purchased entirely with your covered card.\nB. The kind of coverage you receive:\nIf you are delayed more than six (6) hours while traveling to your \ndestination or return destination, we will reimburse you for travel \nexpenses as a result of the delay. There is no coverage, if the common \ncarrier cancels within six (6) hours of your scheduled departure time on \nthe common carrier for which you have purchased a ticket for your trip.\nDelay is:\na) Inclement weather;\nb)  Equipment failure of a common carrier (documented by the common \ncarrier); or\nc) Lost or stolen passport or travel documents.\nd)  Delays due to: war, invasion, acts of foreign enemies, hostilities \nbetween nations (whether declared or not), and civil war are not \ncovered.\nGuide to Benefi  ts for \nMastercard® Cardholders\nTrip Delay', '2\nC. Coverage limitations:\nCoverage is limited to the actual cost, up to $1,500 per incident of \nrepairing or replacing your checked and/or carry-on luggage and any \npersonal property contained within. There is a maximum of 2 claim(s) \nper twelve (12) month period.\nD. Where you are covered:\nCoverage applies worldwide.\nE. What is NOT covered:\n •L\noss or damage of luggage or personal property for regularly scheduled \nshort-distance travel under one hundred (100) miles.\n •L\noss or damage resulting from any dishonest, fraudulent, or criminal act \ncommitted or arranged by you.\n •L\noss resulting from war or hostilities of any kind (including, but \nnot limited to, invasion, terrorism, rebellion, insurrection, riot, or \ncivil commotion); confiscation, expropriation or detention by any \ngovernment, public authority, or customs official; illegal activity or acts.\n •L\noss resulting from contamination by radioactive or hazardous \nsubstances, including mold.\n •Spor\nting equipment or musical instruments, unless checked in as \nluggage with the common carrier and for which a claim check has been \nissued.\n •Elec\ntronic equipment (including, but not limited to, laptops, PDAs, \nvideo/film cameras, or hearing aids).\n •E\nyeglasses, contact lenses, prosthetic devices, dentures, silverware, furs, \nhousehold furniture, or documents (including, but not limited to, visas \nand IDs).\n •Plan\nts, shrubs, animals, consumables, and perishables.\n •T\nraveler’s checks, tickets of any kind (e.g., for airlines, sporting events, \nconcerts, or lottery), negotiable instruments, bullion, rare, or precious \nmetals, stamps, and coins, currency or its equivalent.\n •Je\nwelry, art, used or antique items; collectibles of any kind (such as \nitems designed for people to collect or items that over time become \ncollectibles); recycled, previously owned, refurbished, rebuilt, or \nremanufactured items.\n •D\nefective material or workmanship, ordinary wear and tear or normal \ndeterioration.']","The Trip Cancellation and Interruption limits on the Bilt Palladium card are a maximum benefit amount of $2,000 per Covered Trip and $5,000 per Eligible Account per 12 consecutive month period.","The Bilt Palladium Trip Cancellation and Interruption benefit provides up to $2,000 per covered trip, with a maximum of $5,000 per eligible account per 12-month period.",0.0,1.0,1.0,0.49999999995,Bilt Palladium,benefit_detail,,2026-04-19T13:01:11.156750
What is the Extended Warranty Protection on the United Explorer Card?,"['repair warranty, store provided warranty and a consumer \npurchased service contract exceeds three (3) years there would \nnot be coverage under this benefit. In no event will coverage \nfrom the original manufacturer’s U.S. repair warranty, store \nprovided warranty or consumer purchased service contract and \nthis coverage exceed four (4) years from the purchase date.\nTo be eligible for this benefit, the item must come with a valid \noriginal manufacturer’s U.S. repair warranty and You must \ncharge all or a portion of the cost of the eligible item to Your \nCovered Card and/or use redeemable Rewards.\nWhat’s Covered?\nThe benefit applies to purchases made both inside and outside \nthe U.S. Eligible items given as gifts can also be covered.\nCoverage is limited to the lesser of the following:\n• The cost to repair the item\n•  The cost to replace the item with an item of like kind \nand quality', '9\n•  The  amount charged to the Covered Card and/or redeemable \nRewards used (excluding shipping and handling)\n•  $10,000 per item and a maximum of $50,000 per \ncalendar year\nNote: Eligible purchases made with redeemable Rewards will be \nreimbursed in dollars.\nWe will decide whether to reimburse for the cost to have the \nitem repaired or replaced, whichever is less. Maximum coverage \nlimits apply.\nIf Your item is to be repaired, You may go to an authorized \nrepair facility and file a claim for reimbursement. Only valid, \ncustomary and reasonable repairs made at the authorized \nrepair facility are covered.\nHow Does This Benefit Work?\nThe coverage begins at the end of the original manufacturer’s \nU.S. repair warranty and provides one (1) year of coverage after \nit has expired. This benefit only covers what would have been \ncovered under the original manufacturer’s U.S. repair warranty.\nIf You received a store provided warranty or purchased a \nservice contract, Our coverage begins at the expiration of the \ncumulative warranties and service contract. If the original \nmanufacturer’s U.S. repair warranty or a combination of the \noriginal manufacturer’s U.S. repair warranty, store provided \nwarranty and a consumer purchased service contract exceeds \nthree (3) years there would not be coverage under this benefit.\nExamples:\n•  On an original manufacture r’s U.S. repair warranty of \nsix (6) months, We would provide You with an additional \ntwelve (12) months of coverage for a combined total of \neighteen (18) months of coverage.\n•  On an original manufacture r’s U.S. repair warranty of \ntwelve (12) months, and a consumer purchased service \ncontract of twenty-four (24) months, We would provide You \nwith an additional twelve (12) months of coverage starting \nat the end of the consumer purchased service contract for a \ncombined total of forty-eight (48) months of coverage.\n•  On an original manufacture r’s U.S. repair warranty of \nsix (6) months, and a consumer purchased service contract \nof thirty-six (36) months, there would be no extension of \ncoverage under this benefit.\nHow Can You Store Your Warranty?', 'repair warranty of \nsix (6) months, and a consumer purchased service contract \nof thirty-six (36) months, there would be no extension of \ncoverage under this benefit.\nHow Can You Store Your Warranty?\nWhen You purchase an eligible item that carries a warranty, You \ncan store Your itemized sales receipt and warranty information \nonline at chasecardbenefits.com. \nYou can call 1-800-350-2919 \nfor assistance uploading Your documentation.\nIf You choose not to utilize the warranty storage, be sure to \nkeep Your monthly billing statement (showing the last four \n(4) digits of the Account number) reflecting the purchase, the \nitemized sales receipt, and the warranty information in a safe \nplace. These documents will be required to verify Your claim.\nWhat’s Not Covered?\nThis benefit does not cover the following:\n•  Boats , automobiles, aircraft, and any other motorized vehicles \nand their motors, equipment, or accessories, including trailers \nand other items that can be towed by or attached to any \nmotorized vehicle', '8\nmotor vehicle lease or a joint credit card account with a financial \ninstitution, (4) are not married or joined in a civil union to \nanyone else or are not the Domestic Partner of anyone else, and \n(5) are not blood related\nFamily Member - an individual’s: spouse or Domestic Partner, \nand parents thereof; sons and daughters, including adopted \nchildren and stepchildren; legal guardians or wards; parents, \nincluding stepparents; brothers and sisters; grandparents and \ngrandchildren; aunts or uncles; nieces or nephews; spouses or \nDomestic Partners of any individual of this definition\nRewards - points, miles, cash rewards, or any other type of \nredeemable Rewards associated with Your Covered Card, \nprovided that all Rewards have been accumulated by You \nthrough use of a JPMorgan Chase Bank, N.A. and/or its affiliates \nsponsored Rewards program\nTrip - any pre-paid travel when a portion or the entire cost of a \nround trip or one way Common Carrier fare was paid using the \nCovered Card and/or redeemable Rewards\nTrip Completion Date - the date on which the Covered Traveler \nis scheduled to return to the point of origin or to a different \nfinal destination\nTrip Departure Date - the date on which the Covered Traveler \nis scheduled to leave on the Trip\nWe, Us and Our - Virginia Surety Company, Inc., an Assurant \ncompany, the insurance company that provides these benefits \nfor the Covered Card\nYou and Your - an individual to whom a Covered Card Account \nhas been issued by JPMorgan Chase Bank, N.A. and/or \nits affiliates\nBD_CON_$100 DAY_3 DAYS_20240311\nExtended Warranty Protection\nThis benefit extends the original manufacturer’s U.S. repair \nwarranty coverage by one (1) additional year. If You received \na store provided warranty or purchased a service contract, \nthis coverage begins at the end of the cumulative warranties \nand service contract. If the original manufacturer’s U.S. repair \nwarranty or a combination of the original manufacturer’s U.S. \nrepair warranty, store provided warranty and a consumer \npurchased service contract exceeds three (3) years there would \nnot be coverage under this benefit. In no event will coverage \nfrom the original manufacturer’s U.S.', 'For questions,  \ncall 1-800-350-2919 \nEffective 10/01/24\nBGC11386\nGuide to Benefits\nImportant information about your  \ntravel and purchase protection benefits\nUnited SM Explorer Card and\nUnited Quest SM Card\nVisa Signature® and Visa Platinum']","The Extended Warranty Protection on the United Explorer Card extends the original manufacturer’s U.S. repair warranty coverage by one (1) additional year. If you received a store provided warranty or purchased a service contract, this coverage begins at the end of the cumulative warranties and service contract. If the original manufacturer’s U.S. repair warranty or a combination of the original manufacturer’s U.S. repair warranty, store provided warranty, and a consumer purchased service contract exceeds three (3) years, there would not be coverage under this benefit.","The United Explorer Card Extended Warranty Protection extends the original manufacturer's U.S. repair warranty by one additional year on warranties of 3 years or less. Coverage is limited to $10,000 per item and $50,000 per Account.",1.0,0.9514188288938658,1.0,0.9166666666361111,United Explorer,benefit_detail,,2026-04-19T13:01:11.156750
What rewards rate does the Amex Gold card earn at U.S. supermarkets?,"['Only the Basic Card Member or Authorized Account\nManager(s) on a U.S. Consumer Gold Card Account can enroll in the benefit. U.S. Consumer\nTraditional Gold, Senior Gold, and Classic Gold are not eligible. Eligible purchases must be charged\nto a Card Member on the enrolled Card Account for the benefit to apply. Purchases by both the Basic\nCard Member and Additional Card Members on the enrolled Card Account are eligible for statement\ncredits. However, each Card Account is eligible for up to a $10 statement credit per month, for a total\nof $120 per calendar year in statement credits across all Cards on the Account. Participating partners\nare Grubhub (including Seamless), The Cheesecake Factory, Goldbelly, Wine.com and Five Guys. In-\nperson transactions and online orders only valid if made from participating partner locations in the\nU.S. If American Express does not receive information that identifies your transaction as eligible for\n4/17/26, 7:28 PM American Express® Gold Card - Terms, Conditions & Disclosures\nhttps://www.americanexpress.com/us/credit-cards/card-application/apply/supplementary/terms/gold-card/39161-9-0 3/17', ""Any limit will not be\napplied to Charges for foreign currency or for travelers cheques or gift cheques obtained other than\nby telephone from us.\nThe Spending Limit for the Additional Card Member(s) is optional. If no Spending Limit is set on the\nAdditional Card, spending capacity on this Card will be subject to the Basic Card Member's account\nterms and conditions.\nThe Gold Card Membership Rewards\nBasic Card Members will earn one point for each dollar charged for an eligible purchase in each\nbilling period on The American Express Gold Card or an Additional Card on their Account. Basic Card\nMembers will earn: 3 additional points (for a total of 4 points) on the first $50,000 of eligible\npurchases per calendar year at restaurants worldwide; 3 additional points (for a total of 4 points) on\nthe first $25,000 of eligible purchases per calendar year at supermarkets located in the U.S.\n(superstores, convenience stores, warehouse clubs, and meal-kit delivery services are not considered\nsupermarkets); 2 additional points (for a total of 3 points) for each dollar of eligible purchases\ncharged on airfare on a scheduled flight charged directly with passenger airlines (charter flights and\nprivate jet flights are excluded) and airfare charged directly through amextravel.com or the Amex\nTravel App ; and 1 additional point (for a total of 2 points) for each dollar of eligible purchases\ncharged through amextravel.com or the Amex Travel App  for prepaid hotels, prepaid car rentals, or\ncruise reservations (non-prepaid car rentals, non-prepaid hotels, ticketing services or other fees are\nexcluded). Bonuses you may receive with your Card on other purchase categories or in connection\nwith promotions or offers from American Express may not be combined with this benefit. Basic Card\nMembers may not earn additional points for purchases at a restaurant located within another\nestablishment (e.g., a restaurant inside a hotel, casino, or event venue), events held within a\nrestaurant, purchases at events or of event tickets, purchases made through third-party food delivery\nservices outside of the U.S., or purchases at bars, nightclubs, cafeterias, caterers, theatre clubs,\nbreweries, bakeries, and meeting venues."", 'American Express will honor the lower price for verified\nrequests. The ""Lowest Hotel Rates Guarantee"" policy applies only to online rates available to the\ngeneral public and excludes (1) rates or discounts that are not available to the general public,\nincluding, but not limited to, corporate, group, charter, meeting/convention, AAA, government/military,\nand senior citizen rates/discounts; or (2) hotel rooms booked through or in combination with frequent\nstay, loyalty, points, coupon promotions, rooms won through contests or sweepstakes or transferred,\nor rooms booked on opaque websites that do not allow you to see the name of the hotel until your\nreservation is complete; or (3) promotional packages, deals, all-inclusive packages, or bundles that\nmay include additional amenities such as parking, meals, or entertainment, or (4) rates booked\nthrough the Fine Hotels + Resorts  and The Hotel Collection programs. Details\nMedallion Status Upgrades\nMedallion Complimentary Upgrades are subject to availability and may not be available on all flights\nor in all markets.\nMiles on Eligible Purchases\n1x Mile on eligible purchases: Basic Card Members will earn 1 mile for each dollar of eligible\npurchases charged on their Card or any Additional Cards on the Card Account.\n2x Miles at U.S. Supermarkets: Basic Card Members will earn 1 additional mile (for a total of 2 miles)\nfor each dollar of eligible purchases on their Card or any Additional Cards on the Card Account\ncharged at supermarkets located in the United States. Superstores, convenience stores, warehouse\nclubs, and meal-kit delivery services are not considered supermarkets.\n2x Miles at Restaurants: Basic Card Members will earn 1 additional mile (for a total of 2 miles) for\neach dollar of eligible purchases on their Card or any Additional Cards on the Card Account charged\nat restaurants worldwide. Basic Card Members may not get additional miles for purchases at a\nrestaurant located within another establishment (e.g., a restaurant located inside a hotel, casino, or\nevent venue) or for purchases made through third-party food delivery services outside of the U.S. For\nexample, purchases made at a restaurant located within a hotel may be recognized as a purchase at\na hotel, not a restaurant.', 'Visit\nmembershiprewards.com/terms for more information. The value of Membership Rewards® points\nvaries according to how you choose to use them. To learn more, go to\nwww.membershiprewards.com/pointsinfo.\nMembership Rewards Program - Transfer Points\n™\n®\n®\n® ®\n®\n®\n®\n®\n4/17/26, 7:28 PM American Express® Gold Card - Terms, Conditions & Disclosures\nhttps://www.americanexpress.com/us/credit-cards/card-application/apply/supplementary/terms/gold-card/39161-9-0 10/17', ""Please allow 8-12 weeks after the qualifying purchase is\ncharged to your Card Account for points to be posted to the account. Eligible purchases are\npurchases for goods and services minus returns and other credits. Eligible purchases do NOT include\nfees or interest charges, cash advances, person to person payments, purchases of gift cards,\npurchases of travelers checks, purchases or reloading of prepaid cards, or purchases of other cash\nequivalents. Additional terms and restrictions apply. Merchants are assigned codes based on what\nthey primarily sell. We group certain merchant codes into categories that are eligible for additional\npoints. A purchase with a merchant will not earn additional points if the merchant's code is not\nincluded in an additional points category. Basic Card Members may not receive additional points if we\nreceive inaccurate information or are otherwise unable to identify your purchase as eligible for an\n™\n™\n4/17/26, 7:28 PM American Express® Gold Card - Terms, Conditions & Disclosures\nhttps://www.americanexpress.com/us/credit-cards/card-application/apply/supplementary/terms/gold-card/39161-9-0 15/17""]","The Amex Gold card earns 4 points for each dollar of eligible purchases charged at supermarkets located in the U.S. on the first $25,000 of eligible purchases per calendar year.","The Amex Gold card earns 4X Membership Rewards points at U.S. supermarkets on up to $25,000 per year in purchases. Superstores, warehouse clubs, and convenience stores are not included.",0.0,0.8717133988650331,1.0,0.5833333333041666,Amex Gold,benefit_detail,,2026-04-19T13:01:11.156750
What is the Delta Stays credit on the Delta SkyMiles Gold card?,"['For additional\ninformation on Delta Stays, visit delta.com/stays. The Delta Stays program is subject to change, and\nAmerican Express has no control over those changes. Bookings through Delta Vacations and\nproducts other than prepaid hotels and vacation rentals booked through Delta Stays will not qualify\nfor statement credits. Statement credit(s) may not be received or may be reversed if the Eligible Delta\nStays Booking is refunded, cancelled, or modified. If the Card Account is cancelled or past due at the\ntime of statement credit fulfillment, it may not qualify to receive a statement credit. Prepaid hotels and\nvacation rentals available through the Delta Stays platform are subject to change. If American\nExpress, in its sole discretion, determines that you have engaged in or intend to engage in any\nmanner of abuse, misuse, or gaming in connection with this benefit, American Express will not have\nan obligation to provide and may reverse any statement credits provided to you.\n$200 Delta Flight Credit\nIf, in any calendar year, eligible purchases on the Delta SkyMiles Gold or Gold Business American\nExpress Card Account total $10,000 or more (the ""Purchase Requirement""), the Basic Card Member\nwill receive a $200 Delta eCredit (the ""Credit"") in their SkyMiles account that can be used toward a\nDelta flight purchase. Delta flight purchases are limited to purchases of Delta-marketed flights made\non delta.com or with Delta Reservations. The Credit may also be applied toward the Delta airfare\nportion of a Delta Vacations package. The Credit will be issued as a Delta eCredit, which will be\navailable in ""My Profile"" on delta.com under ""Certificates, eCredits, and Vouchers."" To use the Credit,\nrefer to the certificate number, redemption code, and redemption instructions that will be sent to the\nemail address listed on your Delta SkyMiles account. The Credit is only valid for payment of tickets,\nincluding fare, surcharge and government-imposed taxes and fees imposed on ticket purchases. It is\nnot valid for other types of fees (including bag fees, change fees, upgrades or other ancillary\npurchases or fees with Delta), and it does not have any cash value.', 'The\ntrademarks are registered, or registrations are applied for, in countries of the world served by Delta.\n©2026. All SkyMiles program rules apply to SkyMiles program membership, miles, offers, mile accrual,\nmile redemption and travel benefits. To review the rules, please visit delta.com/memberguide. Offers void\nwhere prohibited by law. Offers are subject to change without notice. Other restrictions apply.\nThe Delta SkyMiles® Gold American Express Card is issued by American Express National Bank.\n©2026 American Express National Bank.\nPOID K2FX:9962\nBENEFIT TERMS\nThe following benefits and services are subject to change or cancellation.\n$100 Delta Stays Credit\nBasic Delta SkyMiles  Gold American Express Card Members can earn up to $100 in statement\ncredits per calendar year when a Basic Card or an Additional Card on the Account is used to pay for\n®\n4/17/26, 7:29 PM Delta SkyMiles® Gold American Express Card - Terms, Conditions & Disclosures\nhttps://www.americanexpress.com/us/credit-cards/card-application/apply/supplementary/terms/delta-skymiles-gold-american-express-card/36182-9-0 1/13', ""It is\nnot valid for other types of fees (including bag fees, change fees, upgrades or other ancillary\npurchases or fees with Delta), and it does not have any cash value. The Credit expires within one\nyear from the date of issuance and must be redeemed on or before the expiration date. If the value\nof the Credit is greater than the flight purchased, the Card Member will be able to use the residual\nvalue in another transaction before the expiration date. Visit delta.com/redeem for more information\nabout redemption options. Limit one Credit per calendar year per Card Account. Please allow 6-8\nweeks after reaching the Purchase Requirement for the Credit to be issued. On rare occasions (for\nexample, when the name on your SkyMiles account doesn't match the name on your Amex account),\nthe timing of the deposit could be delayed. If the Card Account is cancelled or past due at the time of\nCredit issuance, it may not qualify to receive the Credit. If you have transferred to a different Card\nafter reaching the Purchase Requirement and before the time of Credit issuance, you may not\nreceive the Credit. The Credit is non-transferable from one Delta SkyMiles Member's account to\nanother but can be applied towards someone else's ticket without limitation. The Credit may be\ncombined with up to 2 other Delta eCredits. If the Basic Card Member transfers from a different Delta\nSkyMiles Card product to the Delta SkyMiles Gold Card, any eligible purchases made on the prior\n4/17/26, 7:29 PM Delta SkyMiles® Gold American Express Card - Terms, Conditions & Disclosures\nhttps://www.americanexpress.com/us/credit-cards/card-application/apply/supplementary/terms/delta-skymiles-gold-american-express-card/36182-9-0 2/13"", 'a new Delta Stays prepaid hotel or vacation rental booking on the Delta Stays platform\n(delta.com/stays) (each, an ""Eligible Delta Stays Booking"").\nPurchases by both the Basic Card Member and any Additional Card Members on the Card Account\nare eligible for statement credits. However, the total amount of statement credits for Eligible Delta\nStays Bookings will not exceed $100 on the Card Account per calendar year. Eligible Delta Stays\nBooking does not include interest charges, cancellation fees, property fees, resort fees, or other\nsimilar fees, or any charges by a property to you (whether for your booking, your stay or otherwise).\nPlease allow 6-8 weeks after an Eligible Delta Stays Booking is charged to your Card for statement\ncredit(s) to be posted to the Account. Call the number on the back of the Card if statement credits\nhave not posted by that time, or for additional information. American Express relies on the merchant\'s\nprocessing of transactions to determine the transaction date. If there is a delay in the merchant\nsubmitting the transaction to us or if the merchant uses another date as the transaction date then\nyour purchase may not earn the statement credit benefit for the benefit period in which you made the\npurchase. For example, if an Eligible Delta Stays Booking is purchased on December 31st but the\nmerchant processes the transaction such that it is identified to us as occurring on January 1st, the\nJanuary statement credit would be applied if available. American Express also relies on information\nprovided to us by the merchant to identify an Eligible Delta Stays Booking. If American Express does\nnot receive the information that identifies your transaction as eligible for this benefit, the Basic Card\nMember will not receive the statement credit. Basic Card Members may not receive the statement\ncredit if we receive inaccurate information or are otherwise unable to identify your purchase as\neligible, if a transaction is made with an electronic wallet or through a third party (such as an app\nstore), or if the merchant uses a mobile or wireless card reader to process it. For additional\ninformation on Delta Stays, visit delta.com/stays. The Delta Stays program is subject to change, and\nAmerican Express has no control over those changes.', 'nightclubs, cafeterias, and convenience stores.\n2x Miles on Delta Purchases: Basic Card Members will earn 1 additional mile (for a total of 2 miles)\non each dollar of eligible purchases on their Card or any Additional Cards on the Card Account\ncharged directly with Delta where Delta is the merchant of record, such as purchases via delta.com,\nthe Fly Delta app, phone reservations, or ticket counters, for upgrades, miles, seat selection, Delta\nSky Club  membership, and in-flight purchases of food and beverages on Delta-operated flights\n(""Delta Purchases""). Delta Purchases do not include in-flight purchases where Delta is not the\nmerchant of record, such as in-flight wireless internet access and charitable contributions. Delta\nPurchases do not include Delta Gift Cards and purchases made at deltashop.com and/or the Delta\nFlight Museum. Delta Purchases include Delta Vacations  packages but not other all-inclusive\npackages. Delta purchases include new Delta Stays prepaid hotel or vacation rental bookings on the\nDelta Stays platform (delta.com/stays). Delta Purchases include purchases of qualifying Delta, Delta\nConnection  carrier and Delta Shuttle  flights taken with the purchase of a fare that is eligible for\nSkyMiles mileage credit. For purposes of this Card benefit, ""Delta Purchases"" also includes Delta\nMain Basic (Basic Economy) fares, notwithstanding that these fares do not earn SkyMiles mileage\ncredit for travel. Full SkyMiles program terms: delta.com/memberguide. Additional miles earned for\nDelta flight purchases made with the Card will be based on the total ticket price, including base fare,\ncarrier-imposed surcharges and government-imposed taxes and fees.\nEligible purchases are purchases for goods and services minus returns and other credits. Eligible\npurchases do NOT include fees or interest charges, cash advances, purchases of travelers checks,\npurchases of gift cards, person-to-person transactions, purchases or reloading of prepaid cards, or\npurchases of other cash equivalents. Miles will be posted to the Basic Card Member\'s Delta SkyMiles\naccount 8 to 12 weeks after the end of each month. To be eligible to receive miles, the Card Account\nmust not be canceled or past due at the time of fulfillment.']","Basic Delta SkyMiles Gold American Express Card Members can earn up to $100 in statement credits per calendar year when a Basic Card or an Additional Card on the Account is used to pay for a new Delta Stays prepaid hotel or vacation rental booking on the Delta Stays platform (delta.com/stays). The total amount of statement credits for Eligible Delta Stays Bookings will not exceed $100 on the Card Account per calendar year. Eligible Delta Stays Booking does not include interest charges, cancellation fees, property fees, resort fees, or other similar fees. Please allow 6-8 weeks after an Eligible Delta Stays Booking is charged to your Card for statement credit(s) to be posted to the Account.",The Delta SkyMiles Gold card offers up to $100 per calendar year in statement credits on eligible Delta Stays prepaid hotel or vacation rental bookings on the Delta Stays platform.,1.0,0.7876179512035884,1.0,0.5333333333155555,Amex Delta Gold,benefit_detail,,2026-04-19T13:01:11.156750
Does the Delta SkyMiles Gold card offer free checked bags?,"[""Benefits are non-transferable, subject to availability,\nand cannot be redeemed for cash, cash-equivalents, or credit.\nDispute Resolution\nNot all disputes are resolved in the Card Member's favor.\nFirst Checked Bag Free\nBenefit is limited to Basic Card Members (not Additional Card Members) with the Delta SkyMiles\nGold or Gold Business, Delta SkyMiles  Platinum or Platinum Business, or Delta SkyMiles  Reserve\nor Reserve Business American Express Card. Reservation must include the Basic Card Member's\nSkyMiles number. Fee waiver also available for passengers traveling on the same reservation as the\nBasic Card Member. Maximum nine waivers per reservation. Waiver is only for standard bag fee, if\nany, for the first checked bag that is not overweight and not oversize under Delta's applicable rules\nas set forth in Delta's contract of carriage. Additional checked bags will be subject to the applicable\nbaggage fees as outlined by Delta's rules and the purchased fare as set forth in Delta's contract of\ncarriage. The first checked bag fee waiver will only be applied on flight segments which originate on\na Delta or Delta Connection  carrier when you check-in with Delta for both a Delta marketed and\nDelta operated flight. Codeshare flights are not eligible. New Card Members and Card Members\nupgrading from another Delta SkyMiles Card product will be eligible for the checked baggage fee\nwaiver benefit after receiving their Card from American Express. Waiver is not available to\npassengers who are already receiving one or more checked bags free (for example, due to itinerary\n®\n®\n® ®\n®\n4/17/26, 7:29 PM Delta SkyMiles® Gold American Express Card - Terms, Conditions & Disclosures\nhttps://www.americanexpress.com/us/credit-cards/card-application/apply/supplementary/terms/delta-skymiles-gold-american-express-card/36182-9-0 6/13"", 'The\ntrademarks are registered, or registrations are applied for, in countries of the world served by Delta.\n©2026. All SkyMiles program rules apply to SkyMiles program membership, miles, offers, mile accrual,\nmile redemption and travel benefits. To review the rules, please visit delta.com/memberguide. Offers void\nwhere prohibited by law. Offers are subject to change without notice. Other restrictions apply.\nThe Delta SkyMiles® Gold American Express Card is issued by American Express National Bank.\n©2026 American Express National Bank.\nPOID K2FX:9962\nBENEFIT TERMS\nThe following benefits and services are subject to change or cancellation.\n$100 Delta Stays Credit\nBasic Delta SkyMiles  Gold American Express Card Members can earn up to $100 in statement\ncredits per calendar year when a Basic Card or an Additional Card on the Account is used to pay for\n®\n4/17/26, 7:29 PM Delta SkyMiles® Gold American Express Card - Terms, Conditions & Disclosures\nhttps://www.americanexpress.com/us/credit-cards/card-application/apply/supplementary/terms/delta-skymiles-gold-american-express-card/36182-9-0 1/13', 'Miscellaneous:\nAll SkyMiles Program rules apply to SkyMiles Program membership, miles, offers, mile accrual, mile\nredemption, and travel benefits. To review the rules, please visit Program Rules. SkyMiles Program\n®\n4/17/26, 7:29 PM Delta SkyMiles® Gold American Express Card - Terms, Conditions & Disclosures\nhttps://www.americanexpress.com/us/credit-cards/card-application/apply/supplementary/terms/delta-skymiles-gold-american-express-card/36182-9-0 12/13', 'deposits; late, damage or other fees in connection with rentals; Purchases billed in installments;\nrestaurant tips and other gratuities; and Charges that occur before the end of billing period, if the\nCharge is posted to your Account after the Closing Date of that billing period. Any limit will not be\napplied to Charges for foreign currency or for travelers cheques or gift cheques obtained other than\nby telephone from us.\nThe Spending Limit for the Additional Card Member(s) is optional. If no Spending Limit is set on the\nAdditional Card, spending capacity on this Card will be subject to the Basic Card Member\'s account\nterms and conditions.\nTakeOﬀ 15\nEligibility:\nBasic Delta SkyMiles Gold, Platinum and Reserve American Express Card Members, as well as\nBasic Delta SkyMiles Gold, Platinum and Reserve Business American Express Card Members (each,\nan ""Eligible Card""), can get at least a fifteen percent (15%) discount off the mileage portion of an\nAward Ticket (the ""TakeOff 15"" benefit). Additional Card Members are not eligible.\nAvailable only if entire itinerary is on Delta and Delta Connection  carrier-operated and ticketed flights\nbooked at delta.com or the FlyDelta app. Not available on flights operated by other carriers. Not\navailable for Pay with Miles, Miles + Cash, seat upgrades purchased after the initial flight booking, or\nother Delta products or services. Discount only applies to the mileage portion of the Award Ticket fare\nand does not apply to applicable taxes and fees which must be paid using the Eligible Card. Card\nMember must be logged-in to a SkyMiles account linked to an Eligible Card to receive the TakeOff 15\nbenefit discount. Mileage discount will be greater than or equal to 15% of the overall miles portion for\nthe Award Ticket. An Award Ticket is a ticket issued by Delta pursuant to the SkyMiles Program\nRules, by which SkyMiles members may redeem miles and pay applicable government-imposed\ntaxes and fees in exchange for air transportation. All Award Ticket rules apply, as set forth on\ndelta.com and in the specific terms incorporated into your Award Ticket. Award Travel is defined as\ntravel using an Award Ticket.', 'nightclubs, cafeterias, and convenience stores.\n2x Miles on Delta Purchases: Basic Card Members will earn 1 additional mile (for a total of 2 miles)\non each dollar of eligible purchases on their Card or any Additional Cards on the Card Account\ncharged directly with Delta where Delta is the merchant of record, such as purchases via delta.com,\nthe Fly Delta app, phone reservations, or ticket counters, for upgrades, miles, seat selection, Delta\nSky Club  membership, and in-flight purchases of food and beverages on Delta-operated flights\n(""Delta Purchases""). Delta Purchases do not include in-flight purchases where Delta is not the\nmerchant of record, such as in-flight wireless internet access and charitable contributions. Delta\nPurchases do not include Delta Gift Cards and purchases made at deltashop.com and/or the Delta\nFlight Museum. Delta Purchases include Delta Vacations  packages but not other all-inclusive\npackages. Delta purchases include new Delta Stays prepaid hotel or vacation rental bookings on the\nDelta Stays platform (delta.com/stays). Delta Purchases include purchases of qualifying Delta, Delta\nConnection  carrier and Delta Shuttle  flights taken with the purchase of a fare that is eligible for\nSkyMiles mileage credit. For purposes of this Card benefit, ""Delta Purchases"" also includes Delta\nMain Basic (Basic Economy) fares, notwithstanding that these fares do not earn SkyMiles mileage\ncredit for travel. Full SkyMiles program terms: delta.com/memberguide. Additional miles earned for\nDelta flight purchases made with the Card will be based on the total ticket price, including base fare,\ncarrier-imposed surcharges and government-imposed taxes and fees.\nEligible purchases are purchases for goods and services minus returns and other credits. Eligible\npurchases do NOT include fees or interest charges, cash advances, purchases of travelers checks,\npurchases of gift cards, person-to-person transactions, purchases or reloading of prepaid cards, or\npurchases of other cash equivalents. Miles will be posted to the Basic Card Member\'s Delta SkyMiles\naccount 8 to 12 weeks after the end of each month. To be eligible to receive miles, the Card Account\nmust not be canceled or past due at the time of fulfillment.']","Yes, the Amex Delta Gold card offers a benefit of a free first checked bag for Basic Card Members. This benefit is limited to the Basic Card Member and passengers traveling on the same reservation, with certain conditions regarding the reservation and flight segments.","Yes, the Delta SkyMiles Gold card provides the first checked bag free for the Basic Card Member and up to 8 companions on the same reservation on Delta-operated flights.",1.0,0.7034199674028443,1.0,0.9999999999,Amex Delta Gold,benefit_detail,,2026-04-19T13:01:11.156750
Does the Amex Gold card include airport lounge access?,"['Companion\nPlatinum Cards on Consumer Platinum Accounts and Additional Gold and Additional Business\nExpense Cards on Business Platinum Accounts are not eligible for access to participating locations.\nCard Members must present their valid U.S. Platinum Card , a government-issued I.D., and a\nboarding pass showing a confirmed reservation for same-day travel on any carrier. Guest access and\nassociated fees are subject to the terms and conditions of the participating lounge provider.\nParticipation, locations, rates, and policies of lounges are subject to change without notice, and Card\nMembers and their guests will not be compensated for such changes. Amenities, services, and hours\nmay vary by participating lounge and are subject to change without notice. American Express and the\nparticipating lounge will not be liable for any articles lost or stolen, or damages suffered by the Card\nMember or guests inside the participating lounge. For participating lounges with a self-service bar, the\nCard Member may be required to be of legal drinking age in the participating lounge jurisdiction to\nenter without a parent or legal guardian. All Card Members and their guests must be of legal drinking\nage to consume alcoholic beverages. Please drink responsibly. Each participating lounge may have\ntheir own policy allowing for children under a certain age to enter for free with the Card Member who\nis a parent or legal guardian. Card Member must adhere to all house rules of participating lounges.\nParticipating lounges reserve the right to remove any person from the premises for inappropriate\nbehavior or failure to adhere to rules, including, but not limited to, conduct that is disruptive, abusive,\nor violent. If American Express, in its sole discretion, determines that the Card Member or their\nguests have engaged in abuse, misuse, or gaming in connection with access to participating lounges\nin any way, or that the Card Member or their guests intend to do so, we may remove access to the\nAdditional Lounges from the Account. American Express and the participating lounge reserve the right\nto revise the rules at any time without notice. For the most current list of participating lounges and\naccess requirements, please use the Lounge Finder feature in the American Express App or visit\nwww.americanexpress.com/findalounge.', ""issued American\nExpress card. For access at select locations, Card Members must arrive within 3 hours of their\ndeparting flight. Refer to the specific location's access policy for more information. During a layover\nCard Members may use the Escape Lounge in the connecting airport at any time. For more\ninformation on access policies and lounge terms and conditions, see https://escapelounges.com. All\naccess to an Escape Lounge is subject to space availability. Card Member must be at least 18 years\nof age to enter without a parent or legal guardian. All Escape Lounge visitors must be of legal\ndrinking age in the jurisdiction where the Lounge is located to consume alcoholic beverages. Please\ndrink responsibly. Card Members may bring up to two complimentary guests per visit. Card Member\nmust adhere to all house rules of participating lounges. Card Members and their guests will receive\nall the complimentary benefits and amenities afforded to the Escape Lounge customers, as well as\naccess to purchase non-complimentary items. Some product features may be subject to additional\ncharges. Escape Lounge locations are subject to change without notice. Additional restrictions may\napply.\nFee Credit for Global Entry or TSA PreCheck\nThe benefit is available to (i) Consumer Platinum Card  Members, and Business Platinum Card\nMembers, and (ii) Centurion  Card Members. The benefit is also available to all Additional Card\nMembers on Consumer and Business Platinum Accounts, and all Additional Card Members on\nConsumer and Business Centurion Accounts. Basic Card Members are eligible to receive a statement\ncredit every 4 years for either up to $85 for the TSA PreCheck  application fee (when applying\nthrough a TSA official enrollment provider) or $120 for the Global Entry application fee, in each case\nwhen charged to the Basic Card or any eligible Additional Cards on the eligible Card Account. Basic\nCard Members will receive a statement credit for the first program (either Global Entry or TSA\nPreCheck) to which they or their eligible Additional Cards apply and pay for with their eligible Card\nregardless of whether they are approved for Global Entry or TSA PreCheck."", ""service bar, unless accompanied by a responsible, supervising adult who has access to Delta Sky\nClub. Benefit valid only at Delta Sky Club. Delta partner lounges are not included. Note that\namenities may vary among Delta Sky Club locations. Participating airport clubs and locations subject\nto change without notice. All access is subject to Delta Sky Club House Rules. To review the House\nRules, please visit delta.com/skyclub. Benefit and rules subject to change without notice. Additional\nrestrictions may apply.\nDestination Family\nBenefits are valid for new bookings of eligible cruises or tour packages made through American\nExpress Travel with participating travel providers using an eligible U.S. Consumer, Business,\nCorporate American Express  Card. Payment must be made with the eligible Card, and that Card\nMember must travel on the itinerary booked. Benefits may not be available to residents outside the\n50 United States. Benefits apply per booking, not per traveler and cannot be combined with other\noffers unless indicated. Blackout dates may apply. Participating travel providers and benefits are\nsubject to change and vary by travel provider. Benefits are non-transferable, subject to availability,\nand cannot be redeemed for cash, cash-equivalents, or credit.\nDispute Resolution\nNot all disputes are resolved in the Card Member's favor.\nEscape Lounges\nThis benefit is available to U.S. Platinum Card  Members. Card Members receive complimentary\naccess to all Escape Lounge locations, including Escape Lounge – the Centurion  Studio Partner\nlocations. Companion Platinum Cards on Consumer Platinum Accounts and Additional Gold and\nAdditional Business Expense Cards on Business Platinum Accounts are not eligible for access to\nEscape Lounges, including Escape Lounge – the Centurion  Studio Partner locations. To access an\nEscape Lounge, Card Members must present their valid Card, a boarding pass showing a confirmed\nreservation for same-day travel on any carrier and government-issued I.D. Name on boarding pass\nmust match name on the Card and the eligible flight must be booked on a U.S. issued American\nExpress card. For access at select locations, Card Members must arrive within 3 hours of their\ndeparting flight. Refer to the specific location's access policy for more information."", 'Companion Platinum Cards on Consumer Platinum Accounts and Employee\nBusiness Platinum Accounts and Additional Business Expense Cards on Business Platinum Accounts\nare not eligible for access to The Centurion Lounge. All access to The Centurion Lounge is subject to\nspace availability. To access The Centurion Lounge, Platinum Card Members must arrive within 3\nhours of their departing flight and present The Centurion Lounge agent with the following upon each\nvisit: their valid Card, a boarding pass showing a confirmed reservation for a departing flight on the\nsame day on any carrier and a government-issued I.D. Name on boarding pass must match name on\nthe Card. Failure to present this documentation may result in access being denied. Effective July 8,\n2026, during a layover, Card Members must arrive within 5 hours of the connecting flight. Same-day\nround trip itineraries are not considered connecting flights. Card Members must be at least 18 years\nof age to enter without a parent or legal guardian. All Centurion Lounge visitors must be of legal\ndrinking age in the jurisdiction where the Lounge is located to consume alcoholic beverages. Please\ndrink responsibly. American Express reserves the right to remove any person from the Lounge for\ninappropriate behavior or failure to adhere to rules, including, but not limited to, conduct that is\ndisruptive, abusive or violent. Soliciting other Card Members for access into our Lounge is not\npermissible. Hours may vary by location and are subject to change. Amenities vary among The\nCenturion Lounge locations and are subject to change. Card Members will not be compensated for\nchanges in locations, rates or policies. In addition to the complimentary services and amenities in the\nLounge, certain services, products or amenities may be offered for sale, and you are responsible for\nany purchases of such services, products or amenities. Services available at the Member Services\nDesk are based on the type of American Express Card used to enter the Lounge. American Express\nwill not be liable for any articles lost or stolen or damages suffered by visitors to The Centurion\nLounge.', ""Offer not valid on purchases made using third parties, such as resellers, delivery services, or other\nintermediaries.\nStatement Credit\nPlease allow up to 120 days after the qualifying purchase for the statement credit(s) to be posted to\nthe Card account, provided that American Express receives information from the merchant about your\nqualifying purchase. The 10% back in the form of statement credit(s), up to $250 in total statement\ncredits per calendar year, is calculated based off the total amount of a qualifying purchase made in\nUS dollars or following conversion to US dollars from a foreign currency, if applicable.\nParticipation in Amex Offers is subject to Amex Offers Program Terms.\nAmerican Express Venue Collection Entrances and Fast Lanes\nAmerican Express Venue Collection  Entrances and Fast Lanes\nAmerican Express Card Member entrances and/or fast lanes are available at venues in the American\nExpress Venue Collection. Card Member entrances and fast lanes may not be available for all\nevents; hours of availability may vary and are subject to change. Entrances and fast lanes may be\nmodified or discontinued at any time and without notice. Card Members must have a valid ticket to\nthe event and can access the Card Member entrance or fast lane by presenting a valid American\nExpress Card in the Card Member's name. The number of guests that may accompany a Card\nMember through a Card Member entrance of fast lane may vary by venue. Additional terms may\napply by venue and by event (including, without limitation, security protocols). American Express does\nnot operate the Card Member entrances or fast lanes; the applicable venue operates the entrance.\nVenue personnel reserve the right to not allow Card Members and their guests admittance through\n™\n™\n4/17/26, 7:28 PM American Express® Gold Card - Terms, Conditions & Disclosures\nhttps://www.americanexpress.com/us/credit-cards/card-application/apply/supplementary/terms/gold-card/39161-9-0 7/17""]",This benefit is not mentioned in the Amex Gold benefits guide.,"No, the Amex Gold card does not include airport lounge access.",0.0,0.0,1.0,0.0,Amex Gold,negative,,2026-04-19T13:01:11.156750
Does the United Explorer Card include cell phone protection?,"['For questions,  \ncall 1-800-350-2919 \nEffective 10/01/24\nBGC11386\nGuide to Benefits\nImportant information about your  \ntravel and purchase protection benefits\nUnited SM Explorer Card and\nUnited Quest SM Card\nVisa Signature® and Visa Platinum', 'repair warranty, store provided warranty and a consumer \npurchased service contract exceeds three (3) years there would \nnot be coverage under this benefit. In no event will coverage \nfrom the original manufacturer’s U.S. repair warranty, store \nprovided warranty or consumer purchased service contract and \nthis coverage exceed four (4) years from the purchase date.\nTo be eligible for this benefit, the item must come with a valid \noriginal manufacturer’s U.S. repair warranty and You must \ncharge all or a portion of the cost of the eligible item to Your \nCovered Card and/or use redeemable Rewards.\nWhat’s Covered?\nThe benefit applies to purchases made both inside and outside \nthe U.S. Eligible items given as gifts can also be covered.\nCoverage is limited to the lesser of the following:\n• The cost to repair the item\n•  The cost to replace the item with an item of like kind \nand quality', '2\nYour Guide to Benefits describes the benefit that is in effect as \nof 10/01/24. Information in this guide takes the place of any \nprior benefit and benefit description you may have previously \nreceived. Your effective date of eligibility is determined \nby Chase. \nPlease keep the guide with your account information for future \nreference and call the benefit administrator if you have any \nquestions before taking advantage of the benefit.\nIf you have any questions please call 1-800-350-2919 or if you \nare outside the U.S., call collect at 001-214-503-2953.\nTABLE OF CONTENTS\nAuto Rental Coverage 3\nBaggage Delay Insurance 6\nExtended Warranty Protection 8\nLost Luggage Reimbursement 11\nPurchase Protection 13\nRoadside Assistance 15\nTravel Accident Insurance 17\nTravel and Emergency Assistance 22\nTrip Cancellation and Interruption Insurance 24\nTrip Delay Reimbursement 31\nAdditional Terms 33', 'What’s Covered?\nThe benefit applies to purchases made both inside and outside \nthe U.S. Eligible items given as gifts can also be covered.\nCoverage is limited to the lesser of the following:\n• The cost to repair item\n•  The cost to replace the item with an item of like kind \nand quality\n•  The amount charged to the Covered Card and/or redeemable \nRewards used (excluding shipping and handling)\n•  $10,000 per item and a maximum of $50,000 per \ncalendar year\nNote: Eligible purchases made with redeemable Rewards will be \nreimbursed in dollars.\nIf a loss involves a portion of a pair or set, You will only be \nreimbursed for the item that was stolen, damaged, or part of \nan Involuntary and Accidental Parting, not the total value of the \npair or set. This does not apply to items normally sold as pairs \nor sets that are not replaceable by purchasing one piece of \nthe pair or set. You may be asked to send the individual item,', 'This benefit is secondary and payable on an excess basis over \nand above any amount due from any other valid or collectible \ninsurance or any other form of reimbursement payable by those \nresponsible for the loss.\nWhat’s Not Covered?\nThis benefit does not apply to the following:\n• Hearing aids\n• Artificial teeth, dental bridges, or prosthetic devices\n•  Tickets, documents, money, securities, checks, travelers \nchecks, and valuable papers\n• Business samples\n• Jewelry and watches\n• Cameras, video recorders, and other electronic equipment\n•  Recreational equipment, any equipment that is used to \nengage in a particular sport, hobby, game, excursion, or other \nrecreational activity']",This benefit is not mentioned in the United Explorer benefits guide.,"No, the United Explorer Card does not include cell phone protection.",1.0,0.6705386065981197,0.0,0.0,United Explorer,negative,,2026-04-19T13:01:11.156750
Does the Delta SkyMiles Gold card include a companion certificate?,"['Miscellaneous:\nAll SkyMiles Program rules apply to SkyMiles Program membership, miles, offers, mile accrual, mile\nredemption, and travel benefits. To review the rules, please visit Program Rules. SkyMiles Program\n®\n4/17/26, 7:29 PM Delta SkyMiles® Gold American Express Card - Terms, Conditions & Disclosures\nhttps://www.americanexpress.com/us/credit-cards/card-application/apply/supplementary/terms/delta-skymiles-gold-american-express-card/36182-9-0 12/13', 'The\ntrademarks are registered, or registrations are applied for, in countries of the world served by Delta.\n©2026. All SkyMiles program rules apply to SkyMiles program membership, miles, offers, mile accrual,\nmile redemption and travel benefits. To review the rules, please visit delta.com/memberguide. Offers void\nwhere prohibited by law. Offers are subject to change without notice. Other restrictions apply.\nThe Delta SkyMiles® Gold American Express Card is issued by American Express National Bank.\n©2026 American Express National Bank.\nPOID K2FX:9962\nBENEFIT TERMS\nThe following benefits and services are subject to change or cancellation.\n$100 Delta Stays Credit\nBasic Delta SkyMiles  Gold American Express Card Members can earn up to $100 in statement\ncredits per calendar year when a Basic Card or an Additional Card on the Account is used to pay for\n®\n4/17/26, 7:29 PM Delta SkyMiles® Gold American Express Card - Terms, Conditions & Disclosures\nhttps://www.americanexpress.com/us/credit-cards/card-application/apply/supplementary/terms/delta-skymiles-gold-american-express-card/36182-9-0 1/13', 'nightclubs, cafeterias, and convenience stores.\n2x Miles on Delta Purchases: Basic Card Members will earn 1 additional mile (for a total of 2 miles)\non each dollar of eligible purchases on their Card or any Additional Cards on the Card Account\ncharged directly with Delta where Delta is the merchant of record, such as purchases via delta.com,\nthe Fly Delta app, phone reservations, or ticket counters, for upgrades, miles, seat selection, Delta\nSky Club  membership, and in-flight purchases of food and beverages on Delta-operated flights\n(""Delta Purchases""). Delta Purchases do not include in-flight purchases where Delta is not the\nmerchant of record, such as in-flight wireless internet access and charitable contributions. Delta\nPurchases do not include Delta Gift Cards and purchases made at deltashop.com and/or the Delta\nFlight Museum. Delta Purchases include Delta Vacations  packages but not other all-inclusive\npackages. Delta purchases include new Delta Stays prepaid hotel or vacation rental bookings on the\nDelta Stays platform (delta.com/stays). Delta Purchases include purchases of qualifying Delta, Delta\nConnection  carrier and Delta Shuttle  flights taken with the purchase of a fare that is eligible for\nSkyMiles mileage credit. For purposes of this Card benefit, ""Delta Purchases"" also includes Delta\nMain Basic (Basic Economy) fares, notwithstanding that these fares do not earn SkyMiles mileage\ncredit for travel. Full SkyMiles program terms: delta.com/memberguide. Additional miles earned for\nDelta flight purchases made with the Card will be based on the total ticket price, including base fare,\ncarrier-imposed surcharges and government-imposed taxes and fees.\nEligible purchases are purchases for goods and services minus returns and other credits. Eligible\npurchases do NOT include fees or interest charges, cash advances, purchases of travelers checks,\npurchases of gift cards, person-to-person transactions, purchases or reloading of prepaid cards, or\npurchases of other cash equivalents. Miles will be posted to the Basic Card Member\'s Delta SkyMiles\naccount 8 to 12 weeks after the end of each month. To be eligible to receive miles, the Card Account\nmust not be canceled or past due at the time of fulfillment.', 'For\nexample, purchases made at a restaurant located within a hotel may be recognized as a purchase at\na hotel, not a restaurant. Basic Card Members will not earn additional miles for purchases at bars,\n®\n®\n™\n®\n4/17/26, 7:29 PM Delta SkyMiles® Gold American Express Card - Terms, Conditions & Disclosures\nhttps://www.americanexpress.com/us/credit-cards/card-application/apply/supplementary/terms/delta-skymiles-gold-american-express-card/36182-9-0 7/13', ""It is\nnot valid for other types of fees (including bag fees, change fees, upgrades or other ancillary\npurchases or fees with Delta), and it does not have any cash value. The Credit expires within one\nyear from the date of issuance and must be redeemed on or before the expiration date. If the value\nof the Credit is greater than the flight purchased, the Card Member will be able to use the residual\nvalue in another transaction before the expiration date. Visit delta.com/redeem for more information\nabout redemption options. Limit one Credit per calendar year per Card Account. Please allow 6-8\nweeks after reaching the Purchase Requirement for the Credit to be issued. On rare occasions (for\nexample, when the name on your SkyMiles account doesn't match the name on your Amex account),\nthe timing of the deposit could be delayed. If the Card Account is cancelled or past due at the time of\nCredit issuance, it may not qualify to receive the Credit. If you have transferred to a different Card\nafter reaching the Purchase Requirement and before the time of Credit issuance, you may not\nreceive the Credit. The Credit is non-transferable from one Delta SkyMiles Member's account to\nanother but can be applied towards someone else's ticket without limitation. The Credit may be\ncombined with up to 2 other Delta eCredits. If the Basic Card Member transfers from a different Delta\nSkyMiles Card product to the Delta SkyMiles Gold Card, any eligible purchases made on the prior\n4/17/26, 7:29 PM Delta SkyMiles® Gold American Express Card - Terms, Conditions & Disclosures\nhttps://www.americanexpress.com/us/credit-cards/card-application/apply/supplementary/terms/delta-skymiles-gold-american-express-card/36182-9-0 2/13""]",This benefit is not mentioned in the Amex Delta Gold benefits guide.,"No, the Delta SkyMiles Gold card does not include a companion certificate.",0.0,0.0,0.0,0.0,Amex Delta Gold,negative,,2026-04-19T13:01:11.156750
Does the Capital One Venture X auto rental coverage include motorcycles?,"['Because \nregulations vary outside the United States, check with Y our \nauto rental company and the Benefit Administrator before \nY ou travel, to be sure that Auto Rental Collision Damage \nWaiver will apply.\nVehicles not covered\nCertain vehicles are not covered by this benefit, they consist of \nexpensive, exotic, and antique cars; cargo vans; certain vans; \nvehicles with an open cargo bed; trucks; motorcycles; mopeds; \nmotorbikes; limousines; and recreational vehicles.\nAn expensive automobile is defined as any vehicle with an \noriginal manufacturer’s suggested retail price of more than \nseventy-five thousand dollars ($75,000.00) when new.\nAn antique car is defined as one that is over twenty (20) years \nold, or one that has not been manufactured for ten (10) years \nor more.\nVans are not covered. But those designed as small-group \ntransportation vehicles (seating up to nine (9) people, \nincluding the driver) are covered.\nIf Y ou have questions about a specific vehicle’s coverage \nor organization where the vehicle is being reserved, call \nthe Benefit Administrator at 1-800-825-4062, or call collect \noutside the United States at 1-804-965-8071 collect.', '(Longer rental periods, however, \nare not covered).\nYou are eligible for this benefit if Your name is embossed on \nan eligible card issued in the United States and You use it \nto initiate and complete Your entire car rental transaction. \nOnly You as the primary car renter and any additional drivers \npermitted by the Rental Car Agreement are covered.\nHow Auto Rental Collision Damage Waiver works\nYour Auto Rental Collision Damage Waiver benefit acts as \nprimary coverage and covers theft, damage, valid loss-of-\nuse charges imposed and substantiated by the auto rental \ncompany, administrative fees and reasonable and customary \ntowing charges, due to a covered theft or damage to the \nnearest qualified repair facility. \nHow to use Auto Rental Collision Damage Waiver\n1.  Use Your card to initiate and complete Your entire car rental \ntransaction. \n2.  Review the auto rental agreement and decline the rental \ncompany’s collision damage waiver (CDW/LDW) option, or \na similar provision, as accepting this coverage will cancel \nout Y our benefit. If the rental company insists that You \npurchase their insurance or collision damage waiver, call the \nBenefit Administrator for assistance at 1-800-825-4062. \nOutside the United States, call collect at 1-804-965-8071.\nBefore Y ou leave the lot, be sure to check the car for any \nprior damage.\nThis benefit is in effect during the time the rental car is in Your \n(or an authorized driver’s) control, and it terminates when the \nrental company reassumes control of their vehicle.\nThis benefit is available in the United States and most foreign \ncountries (with the exception of Israel, Jamaica, the \nRepublic of Ireland or Northern Ireland). However, this \nbenefit is not available where precluded by law, or where it’s \nin violation of the territory terms of the auto rental agreement, \nor when prohibited by individual merchants. Because \nregulations vary outside the United States, check with Y our \nauto rental company and the Benefit Administrator before \nY ou travel, to be sure that Auto Rental Collision Damage \nWaiver will apply.', 'Related instances & losses not covered\n•  Any obligation You assume under any agreement (other \nthan the deductible on Your personal auto policy)\n•  Any violation of the auto rental agreement or this benefit\n•  Injury of anyone, or damage to anything, inside or outside \nthe Rental Vehicle\n•  Loss or theft of personal belongings\n•  Personal liability\n•  Expenses assumed, waived, or paid by the auto rental \ncompany, or its insurer\n•  The cost of any insurance, or collision damage waiver, \noffered by or purchased through the auto rental company\n•  Depreciation of the Rental Vehicle caused by the incident \nincluding, but not limited to, “diminished value”\n•  Expenses reimbursable by Your insurer, employer, or \nemployer’s insurance\n•  Theft or damage due to intentional acts, or due to the \ndriver(s) being under the influence of alcohol, intoxicants, or \ndrugs, or due to contraband, or illegal activities\n•  Wear and tear, gradual deterioration, or mechanical \nbreakdown\n•  Items not installed by the original manufacturer\n•  Damage due to off-road operation of the Rental Vehicle\n•  Theft or damage due to hostility of any kind (including, \nbut not limited to, war, invasion, rebellion, insurrection, or \nterrorist activities)\n•  Confiscation by authorities\n•  Vehicles that do not meet the definition of covered vehicles\nBR414848_M133789_LetterSize.indd   2BR414848_M133789_LetterSize.indd   2 7/15/21   11:58 AM7/15/21   11:58 AM', 'The \nbenefit is limited to one claim per Covered Trip. To be eligible \nfor this coverage, You need to purchase either a portion or the \nentire cost of Your Common Carrier fare using Your Account. \nYou, Your spouse and Your dependent children under twenty-\ntwo (22) years of age are automatically covered when You \ncharge Your Covered Trip’s Common Carrier fare to Your \neligible Account and/or rewards program associated with Your \ncovered Account. \nThis benefit is supplemental coverage, which means \nthat reasonable expenses during the delay not \notherwise covered by Your Common Carrier, another \nparty or Your primary personal insurance policy, \nmay be reimbursed up to a maximum of five hundred \ndollars ($500.00) per ticket. You will be refunded the \n7\nBR414848_M133789_LetterSize.indd   7BR414848_M133789_LetterSize.indd   7 7/15/21   11:58 AM7/15/21   11:58 AM', 'You are eligible for this benefit if You are a cardholder of an \neligible card issued in the United States. \nGifts purchased for friends and family members may also be \ncovered if they are purchased with Your covered Account and/\nor rewards program associated with Your covered Account.\nPurchase Security covers \nEligible items of personal property purchased with Your \nAccount and/or rewards program associated with Your \ncovered Account are covered for damage or theft. Purchases \nmade outside the United States are also covered as long as You \npurchased the item with Your covered Account and/or rewards \nprogram associated with Your covered Account.\nPurchase Security does not cover \n•  Animals and living plants\n•  Antiques or collectible items\n•  Boats, aircraft, automobiles, and any other motorized \nvehicles and their motors, equipment, or accessories, \nincluding trailers and other items towable or attachable to \nany motorized vehicle\n•  Broken items, unless the result of a covered occurrence\n•  Computer software\n•  Items purchased for resale, either professional or \ncommercial use\n•  Items that are lost, or that “mysteriously disappear,” \nmeaning they vanished in an unexplained manner, with no \nevidence of wrongdoing by one person or several\n•  Items under the control and care of a common carrier \n(including the U.S.']",This benefit is not mentioned in the Capital One Venture X benefits guide.,"No, motorcycles are explicitly excluded from the Capital One Venture X Auto Rental Collision Damage Waiver.",0.5,0.0,1.0,0.699999999965,Capital One Venture X,negative,,2026-04-19T13:01:11.156750
Does the Bilt Palladium cell phone protection cover lost phones?,"['2\n2. Y\nour coverage resumes on the first day of the calendar month \nfollowing the date of any future payment of your eligible cellular \nwireless telephone bill with your covered card.\nB.\n T\nhe kind of coverage you receive:\n •R\neimbursement for the actual cost to replace or repair a stolen or \ndamaged eligible cellular wireless telephone.\n •C\noverage ends on the earliest of: The date you no longer are a \ncardholder; the date the covered card is determined to be ineligible by \nthe participating organization; the date the participating organization \nceases to pay premium on the \ngroup policy; the date the participating \norganization ceases to participate in the group policy; the date the \ngroup policy is terminated.\nC. Coverage limitations: \nCoverage for a stolen or damaged eligible cellular wireless telephone is \nsubject to the terms, conditions, exclusions, and limits of liability of this \nbenefit. The maximum liability is $800 per claim, and $1,000 per covered \ncard per 12 month period. Each claim is subject to a $50 deductible.  \nCoverage is limited to two (2) claims per covered card per 12 month \nperiod. \nCoverage is excess of any other applicable insurance or indemnity \navailable to you. Coverage is limited only to those amounts not covered \nby any other insurance or indemnity. In no event will this coverage \napply as contributing insurance. This “non-contribution” clause will take \nprecedence over a similar clause found in other insurance or indemnity \nlanguage.\nD.\n What is NOT covered: \nThe following items are excluded from coverage under the group policy:\n •Eligi\nble cellular wireless telephone accessories other than the standard \nbattery and standard antenna provided by the manufacturer; \n •Eligi\nble cellular wireless telephones purchased for resale or for \nprofessional or commercial use;\n •Eligi\nble cellular wireless telephones that are lost or mysteriously \ndisappear;\n •Eligi ble cellular wireless telephones under the care and control of a \ncommon carrier, including, but not limited to, the U.S.', 'Postal Service, \nairplanes or delivery service; \n •Eligi\nble cellular wireless telephones stolen from baggage unless \nhand-carried and under the eligible person’s supervision or under the \nsupervision of the eligible person’s traveling companion who is previously \nknown to the eligible person; \n •Eligi\nble cellular wireless telephones stolen from a construction site;\n •Eligi\nble cellular wireless telephones which have been rented or leased \nfrom a person or company other than a cellular provider;\n •Eligi\nble cellular wireless telephones which have been borrowed;\n •Eligi\nble cellular wireless telephones that are received as part of a \npre-paid plan;\n •C\nosmetic damage to the eligible cellular wireless telephone or damage \nthat does not impact the eligible cellular wireless telephone’s ability to \nmake or receive phone calls (including minor screen cracks and fractures \nless than 2 inches in length that do not prevent the ability to make \nor receive phone calls or to use other features related to making or \nreceiving phone calls);\n •D\namage or theft resulting from abuse, intentional acts, fraud, hostilities \nof any kind (including, but not limited to, war, invasion, rebellion or \ninsurrection), confiscation by the authorities, risks of contraband, \nillegal activities, normal wear and tear, flood, earthquake, radioactive \ncontamination, or damage from inherent product defects or vermin;\n •D\namage or theft resulting from mis-delivery or voluntary parting from \nthe eligible cellular wireless telephone; \n •R\neplacement eligible cellular wireless telephone(s) purchased from \nanyone other than a cellular service provider’s retail or internet store \nthat has the ability to initiate activation with the cellular service \nprovider;\n •T axes, delivery or transportation charges or any fees associated with \nthe service provided; and\n •L\nosses covered under a warranty issued by a manufacturer, distributor \nor seller.', 'A. To get coverage:\n •You must purchase the new item entirely with your covered card and/\nor accumulated points from your covered card for yourself or to give as \na gift.\nB. The kind of coverage you receive:\n• Most items you purchase entirely with your covered card are covered if \ndamaged or stolen within 90 \ndays from the date of purchase as \nindicated on your covered card’s receipt.\n• Items you purchase with your covered card and give as gifts also are \ncovered.\n• This coverage is secondary to any other applicable insurance or \ncoverage available to you or the gift recipient. Coverage is limited to \nonly those amounts not covered by any other insurance or coverage \nbenefi t.\nC. Coverage limitations:\n• Coverage is limited to the lesser of the following:\n• \nThe actual cost of the item (excluding delivery and transportation \ncosts).\n• A maximum of $1,000 per loss and a total of $50,000 per cardholder\naccount per twelve (12) month period.\n• Purchases that are made up of a pair or set will be limited to the cost \nof repair or replacement of the specifi c item stolen or damaged. If the \nspecifi c item cannot be replaced individually or repaired, the value of the \npair or set will be covered not to exceed the limits above.\nGuide to Benefi  ts for \nMastercard® Cardholders\nPurchase Assurance', 'In addition, we shall not be deemed to provide cover and we shall not \nbe liable to pay any claim or provide any benefit under the group policy \nto the extent that the provision of such cover, payment of such claim \nor provision of such benefit would expose us, our parent company or \nits ultimate controlling entity to any sanction, prohibition or restriction \nunder United Nations resolutions or the trade or economic sanctions, \nlaws or regulations of the European Union or the United States \nof America.\nE.\t How\n\tt\no\n\tfi\nle\n\t\na\n\t\nclaim:\n •C\nall 1-800-Mastercard or go to www.mycardbenefits.com to open a \nclaim. You must report the claim within 90 days of the loss, or as soon \nas reasonably possible, or the claim may not be honored. Upon receipt \nof a notice of claim, we will provide you with the necessary instructions \nfor filing proof of loss. Written proof of loss must be submitted to \nour \nadministrator within 120 days of the loss or the claim may not be \nhonored. Required documentation may include but is not limited to the \nfollowing:\n o Y\nour card statement reflecting the monthly eligible cellular wireless \ntelephone payments for the month preceding the date the eligible \ncellular wireless telephone was stolen or suffered damage;\n o A\n copy of your current wireless service provider’s billing statement;\n o If\n a claim is due to damage, a copy of the repair estimate and photos \nof the damage; \n o If\n the claim is due to theft, a copy of the police report filed within 48 \nhours of the theft; and\n o An\ny other documentation or information reasonably requested by us \nto support the claim.\nLegal Disclosure\nThis Guide to Benefits is not, by itself, a policy or contract of insurance or \nother contract.\nBenefits are provided to you, the \ncardholder, at no additional charge.  \nThe insurance benefits are provided under the group policy issued by  \nNew Hampshire Insurance Company, an AIG company. This Guide to \nBenefits is a summary of benefits provided to you. The attached Key \nTerms and \nEOC are governed by the group policy.', 'In the event \nthe EOC, Key Terms, or Legal Disclosures of this Guide to Benefi  ts confl  ict \nwith the provisions of the group policy, the terms of the group policy \ngovern your coverage.\nGroup Policy means the Cellular Protection Insurance Policy entered \nbetween New Hampshire Insurance Company, an AIG Company, and \nMastercard Insurance Master Trust, which is the subject of this Guide to \nBenefi  ts.\nMysteriously Disappear means the vanishing of an item in an unexplained \nmanner where there is absence of evidence of a wrongful act by a person \nor persons. \nStolen means taken by force and/or under duress or a loss which involves \nthe disappearance of an eligible cellular wireless telephone from a known \nplace under circumstances that would indicate the probability of theft \nand for which a police report was fi  led within forty-eight hours of the \ntheft.\nEvidence of Coverage\nRefer to Key Terms for the defi  nitions of you, your, we, us, our, and words \nthat appear in bold. This \nEOC is subject to the Legal Disclosures set forth \nbelow.\nA. To get coverage:\nYou must charge your monthly \neligible cellular wireless telephone bill \nto your covered card. You are eligible for coverage the fi  rst day of the \ncalendar month following the payment of your eligible cellular wireless \ntelephone bill to your covered card. If you pay an eligible cellular wireless \ntelephone bill with your covered card and fail to pay a subsequent bill to \nyour covered card in a particular month, your coverage period changes as \nfollows:\n1. Your coverage is suspended beginning the fi  rst day of the calendar \nmonth following the month of nonpayment to your covered card; and\nGuide to Benefi  ts for \nMastercard® Cardholders\nCellular Wireless Telephone \nProtection – Consumer']",This benefit is not mentioned in the Bilt Palladium benefits guide.,"No, the Bilt Palladium cell phone protection does not cover phones that are lost or mysteriously disappear. It only covers stolen or damaged phones.",0.0,0.5208406848697827,1.0,0.8333333332916666,Bilt Palladium,negative,,2026-04-19T13:01:11.156750
How does the auto rental coverage limit differ between the Capital One Venture X and the United Explorer Card?,"['Because \nregulations vary outside the United States, check with Y our \nauto rental company and the Benefit Administrator before \nY ou travel, to be sure that Auto Rental Collision Damage \nWaiver will apply.\nVehicles not covered\nCertain vehicles are not covered by this benefit, they consist of \nexpensive, exotic, and antique cars; cargo vans; certain vans; \nvehicles with an open cargo bed; trucks; motorcycles; mopeds; \nmotorbikes; limousines; and recreational vehicles.\nAn expensive automobile is defined as any vehicle with an \noriginal manufacturer’s suggested retail price of more than \nseventy-five thousand dollars ($75,000.00) when new.\nAn antique car is defined as one that is over twenty (20) years \nold, or one that has not been manufactured for ten (10) years \nor more.\nVans are not covered. But those designed as small-group \ntransportation vehicles (seating up to nine (9) people, \nincluding the driver) are covered.\nIf Y ou have questions about a specific vehicle’s coverage \nor organization where the vehicle is being reserved, call \nthe Benefit Administrator at 1-800-825-4062, or call collect \noutside the United States at 1-804-965-8071 collect.', 'The \nbenefit is limited to one claim per Covered Trip. To be eligible \nfor this coverage, You need to purchase either a portion or the \nentire cost of Your Common Carrier fare using Your Account. \nYou, Your spouse and Your dependent children under twenty-\ntwo (22) years of age are automatically covered when You \ncharge Your Covered Trip’s Common Carrier fare to Your \neligible Account and/or rewards program associated with Your \ncovered Account. \nThis benefit is supplemental coverage, which means \nthat reasonable expenses during the delay not \notherwise covered by Your Common Carrier, another \nparty or Your primary personal insurance policy, \nmay be reimbursed up to a maximum of five hundred \ndollars ($500.00) per ticket. You will be refunded the \n7\nBR414848_M133789_LetterSize.indd   7BR414848_M133789_LetterSize.indd   7 7/15/21   11:58 AM7/15/21   11:58 AM', 'at 804-965-8071.\n$1,000,000.00 Worldwide Automatic Common \nCarrier Travel Accident Insurance\nTHE PLAN: As a Capital One Visa Infinite Cardholder, you \nwill be automatically insured up to $1,000,000.00 against \naccidental loss of life, limb, sight, speech or hearing while riding \nas a passenger in, entering or exiting any licensed common \ncarrier, provided the entire cost of the passenger fare(s), less \nredeemable certificates, vouchers or coupons, has been \ncharged to your Capital One Visa Infinite account. If the entire \ncost of the passenger fare has been charged to your Capital One \nVisa Infinite account prior to departure for the airport, terminal \nor station, coverage is also provided for common carrier travel \n(including taxi, bus, train or airport limousine, including courtesy \ntransportation); immediately, a) preceding your departure, \ndirectly to the airport, terminal or station b) while at the airport, \nterminal or station, and c) immediately following your arrival at \nthe airport, terminal or station of your destination. If the entire \ncost of the passenger fare has not been charged prior to your \narrival at the airport, terminal or station, coverage begins at the \ntime the entire cost of the travel passenger fare is charged to \nyour Capital One Visa Infinite account. Common Carrier means \nany land, water or air conveyance operated by those whose \noccupation or business is the transportation of persons without \ndiscrimination and for hire.\nELIGIBILITY: This travel insurance plan is provided to Capital \nOne Visa Infinite cardholders, automatically when the entire \ncost of the passenger fare(s) are charged to your Capital One \nVisa Infinite account while the insurance is effective. It is not \nnecessary for you to notify Capital One, the administrator or \nthe Company when tickets are purchased.\n8\nBR414848_M133789_LetterSize.indd   8BR414848_M133789_LetterSize.indd   8 7/15/21   11:58 AM7/15/21   11:58 AM', '(Longer rental periods, however, \nare not covered).\nYou are eligible for this benefit if Your name is embossed on \nan eligible card issued in the United States and You use it \nto initiate and complete Your entire car rental transaction. \nOnly You as the primary car renter and any additional drivers \npermitted by the Rental Car Agreement are covered.\nHow Auto Rental Collision Damage Waiver works\nYour Auto Rental Collision Damage Waiver benefit acts as \nprimary coverage and covers theft, damage, valid loss-of-\nuse charges imposed and substantiated by the auto rental \ncompany, administrative fees and reasonable and customary \ntowing charges, due to a covered theft or damage to the \nnearest qualified repair facility. \nHow to use Auto Rental Collision Damage Waiver\n1.  Use Your card to initiate and complete Your entire car rental \ntransaction. \n2.  Review the auto rental agreement and decline the rental \ncompany’s collision damage waiver (CDW/LDW) option, or \na similar provision, as accepting this coverage will cancel \nout Y our benefit. If the rental company insists that You \npurchase their insurance or collision damage waiver, call the \nBenefit Administrator for assistance at 1-800-825-4062. \nOutside the United States, call collect at 1-804-965-8071.\nBefore Y ou leave the lot, be sure to check the car for any \nprior damage.\nThis benefit is in effect during the time the rental car is in Your \n(or an authorized driver’s) control, and it terminates when the \nrental company reassumes control of their vehicle.\nThis benefit is available in the United States and most foreign \ncountries (with the exception of Israel, Jamaica, the \nRepublic of Ireland or Northern Ireland). However, this \nbenefit is not available where precluded by law, or where it’s \nin violation of the territory terms of the auto rental agreement, \nor when prohibited by individual merchants. Because \nregulations vary outside the United States, check with Y our \nauto rental company and the Benefit Administrator before \nY ou travel, to be sure that Auto Rental Collision Damage \nWaiver will apply.', '2\nVisa Infinite Concierge\nCount on your 24/7 Visa Infinite® Concierge* to book your \ntravel, dinner reservations, event tickets and more.\nVisa Infinite Concierge can help you open the door to unique \nexperiences wherever you are around the world. Secure a \ntable at a premium restaurant, enjoy VIP seating at a special \nevent, or make life a little easier with assistance for your \neveryday needs. Visa Concierge is there to help with it all.\nYour Capital One Visa Infinite card comes with complimentary, \n24/7 access to the Visa Infinite® Concierge* service. Simply call \n888-315-6982 anytime for assistance.\n* Capital One Visa Infinite accountholders are responsible for the \npayment of any and all charges associated with any goods, \nservices, reservations or bookings purchased or arranged by \nthe Visa Infinite Concierge on cardholders’ behalf. Any such \npurchases or arrangements are solely between the cardholder \nand the respective merchant, and Visa is not a party to the \ntransaction. All goods and services subject to availability.\nAuto Rental Collision Damage Waiver\nNo cardholder wants to incur the expense of repairing or \nreplacing a rented car. But accidents do happen, and vehicles \ndo get stolen. No matter what happens to Your rental car, You \ncan be covered with Auto Rental Collision Damage Waiver.\nAuto Rental Collision Damage Waiver reimburses You for \ndamages caused by theft or collision – up to the Actual \nCash Value of rental vehicles with an original manufacturer’s \nsuggested retail price of up to seventy-five thousand dollars \n($75,000.00) when new. Auto Rental Collision Damage Waiver \ncovers no other type of loss. For example, in the event of a \ncollision involving Your rented vehicle, damage to any other \ndriver’s car or the injury of anyone or anything is not covered. \nRental periods of fifteen (15) consecutive days within Your \ncountry of residence, and thirty-one (31) consecutive days \noutside it, are both covered. (Longer rental periods, however, \nare not covered).\nYou are eligible for this benefit if Your name is embossed on \nan eligible card issued in the United States and You use it \nto initiate and complete Your entire car rental transaction.']",This benefit is not mentioned in the Capital One Venture X benefits guide.,"The Capital One Venture X covers rental vehicles with an MSRP up to $75,000, while the United Explorer Card covers up to $60,000. Both provide primary coverage.",0.0,0.0,0.3333333333333333,0.0,Multiple,cross_card,,2026-04-19T13:01:11.156750
How does the Trip Delay Reimbursement threshold differ between the Capital One Venture X and the United Explorer Card?,"['•  This benefit is provided to eligible cardholders at no \nadditional cost. The terms and conditions contained in \nthis Guide to Benefits may be modified by subsequent \nendorsements. Modifications to the terms and conditions \nmay be provided via additional Guide to Benefits mailings, \nstatement inserts, statement messages or electronic \nnotification. The benefits described in this Guide will not \napply to cardholders whose Accounts have been suspended \nor cancelled. \n•  Termination dates may vary by financial institutions. Your \nfinancial institution can cancel or non-renew the benefits \nfor cardholders, and if they do, they will notify You at least \nthirty (30) days in advance. Federal Insurance Company \n(“Provider”) is the underwriter of these benefits and is solely \nresponsible for its administration and claims. The Plan \nAdministrator provides services on behalf of the Provider. \n•  After the Plan Administrator has paid Your claim, all Your \nrights and remedies against any party in respect of this \nclaim will be transferred to the Plan Administrator to the \nextent of the payment made to You. You must give the Plan \nAdministrator all assistance as may reasonably be required \nto secure all rights and remedies. \n•  This benefit does not apply to the extent that trade or \neconomic sanctions or other laws or regulations prohibit \nthe provision of insurance, including, but not limited to, the \npayment of claims.\nFORM #TRCAN – 2017 (04/17)                                                                               TC-I\nFor more information about the benefit described in this \nguide, please contact the Plan Administrator.\nTrip Delay Reimbursement\nHaving a Covered Trip delayed can mean more than just lost \ntime; it can also create an additional cost that You weren’t \nexpecting to pay.\nTrip Delay Reimbursement covers up to a maximum of five \nhundred dollars ($500.00) for each purchased ticket, for \nreasonable additional expenses incurred when a Covered Trip \nYou purchased with Your eligible Account and/or rewards \nprogram associated with Your covered Account is delayed \nfor more than six (6) hours or requires an overnight stay. The \nbenefit is limited to one claim per Covered Trip. To be eligible \nfor this coverage, You need to purchase either a portion or the \nentire cost of Your Common Carrier fare using Your Account.', 'The \nbenefit is limited to one claim per Covered Trip. To be eligible \nfor this coverage, You need to purchase either a portion or the \nentire cost of Your Common Carrier fare using Your Account. \nYou, Your spouse and Your dependent children under twenty-\ntwo (22) years of age are automatically covered when You \ncharge Your Covered Trip’s Common Carrier fare to Your \neligible Account and/or rewards program associated with Your \ncovered Account. \nThis benefit is supplemental coverage, which means \nthat reasonable expenses during the delay not \notherwise covered by Your Common Carrier, another \nparty or Your primary personal insurance policy, \nmay be reimbursed up to a maximum of five hundred \ndollars ($500.00) per ticket. You will be refunded the \n7\nBR414848_M133789_LetterSize.indd   7BR414848_M133789_LetterSize.indd   7 7/15/21   11:58 AM7/15/21   11:58 AM', 'excess amount once all other reimbursement has \nbeen exhausted up the limit of liability. \nWhat is covered?\nYour reasonable additional expenses, such as meals and \nlodging, may be reimbursed as long as: \n•  A portion of the fare was purchased with an eligible Account \nand/or rewards program associated with Your covered \nAccount\n•  Your Covered Trip was delayed for more than six (6) hours or \nrequired an overnight stay due to Covered Hazards \n•  Your Covered Trip is for a period of travel that does not \nexceed three hundred and sixty-five (365) days\nWhat is not covered?\n•  Any delay due to a Covered Hazard which was made public \nor made known to You prior to Your departure.\n•  Any pre-paid expenses related to Your Covered Trip, such as \ntour or activity fees associated with Your Covered Trip.\nHow to file a Trip Delay Reimbursement claim\nWithin thirty (30) days of the Covered Trip delay, call \nthe Benefit Administrator at 1-800-825-4062, or call \ncollect outside the U.S. at 1-804-965-8071 . The Benefit \nAdministrator will ask You for some preliminary claim \ninformation and send You a claim form.\nWithin ninety (90) days of the date of Your Covered Trip \ndelay, return Your completed and signed claim form and the \nrequested documentation below to the following address:\nCard Benefit Services\nP .O. Box 72034\nRichmond, VA 23255\nPlease submit the following documents:\n•  A copy of the detailed original and updated travel itinerary \nand/or the Common Carrier tickets\n•  A copy of Your monthly billing statement (showing the \nlast four [4] digits of the Account number) confirming the \nCommon Carrier ticket was charged to the covered Account. \nOnly applicable if the travel itinerary does not reflect the last \nfour (4) digits of the Account number.\n•  If more than one method of payment was used, please \nprovide documentation as to additional currency, voucher, \npoints or any other payment method utilized\n•  Tickets reflecting the total amount charged for the claimed \nCovered Trip\n•  A statement from the Common Carrier explaining the \nreason for the delay\n•  Copies of itemized receipts for Your claimed expenses.', 'For \nfood expenses, receipts are required, however itemized \nreceipts are only required for bills of fifty dollars ($50.00) or \nmore per covered traveler.\n•  Any other documentation deemed necessary by the Benefit \nAdministrator to substantiate the claim\nFailure to contact the Benefit Administrator or return the \ncompleted claim form and documentation within the time \nperiods indicated above may result in the denial of Your \nclaim.\nFor faster filing, or to learn more about  \nTrip Delay Reimbursement, visit   \nwww.eclaimsline.com\nDefinitions\nAccount means your eligible credit card account.\nCommon Carrier means any land, water, or air conveyance \noperating for hire under a valid license for the transportation \nof passengers and for which a ticket must be purchased prior \nto commencing travel. Common Carrier does not include taxis, \nlimousine services, or commuter rail or commuter bus lines or \nrental vehicles.\nCovered Trip means a period of travel that does not exceed \nthree hundred and sixty-five (365) days away from the Eligible \nPerson’s residence to a destination other than the Eligible \nPerson’s city of residence for which the Eligible Person charges \nthe cost of transportation by Common Carrier to the Account \nand/or rewards programs associated with the covered Account.\nCovered Hazards means equipment failure, inclement \nweather, strike and hijacking/skyjacking.\nEligible Person means a cardholder who pays for their \nCovered Trip by using their eligible Account and/or rewards \nprograms associated with their covered Account.\nFamily Member means Your spouse or legally dependent \nchildren under age eighteen (18) [twenty-five (25) if enrolled as \na full-time student at an accredited university].\nYou or Your means an Eligible Person or Your Family Members \nwho charged their Covered Trip to Your eligible Account and/\nor rewards programs associated with Your covered Account. \nPlease see “General Provisions” section at the end of this \ndocument.\nFORM#TRIP 12-300-2017 (04/17)                                                                TD-O\nFor more information about the benefit described in this \nguide, call the Benefit Administrator at 1-800-825-4062, \nor call collect outside the U.S. at 804-965-8071.', 'Trip Interruption means the Insured Person’s Covered Trip \nis interrupted either on the way to the Covered Trip point of \ndeparture or after the Covered Trip departure.\nYou or Yours means an Insured Person who purchase their \ntrip to the Insured person’s covered Account and/or rewards \nprograms associated with the Insured Person’s covered Account.\nAdditional provisions for Trip Cancellation and Interruption\n•  As a handy reference guide, please read this and keep it in a \nsafe place with Your other insurance documents. \n•  This description of coverage is not a contract of insurance \nbut is simply an informative statement of the principal \nprovisions of the insurance while in effect. Complete \nprovisions pertaining to this plan of insurance are contained \nin the master policy, on file with the Policyholder: BNY \nMidwest Trust Company as trustee of the Chubb Financial \nInstitution Group Insurance Trust for the Account of \nparticipating financial institutions. Policy #: 6478-07-74\n•  Signed or pinned transactions are covered as long as You \nuse Your eligible card to secure the transaction. \n•  You shall do all things reasonable to avoid or diminish any \nLoss covered by this benefit. This provision will not be \nunreasonably applied to avoid claims. \n•  If You make any claim knowing it to be false or fraudulent \nin any respect, no coverage shall exist for such claim, and \nYour benefit may be cancelled. Each cardholder agrees \nthat representations regarding claims will be accurate and \ncomplete. Any and all relevant provisions shall be void in any \ncase of fraud, intentional concealment, or misrepresentation \nof material fact. \n•  No legal action for a claim may be brought against the \nProvider until sixty (60) days after the Provider receives Proof \nof Loss. No legal action against the Provider may be brought \nmore than two (2) years after the time for giving Proof of \nLoss. Further, no legal action may be brought against the \nProvider unless all the terms of the Guide to Benefits have \nbeen complied with fully. \n•  This benefit is provided to eligible cardholders at no \nadditional cost. The terms and conditions contained in \nthis Guide to Benefits may be modified by subsequent \nendorsements.']",This benefit is not mentioned in the Capital One Venture X benefits guide.,"The Capital One Venture X Trip Delay Reimbursement kicks in after a 6-hour delay, while the United Explorer Card requires a delay of more than 12 hours or an overnight stay. Both offer a maximum benefit of $500.",0.0,0.0,0.3333333333333333,0.0,Multiple,cross_card,,2026-04-19T13:01:11.156750
"Which card has a higher Trip Cancellation limit, the United Explorer Card or the Bilt Palladium?","['For questions,  \ncall 1-800-350-2919 \nEffective 10/01/24\nBGC11386\nGuide to Benefits\nImportant information about your  \ntravel and purchase protection benefits\nUnited SM Explorer Card and\nUnited Quest SM Card\nVisa Signature® and Visa Platinum', 'A. To get coverage:\nYou must pay the entire cost of the \ncommon carrier ticket(s) with your \ncovered card and/or accumulated points from your covered card.\nB. The kind of coverage you receive:\n •Reimbursement for the actual cost of replacing, on an emergency basis, \nany personal articles (e.g., clothing, hygiene and/or grooming products) \nor business eff  ects (e.g., uniforms or general offi   ce supplies) contained \nin your \nchecked baggage, if the checked baggage is delayed in getting to \nyou at your scheduled destination.\n •Coverage begins when the baggage is checked in with the common \ncarrier by you. This includes curbside check-in with facility-designated \npersonnel.\n •Coverage ends when you regain possession of your checked baggage \nfrom the common carrier. This includes curbside checkout with facility-\ndesignated personnel.\n •Coverage is secondary to any other applicable insurance or coverage \navailable to you including benefi  ts provided by the common carrier \n(including, but not limited to, goodwill payments, refunds, credit/\nvouchers). Coverage is limited to only those amounts not covered by any \nother insurance or coverage or common carrier benefi  ts (including, but \nnot limited to, goodwill payments, refunds, credit/vouchers).\nC. Coverage limitations:\nCoverage is limited to the actual cost, up to $250 per claim, of \nreplacing, on an emergency basis, any personal articles or business eff \nects contained in your checked baggage. There is a maximum of 2 \nclaim(s) per twelve (12) month period.\nGuide to Benefi  ts for \nMastercard® Cardholders\nBaggage Delay', 'Evidence of Coverage\nRefer to Key Terms for the definitions of you, your, we, us and our, \nand words that appear capitalized. This EOC is subject to the Legal \nDisclosures set forth below.\nA. To get coverage:\nYou must charge the full amount of a Covered Trip to your Covered \nCard or in combination with your Covered Card and accumulated \npoints on your Eligible Account or redeemable certificates, vouchers, \ncoupons, or discounts awarded from frequent flyer program or \nsimilar program.\nB. Covered Losses:\nCovered Losses include Trip Cancellations or Trip Interruptions that \nresult from Accidental Bodily Injury or loss of life or Sickness of either \nthe Eligible Traveler, Traveling Companion or a Family Member of the \nEligible Traveler or Traveling Companion.\nC. The kind of coverage you receive:\nTrip Cancellation\nWe will reimburse you for the nonrefundable amount paid to a \nCommon Carrier with your Covered Card if a Covered Loss causes \nan Eligible Traveler’s Trip Cancellation, subject to the cancellation \nprovisions in effect at the time the Common Carrier is notified of \ncancellation.\nIf a Physician advises the Eligible Traveler that a Covered Trip is \nmedically inadvisable, the Eligible Traveler must immediately notify \nthe appropriate Common Carrier of his or her Trip Cancellation after \nreceiving such medical advice. If the Eligible Traveler does not provide \nsuch notification, our payment will not exceed the cancellation \npenalties imposed by the Common Carrier and in effect during the \nforty-eight (48) hour period immediately following the Physician’s \nnotice that travel was not advisable, subject to any other limits set \nforth herein.\nTrip Interruption\nIf a Covered Loss causes an Eligible Traveler’s Trip Interruption, we \nwill reimburse you for the nonrefundable amount paid to a Common \nCarrier with your Covered Card for the following:\n1.  The forfeited, non-refundable, pre-paid land, air and sea\ntransportation arrangements that were missed; and\n2.', 'What’s Covered?\nThe benefit applies to purchases made both inside and outside \nthe U.S. Eligible items given as gifts can also be covered.\nCoverage is limited to the lesser of the following:\n• The cost to repair item\n•  The cost to replace the item with an item of like kind \nand quality\n•  The amount charged to the Covered Card and/or redeemable \nRewards used (excluding shipping and handling)\n•  $10,000 per item and a maximum of $50,000 per \ncalendar year\nNote: Eligible purchases made with redeemable Rewards will be \nreimbursed in dollars.\nIf a loss involves a portion of a pair or set, You will only be \nreimbursed for the item that was stolen, damaged, or part of \nan Involuntary and Accidental Parting, not the total value of the \npair or set. This does not apply to items normally sold as pairs \nor sets that are not replaceable by purchasing one piece of \nthe pair or set. You may be asked to send the individual item,', 'The forfeited, non-refundable, pre-paid land, air and sea\ntransportation arrangements that were missed; and\n2.  Additional transportation expenses that the Eligible Traveler incurs \nless any available refunds, not to exceed the cost of an economy-\nclass air ticket by the most direct route for the Eligible Traveler to\nrejoin his or her Common Carrier Covered Trip or to return to his or \nher place of origin.\nIf a Covered Loss causes an Eligible Traveler to temporarily postpone \ntransportation by a Common Carrier for a Covered Trip and a new \ndeparture date is set, we will reimburse you for the following: \n1.  The additional expenses incurred to purchase tickets for the new \ndeparture (not to exceed the difference between the original fare\nand the economy fare for the rescheduled Covered Trip by the most \ndirect route); and\n2.  The unused, non-refundable land, air, and sea arrangements paid\nto a Common Carrier with your Covered Card.\nTerm of Coverage\nCoverage begins on the date the Covered Trip was purchased and \nends immediately at the time the Covered Trip is completed.\nAn Eligible Traveler’s coverage terminates on any of the following \ndates: The date the Eligible Traveler is no longer eligible to \nparticipate; the date the Eligible Account is determined to be \nineligible by the participating organization; the date the participating \norganization ceases to pay premium on the Group Policy; the date \nthe participating organization ceases to participate in the Group \nPolicy; or the date the Group Policy is terminated.\nCoverage Limitations\nThe maximum benefit amount is $2,000 per Covered Trip and \n$5,000 per Eligible Account per 12 consecutive month period.\nCoverage is secondary to and in excess of any other applicable \ninsurance or benefit available to the Eligible Traveler including \nbenefits provided by the Common Carrier, such as exchanged tickets, \ndrop in ticket prices, goodwill payments, refunds, credits, or \nvouchers. In no event will this coverage apply as contributing \ninsurance. \nThis “non-contribution” clause will take precedence over the “non-\ncontribution” clauses found in other insurance or indemnity \nlanguage. Coverage is not available in states where prohibited.']","This benefit is not mentioned in the United Explorer benefits guide. However, the Bilt Palladium has a maximum benefit amount of $2,000 per Covered Trip for Trip Cancellation. Therefore, based on the available information, I cannot determine which card has a higher Trip Cancellation limit.","The Bilt Palladium has a higher per-trip limit at $2,000 per trip, while the United Explorer Card provides $1,500 per covered traveler. However, the United Explorer allows up to $6,000 per trip for all covered travelers combined.",0.3333333333333333,0.0,0.0,0.19999999998,Multiple,cross_card,,2026-04-19T13:01:11.156750
"Which cards offer Priority Pass lounge access, the Amex Platinum or the Bilt Palladium?","['Description\nAirport lounge access provided by Priority Pass is available to all \neligible Bilt Palladium Card cardholders. Cardholders can use \ntheir Priority Pass membership or digital membership card to \naccess an airport lounge in a seamless way, as follows: \n•Eligible cardholders will enjoy complimentary lounge \nmembership for them and up to two guests.For additional guests \nabove two, the Cardholder will be charged $35 per guest per \nlounge visit.\n• Membership to 1200+ Priority Pass lounges in 120+ countries and \nin over 400 airports regardless of airline, frequent ﬂ yer membership \nor class of ticket.\nPriority Pass provides aﬄ  uent cardholders the opportunity to relax, \nrefresh and enhance their airport experience as they wait for their ﬂ \night.\nDetail\nWho Is Eligible:\nU.S. issued Bilt Palladium Card cardholders whose issuing bank \nhas completed the enrollment process.\nHow Priority Pass Works:\n1. Before traveling, eligible cardholders need to activate their \nmembership using their Bilt Palladium Card at the \nwww.PriorityPass.com website. Once activated, cardholders \ncan log on their Priority Pass account at www.PriorityPass.com \nand view a list of participating lounges and experiences.\n2.  Eligible cardholders will enjoy complimentary refreshments, \nnewspapers and\n television. In addition, there is access to business \nfacilities including phone, fax, conference and Internet facilities \n(where available).\n3. To gain access to the lounges, an eligible cardholder only \nneeds to quote “Priority Pass” at the participating lounge \nand, once activated, present their Bilt Palladium Card or \npresent their Digital Membership card (QR Code), found in \nthe Priority Pass app, and their boarding pass.\n4.  A list of participating lounges can be found and viewed using \nthe Priority Pass website or app.\n • FAQs can be viewed online at\nhttps:/ /www.prioritypass.com/en/member-support/faq\n • Contact Priority Pass at\nhttps:/ /www.prioritypass.com/en/member-support/contact-us\nor +1 469 334 4174 for customer support.', 'When visiting a Priority Pass Select lounge that admits guests, Platinum Card\nMembers receive complimentary access for up to two accompanying guests. After two guests, the\nCard Account on file with Priority Pass Select will be automatically charged the guest visit fee of the\nPriority Pass Standard program for each additional guest after you have signed up for the additional\nguest visit and it has been reported to Priority Pass by the participating lounge. Some lounges limit\n®\n®\n™\n® ®\n® ™\n®\n®\n4/17/26, 7:27 PM Platinum Card® - Terms, Conditions & Disclosures\nhttps://www.americanexpress.com/us/credit-cards/card-application/apply/supplementary/terms/platinum-card/36182-9-0 32/40', 'Please drink responsibly. American Express reserves the right to limit the number of\nevents Card Members (and their guests) may attend and to cancel tickets/packages without refund\nfor any violations of the terms and conditions of this event. American Express also reserves the right\nto remove any person from any event for inappropriate behavior including, but not limited to, conduct\nthat is disruptive, abusive, or violent. American Express is not responsible for the actions or inactions\nof any third party. For more information, please visit americanexpress.com/entertainment.\nPremium Global Assist® Hotline\nWhile Premium Global Assist  Hotline coordination and assistance services are offered at no\nadditional charge from American Express, Card Members may be responsible for the costs charged\nby third-party service providers. Premium Global Assist Hotline may provide emergency medical\ntransportation assistance at no cost if approved and coordinated by Premium Global Assist Hotline.\nFor full Terms and Conditions call 1-800-345-AMEX or see americanexpress.com/GAterms.\nPriority Pass  Select\nThis benefit is available to U.S. Platinum Card  Members. Platinum Card  Members and Additional\nPlatinum Card  Members must enroll in the Priority Pass  Select program through the benefits\nsection of their americanexpress.com account or by calling the number on the back of their Card to\nreceive the benefit. Companion Platinum Cards on Consumer Platinum Accounts and Additional Gold\nand Additional Business Expense Cards on Business Platinum Accounts are not eligible for the\nPriority Pass Select benefit. Priority Pass is an independent airport lounge access program. You\nacknowledge and agree that American Express will verify your Card Account number and provide\nupdated Card Account information to Priority Pass. Priority Pass will use this information to fulfill on\nthe Priority Pass Select program and may use this information for marketing related to the program.\nOnce enrolled, Platinum Card  Card Members with a valid Card Account may access participating\nPriority Pass Select lounges by presenting their Priority Pass Select card and airline boarding pass. If\nthe Card Account is canceled, you will not be eligible for Priority Pass Select and your enrollment will\nbe canceled. When visiting a Priority Pass Select lounge that admits guests, Platinum Card\nMembers receive complimentary access for up to two accompanying guests.', 'the number of guests or do not admit guests. In some lounges, Priority Pass Select members must\nbe 21 years of age to enter without a parent or guardian. Priority Pass Select members must adhere\nto all house rules of participating lounges and access to participating lounges is subject to all rules,\nterms and conditions of the applicable lounge. Amenities may vary among airport lounge locations.\nConference rooms, where available, may be reserved for a nominal fee. Priority Pass Select lounge\npartners and locations are subject to change. All Priority Pass Select members must adhere to the\nPriority Pass Conditions of Use, which will be sent to you with your membership package, and can\nbe viewed at www.prioritypass.com. Upon receipt of your enrollment information, Priority Pass will\nsend your Priority Pass Select card and membership package which you should receive within 10–14\nbusiness days. If you have not received the Priority Pass card after 14 days, please contact American\nExpress using the number on the back of your American Express  Card. To receive immediate\naccess to lounges after your enrollment in Priority Pass Select has been processed, you can activate\nyour membership online by using your Priority Pass Select membership details to receive a Digital\nMembership Card. For a step-by-step guide on the activation process, visit prioritypass.com/activation.\nEffective May 19, 2026, guest visit fees may be automatically charged to your Card or paid during\nthe check-in process at the Priority Pass Select lounge, as instructed by check-in staff at the Priority\nPass Select lounge.\nEffective June 22, 2026, you acknowledge and agree that American Express will verify your email\naddress and provide that information to Priority Pass. Priority Pass will use this information to fulfill\nthe Priority Pass Select program and may use this information for marketing related to the program.\nUpon receipt of your enrollment information, Priority Pass will send you email instructions to receive\nyour Priority Pass Digital Membership Card. Once enrolled in Priority Pass Select, Platinum Card\nCard Members whose Card account is not cancelled may access participating Priority Pass Select\nlounges by presenting their valid physical Priority Pass Card (if previously received), their Priority\nPass Digital Membership Card, or their physical American Express Card and airline boarding\npass.\nReturn Protection\nReturn Protection is subject to additional important terms, conditions and exclusions.', 'Card Members receive\ncomplimentary access to any global location of Plaza Premium Lounges. Card Member must present\ntheir valid Card, a boarding pass showing a confirmed reservation for same-day travel on any carrier\nand government-issued I.D. In some cases, Card Member must be 21 years of age to enter without a\nparent or guardian. Card Members may bring up to two (2) companions into Plaza Premium Lounges\nas complimentary guests. Must be of legal drinking age to consume alcohol. Please drink responsibly.\n®\n®\n4/17/26, 7:27 PM Platinum Card® - Terms, Conditions & Disclosures\nhttps://www.americanexpress.com/us/credit-cards/card-application/apply/supplementary/terms/platinum-card/36182-9-0 31/40']","Both the Amex Platinum and the Bilt Palladium offer Priority Pass lounge access. The Bilt Palladium provides complimentary lounge membership for eligible cardholders and their guests, while the Amex Platinum also offers complimentary access for up to two accompanying guests at Priority Pass Select lounges.",Both the Amex Platinum and the Bilt Palladium offer Priority Pass lounge access. The Bilt Palladium includes the cardholder and up to 2 guests free. The Amex Platinum includes Priority Pass Select with unlimited access.,0.5,0.852989906663378,0.6666666666666666,0.0,Multiple,cross_card,,2026-04-19T13:01:11.156750
